FileName,Station,Session,Date,Time,DateReadable,filename_new,Species,Number_animals,Favorite (y/n),Notes
MFDC2953.JPG,4_AEP,Session_1,1/14/2021,8:49:55,TRUE,Session_1__2021-01-14__08-49-55(1).JPG,Sciurus_sp,1,n,
MFDC2954.JPG,4_AEP,Session_1,1/14/2021,9:23:06,TRUE,Session_1__2021-01-14__09-23-06(1).JPG,Sciurus_sp,1,n,
MFDC2955.JPG,4_AEP,Session_1,1/14/2021,20:01:01,TRUE,Session_1__2021-01-14__20-01-01(1).JPG,Felis_catus,1,n,?
MFDC2956.JPG,4_AEP,Session_1,1/14/2021,20:01:37,TRUE,Session_1__2021-01-14__20-01-37(2).JPG,Felis_catus,1,n,?
MFDC2957.JPG,4_AEP,Session_1,1/14/2021,20:51:53,TRUE,Session_1__2021-01-14__20-51-53(1).JPG,Didelphis_virginiana,1,n,
MFDC2958.JPG,4_AEP,Session_1,1/14/2021,20:52:49,TRUE,Session_1__2021-01-14__20-52-49(1).JPG,Didelphis_virginiana,1,n,
MFDC2960.JPG,4_AEP,Session_1,1/17/2021,11:17:25,TRUE,Session_1__2021-01-17__11-17-25(1).JPG,Odocoileus_virginianus,1,n,
MFDC2961.JPG,4_AEP,Session_1,1/17/2021,11:17:27,TRUE,Session_1__2021-01-17__11-17-27(2).JPG,Odocoileus_virginianus,1,y,leg growth
MFDC2962.JPG,4_AEP,Session_1,1/17/2021,11:17:30,TRUE,Session_1__2021-01-17__11-17-30(3).JPG,Odocoileus_virginianus,1,n,
MFDC2963.JPG,4_AEP,Session_1,1/17/2021,11:17:59,TRUE,Session_1__2021-01-17__11-17-59(4).JPG,Odocoileus_virginianus,1,y,
MFDC2964.JPG,4_AEP,Session_1,1/17/2021,11:18:03,TRUE,Session_1__2021-01-17__11-18-03(1).JPG,Odocoileus_virginianus,1,n,
MFDC2965.JPG,4_AEP,Session_1,1/17/2021,11:18:03,TRUE,Session_1__2021-01-17__11-18-03(2).JPG,Odocoileus_virginianus,1,y,
MFDC2966.JPG,4_AEP,Session_1,1/17/2021,11:18:32,TRUE,Session_1__2021-01-17__11-18-32(3).JPG,Odocoileus_virginianus,1,n,
MFDC2967.JPG,4_AEP,Session_1,1/17/2021,11:18:35,TRUE,Session_1__2021-01-17__11-18-35(4).JPG,Odocoileus_virginianus,2,n,
MFDC2968.JPG,4_AEP,Session_1,1/17/2021,11:18:36,TRUE,Session_1__2021-01-17__11-18-36(5).JPG,Odocoileus_virginianus,2,n,
MFDC2969.JPG,4_AEP,Session_1,1/17/2021,11:19:05,TRUE,Session_1__2021-01-17__11-19-05(1).JPG,Odocoileus_virginianus,2,n,
MFDC2970.JPG,4_AEP,Session_1,1/17/2021,11:19:08,TRUE,Session_1__2021-01-17__11-19-08(2).JPG,Odocoileus_virginianus,2,n,
MFDC2971.JPG,4_AEP,Session_1,1/17/2021,11:19:09,TRUE,Session_1__2021-01-17__11-19-09(3).JPG,Odocoileus_virginianus,2,n,
MFDC2972.JPG,4_AEP,Session_1,1/17/2021,11:19:38,TRUE,Session_1__2021-01-17__11-19-38(4).JPG,Odocoileus_virginianus,1,n,
MFDC2973.JPG,4_AEP,Session_1,1/17/2021,11:20:09,TRUE,Session_1__2021-01-17__11-20-09(1).JPG,Odocoileus_virginianus,2,n,
MFDC2974.JPG,4_AEP,Session_1,1/17/2021,11:21:09,TRUE,Session_1__2021-01-17__11-21-09(1).JPG,Odocoileus_virginianus,1,n,
MFDC2975.JPG,4_AEP,Session_1,1/17/2021,16:56:51,TRUE,Session_1__2021-01-17__16-56-51(1).JPG,Odocoileus_virginianus,1,n,
MFDC2976.JPG,4_AEP,Session_1,1/17/2021,16:57:55,TRUE,Session_1__2021-01-17__16-57-55(1).JPG,Odocoileus_virginianus,2,n,
MFDC2977.JPG,4_AEP,Session_1,1/17/2021,19:09:24,TRUE,Session_1__2021-01-17__19-09-24(1).JPG,Unid,1,n,
MFDC2978.JPG,4_AEP,Session_1,1/20/2021,20:29:13,TRUE,Session_1__2021-01-20__20-29-13(1).JPG,Procyon_lotor,1,n,
MFDC2980.JPG,4_AEP,Session_1,1/21/2021,8:51:18,TRUE,Session_1__2021-01-21__08-51-18(1).JPG,Odocoileus_virginianus,1,n,
MFDC2981.JPG,4_AEP,Session_1,1/21/2021,8:51:20,TRUE,Session_1__2021-01-21__08-51-20(2).JPG,Odocoileus_virginianus,1,n,
MFDC2982.JPG,4_AEP,Session_1,1/21/2021,8:51:21,TRUE,Session_1__2021-01-21__08-51-21(3).JPG,Odocoileus_virginianus,1,n,
MFDC2983.JPG,4_AEP,Session_1,1/21/2021,8:52:10,TRUE,Session_1__2021-01-21__08-52-10(1).JPG,Odocoileus_virginianus,1,n,
MFDC2984.JPG,4_AEP,Session_1,1/21/2021,8:52:39,TRUE,Session_1__2021-01-21__08-52-39(2).JPG,Odocoileus_virginianus,2,n,
MFDC2985.JPG,4_AEP,Session_1,1/21/2021,8:52:42,TRUE,Session_1__2021-01-21__08-52-42(3).JPG,Odocoileus_virginianus,2,n,
MFDC2986.JPG,4_AEP,Session_1,1/21/2021,8:52:43,TRUE,Session_1__2021-01-21__08-52-43(4).JPG,Odocoileus_virginianus,2,n,
MFDC2987.JPG,4_AEP,Session_1,1/21/2021,8:53:17,TRUE,Session_1__2021-01-21__08-53-17(1).JPG,Odocoileus_virginianus,1,n,
MFDC2989.JPG,4_AEP,Session_1,1/22/2021,4:03:43,TRUE,Session_1__2021-01-22__04-03-43(1).JPG,Canis_latrans,1,n,
MFDC2990.JPG,4_AEP,Session_1,1/22/2021,4:04:14,TRUE,Session_1__2021-01-22__04-04-14(1).JPG,Canis_latrans,1,n,
MFDC2991.JPG,4_AEP,Session_1,1/22/2021,4:04:17,TRUE,Session_1__2021-01-22__04-04-17(2).JPG,Canis_latrans,1,y,peeing
MFDC2992.JPG,4_AEP,Session_1,1/22/2021,4:04:47,TRUE,Session_1__2021-01-22__04-04-47(3).JPG,Canis_latrans,1,n,
MFDC2993.JPG,4_AEP,Session_1,1/22/2021,4:04:49,TRUE,Session_1__2021-01-22__04-04-49(4).JPG,Canis_latrans,1,n,
MFDC2994.JPG,4_AEP,Session_1,1/22/2021,4:04:52,TRUE,Session_1__2021-01-22__04-04-52(5).JPG,Canis_latrans,1,n,
MFDC2995.JPG,4_AEP,Session_1,1/22/2021,4:05:20,TRUE,Session_1__2021-01-22__04-05-20(1).JPG,Canis_latrans,1,n,
MFDC2996.JPG,4_AEP,Session_1,1/22/2021,4:05:22,TRUE,Session_1__2021-01-22__04-05-22(2).JPG,Canis_latrans,1,n,
MFDC2997.JPG,4_AEP,Session_1,1/22/2021,4:05:25,TRUE,Session_1__2021-01-22__04-05-25(3).JPG,Canis_latrans,1,n,
MFDC2998.JPG,4_AEP,Session_1,1/23/2021,6:40:21,TRUE,Session_1__2021-01-23__06-40-21(1).JPG,Odocoileus_virginianus,1,n,
MFDC2999.JPG,4_AEP,Session_1,1/23/2021,6:40:23,TRUE,Session_1__2021-01-23__06-40-23(2).JPG,NA,0,n,
MFDC3000.JPG,4_AEP,Session_1,1/23/2021,6:40:25,TRUE,Session_1__2021-01-23__06-40-25(3).JPG,Odocoileus_virginianus,1,n,
MFDC3001.JPG,4_AEP,Session_1,1/24/2021,8:11:47,TRUE,Session_1__2021-01-24__08-11-47(1).JPG,Lynx_rufus,1,n,
MFDC3003.JPG,4_AEP,Session_1,1/25/2021,20:23:04,TRUE,Session_1__2021-01-25__20-23-04(1).JPG,Lynx_rufus,1,n,
MFDC3004.JPG,4_AEP,Session_1,1/25/2021,20:25:26,TRUE,Session_1__2021-01-25__20-25-26(1).JPG,Unid,0,n,
MFDC3005.JPG,4_AEP,Session_1,1/27/2021,0:56:04,TRUE,Session_1__2021-01-27__00-56-04(1).JPG,NA,0,n,
MFDC3006.JPG,4_AEP,Session_1,1/27/2021,0:56:35,TRUE,Session_1__2021-01-27__00-56-35(2).JPG,Odocoileus_virginianus,1,n,
MFDC3007.JPG,4_AEP,Session_1,1/27/2021,0:56:38,TRUE,Session_1__2021-01-27__00-56-38(3).JPG,Odocoileus_virginianus,1,n,
MFDC3008.JPG,4_AEP,Session_1,1/27/2021,0:56:38,TRUE,Session_1__2021-01-27__00-56-38(4).JPG,Odocoileus_virginianus,2,n,
MFDC3009.JPG,4_AEP,Session_1,1/27/2021,0:57:10,TRUE,Session_1__2021-01-27__00-57-10(1).JPG,Odocoileus_virginianus,2,n,
MFDC3010.JPG,4_AEP,Session_1,1/27/2021,0:57:13,TRUE,Session_1__2021-01-27__00-57-13(2).JPG,Odocoileus_virginianus,2,n,
MFDC3011.JPG,4_AEP,Session_1,1/27/2021,0:57:14,TRUE,Session_1__2021-01-27__00-57-14(3).JPG,Odocoileus_virginianus,2,n,
MFDC3013.JPG,4_AEP,Session_1,1/27/2021,20:16:32,TRUE,Session_1__2021-01-27__20-16-32(1).JPG,Canis_latrans,1,n,
MFDC3014.JPG,4_AEP,Session_1,1/27/2021,20:17:04,TRUE,Session_1__2021-01-27__20-17-04(1).JPG,Canis_latrans,1,n,
MFDC3015.JPG,4_AEP,Session_1,1/27/2021,20:17:07,TRUE,Session_1__2021-01-27__20-17-07(2).JPG,Canis_latrans,1,n,
MFDC3016.JPG,4_AEP,Session_1,1/27/2021,20:17:07,TRUE,Session_1__2021-01-27__20-17-07(3).JPG,Canis_latrans,1,n,
MFDC3017.JPG,4_AEP,Session_1,1/27/2021,20:17:40,TRUE,Session_1__2021-01-27__20-17-40(4).JPG,Canis_latrans,1,n,
MFDC3019.JPG,4_AEP,Session_1,1/28/2021,7:35:22,TRUE,Session_1__2021-01-28__07-35-22(1).JPG,Odocoileus_virginianus,1,n,
MFDC3020.JPG,4_AEP,Session_1,1/28/2021,7:35:24,TRUE,Session_1__2021-01-28__07-35-24(2).JPG,Odocoileus_virginianus,1,n,
MFDC3021.JPG,4_AEP,Session_1,1/28/2021,8:41:19,TRUE,Session_1__2021-01-28__08-41-19(1).JPG,Sciurus_sp,1,n,
MFDC3023.JPG,4_AEP,Session_1,2/3/2021,4:53:55,TRUE,Session_1__2021-02-03__04-53-55(1).JPG,Odocoileus_virginianus,1,n,
MFDC3024.JPG,4_AEP,Session_1,2/3/2021,12:19:05,TRUE,Session_1__2021-02-03__12-19-05(1).JPG,Odocoileus_virginianus,1,n,
MFDC3025.JPG,4_AEP,Session_1,2/3/2021,12:19:08,TRUE,Session_1__2021-02-03__12-19-08(2).JPG,Odocoileus_virginianus,1,n,
MFDC3026.JPG,4_AEP,Session_1,2/3/2021,12:19:40,TRUE,Session_1__2021-02-03__12-19-40(3).JPG,Odocoileus_virginianus,1,n,
MFDC3027.JPG,4_AEP,Session_1,2/3/2021,12:19:43,TRUE,Session_1__2021-02-03__12-19-43(4).JPG,Odocoileus_virginianus,1,n,
MFDC3028.JPG,4_AEP,Session_1,2/3/2021,12:19:45,TRUE,Session_1__2021-02-03__12-19-45(5).JPG,Odocoileus_virginianus,1,n,
MFDC3029.JPG,4_AEP,Session_1,2/4/2021,12:00:30,TRUE,Session_1__2021-02-04__12-00-30(1).JPG,Canis_familiaris,1,n,hound
MFDC3031.JPG,4_AEP,Session_1,2/4/2021,12:03:22,TRUE,Session_1__2021-02-04__12-03-22(1).JPG,Canis_familiaris,1,n,hound
MFDC3034.JPG,4_AEP,Session_1,2/6/2021,10:23:57,TRUE,Session_1__2021-02-06__10-23-57(1).JPG,Homo_sapiens,1,n,
MFDC3035.JPG,4_AEP,Session_1,2/6/2021,10:24:27,TRUE,Session_1__2021-02-06__10-24-27(1).JPG,Homo_sapiens,2,n,
MFDC3041.JPG,4_AEP,Session_2,2/6/2021,10:28:43,TRUE,Session_2__2021-02-06__10-28-43(1).JPG,Canis_familiaris,1,n,
MFDC3042.JPG,4_AEP,Session_2,2/6/2021,10:28:45,TRUE,Session_2__2021-02-06__10-28-45(2).JPG,Canis_familiaris,1,n,
MFDC3043.JPG,4_AEP,Session_2,2/6/2021,10:28:47,TRUE,Session_2__2021-02-06__10-28-47(3).JPG,Canis_familiaris,1,n,
MFDC3044.JPG,4_AEP,Session_2,2/6/2021,10:29:17,TRUE,Session_2__2021-02-06__10-29-17(1).JPG,Canis_familiaris,1,n,
MFDC3045.JPG,4_AEP,Session_2,2/6/2021,10:29:19,TRUE,Session_2__2021-02-06__10-29-19(2).JPG,NA,0,n,
MFDC3046.JPG,4_AEP,Session_2,2/7/2021,10:09:00,TRUE,Session_2__2021-02-07__10-09-00(1).JPG,NA,0,n,
MFDC3047.JPG,4_AEP,Session_2,2/8/2021,0:42:36,TRUE,Session_2__2021-02-08__00-42-36(1).JPG,NA,0,n,
MFDC3048.JPG,4_AEP,Session_2,2/8/2021,0:43:07,TRUE,Session_2__2021-02-08__00-43-07(1).JPG,Odocoileus_virginianus,1,n,
MFDC3049.JPG,4_AEP,Session_2,2/8/2021,0:43:38,TRUE,Session_2__2021-02-08__00-43-38(2).JPG,Odocoileus_virginianus,1,n,
MFDC3050.JPG,4_AEP,Session_2,2/8/2021,0:43:40,TRUE,Session_2__2021-02-08__00-43-40(3).JPG,Odocoileus_virginianus,1,n,
MFDC3051.JPG,4_AEP,Session_2,2/8/2021,0:44:11,TRUE,Session_2__2021-02-08__00-44-11(1).JPG,Odocoileus_virginianus,1,n,
MFDC3052.JPG,4_AEP,Session_2,2/8/2021,0:44:42,TRUE,Session_2__2021-02-08__00-44-42(2).JPG,Odocoileus_virginianus,1,n,
MFDC3053.JPG,4_AEP,Session_2,2/8/2021,0:44:44,TRUE,Session_2__2021-02-08__00-44-44(3).JPG,Odocoileus_virginianus,1,n,
MFDC3054.JPG,4_AEP,Session_2,2/8/2021,0:45:19,TRUE,Session_2__2021-02-08__00-45-19(1).JPG,NA,0,n,
MFDC3055.JPG,4_AEP,Session_2,2/8/2021,0:45:21,TRUE,Session_2__2021-02-08__00-45-21(2).JPG,Odocoileus_virginianus,1,n,
MFDC3056.JPG,4_AEP,Session_2,2/8/2021,0:45:23,TRUE,Session_2__2021-02-08__00-45-23(3).JPG,Odocoileus_virginianus,1,n,
MFDC3057.JPG,4_AEP,Session_2,2/8/2021,0:45:53,TRUE,Session_2__2021-02-08__00-45-53(4).JPG,Odocoileus_virginianus,1,n,
MFDC3058.JPG,4_AEP,Session_2,2/8/2021,0:45:55,TRUE,Session_2__2021-02-08__00-45-55(5).JPG,NA,0,n,
MFDC3059.JPG,4_AEP,Session_2,2/8/2021,0:45:56,TRUE,Session_2__2021-02-08__00-45-56(6).JPG,NA,0,n,
MFDC3060.JPG,4_AEP,Session_2,2/8/2021,0:46:28,TRUE,Session_2__2021-02-08__00-46-28(1).JPG,NA,0,n,
MFDC3061.JPG,4_AEP,Session_2,2/8/2021,0:46:30,TRUE,Session_2__2021-02-08__00-46-30(2).JPG,Odocoileus_virginianus,1,n,
MFDC3062.JPG,4_AEP,Session_2,2/8/2021,0:46:32,TRUE,Session_2__2021-02-08__00-46-32(3).JPG,Odocoileus_virginianus,1,n,
MFDC3063.JPG,4_AEP,Session_2,2/8/2021,0:47:01,TRUE,Session_2__2021-02-08__00-47-01(1).JPG,Odocoileus_virginianus,1,n,
MFDC3064.JPG,4_AEP,Session_2,2/8/2021,0:47:04,TRUE,Session_2__2021-02-08__00-47-04(2).JPG,NA,0,n,
MFDC3065.JPG,4_AEP,Session_2,2/8/2021,0:47:33,TRUE,Session_2__2021-02-08__00-47-33(3).JPG,Odocoileus_virginianus,1,n,
MFDC3066.JPG,4_AEP,Session_2,2/8/2021,0:47:36,TRUE,Session_2__2021-02-08__00-47-36(4).JPG,Odocoileus_virginianus,1,n,
MFDC3067.JPG,4_AEP,Session_2,2/8/2021,0:47:37,TRUE,Session_2__2021-02-08__00-47-37(5).JPG,Odocoileus_virginianus,1,n,
MFDC3068.JPG,4_AEP,Session_2,2/8/2021,15:13:47,TRUE,Session_2__2021-02-08__15-13-47(1).JPG,Avian_sp,1,y,woodpecker
MFDC3069.JPG,4_AEP,Session_2,2/9/2021,11:04:04,TRUE,Session_2__2021-02-09__11-04-04(1).JPG,NA,0,n,
MFDC3070.JPG,4_AEP,Session_2,2/11/2021,7:45:56,TRUE,Session_2__2021-02-11__07-45-56(1).JPG,Canis_latrans,1,n,snow blocking half of picture
MFDC3071.JPG,4_AEP,Session_2,2/11/2021,7:46:28,TRUE,Session_2__2021-02-11__07-46-28(1).JPG,Canis_latrans,1,n,snow blocking half of picture
MFDC3072.JPG,4_AEP,Session_2,2/11/2021,7:46:57,TRUE,Session_2__2021-02-11__07-46-57(2).JPG,Canis_latrans,1,n,snow blocking half of picture
MFDC3073.JPG,4_AEP,Session_2,2/11/2021,7:47:01,TRUE,Session_2__2021-02-11__07-47-01(1).JPG,Canis_latrans,1,n,snow blocking half of picture
MFDC3074.JPG,4_AEP,Session_2,2/11/2021,7:47:01,TRUE,Session_2__2021-02-11__07-47-01(2).JPG,Canis_latrans,1,n,snow blocking half of picture
MFDC3075.JPG,4_AEP,Session_2,2/11/2021,7:47:33,TRUE,Session_2__2021-02-11__07-47-33(3).JPG,Canis_latrans,1,n,snow blocking half of picture
MFDC3076.JPG,4_AEP,Session_2,2/11/2021,7:47:36,TRUE,Session_2__2021-02-11__07-47-36(4).JPG,Canis_latrans,1,n,snow blocking half of picture
MFDC3077.JPG,4_AEP,Session_2,2/11/2021,15:12:56,TRUE,Session_2__2021-02-11__15-12-56(1).JPG,NA,0,n,snow blocking half of picture
MFDC3078.JPG,4_AEP,Session_2,2/14/2021,7:39:52,TRUE,Session_2__2021-02-14__07-39-52(1).JPG,Unid,1,n,snow blocking half of picture
MFDC3079.JPG,4_AEP,Session_2,2/14/2021,7:39:55,TRUE,Session_2__2021-02-14__07-39-55(2).JPG,Unid,1,n,snow blocking half of picture
MFDC3080.JPG,4_AEP,Session_2,2/14/2021,7:39:56,TRUE,Session_2__2021-02-14__07-39-56(3).JPG,NA,0,n,snow blocking half of picture
MFDC3081.JPG,4_AEP,Session_2,2/15/2021,15:23:46,TRUE,Session_2__2021-02-15__15-23-46(1).JPG,NA,0,n,snow blocking half of picture
MFDC3082.JPG,4_AEP,Session_2,2/17/2021,18:11:19,TRUE,Session_2__2021-02-17__18-11-19(1).JPG,Lynx_rufus,1,n,snow blocking half of picture
MFDC3083.JPG,4_AEP,Session_2,2/17/2021,18:11:20,TRUE,Session_2__2021-02-17__18-11-20(2).JPG,Lynx_rufus,1,n,snow blocking half of picture
MFDC3084.JPG,4_AEP,Session_2,2/17/2021,18:11:22,TRUE,Session_2__2021-02-17__18-11-22(3).JPG,NA,0,n,snow blocking half of picture
MFDC3085.JPG,4_AEP,Session_2,2/18/2021,14:01:30,TRUE,Session_2__2021-02-18__14-01-30(1).JPG,Odocoileus_virginianus,1,n,snow blocking half of picture
MFDC3086.JPG,4_AEP,Session_2,2/18/2021,14:01:33,TRUE,Session_2__2021-02-18__14-01-33(2).JPG,Odocoileus_virginianus,1,n,snow blocking half of picture
MFDC3087.JPG,4_AEP,Session_2,2/18/2021,14:01:36,TRUE,Session_2__2021-02-18__14-01-36(3).JPG,Didelphis_virginiana,1,n,
MFDC3088.JPG,4_AEP,Session_2,2/18/2021,19:16:46,TRUE,Session_2__2021-02-18__19-16-46(1).JPG,Didelphis_virginiana,1,n,
MFDC3089.JPG,4_AEP,Session_2,2/18/2021,19:16:49,TRUE,Session_2__2021-02-18__19-16-49(2).JPG,Didelphis_virginiana,1,n,
MFDC3090.JPG,4_AEP,Session_2,2/18/2021,19:16:52,TRUE,Session_2__2021-02-18__19-16-52(3).JPG,Didelphis_virginiana,1,n,
MFDC3091.JPG,4_AEP,Session_2,2/18/2021,19:52:05,TRUE,Session_2__2021-02-18__19-52-05(1).JPG,Didelphis_virginiana,1,n,
MFDC3092.JPG,4_AEP,Session_2,2/18/2021,19:52:51,TRUE,Session_2__2021-02-18__19-52-51(2).JPG,Didelphis_virginiana,1,n,
MFDC3093.JPG,4_AEP,Session_2,2/18/2021,19:52:54,TRUE,Session_2__2021-02-18__19-52-54(3).JPG,Didelphis_virginiana,1,n,
MFDC3094.JPG,4_AEP,Session_2,2/18/2021,19:52:55,TRUE,Session_2__2021-02-18__19-52-55(4).JPG,Didelphis_virginiana,1,n,
MFDC3095.JPG,4_AEP,Session_2,2/18/2021,19:53:58,TRUE,Session_2__2021-02-18__19-53-58(1).JPG,Didelphis_virginiana,1,n,
MFDC3096.JPG,4_AEP,Session_2,2/23/2021,0:34:13,TRUE,Session_2__2021-02-23__00-34-13(1).JPG,Didelphis_virginiana,1,n,
MFDC3097.JPG,4_AEP,Session_2,2/23/2021,0:34:15,TRUE,Session_2__2021-02-23__00-34-15(2).JPG,Didelphis_virginiana,1,n,
MFDC3098.JPG,4_AEP,Session_2,2/23/2021,0:36:11,TRUE,Session_2__2021-02-23__00-36-11(1).JPG,Didelphis_virginiana,1,n,
MFDC3099.JPG,4_AEP,Session_2,2/23/2021,0:36:13,TRUE,Session_2__2021-02-23__00-36-13(2).JPG,Didelphis_virginiana,1,n,
MFDC3100.JPG,4_AEP,Session_2,2/23/2021,0:36:43,TRUE,Session_2__2021-02-23__00-36-43(3).JPG,Didelphis_virginiana,1,n,
MFDC3101.JPG,4_AEP,Session_2,2/23/2021,2:22:31,TRUE,Session_2__2021-02-23__02-22-31(1).JPG,Lynx_rufus,1,n,
MFDC3102.JPG,4_AEP,Session_2,2/23/2021,2:22:34,TRUE,Session_2__2021-02-23__02-22-34(2).JPG,Lynx_rufus,1,n,
MFDC3103.JPG,4_AEP,Session_2,2/23/2021,2:23:04,TRUE,Session_2__2021-02-23__02-23-04(1).JPG,Lynx_rufus,1,n,
MFDC3104.JPG,4_AEP,Session_2,2/23/2021,2:24:10,TRUE,Session_2__2021-02-23__02-24-10(1).JPG,Lynx_rufus,1,n,
MFDC3105.JPG,4_AEP,Session_2,2/23/2021,2:24:41,TRUE,Session_2__2021-02-23__02-24-41(2).JPG,Lynx_rufus,1,n,
MFDC3106.JPG,4_AEP,Session_2,2/24/2021,4:28:01,TRUE,Session_2__2021-02-24__04-28-01(1).JPG,Canis_latrans,1,n,
MFDC3107.JPG,4_AEP,Session_2,2/24/2021,4:28:03,TRUE,Session_2__2021-02-24__04-28-03(2).JPG,Canis_latrans,1,n,
MFDC3108.JPG,4_AEP,Session_2,2/24/2021,4:28:33,TRUE,Session_2__2021-02-24__04-28-33(3).JPG,Canis_latrans,1,n,
MFDC3109.JPG,4_AEP,Session_2,2/24/2021,4:28:35,TRUE,Session_2__2021-02-24__04-28-35(4).JPG,Canis_latrans,1,n,
MFDC3110.JPG,4_AEP,Session_2,2/24/2021,4:28:36,TRUE,Session_2__2021-02-24__04-28-36(5).JPG,Canis_latrans,1,n,
MFDC3111.JPG,4_AEP,Session_2,2/24/2021,4:29:10,TRUE,Session_2__2021-02-24__04-29-10(1).JPG,Canis_latrans,1,n,
MFDC3112.JPG,4_AEP,Session_2,2/24/2021,4:29:12,TRUE,Session_2__2021-02-24__04-29-12(2).JPG,Canis_latrans,1,n,
MFDC3113.JPG,4_AEP,Session_2,2/24/2021,4:29:14,TRUE,Session_2__2021-02-24__04-29-14(3).JPG,Canis_latrans,1,n,
MFDC3114.JPG,4_AEP,Session_2,2/24/2021,4:29:43,TRUE,Session_2__2021-02-24__04-29-43(4).JPG,Canis_latrans,1,n,
MFDC3115.JPG,4_AEP,Session_2,2/24/2021,4:30:14,TRUE,Session_2__2021-02-24__04-30-14(1).JPG,Canis_latrans,1,n,
MFDC3116.JPG,4_AEP,Session_2,2/24/2021,4:30:16,TRUE,Session_2__2021-02-24__04-30-16(2).JPG,Canis_latrans,1,n,
MFDC3117.JPG,4_AEP,Session_2,2/24/2021,15:38:19,TRUE,Session_2__2021-02-24__15-38-19(1).JPG,Odocoileus_virginianus,1,n,
MFDC3118.JPG,4_AEP,Session_2,2/24/2021,15:38:49,TRUE,Session_2__2021-02-24__15-38-49(2).JPG,NA,0,n,
MFDC3119.JPG,4_AEP,Session_2,2/24/2021,15:38:53,TRUE,Session_2__2021-02-24__15-38-53(3).JPG,Unid,1,n,overexposed
MFDC3120.JPG,4_AEP,Session_2,2/24/2021,15:38:53,TRUE,Session_2__2021-02-24__15-38-53(4).JPG,NA,0,n,
MFDC3121.JPG,4_AEP,Session_2,2/24/2021,15:39:22,TRUE,Session_2__2021-02-24__15-39-22(1).JPG,Odocoileus_virginianus,1,n,
MFDC3122.JPG,4_AEP,Session_2,2/24/2021,15:39:25,TRUE,Session_2__2021-02-24__15-39-25(2).JPG,Odocoileus_virginianus,1,n,
MFDC3123.JPG,4_AEP,Session_2,2/24/2021,15:40:02,TRUE,Session_2__2021-02-24__15-40-02(1).JPG,Odocoileus_virginianus,1,n,
MFDC3124.JPG,4_AEP,Session_2,2/24/2021,15:40:05,TRUE,Session_2__2021-02-24__15-40-05(2).JPG,Odocoileus_virginianus,1,n,
MFDC3125.JPG,4_AEP,Session_2,2/24/2021,15:40:35,TRUE,Session_2__2021-02-24__15-40-35(3).JPG,Odocoileus_virginianus,1,n,
MFDC3126.JPG,4_AEP,Session_2,2/24/2021,15:41:20,TRUE,Session_2__2021-02-24__15-41-20(1).JPG,Odocoileus_virginianus,1,n,
MFDC3127.JPG,4_AEP,Session_2,2/24/2021,15:44:14,TRUE,Session_2__2021-02-24__15-44-14(1).JPG,Odocoileus_virginianus,1,n,
MFDC3128.JPG,4_AEP,Session_2,2/25/2021,7:51:20,TRUE,Session_2__2021-02-25__07-51-20(1).JPG,Sciurus_sp,1,n,
MFDC3129.JPG,4_AEP,Session_2,2/26/2021,6:15:27,TRUE,Session_2__2021-02-26__06-15-27(1).JPG,NA,0,n,
MFDC3130.JPG,4_AEP,Session_2,2/26/2021,17:18:54,TRUE,Session_2__2021-02-26__17-18-54(1).JPG,Sciurus_sp,1,n,
MFDC3131.JPG,4_AEP,Session_2,2/26/2021,23:47:16,TRUE,Session_2__2021-02-26__23-47-16(1).JPG,Canis_latrans,1,n,
MFDC3132.JPG,4_AEP,Session_2,2/26/2021,23:47:51,TRUE,Session_2__2021-02-26__23-47-51(2).JPG,Canis_latrans,1,n,
MFDC3133.JPG,4_AEP,Session_2,2/27/2021,7:54:44,TRUE,Session_2__2021-02-27__07-54-44(1).JPG,NA,0,n,
MFDC3134.JPG,4_AEP,Session_2,2/27/2021,9:42:50,TRUE,Session_2__2021-02-27__09-42-50(1).JPG,NA,0,n,
MFDC3135.JPG,4_AEP,Session_2,2/27/2021,19:56:32,TRUE,Session_2__2021-02-27__19-56-32(1).JPG,Procyon_lotor,1,n,
MFDC3136.JPG,4_AEP,Session_2,2/27/2021,19:57:32,TRUE,Session_2__2021-02-27__19-57-32(1).JPG,Procyon_lotor,1,n,
MFDC3137.JPG,4_AEP,Session_2,2/28/2021,3:31:51,TRUE,Session_2__2021-02-28__03-31-51(1).JPG,NA,0,n,
MFDC3138.JPG,4_AEP,Session_2,2/28/2021,5:29:55,TRUE,Session_2__2021-02-28__05-29-55(1).JPG,NA,0,n,
MFDC3139.JPG,4_AEP,Session_2,3/1/2021,19:46:19,TRUE,Session_2__2021-03-01__19-46-19(1).JPG,Procyon_lotor,1,n,
MFDC3140.JPG,4_AEP,Session_2,3/1/2021,19:47:19,TRUE,Session_2__2021-03-01__19-47-19(1).JPG,Procyon_lotor,1,n,
MFDC3141.JPG,4_AEP,Session_2,3/2/2021,7:25:51,TRUE,Session_2__2021-03-02__07-25-51(1).JPG,Odocoileus_virginianus,1,n,
MFDC3142.JPG,4_AEP,Session_2,3/2/2021,7:26:46,TRUE,Session_2__2021-03-02__07-26-46(1).JPG,Odocoileus_virginianus,1,n,
MFDC3143.JPG,4_AEP,Session_2,3/2/2021,19:46:04,TRUE,Session_2__2021-03-02__19-46-04(1).JPG,Unid,1,n,
MFDC3144.JPG,4_AEP,Session_2,3/2/2021,22:20:06,TRUE,Session_2__2021-03-02__22-20-06(1).JPG,Procyon_lotor,1,n,
MFDC3145.JPG,4_AEP,Session_2,3/2/2021,22:20:52,TRUE,Session_2__2021-03-02__22-20-52(2).JPG,Procyon_lotor,1,n,
MFDC3146.JPG,4_AEP,Session_2,3/2/2021,22:21:47,TRUE,Session_2__2021-03-02__22-21-47(1).JPG,Procyon_lotor,1,n,
MFDC3147.JPG,4_AEP,Session_2,3/2/2021,22:22:31,TRUE,Session_2__2021-03-02__22-22-31(1).JPG,Procyon_lotor,1,n,
MFDC3148.JPG,4_AEP,Session_2,3/2/2021,22:23:07,TRUE,Session_2__2021-03-02__22-23-07(1).JPG,Unid,1,n,
MFDC3149.JPG,4_AEP,Session_2,3/4/2021,22:13:52,TRUE,Session_2__2021-03-04__22-13-52(1).JPG,Procyon_lotor,1,n,
MFDC3150.JPG,4_AEP,Session_2,3/4/2021,22:13:54,TRUE,Session_2__2021-03-04__22-13-54(2).JPG,Procyon_lotor,1,n,
MFDC3151.JPG,4_AEP,Session_2,3/4/2021,22:14:30,TRUE,Session_2__2021-03-04__22-14-30(1).JPG,NA,0,n,
MFDC3152.JPG,4_AEP,Session_2,3/4/2021,22:32:47,TRUE,Session_2__2021-03-04__22-32-47(1).JPG,Procyon_lotor,1,n,
MFDC3153.JPG,4_AEP,Session_2,3/4/2021,22:32:50,TRUE,Session_2__2021-03-04__22-32-50(2).JPG,NA,0,n,
MFDC3154.JPG,4_AEP,Session_2,3/5/2021,18:31:50,TRUE,Session_2__2021-03-05__18-31-50(1).JPG,Sciurus_sp,1,n,
MFDC3155.JPG,4_AEP,Session_2,3/6/2021,17:45:17,TRUE,Session_2__2021-03-06__17-45-17(1).JPG,NA,0,n,
MFDC3156.JPG,4_AEP,Session_2,3/6/2021,17:45:21,TRUE,Session_2__2021-03-06__17-45-21(2).JPG,Sciurus_sp,1,n,
MFDC3157.JPG,4_AEP,Session_2,3/8/2021,11:36:38,TRUE,Session_2__2021-03-08__11-36-38(1).JPG,Meleagris_gallopavo,1,n,
MFDC3158.JPG,4_AEP,Session_2,3/8/2021,11:36:40,TRUE,Session_2__2021-03-08__11-36-40(2).JPG,Meleagris_gallopavo,1,n,
MFDC3159.JPG,4_AEP,Session_2,3/8/2021,15:17:00,TRUE,Session_2__2021-03-08__15-17-00(1).JPG,Meleagris_gallopavo,1,n,
MFDC3160.JPG,4_AEP,Session_2,3/8/2021,15:17:02,TRUE,Session_2__2021-03-08__15-17-02(2).JPG,Meleagris_gallopavo,2,n,
MFDC3161.JPG,4_AEP,Session_2,3/8/2021,15:17:04,TRUE,Session_2__2021-03-08__15-17-04(3).JPG,Meleagris_gallopavo,2,n,
MFDC3162.JPG,4_AEP,Session_2,3/9/2021,1:01:18,TRUE,Session_2__2021-03-09__01-01-18(1).JPG,NA,0,n,
MFDC3163.JPG,4_AEP,Session_2,3/9/2021,1:02:02,TRUE,Session_2__2021-03-09__01-02-02(1).JPG,Procyon_lotor,1,n,
MFDC3164.JPG,4_AEP,Session_2,3/9/2021,6:44:45,TRUE,Session_2__2021-03-09__06-44-45(1).JPG,NA,0,n,
MFDC3165.JPG,4_AEP,Session_2,3/9/2021,6:47:27,TRUE,Session_2__2021-03-09__06-47-27(1).JPG,Sciurus_sp,1,n,
MFDC3166.JPG,4_AEP,Session_2,3/9/2021,16:42:26,TRUE,Session_2__2021-03-09__16-42-26(1).JPG,Sciurus_sp,1,n,
MFDC3167.JPG,4_AEP,Session_2,3/11/2021,1:28:49,TRUE,Session_2__2021-03-11__01-28-49(1).JPG,Odocoileus_virginianus,1,n,
MFDC3168.JPG,4_AEP,Session_2,3/11/2021,1:28:51,TRUE,Session_2__2021-03-11__01-28-51(2).JPG,Odocoileus_virginianus,1,n,
MFDC3169.JPG,4_AEP,Session_2,3/11/2021,1:29:42,TRUE,Session_2__2021-03-11__01-29-42(1).JPG,Odocoileus_virginianus,1,n,
MFDC3170.JPG,4_AEP,Session_2,3/13/2021,17:48:50,TRUE,Session_2__2021-03-13__17-48-50(1).JPG,NA,0,n,
MFDC3171.JPG,4_AEP,Session_2,3/13/2021,21:19:29,TRUE,Session_2__2021-03-13__21-19-29(1).JPG,NA,0,n,
MFDC3172.JPG,4_AEP,Session_2,3/14/2021,4:39:47,TRUE,Session_2__2021-03-14__04-39-47(1).JPG,Procyon_lotor,1,n,
MFDC3173.JPG,4_AEP,Session_2,3/14/2021,10:00:38,TRUE,Session_2__2021-03-14__10-00-38(1).JPG,Canis_familiaris,1,n,
MFDC3174.JPG,4_AEP,Session_2,3/14/2021,10:01:11,TRUE,Session_2__2021-03-14__10-01-11(1).JPG,Homo_sapiens,1,n,
MFDC3175.JPG,4_AEP,Session_2,3/14/2021,10:01:13,TRUE,Session_2__2021-03-14__10-01-13(2).JPG,Homo_sapiens,1,n,
MFDC3176.JPG,4_AEP,Session_2,3/14/2021,10:01:14,TRUE,Session_2__2021-03-14__10-01-14(3).JPG,Homo_sapiens,1,n,
MFDC3177.JPG,4_AEP,Session_3,3/14/2021,11:03:41,TRUE,Session_3__2021-03-14__11-03-41(1).JPG,Canis_familiaris,1,n,
MFDC3178.JPG,4_AEP,Session_3,3/14/2021,11:03:41,TRUE,Session_3__2021-03-14__11-03-41(2).JPG,NA,0,n,
MFDC3179.JPG,4_AEP,Session_3,3/14/2021,11:03:41,TRUE,Session_3__2021-03-14__11-03-41(3).JPG,NA,0,n,
MFDC3180.JPG,4_AEP,Session_3,3/15/2021,19:31:20,TRUE,Session_3__2021-03-15__19-31-20(1).JPG,NA,0,n,
MFDC3181.JPG,4_AEP,Session_3,3/15/2021,19:31:20,TRUE,Session_3__2021-03-15__19-31-20(2).JPG,Odocoileus_virginianus,1,n,
MFDC3182.JPG,4_AEP,Session_3,3/15/2021,19:31:20,TRUE,Session_3__2021-03-15__19-31-20(3).JPG,Odocoileus_virginianus,1,n,
MFDC3183.JPG,4_AEP,Session_3,3/15/2021,20:01:16,TRUE,Session_3__2021-03-15__20-01-16(1).JPG,Odocoileus_virginianus,1,n,
MFDC3184.JPG,4_AEP,Session_3,3/15/2021,20:01:16,TRUE,Session_3__2021-03-15__20-01-16(2).JPG,Odocoileus_virginianus,1,n,
MFDC3185.JPG,4_AEP,Session_3,3/15/2021,20:01:17,TRUE,Session_3__2021-03-15__20-01-17(3).JPG,Odocoileus_virginianus,1,n,
MFDC3186.JPG,4_AEP,Session_3,3/16/2021,1:45:36,TRUE,Session_3__2021-03-16__01-45-36(1).JPG,NA,0,n,
MFDC3187.JPG,4_AEP,Session_3,3/16/2021,1:45:36,TRUE,Session_3__2021-03-16__01-45-36(2).JPG,NA,0,n,
MFDC3188.JPG,4_AEP,Session_3,3/16/2021,1:45:36,TRUE,Session_3__2021-03-16__01-45-36(3).JPG,NA,0,n,
MFDC3189.JPG,4_AEP,Session_3,3/16/2021,1:47:07,TRUE,Session_3__2021-03-16__01-47-07(1).JPG,Procyon_lotor,1,n,
MFDC3190.JPG,4_AEP,Session_3,3/16/2021,1:47:07,TRUE,Session_3__2021-03-16__01-47-07(2).JPG,Procyon_lotor,1,n,
MFDC3191.JPG,4_AEP,Session_3,3/16/2021,1:47:07,TRUE,Session_3__2021-03-16__01-47-07(3).JPG,Procyon_lotor,1,n,
MFDC3192.JPG,4_AEP,Session_3,3/16/2021,1:58:20,TRUE,Session_3__2021-03-16__01-58-20(1).JPG,Procyon_lotor,1,n,
MFDC3193.JPG,4_AEP,Session_3,3/16/2021,1:58:20,TRUE,Session_3__2021-03-16__01-58-20(2).JPG,Procyon_lotor,1,n,
MFDC3194.JPG,4_AEP,Session_3,3/16/2021,1:58:21,TRUE,Session_3__2021-03-16__01-58-21(3).JPG,Procyon_lotor,1,n,
MFDC3195.JPG,4_AEP,Session_3,3/16/2021,2:06:25,TRUE,Session_3__2021-03-16__02-06-25(1).JPG,Sylvilagus_floridanus,1,n,
MFDC3196.JPG,4_AEP,Session_3,3/16/2021,2:06:25,TRUE,Session_3__2021-03-16__02-06-25(2).JPG,Sylvilagus_floridanus,1,n,
MFDC3197.JPG,4_AEP,Session_3,3/16/2021,2:06:26,TRUE,Session_3__2021-03-16__02-06-26(3).JPG,Sylvilagus_floridanus,1,n,
MFDC3198.JPG,4_AEP,Session_3,3/16/2021,19:14:26,TRUE,Session_3__2021-03-16__19-14-26(1).JPG,Sciurus_sp,1,n,
MFDC3199.JPG,4_AEP,Session_3,3/16/2021,19:14:26,TRUE,Session_3__2021-03-16__19-14-26(2).JPG,Sciurus_sp,1,n,
MFDC3200.JPG,4_AEP,Session_3,3/16/2021,19:14:26,TRUE,Session_3__2021-03-16__19-14-26(3).JPG,Sciurus_sp,1,n,
MFDC3201.JPG,4_AEP,Session_3,3/16/2021,19:19:01,TRUE,Session_3__2021-03-16__19-19-01(1).JPG,Sciurus_sp,1,n,
MFDC3202.JPG,4_AEP,Session_3,3/16/2021,19:19:02,TRUE,Session_3__2021-03-16__19-19-02(2).JPG,Sciurus_sp,1,n,
MFDC3203.JPG,4_AEP,Session_3,3/16/2021,19:19:03,TRUE,Session_3__2021-03-16__19-19-03(3).JPG,Sciurus_sp,1,n,
MFDC3204.JPG,4_AEP,Session_3,3/17/2021,11:16:18,TRUE,Session_3__2021-03-17__11-16-18(1).JPG,NA,0,n,
MFDC3205.JPG,4_AEP,Session_3,3/17/2021,11:16:18,TRUE,Session_3__2021-03-17__11-16-18(2).JPG,NA,0,n,
MFDC3206.JPG,4_AEP,Session_3,3/17/2021,11:16:18,TRUE,Session_3__2021-03-17__11-16-18(3).JPG,NA,0,n,
MFDC3207.JPG,4_AEP,Session_3,3/17/2021,19:18:58,TRUE,Session_3__2021-03-17__19-18-58(1).JPG,Odocoileus_virginianus,1,n,
MFDC3208.JPG,4_AEP,Session_3,3/17/2021,19:18:58,TRUE,Session_3__2021-03-17__19-18-58(2).JPG,Odocoileus_virginianus,1,n,
MFDC3209.JPG,4_AEP,Session_3,3/17/2021,19:18:59,TRUE,Session_3__2021-03-17__19-18-59(3).JPG,Odocoileus_virginianus,1,n,
MFDC3210.JPG,4_AEP,Session_3,3/17/2021,19:21:52,TRUE,Session_3__2021-03-17__19-21-52(1).JPG,Odocoileus_virginianus,2,n,
MFDC3211.JPG,4_AEP,Session_3,3/17/2021,19:21:52,TRUE,Session_3__2021-03-17__19-21-52(2).JPG,Odocoileus_virginianus,2,n,
MFDC3212.JPG,4_AEP,Session_3,3/17/2021,19:21:53,TRUE,Session_3__2021-03-17__19-21-53(3).JPG,Odocoileus_virginianus,2,n,
MFDC3213.JPG,4_AEP,Session_3,3/17/2021,19:22:54,TRUE,Session_3__2021-03-17__19-22-54(1).JPG,Odocoileus_virginianus,1,n,
MFDC3214.JPG,4_AEP,Session_3,3/17/2021,19:22:54,TRUE,Session_3__2021-03-17__19-22-54(2).JPG,Odocoileus_virginianus,1,n,
MFDC3215.JPG,4_AEP,Session_3,3/17/2021,19:22:54,TRUE,Session_3__2021-03-17__19-22-54(3).JPG,Odocoileus_virginianus,1,n,
MFDC3216.JPG,4_AEP,Session_3,3/17/2021,19:24:21,TRUE,Session_3__2021-03-17__19-24-21(1).JPG,Odocoileus_virginianus,1,n,
MFDC3217.JPG,4_AEP,Session_3,3/17/2021,19:24:22,TRUE,Session_3__2021-03-17__19-24-22(2).JPG,Odocoileus_virginianus,1,n,
MFDC3218.JPG,4_AEP,Session_3,3/17/2021,19:24:22,TRUE,Session_3__2021-03-17__19-24-22(3).JPG,Odocoileus_virginianus,1,n,
MFDC3219.JPG,4_AEP,Session_3,3/17/2021,21:10:23,TRUE,Session_3__2021-03-17__21-10-23(1).JPG,NA,0,n,
MFDC3220.JPG,4_AEP,Session_3,3/17/2021,21:10:23,TRUE,Session_3__2021-03-17__21-10-23(2).JPG,NA,0,n,
MFDC3221.JPG,4_AEP,Session_3,3/17/2021,21:10:23,TRUE,Session_3__2021-03-17__21-10-23(3).JPG,NA,0,n,
MFDC3222.JPG,4_AEP,Session_3,3/17/2021,23:04:09,TRUE,Session_3__2021-03-17__23-04-09(1).JPG,NA,0,n,
MFDC3223.JPG,4_AEP,Session_3,3/17/2021,23:04:09,TRUE,Session_3__2021-03-17__23-04-09(2).JPG,NA,0,n,
MFDC3224.JPG,4_AEP,Session_3,3/17/2021,23:04:10,TRUE,Session_3__2021-03-17__23-04-10(3).JPG,NA,0,n,
MFDC3225.JPG,4_AEP,Session_3,3/19/2021,2:45:12,TRUE,Session_3__2021-03-19__02-45-12(2).JPG,NA,0,n,
MFDC3226.JPG,4_AEP,Session_3,3/19/2021,2:45:11,TRUE,Session_3__2021-03-19__02-45-11(1).JPG,NA,0,n,
MFDC3227.JPG,4_AEP,Session_3,3/19/2021,2:45:12,TRUE,Session_3__2021-03-19__02-45-12(3).JPG,NA,0,n,
MFDC3228.JPG,4_AEP,Session_3,3/20/2021,20:16:14,TRUE,Session_3__2021-03-20__20-16-14(1).JPG,Didelphis_virginiana,1,n,
MFDC3229.JPG,4_AEP,Session_3,3/20/2021,20:16:15,TRUE,Session_3__2021-03-20__20-16-15(2).JPG,Didelphis_virginiana,1,n,
MFDC3230.JPG,4_AEP,Session_3,3/20/2021,20:16:15,TRUE,Session_3__2021-03-20__20-16-15(3).JPG,Didelphis_virginiana,1,n,
MFDC3231.JPG,4_AEP,Session_3,3/21/2021,4:31:09,TRUE,Session_3__2021-03-21__04-31-09(1).JPG,Sylvilagus_floridanus,1,n,
MFDC3232.JPG,4_AEP,Session_3,3/21/2021,4:31:09,TRUE,Session_3__2021-03-21__04-31-09(2).JPG,Sylvilagus_floridanus,1,n,
MFDC3233.JPG,4_AEP,Session_3,3/21/2021,4:31:09,TRUE,Session_3__2021-03-21__04-31-09(3).JPG,Sylvilagus_floridanus,1,n,
MFDC3234.JPG,4_AEP,Session_3,3/21/2021,10:57:16,TRUE,Session_3__2021-03-21__10-57-16(2).JPG,NA,0,n,
MFDC3235.JPG,4_AEP,Session_3,3/21/2021,10:57:15,TRUE,Session_3__2021-03-21__10-57-15(1).JPG,NA,0,n,
MFDC3236.JPG,4_AEP,Session_3,3/21/2021,10:57:17,TRUE,Session_3__2021-03-21__10-57-17(3).JPG,NA,0,n,
MFDC3237.JPG,4_AEP,Session_3,3/22/2021,2:09:22,TRUE,Session_3__2021-03-22__02-09-22(1).JPG,NA,0,n,
MFDC3238.JPG,4_AEP,Session_3,3/22/2021,2:09:22,TRUE,Session_3__2021-03-22__02-09-22(2).JPG,NA,0,n,
MFDC3239.JPG,4_AEP,Session_3,3/22/2021,2:09:22,TRUE,Session_3__2021-03-22__02-09-22(3).JPG,NA,0,n,
MFDC3240.JPG,4_AEP,Session_3,3/22/2021,4:45:48,TRUE,Session_3__2021-03-22__04-45-48(2).JPG,Procyon_lotor,1,n,
MFDC3241.JPG,4_AEP,Session_3,3/22/2021,4:45:47,TRUE,Session_3__2021-03-22__04-45-47(1).JPG,Procyon_lotor,1,n,
MFDC3242.JPG,4_AEP,Session_3,3/22/2021,4:45:48,TRUE,Session_3__2021-03-22__04-45-48(3).JPG,Procyon_lotor,1,n,
MFDC3243.JPG,4_AEP,Session_3,3/22/2021,20:35:00,TRUE,Session_3__2021-03-22__20-35-00(1).JPG,NA,0,n,
MFDC3244.JPG,4_AEP,Session_3,3/22/2021,20:35:01,TRUE,Session_3__2021-03-22__20-35-01(3).JPG,NA,0,n,
MFDC3245.JPG,4_AEP,Session_3,3/22/2021,20:35:00,TRUE,Session_3__2021-03-22__20-35-00(2).JPG,NA,0,n,
MFDC3246.JPG,4_AEP,Session_3,3/23/2021,9:04:09,TRUE,Session_3__2021-03-23__09-04-09(2).JPG,NA,0,n,
MFDC3247.JPG,4_AEP,Session_3,3/23/2021,9:04:08,TRUE,Session_3__2021-03-23__09-04-08(1).JPG,NA,0,n,
MFDC3248.JPG,4_AEP,Session_3,3/23/2021,9:04:09,TRUE,Session_3__2021-03-23__09-04-09(3).JPG,NA,0,n,
MFDC3249.JPG,4_AEP,Session_3,3/24/2021,10:38:38,TRUE,Session_3__2021-03-24__10-38-38(3).JPG,Avian_sp,1,y,hawk with kill
MFDC3250.JPG,4_AEP,Session_3,3/24/2021,10:38:37,TRUE,Session_3__2021-03-24__10-38-37(1).JPG,Avian_sp,1,n,hawk with kill
MFDC3251.JPG,4_AEP,Session_3,3/24/2021,10:38:37,TRUE,Session_3__2021-03-24__10-38-37(2).JPG,Avian_sp,1,n,hawk with kill
MFDC3252.JPG,4_AEP,Session_3,3/24/2021,21:20:49,TRUE,Session_3__2021-03-24__21-20-49(1).JPG,NA,0,n,
MFDC3253.JPG,4_AEP,Session_3,3/24/2021,21:20:49,TRUE,Session_3__2021-03-24__21-20-49(2).JPG,NA,0,n,
MFDC3254.JPG,4_AEP,Session_3,3/24/2021,21:20:50,TRUE,Session_3__2021-03-24__21-20-50(3).JPG,NA,0,n,
MFDC3255.JPG,4_AEP,Session_3,3/24/2021,21:23:29,TRUE,Session_3__2021-03-24__21-23-29(1).JPG,NA,0,n,
MFDC3256.JPG,4_AEP,Session_3,3/24/2021,21:23:29,TRUE,Session_3__2021-03-24__21-23-29(2).JPG,NA,0,n,
MFDC3257.JPG,4_AEP,Session_3,3/24/2021,21:23:29,TRUE,Session_3__2021-03-24__21-23-29(3).JPG,NA,0,n,
MFDC3258.JPG,4_AEP,Session_3,3/26/2021,8:38:26,TRUE,Session_3__2021-03-26__08-38-26(2).JPG,NA,0,n,
MFDC3259.JPG,4_AEP,Session_3,3/26/2021,8:38:25,TRUE,Session_3__2021-03-26__08-38-25(1).JPG,NA,0,n,
MFDC3260.JPG,4_AEP,Session_3,3/26/2021,8:38:26,TRUE,Session_3__2021-03-26__08-38-26(3).JPG,NA,0,n,
MFDC3261.JPG,4_AEP,Session_3,3/26/2021,8:39:24,TRUE,Session_3__2021-03-26__08-39-24(1).JPG,NA,0,n,
MFDC3262.JPG,4_AEP,Session_3,3/26/2021,8:39:25,TRUE,Session_3__2021-03-26__08-39-25(2).JPG,NA,0,n,
MFDC3263.JPG,4_AEP,Session_3,3/26/2021,8:39:26,TRUE,Session_3__2021-03-26__08-39-26(3).JPG,NA,0,n,
MFDC3264.JPG,4_AEP,Session_3,3/26/2021,8:57:25,TRUE,Session_3__2021-03-26__08-57-25(3).JPG,NA,0,n,
MFDC3265.JPG,4_AEP,Session_3,3/26/2021,8:57:24,TRUE,Session_3__2021-03-26__08-57-24(1).JPG,NA,0,n,
MFDC3266.JPG,4_AEP,Session_3,3/26/2021,8:57:24,TRUE,Session_3__2021-03-26__08-57-24(2).JPG,NA,0,n,
MFDC3267.JPG,4_AEP,Session_3,3/26/2021,17:24:36,TRUE,Session_3__2021-03-26__17-24-36(1).JPG,NA,0,n,
MFDC3268.JPG,4_AEP,Session_3,3/26/2021,17:24:36,TRUE,Session_3__2021-03-26__17-24-36(2).JPG,NA,0,n,
MFDC3269.JPG,4_AEP,Session_3,3/26/2021,17:24:38,TRUE,Session_3__2021-03-26__17-24-38(3).JPG,NA,0,n,
MFDC3270.JPG,4_AEP,Session_3,3/27/2021,5:26:35,TRUE,Session_3__2021-03-27__05-26-35(1).JPG,Lynx_rufus,1,y,tree hugger
MFDC3271.JPG,4_AEP,Session_3,3/27/2021,5:26:35,TRUE,Session_3__2021-03-27__05-26-35(2).JPG,Lynx_rufus,1,y,tree hugger
MFDC3272.JPG,4_AEP,Session_3,3/27/2021,5:26:35,TRUE,Session_3__2021-03-27__05-26-35(3).JPG,Lynx_rufus,1,y,tree hugger
MFDC3273.JPG,4_AEP,Session_3,3/27/2021,5:27:08,TRUE,Session_3__2021-03-27__05-27-08(1).JPG,Lynx_rufus,1,y,tree hugger
MFDC3274.JPG,4_AEP,Session_3,3/27/2021,5:27:08,TRUE,Session_3__2021-03-27__05-27-08(2).JPG,Lynx_rufus,1,y,tree hugger
MFDC3275.JPG,4_AEP,Session_3,3/27/2021,5:27:10,TRUE,Session_3__2021-03-27__05-27-10(3).JPG,Lynx_rufus,1,y,tree hugger
MFDC3276.JPG,4_AEP,Session_3,3/27/2021,5:27:46,TRUE,Session_3__2021-03-27__05-27-46(4).JPG,Lynx_rufus,1,y,tree hugger
MFDC3277.JPG,4_AEP,Session_3,3/27/2021,5:27:46,TRUE,Session_3__2021-03-27__05-27-46(5).JPG,Lynx_rufus,1,y,tree hugger
MFDC3278.JPG,4_AEP,Session_3,3/27/2021,5:27:46,TRUE,Session_3__2021-03-27__05-27-46(6).JPG,Lynx_rufus,1,y,tree hugger
MFDC3279.JPG,4_AEP,Session_3,3/27/2021,5:29:15,TRUE,Session_3__2021-03-27__05-29-15(1).JPG,Lynx_rufus,1,y,tree hugger
MFDC3280.JPG,4_AEP,Session_3,3/27/2021,5:29:16,TRUE,Session_3__2021-03-27__05-29-16(2).JPG,Lynx_rufus,1,y,tree hugger
MFDC3281.JPG,4_AEP,Session_3,3/27/2021,5:29:16,TRUE,Session_3__2021-03-27__05-29-16(3).JPG,Lynx_rufus,1,y,tree hugger
MFDC3282.JPG,4_AEP,Session_3,3/27/2021,5:30:22,TRUE,Session_3__2021-03-27__05-30-22(1).JPG,Lynx_rufus,1,y,tree hugger
MFDC3283.JPG,4_AEP,Session_3,3/27/2021,5:30:23,TRUE,Session_3__2021-03-27__05-30-23(2).JPG,Lynx_rufus,1,y,tree hugger
MFDC3284.JPG,4_AEP,Session_3,3/27/2021,5:30:23,TRUE,Session_3__2021-03-27__05-30-23(3).JPG,Lynx_rufus,1,y,tree hugger
MFDC3285-Marissa’s MacBook Pro (2).JPG,4_AEP,Session_3,3/27/2021,5:57:51,TRUE,Session_3__2021-03-27__05-57-51(1).JPG,Procyon_lotor,1,n,
MFDC3285.JPG,4_AEP,Session_3,NA,NA,FALSE,Session_3__NA(NA).JPG,NA,0,n,
MFDC3286.JPG,4_AEP,Session_3,3/27/2021,5:57:52,TRUE,Session_3__2021-03-27__05-57-52(2).JPG,Procyon_lotor,1,n,
MFDC3287.JPG,4_AEP,Session_3,3/27/2021,5:57:52,TRUE,Session_3__2021-03-27__05-57-52(3).JPG,Procyon_lotor,1,n,
MFDC3288.JPG,4_AEP,Session_3,3/27/2021,9:51:11,TRUE,Session_3__2021-03-27__09-51-11(1).JPG,Procyon_lotor,1,n,
MFDC3289.JPG,4_AEP,Session_3,3/27/2021,9:51:11,TRUE,Session_3__2021-03-27__09-51-11(2).JPG,Sciurus_sp,1,n,carrying nut
MFDC3290.JPG,4_AEP,Session_3,3/27/2021,9:51:11,TRUE,Session_3__2021-03-27__09-51-11(3).JPG,Sciurus_sp,1,n,
MFDC3291.JPG,4_AEP,Session_3,3/27/2021,11:44:27,TRUE,Session_3__2021-03-27__11-44-27(1).JPG,Sciurus_sp,1,n,
MFDC3292.JPG,4_AEP,Session_3,3/27/2021,11:44:28,TRUE,Session_3__2021-03-27__11-44-28(2).JPG,Odocoileus_virginianus,1,n,
MFDC3293.JPG,4_AEP,Session_3,3/27/2021,11:44:28,TRUE,Session_3__2021-03-27__11-44-28(3).JPG,Odocoileus_virginianus,1,n,
MFDC3294.JPG,4_AEP,Session_3,3/28/2021,5:03:40,TRUE,Session_3__2021-03-28__05-03-40(1).JPG,NA,0,n,
MFDC3295.JPG,4_AEP,Session_3,3/28/2021,5:03:40,TRUE,Session_3__2021-03-28__05-03-40(2).JPG,NA,0,n,
MFDC3296.JPG,4_AEP,Session_3,3/28/2021,5:03:41,TRUE,Session_3__2021-03-28__05-03-41(3).JPG,NA,0,n,
MFDC3297.JPG,4_AEP,Session_3,3/28/2021,20:13:03,TRUE,Session_3__2021-03-28__20-13-03(1).JPG,NA,0,n,
MFDC3298.JPG,4_AEP,Session_3,3/28/2021,20:13:04,TRUE,Session_3__2021-03-28__20-13-04(3).JPG,NA,0,n,
MFDC3299.JPG,4_AEP,Session_3,3/28/2021,20:13:03,TRUE,Session_3__2021-03-28__20-13-03(2).JPG,NA,0,n,
MFDC3300.JPG,4_AEP,Session_3,3/28/2021,20:17:33,TRUE,Session_3__2021-03-28__20-17-33(1).JPG,NA,0,n,
MFDC3301.JPG,4_AEP,Session_3,3/28/2021,20:17:35,TRUE,Session_3__2021-03-28__20-17-35(3).JPG,NA,0,n,
MFDC3302.JPG,4_AEP,Session_3,3/28/2021,20:17:34,TRUE,Session_3__2021-03-28__20-17-34(2).JPG,NA,0,n,
MFDC3303.JPG,4_AEP,Session_3,3/29/2021,0:19:59,TRUE,Session_3__2021-03-29__00-19-59(1).JPG,NA,0,n,
MFDC3304.JPG,4_AEP,Session_3,3/29/2021,0:19:59,TRUE,Session_3__2021-03-29__00-19-59(2).JPG,NA,0,n,
MFDC3305.JPG,4_AEP,Session_3,3/29/2021,0:19:59,TRUE,Session_3__2021-03-29__00-19-59(3).JPG,NA,0,n,
MFDC3306.JPG,4_AEP,Session_3,3/30/2021,3:01:15,TRUE,Session_3__2021-03-30__03-01-15(1).JPG,Procyon_lotor,1,n,
MFDC3307.JPG,4_AEP,Session_3,3/30/2021,3:01:15,TRUE,Session_3__2021-03-30__03-01-15(2).JPG,Procyon_lotor,1,n,
MFDC3308.JPG,4_AEP,Session_3,3/30/2021,3:01:15,TRUE,Session_3__2021-03-30__03-01-15(3).JPG,Procyon_lotor,1,n,
MFDC3309.JPG,4_AEP,Session_3,3/30/2021,8:53:41,TRUE,Session_3__2021-03-30__08-53-41(1).JPG,NA,0,n,
MFDC3310.JPG,4_AEP,Session_3,3/30/2021,8:53:41,TRUE,Session_3__2021-03-30__08-53-41(2).JPG,NA,0,n,
MFDC3311.JPG,4_AEP,Session_3,3/30/2021,8:53:42,TRUE,Session_3__2021-03-30__08-53-42(3).JPG,NA,0,n,
MFDC3312.JPG,4_AEP,Session_3,3/31/2021,3:07:57,TRUE,Session_3__2021-03-31__03-07-57(1).JPG,NA,0,n,
MFDC3313.JPG,4_AEP,Session_3,3/31/2021,3:07:57,TRUE,Session_3__2021-03-31__03-07-57(2).JPG,NA,0,n,
MFDC3314.JPG,4_AEP,Session_3,3/31/2021,3:07:59,TRUE,Session_3__2021-03-31__03-07-59(3).JPG,NA,0,n,
MFDC3315.JPG,4_AEP,Session_3,3/31/2021,8:07:29,TRUE,Session_3__2021-03-31__08-07-29(1).JPG,NA,0,n,
MFDC3316.JPG,4_AEP,Session_3,3/31/2021,8:07:30,TRUE,Session_3__2021-03-31__08-07-30(2).JPG,NA,0,n,
MFDC3317.JPG,4_AEP,Session_3,3/31/2021,8:07:30,TRUE,Session_3__2021-03-31__08-07-30(3).JPG,NA,0,n,
MFDC3318.JPG,4_AEP,Session_3,4/1/2021,7:07:55,TRUE,Session_3__2021-04-01__07-07-55(1).JPG,Sciurus_sp,1,n,
MFDC3319.JPG,4_AEP,Session_3,4/1/2021,7:07:55,TRUE,Session_3__2021-04-01__07-07-55(2).JPG,NA,0,n,
MFDC3320.JPG,4_AEP,Session_3,4/1/2021,7:07:55,TRUE,Session_3__2021-04-01__07-07-55(3).JPG,NA,0,n,
MFDC3321.JPG,4_AEP,Session_3,4/1/2021,22:32:54,TRUE,Session_3__2021-04-01__22-32-54(1).JPG,Sylvilagus_floridanus,1,n,
MFDC3322.JPG,4_AEP,Session_3,4/1/2021,22:32:54,TRUE,Session_3__2021-04-01__22-32-54(2).JPG,Sylvilagus_floridanus,1,n,
MFDC3323.JPG,4_AEP,Session_3,4/1/2021,22:32:55,TRUE,Session_3__2021-04-01__22-32-55(3).JPG,Sylvilagus_floridanus,1,n,
MFDC3324 2.JPG,4_AEP,Session_3,4/2/2021,22:48:55,TRUE,Session_3__2021-04-02__22-48-55(3).JPG,NA,0,n,
MFDC3324.JPG,4_AEP,Session_3,4/2/2021,22:48:41,TRUE,Session_3__2021-04-02__22-48-41(1).JPG,Procyon_lotor,1,n,
MFDC3325 2.JPG,4_AEP,Session_3,4/2/2021,22:48:55,TRUE,Session_3__2021-04-02__22-48-55(4).JPG,NA,0,n,
MFDC3325.JPG,4_AEP,Session_3,4/2/2021,22:48:43,TRUE,Session_3__2021-04-02__22-48-43(2).JPG,Procyon_lotor,1,n,
MFDC3326 2.JPG,4_AEP,Session_3,4/2/2021,22:48:55,TRUE,Session_3__2021-04-02__22-48-55(5).JPG,NA,0,n,
MFDC3326.JPG,4_AEP,Session_3,NA,NA,FALSE,Session_3__NA(NA).JPG,NA,0,n,
MFDC3327.JPG,4_AEP,Session_3,4/3/2021,8:34:25,TRUE,Session_3__2021-04-03__08-34-25(1).JPG,Meleagris_gallopavo,1,n,
MFDC3328.JPG,4_AEP,Session_3,4/3/2021,8:34:27,TRUE,Session_3__2021-04-03__08-34-27(3).JPG,Meleagris_gallopavo,1,n,
MFDC3329.JPG,4_AEP,Session_3,4/3/2021,8:34:26,TRUE,Session_3__2021-04-03__08-34-26(2).JPG,Meleagris_gallopavo,1,n,
MFDC3330.JPG,4_AEP,Session_3,4/3/2021,8:35:34,TRUE,Session_3__2021-04-03__08-35-34(2).JPG,Meleagris_gallopavo,6,n,
MFDC3331.JPG,4_AEP,Session_3,4/3/2021,8:35:33,TRUE,Session_3__2021-04-03__08-35-33(1).JPG,Meleagris_gallopavo,6,n,
MFDC3332.JPG,4_AEP,Session_3,4/3/2021,8:35:34,TRUE,Session_3__2021-04-03__08-35-34(3).JPG,Meleagris_gallopavo,6,n,
MFDC3333.JPG,4_AEP,Session_3,4/3/2021,8:36:11,TRUE,Session_3__2021-04-03__08-36-11(1).JPG,Meleagris_gallopavo,3,n,
MFDC3334.JPG,4_AEP,Session_3,4/3/2021,8:36:12,TRUE,Session_3__2021-04-03__08-36-12(2).JPG,Meleagris_gallopavo,3,n,
MFDC3335.JPG,4_AEP,Session_3,4/3/2021,8:36:12,TRUE,Session_3__2021-04-03__08-36-12(3).JPG,Meleagris_gallopavo,2,n,
MFDC3336.JPG,4_AEP,Session_3,4/3/2021,8:39:09,TRUE,Session_3__2021-04-03__08-39-09(1).JPG,Meleagris_gallopavo,1,n,
MFDC3337.JPG,4_AEP,Session_3,4/3/2021,8:39:09,TRUE,Session_3__2021-04-03__08-39-09(2).JPG,Meleagris_gallopavo,1,n,
MFDC3338.JPG,4_AEP,Session_3,4/3/2021,8:39:09,TRUE,Session_3__2021-04-03__08-39-09(3).JPG,Meleagris_gallopavo,1,n,
MFDC3342.JPG,4_AEP,Session_3,4/4/2021,0:03:46,TRUE,Session_3__2021-04-04__00-03-46(1).JPG,Unid,1,n,
MFDC3343.JPG,4_AEP,Session_3,4/4/2021,0:03:47,TRUE,Session_3__2021-04-04__00-03-47(2).JPG,Unid,1,n,
MFDC3345.JPG,4_AEP,Session_3,4/4/2021,4:50:52,TRUE,Session_3__2021-04-04__04-50-52(1).JPG,Odocoileus_virginianus,1,n,
MFDC3346.JPG,4_AEP,Session_3,4/4/2021,4:50:53,TRUE,Session_3__2021-04-04__04-50-53(2).JPG,Odocoileus_virginianus,1,n,
MFDC3347.JPG,4_AEP,Session_3,4/4/2021,4:50:53,TRUE,Session_3__2021-04-04__04-50-53(3).JPG,Odocoileus_virginianus,1,n,
MFDC3350.JPG,4_AEP,Session_3,4/4/2021,4:51:30,TRUE,Session_3__2021-04-04__04-51-30(1).JPG,NA,0,n,
MFDC3351.JPG,4_AEP,Session_3,4/4/2021,4:52:42,TRUE,Session_3__2021-04-04__04-52-42(1).JPG,NA,0,n,
MFDC3352.JPG,4_AEP,Session_3,4/4/2021,4:52:43,TRUE,Session_3__2021-04-04__04-52-43(2).JPG,NA,0,n,
MFDC3353.JPG,4_AEP,Session_3,4/4/2021,4:52:43,TRUE,Session_3__2021-04-04__04-52-43(3).JPG,NA,0,n,
MFDC3354.JPG,4_AEP,Session_3,4/4/2021,6:55:59,TRUE,Session_3__2021-04-04__06-55-59(1).JPG,NA,0,n,
MFDC3355.JPG,4_AEP,Session_3,4/4/2021,6:55:59,TRUE,Session_3__2021-04-04__06-55-59(2).JPG,NA,0,n,
MFDC3356.JPG,4_AEP,Session_3,4/4/2021,6:55:59,TRUE,Session_3__2021-04-04__06-55-59(3).JPG,NA,0,n,
MFDC3357.JPG,4_AEP,Session_3,4/4/2021,7:05:39,TRUE,Session_3__2021-04-04__07-05-39(2).JPG,Sciurus_sp,1,n,
MFDC3358.JPG,4_AEP,Session_3,4/4/2021,7:05:38,TRUE,Session_3__2021-04-04__07-05-38(1).JPG,Sciurus_sp,1,n,
MFDC3359.JPG,4_AEP,Session_3,4/4/2021,7:05:39,TRUE,Session_3__2021-04-04__07-05-39(3).JPG,Sciurus_sp,1,n,
MFDC3363.JPG,4_AEP,Session_3,4/5/2021,18:16:40,TRUE,Session_3__2021-04-05__18-16-40(3).JPG,Odocoileus_virginianus,1,n,
MFDC3364.JPG,4_AEP,Session_3,4/5/2021,18:16:39,TRUE,Session_3__2021-04-05__18-16-39(1).JPG,Odocoileus_virginianus,1,n,
MFDC3365.JPG,4_AEP,Session_3,4/5/2021,18:16:39,TRUE,Session_3__2021-04-05__18-16-39(2).JPG,Odocoileus_virginianus,1,n,
MFDC3366.JPG,4_AEP,Session_3,4/5/2021,21:15:14,TRUE,Session_3__2021-04-05__21-15-14(1).JPG,Sylvilagus_floridanus,1,n,
MFDC3367.JPG,4_AEP,Session_3,4/5/2021,21:15:14,TRUE,Session_3__2021-04-05__21-15-14(2).JPG,Sylvilagus_floridanus,1,n,
MFDC3368.JPG,4_AEP,Session_3,4/5/2021,21:15:14,TRUE,Session_3__2021-04-05__21-15-14(3).JPG,NA,0,n,
MFDC3369.JPG,4_AEP,Session_3,4/5/2021,21:20:52,TRUE,Session_3__2021-04-05__21-20-52(1).JPG,NA,0,n,
MFDC3370.JPG,4_AEP,Session_3,4/5/2021,21:20:52,TRUE,Session_3__2021-04-05__21-20-52(2).JPG,NA,0,n,
MFDC3371.JPG,4_AEP,Session_3,4/5/2021,21:20:52,TRUE,Session_3__2021-04-05__21-20-52(3).JPG,NA,0,n,
MFDC3373.JPG,4_AEP,Session_3,4/6/2021,3:09:00,TRUE,Session_3__2021-04-06__03-09-00(1).JPG,NA,0,n,
MFDC3378.JPG,4_AEP,Session_3,4/6/2021,20:42:38,TRUE,Session_3__2021-04-06__20-42-38(1).JPG,Procyon_lotor,1,n,
MFDC3379.JPG,4_AEP,Session_3,4/6/2021,20:42:38,TRUE,Session_3__2021-04-06__20-42-38(2).JPG,Procyon_lotor,1,n,
MFDC3380.JPG,4_AEP,Session_3,4/6/2021,20:42:38,TRUE,Session_3__2021-04-06__20-42-38(3).JPG,Procyon_lotor,1,n,
MFDC3381.JPG,4_AEP,Session_3,4/6/2021,20:52:00,TRUE,Session_3__2021-04-06__20-52-00(1).JPG,NA,0,n,
MFDC3382.JPG,4_AEP,Session_3,4/6/2021,20:52:01,TRUE,Session_3__2021-04-06__20-52-01(2).JPG,NA,0,n,
MFDC3383.JPG,4_AEP,Session_3,4/6/2021,20:52:01,TRUE,Session_3__2021-04-06__20-52-01(3).JPG,NA,0,n,
MFDC3384.JPG,4_AEP,Session_3,4/6/2021,20:54:24,TRUE,Session_3__2021-04-06__20-54-24(1).JPG,Sylvilagus_floridanus,1,n,
MFDC3385.JPG,4_AEP,Session_3,4/6/2021,20:54:24,TRUE,Session_3__2021-04-06__20-54-24(2).JPG,Sylvilagus_floridanus,1,n,
MFDC3386.JPG,4_AEP,Session_3,4/6/2021,20:54:24,TRUE,Session_3__2021-04-06__20-54-24(3).JPG,Sylvilagus_floridanus,1,n,
MFDC3387.JPG,4_AEP,Session_3,4/7/2021,4:52:12,TRUE,Session_3__2021-04-07__04-52-12(1).JPG,Procyon_lotor,1,n,
MFDC3388.JPG,4_AEP,Session_3,4/7/2021,4:52:12,TRUE,Session_3__2021-04-07__04-52-12(2).JPG,Procyon_lotor,1,n,
MFDC3389.JPG,4_AEP,Session_3,4/7/2021,4:52:12,TRUE,Session_3__2021-04-07__04-52-12(3).JPG,Procyon_lotor,1,n,
MFDC3390.JPG,4_AEP,Session_3,4/7/2021,5:19:03,TRUE,Session_3__2021-04-07__05-19-03(1).JPG,NA,0,n,
MFDC3391.JPG,4_AEP,Session_3,4/7/2021,5:19:03,TRUE,Session_3__2021-04-07__05-19-03(2).JPG,NA,0,n,
MFDC3392.JPG,4_AEP,Session_3,4/7/2021,5:19:04,TRUE,Session_3__2021-04-07__05-19-04(3).JPG,NA,0,n,
MFDC3393.JPG,4_AEP,Session_3,4/7/2021,5:20:17,TRUE,Session_3__2021-04-07__05-20-17(1).JPG,Procyon_lotor,1,n,
MFDC3394.JPG,4_AEP,Session_3,4/7/2021,5:20:18,TRUE,Session_3__2021-04-07__05-20-18(3).JPG,Procyon_lotor,1,n,
MFDC3395.JPG,4_AEP,Session_3,4/7/2021,5:20:17,TRUE,Session_3__2021-04-07__05-20-17(2).JPG,Procyon_lotor,1,n,
MFDC3396.JPG,4_AEP,Session_3,4/7/2021,5:20:52,TRUE,Session_3__2021-04-07__05-20-52(4).JPG,Procyon_lotor,1,n,
MFDC3397.JPG,4_AEP,Session_3,4/7/2021,5:20:53,TRUE,Session_3__2021-04-07__05-20-53(6).JPG,Procyon_lotor,1,n,
MFDC3398.JPG,4_AEP,Session_3,4/7/2021,5:20:52,TRUE,Session_3__2021-04-07__05-20-52(5).JPG,Procyon_lotor,1,n,
MFDC3401.JPG,4_AEP,Session_3,4/7/2021,7:39:19,TRUE,Session_3__2021-04-07__07-39-19(1).JPG,NA,0,n,
MFDC3402.JPG,4_AEP,Session_3,4/7/2021,8:55:04,TRUE,Session_3__2021-04-07__08-55-04(3).JPG,Sciurus_sp,1,n,
MFDC3403.JPG,4_AEP,Session_3,4/7/2021,8:55:03,TRUE,Session_3__2021-04-07__08-55-03(1).JPG,Sciurus_sp,1,n,
MFDC3404.JPG,4_AEP,Session_3,4/7/2021,8:55:03,TRUE,Session_3__2021-04-07__08-55-03(2).JPG,Sciurus_sp,1,n,
MFDC3405.JPG,4_AEP,Session_3,4/8/2021,0:50:41,TRUE,Session_3__2021-04-08__00-50-41(1).JPG,Didelphis_virginiana,1,n,
MFDC3406.JPG,4_AEP,Session_3,4/8/2021,0:50:41,TRUE,Session_3__2021-04-08__00-50-41(2).JPG,Didelphis_virginiana,1,n,
MFDC3407.JPG,4_AEP,Session_3,4/8/2021,0:50:42,TRUE,Session_3__2021-04-08__00-50-42(3).JPG,Didelphis_virginiana,1,n,
MFDC3408.JPG,4_AEP,Session_3,NA,NA,FALSE,Session_3__NA(NA).JPG,NA,0,n,
MFDC3409.JPG,4_AEP,Session_3,NA,NA,FALSE,Session_3__NA(NA).JPG,NA,0,n,
MFDC3420.JPG,4_AEP,Session_3,4/10/2021,5:34:32,TRUE,Session_3__2021-04-10__05-34-32(1).JPG,Procyon_lotor,1,n,
MFDC3421.JPG,4_AEP,Session_3,4/10/2021,5:34:32,TRUE,Session_3__2021-04-10__05-34-32(2).JPG,Procyon_lotor,1,n,
MFDC3422.JPG,4_AEP,Session_3,4/10/2021,5:34:33,TRUE,Session_3__2021-04-10__05-34-33(3).JPG,Procyon_lotor,1,n,
MFDC3423.JPG,4_AEP,Session_3,NA,NA,FALSE,Session_3__NA(NA).JPG,NA,0,n,
MFDC3425.JPG,4_AEP,Session_3,NA,NA,FALSE,Session_3__NA(NA).JPG,NA,0,n,
MFDC3433.JPG,4_AEP,Session_3,NA,NA,FALSE,Session_3__NA(NA).JPG,NA,0,n,
MFDC3434.JPG,4_AEP,Session_3,NA,NA,FALSE,Session_3__NA(NA).JPG,NA,0,n,
MFDC3435.JPG,4_AEP,Session_3,4/11/2021,9:46:14,TRUE,Session_3__2021-04-11__09-46-14(2).JPG,Canis_familiaris,1,n,
MFDC3436.JPG,4_AEP,Session_3,4/11/2021,9:46:13,TRUE,Session_3__2021-04-11__09-46-13(1).JPG,Canis_familiaris,2,n,
MFDC3437.JPG,4_AEP,Session_3,4/11/2021,9:46:14,TRUE,Session_3__2021-04-11__09-46-14(3).JPG,Canis_familiaris,2,n,
MFDC3438.JPG,4_AEP,Session_3,4/11/2021,9:46:42,TRUE,Session_3__2021-04-11__09-46-42(4).JPG,Homo_sapiens,1,n,
MFDC3439.JPG,4_AEP,Session_3,4/11/2021,9:46:44,TRUE,Session_3__2021-04-11__09-46-44(6).JPG,Homo_sapiens,1,n,
MFDC3440.JPG,4_AEP,Session_3,4/11/2021,9:46:43,TRUE,Session_3__2021-04-11__09-46-43(5).JPG,NA,0,n,
MFDC3441.JPG,4_AEP,Session_3,NA,NA,FALSE,Session_3__NA(NA).JPG,NA,0,n,
MFDC3442.JPG,4_AEP,Session_3,NA,NA,FALSE,Session_3__NA(NA).JPG,NA,0,n,
MFDC3443.JPG,4_AEP,Session_3,NA,NA,FALSE,Session_3__NA(NA).JPG,NA,0,n,
MFDC3444.JPG,4_AEP,Session_3,NA,NA,FALSE,Session_3__NA(NA).JPG,NA,0,n,
MFDC3445.JPG,4_AEP,Session_3,NA,NA,FALSE,Session_3__NA(NA).JPG,NA,0,n,
MFDC3446.JPG,4_AEP,Session_3,NA,NA,FALSE,Session_3__NA(NA).JPG,NA,0,n,
MFDC3447.JPG,4_AEP,Session_4,4/11/2021,9:51:03,TRUE,Session_4__2021-04-11__09-51-03(1).JPG,Homo_sapiens,1,n,
MFDC3456.JPG,4_AEP,Session_4,4/12/2021,7:22:29,TRUE,Session_4__2021-04-12__07-22-29(1).JPG,Odocoileus_virginianus,2,n,
MFDC3457.JPG,4_AEP,Session_4,4/12/2021,7:22:29,TRUE,Session_4__2021-04-12__07-22-29(2).JPG,Odocoileus_virginianus,2,n,
MFDC3458.JPG,4_AEP,Session_4,4/12/2021,7:22:29,TRUE,Session_4__2021-04-12__07-22-29(3).JPG,Odocoileus_virginianus,2,n,
MFDC3459.JPG,4_AEP,Session_4,4/12/2021,7:23:09,TRUE,Session_4__2021-04-12__07-23-09(3).JPG,Odocoileus_virginianus,3,n,
MFDC3460.JPG,4_AEP,Session_4,4/12/2021,7:23:08,TRUE,Session_4__2021-04-12__07-23-08(1).JPG,Odocoileus_virginianus,3,n,
MFDC3461.JPG,4_AEP,Session_4,4/12/2021,7:23:08,TRUE,Session_4__2021-04-12__07-23-08(2).JPG,Odocoileus_virginianus,3,n,
MFDC3462.JPG,4_AEP,Session_4,4/12/2021,7:23:39,TRUE,Session_4__2021-04-12__07-23-39(6).JPG,Odocoileus_virginianus,1,n,
MFDC3463.JPG,4_AEP,Session_4,4/12/2021,7:23:38,TRUE,Session_4__2021-04-12__07-23-38(4).JPG,Odocoileus_virginianus,1,n,
MFDC3464.JPG,4_AEP,Session_4,4/12/2021,7:23:38,TRUE,Session_4__2021-04-12__07-23-38(5).JPG,Odocoileus_virginianus,1,n,
MFDC3465.JPG,4_AEP,Session_4,4/12/2021,7:24:20,TRUE,Session_4__2021-04-12__07-24-20(3).JPG,Odocoileus_virginianus,1,n,
MFDC3466.JPG,4_AEP,Session_4,4/12/2021,7:24:19,TRUE,Session_4__2021-04-12__07-24-19(1).JPG,Odocoileus_virginianus,1,n,
MFDC3467.JPG,4_AEP,Session_4,4/12/2021,7:24:19,TRUE,Session_4__2021-04-12__07-24-19(2).JPG,Odocoileus_virginianus,1,n,
MFDC3474.JPG,4_AEP,Session_4,4/17/2021,0:03:23,TRUE,Session_4__2021-04-17__00-03-23(1).JPG,Procyon_lotor,1,n,
MFDC3475.JPG,4_AEP,Session_4,4/17/2021,0:03:23,TRUE,Session_4__2021-04-17__00-03-23(2).JPG,Procyon_lotor,1,n,
MFDC3476.JPG,4_AEP,Session_4,4/17/2021,0:03:24,TRUE,Session_4__2021-04-17__00-03-24(3).JPG,Procyon_lotor,1,n,
MFDC3477.JPG,4_AEP,Session_4,4/18/2021,11:29:48,TRUE,Session_4__2021-04-18__11-29-48(2).JPG,Meleagris_gallopavo,1,n,
MFDC3478.JPG,4_AEP,Session_4,4/18/2021,11:29:47,TRUE,Session_4__2021-04-18__11-29-47(1).JPG,Meleagris_gallopavo,1,n,
MFDC3479.JPG,4_AEP,Session_4,4/18/2021,11:29:48,TRUE,Session_4__2021-04-18__11-29-48(3).JPG,Meleagris_gallopavo,1,n,
MFDC3483.JPG,4_AEP,Session_4,4/20/2021,19:40:07,TRUE,Session_4__2021-04-20__19-40-07(1).JPG,Odocoileus_virginianus,1,n,flying deer
MFDC3485.JPG,4_AEP,Session_4,4/20/2021,19:40:08,TRUE,Session_4__2021-04-20__19-40-08(2).JPG,Odocoileus_virginianus,1,n,
MFDC3486.JPG,4_AEP,Session_4,4/22/2021,6:23:35,TRUE,Session_4__2021-04-22__06-23-35(1).JPG,Odocoileus_virginianus,1,n,
MFDC3487.JPG,4_AEP,Session_4,4/22/2021,6:23:35,TRUE,Session_4__2021-04-22__06-23-35(2).JPG,Odocoileus_virginianus,1,n,
MFDC3488.JPG,4_AEP,Session_4,4/22/2021,6:23:35,TRUE,Session_4__2021-04-22__06-23-35(3).JPG,Odocoileus_virginianus,1,n,
MFDC3489.JPG,4_AEP,Session_4,4/23/2021,2:28:45,TRUE,Session_4__2021-04-23__02-28-45(1).JPG,Odocoileus_virginianus,1,n,
MFDC3490.JPG,4_AEP,Session_4,4/23/2021,2:28:45,TRUE,Session_4__2021-04-23__02-28-45(2).JPG,Odocoileus_virginianus,1,n,
MFDC3491.JPG,4_AEP,Session_4,4/23/2021,2:28:45,TRUE,Session_4__2021-04-23__02-28-45(3).JPG,Odocoileus_virginianus,1,n,
MFDC3492.JPG,4_AEP,Session_4,4/23/2021,2:29:16,TRUE,Session_4__2021-04-23__02-29-16(1).JPG,Odocoileus_virginianus,1,n,
MFDC3493.JPG,4_AEP,Session_4,4/23/2021,2:29:16,TRUE,Session_4__2021-04-23__02-29-16(2).JPG,Odocoileus_virginianus,1,n,
MFDC3494.JPG,4_AEP,Session_4,4/23/2021,2:29:17,TRUE,Session_4__2021-04-23__02-29-17(3).JPG,Odocoileus_virginianus,1,n,
MFDC3507.JPG,4_AEP,Session_4,4/25/2021,16:31:56,TRUE,Session_4__2021-04-25__16-31-56(1).JPG,Odocoileus_virginianus,1,n,
MFDC3508.JPG,4_AEP,Session_4,4/25/2021,16:31:56,TRUE,Session_4__2021-04-25__16-31-56(2).JPG,Odocoileus_virginianus,1,n,
MFDC3509.JPG,4_AEP,Session_4,4/25/2021,16:31:56,TRUE,Session_4__2021-04-25__16-31-56(3).JPG,Odocoileus_virginianus,1,n,
MFDC3513.JPG,4_AEP,Session_4,4/26/2021,0:13:51,TRUE,Session_4__2021-04-26__00-13-51(1).JPG,Odocoileus_virginianus,1,n,
MFDC3514.JPG,4_AEP,Session_4,4/26/2021,0:13:51,TRUE,Session_4__2021-04-26__00-13-51(2).JPG,Odocoileus_virginianus,1,n,
MFDC3515.JPG,4_AEP,Session_4,4/26/2021,0:13:52,TRUE,Session_4__2021-04-26__00-13-52(3).JPG,Odocoileus_virginianus,1,n,
MFDC3516.JPG,4_AEP,Session_4,4/26/2021,0:14:24,TRUE,Session_4__2021-04-26__00-14-24(1).JPG,Odocoileus_virginianus,1,n,
MFDC3517.JPG,4_AEP,Session_4,4/26/2021,0:14:24,TRUE,Session_4__2021-04-26__00-14-24(2).JPG,Odocoileus_virginianus,1,n,
MFDC3518.JPG,4_AEP,Session_4,4/26/2021,0:14:25,TRUE,Session_4__2021-04-26__00-14-25(3).JPG,Odocoileus_virginianus,1,n,
MFDC3519.JPG,4_AEP,Session_4,4/26/2021,6:51:44,TRUE,Session_4__2021-04-26__06-51-44(1).JPG,Odocoileus_virginianus,1,n,
MFDC3520.JPG,4_AEP,Session_4,4/26/2021,6:51:44,TRUE,Session_4__2021-04-26__06-51-44(2).JPG,Odocoileus_virginianus,1,n,
MFDC3521.JPG,4_AEP,Session_4,4/26/2021,6:51:44,TRUE,Session_4__2021-04-26__06-51-44(3).JPG,Odocoileus_virginianus,1,n,
MFDC3522.JPG,4_AEP,Session_4,4/26/2021,6:52:13,TRUE,Session_4__2021-04-26__06-52-13(1).JPG,Odocoileus_virginianus,1,n,
MFDC3523.JPG,4_AEP,Session_4,4/26/2021,6:52:14,TRUE,Session_4__2021-04-26__06-52-14(2).JPG,Odocoileus_virginianus,1,n,
MFDC3524.JPG,4_AEP,Session_4,4/26/2021,6:52:14,TRUE,Session_4__2021-04-26__06-52-14(3).JPG,Odocoileus_virginianus,1,n,
MFDC3525.JPG,4_AEP,Session_4,4/26/2021,7:32:17,TRUE,Session_4__2021-04-26__07-32-17(1).JPG,Odocoileus_virginianus,1,n,
MFDC3526.JPG,4_AEP,Session_4,4/26/2021,7:32:17,TRUE,Session_4__2021-04-26__07-32-17(2).JPG,Odocoileus_virginianus,1,n,
MFDC3527.JPG,4_AEP,Session_4,4/26/2021,7:32:18,TRUE,Session_4__2021-04-26__07-32-18(3).JPG,Odocoileus_virginianus,1,n,
MFDC3528.JPG,4_AEP,Session_4,4/26/2021,7:32:49,TRUE,Session_4__2021-04-26__07-32-49(4).JPG,Odocoileus_virginianus,1,n,
MFDC3529.JPG,4_AEP,Session_4,4/26/2021,7:32:49,TRUE,Session_4__2021-04-26__07-32-49(5).JPG,Odocoileus_virginianus,1,n,
MFDC3530.JPG,4_AEP,Session_4,4/26/2021,7:32:50,TRUE,Session_4__2021-04-26__07-32-50(6).JPG,Odocoileus_virginianus,1,n,
MFDC3531.JPG,4_AEP,Session_4,4/26/2021,7:33:23,TRUE,Session_4__2021-04-26__07-33-23(1).JPG,Odocoileus_virginianus,2,n,
MFDC3532.JPG,4_AEP,Session_4,4/26/2021,7:33:24,TRUE,Session_4__2021-04-26__07-33-24(2).JPG,Odocoileus_virginianus,2,n,
MFDC3533.JPG,4_AEP,Session_4,4/26/2021,7:33:24,TRUE,Session_4__2021-04-26__07-33-24(3).JPG,Odocoileus_virginianus,2,n,
MFDC3534.JPG,4_AEP,Session_4,4/26/2021,8:20:11,TRUE,Session_4__2021-04-26__08-20-11(1).JPG,NA,0,n,
MFDC3535.JPG,4_AEP,Session_4,4/26/2021,8:20:12,TRUE,Session_4__2021-04-26__08-20-12(2).JPG,NA,0,n,
MFDC3536.JPG,4_AEP,Session_4,4/26/2021,8:20:12,TRUE,Session_4__2021-04-26__08-20-12(3).JPG,NA,0,n,
MFDC3537.JPG,4_AEP,Session_4,4/26/2021,8:58:31,TRUE,Session_4__2021-04-26__08-58-31(1).JPG,Meleagris_gallopavo,1,n,
MFDC3538.JPG,4_AEP,Session_4,4/26/2021,8:58:31,TRUE,Session_4__2021-04-26__08-58-31(2).JPG,Meleagris_gallopavo,1,n,
MFDC3539.JPG,4_AEP,Session_4,4/26/2021,8:58:31,TRUE,Session_4__2021-04-26__08-58-31(3).JPG,Meleagris_gallopavo,1,n,
MFDC3553.JPG,4_AEP,Session_4,4/29/2021,20:04:35,TRUE,Session_4__2021-04-29__20-04-35(1).JPG,Odocoileus_virginianus,1,n,
MFDC3554.JPG,4_AEP,Session_4,4/29/2021,20:04:36,TRUE,Session_4__2021-04-29__20-04-36(2).JPG,Odocoileus_virginianus,1,n,
MFDC3555.JPG,4_AEP,Session_4,4/29/2021,20:05:05,TRUE,Session_4__2021-04-29__20-05-05(1).JPG,Odocoileus_virginianus,1,n,
MFDC3556.JPG,4_AEP,Session_4,4/29/2021,20:05:06,TRUE,Session_4__2021-04-29__20-05-06(2).JPG,Odocoileus_virginianus,1,n,
MFDC3557.JPG,4_AEP,Session_4,4/29/2021,20:05:06,TRUE,Session_4__2021-04-29__20-05-06(3).JPG,Odocoileus_virginianus,1,n,
MFDC3558.JPG,4_AEP,Session_4,4/29/2021,20:05:35,TRUE,Session_4__2021-04-29__20-05-35(4).JPG,Odocoileus_virginianus,1,n,
MFDC3559.JPG,4_AEP,Session_4,4/29/2021,20:05:35,TRUE,Session_4__2021-04-29__20-05-35(5).JPG,Odocoileus_virginianus,1,n,
MFDC3560.JPG,4_AEP,Session_4,4/29/2021,20:05:35,TRUE,Session_4__2021-04-29__20-05-35(6).JPG,Odocoileus_virginianus,1,n,
MFDC3561.JPG,4_AEP,Session_4,4/29/2021,22:44:51,TRUE,Session_4__2021-04-29__22-44-51(1).JPG,Odocoileus_virginianus,1,n,
MFDC3562.JPG,4_AEP,Session_4,4/29/2021,22:44:51,TRUE,Session_4__2021-04-29__22-44-51(2).JPG,Odocoileus_virginianus,1,n,
MFDC3563.JPG,4_AEP,Session_4,4/29/2021,22:44:52,TRUE,Session_4__2021-04-29__22-44-52(3).JPG,Odocoileus_virginianus,1,n,
MFDC3606.JPG,4_AEP,Session_4,5/6/2021,8:20:38,TRUE,Session_4__2021-05-06__08-20-38(1).JPG,Odocoileus_virginianus,1,n,
MFDC3607.JPG,4_AEP,Session_4,5/6/2021,8:20:40,TRUE,Session_4__2021-05-06__08-20-40(3).JPG,Odocoileus_virginianus,1,n,
MFDC3608.JPG,4_AEP,Session_4,5/6/2021,8:20:39,TRUE,Session_4__2021-05-06__08-20-39(2).JPG,Odocoileus_virginianus,1,n,
MFDC3615.JPG,4_AEP,Session_4,5/9/2021,11:03:51,TRUE,Session_4__2021-05-09__11-03-51(1).JPG,Odocoileus_virginianus,1,n,
MFDC3616.JPG,4_AEP,Session_4,5/9/2021,11:03:52,TRUE,Session_4__2021-05-09__11-03-52(2).JPG,Odocoileus_virginianus,1,n,
MFDC3617.JPG,4_AEP,Session_4,5/9/2021,11:03:52,TRUE,Session_4__2021-05-09__11-03-52(3).JPG,Odocoileus_virginianus,1,n,
MFDC3618.JPG,4_AEP,Session_4,5/11/2021,6:14:32,TRUE,Session_4__2021-05-11__06-14-32(1).JPG,Odocoileus_virginianus,1,n,
MFDC3619.JPG,4_AEP,Session_4,5/11/2021,6:14:33,TRUE,Session_4__2021-05-11__06-14-33(2).JPG,Odocoileus_virginianus,1,n,
MFDC3620.JPG,4_AEP,Session_4,5/11/2021,6:14:33,TRUE,Session_4__2021-05-11__06-14-33(3).JPG,Odocoileus_virginianus,1,n,
MFDC3627.JPG,4_AEP,Session_4,5/11/2021,18:23:50,TRUE,Session_4__2021-05-11__18-23-50(1).JPG,Meleagris_gallopavo,1,n,
MFDC3628.JPG,4_AEP,Session_4,5/11/2021,18:23:50,TRUE,Session_4__2021-05-11__18-23-50(2).JPG,Meleagris_gallopavo,1,n,
MFDC3629.JPG,4_AEP,Session_4,5/11/2021,18:23:50,TRUE,Session_4__2021-05-11__18-23-50(3).JPG,Meleagris_gallopavo,1,n,
MFDC3639.JPG,4_AEP,Session_4,5/12/2021,10:27:44,TRUE,Session_4__2021-05-12__10-27-44(1).JPG,Homo_sapiens,1,n,
MFDC3640.JPG,4_AEP,Session_4,5/12/2021,10:27:45,TRUE,Session_4__2021-05-12__10-27-45(2).JPG,Homo_sapiens,1,n,
MFDC3641.JPG,4_AEP,Session_4,5/12/2021,10:27:45,TRUE,Session_4__2021-05-12__10-27-45(3).JPG,Homo_sapiens,1,n,
MFDC3642.JPG,4_AEP,Session_4,5/12/2021,10:28:14,TRUE,Session_4__2021-05-12__10-28-14(1).JPG,Homo_sapiens,1,n,
MFDC3643.JPG,4_AEP,Session_4,5/12/2021,10:28:15,TRUE,Session_4__2021-05-12__10-28-15(2).JPG,Homo_sapiens,1,n,
MFDC3644.JPG,4_AEP,Session_4,5/12/2021,10:28:15,TRUE,Session_4__2021-05-12__10-28-15(3).JPG,Homo_sapiens,1,n,
MFDC3645.JPG,4_AEP,Session_4,5/12/2021,10:28:48,TRUE,Session_4__2021-05-12__10-28-48(4).JPG,Homo_sapiens,1,n,
MFDC3646.JPG,4_AEP,Session_4,5/12/2021,10:28:49,TRUE,Session_4__2021-05-12__10-28-49(5).JPG,Homo_sapiens,1,n,
MFDC3647.JPG,4_AEP,Session_4,5/12/2021,10:28:49,TRUE,Session_4__2021-05-12__10-28-49(6).JPG,Homo_sapiens,1,n,
MFDC3648.JPG,4_AEP,Session_5,5/12/2021,10:31:38,TRUE,Session_5__2021-05-12__10-31-38(2).JPG,Homo_sapiens,1,n,
MFDC3649.JPG,4_AEP,Session_5,5/12/2021,10:31:37,TRUE,Session_5__2021-05-12__10-31-37(1).JPG,Homo_sapiens,1,n,
MFDC3650.JPG,4_AEP,Session_5,5/12/2021,10:31:38,TRUE,Session_5__2021-05-12__10-31-38(3).JPG,Homo_sapiens,1,n,
MFDC3651.JPG,4_AEP,Session_5,5/12/2021,11:15:55,TRUE,Session_5__2021-05-12__11-15-55(1).JPG,Odocoileus_virginianus,1,n,
MFDC3652.JPG,4_AEP,Session_5,5/12/2021,11:15:56,TRUE,Session_5__2021-05-12__11-15-56(2).JPG,Odocoileus_virginianus,1,n,
MFDC3653.JPG,4_AEP,Session_5,5/12/2021,11:15:56,TRUE,Session_5__2021-05-12__11-15-56(3).JPG,Odocoileus_virginianus,1,n,
MFDC3654.JPG,4_AEP,Session_5,5/12/2021,11:16:25,TRUE,Session_5__2021-05-12__11-16-25(1).JPG,Odocoileus_virginianus,1,n,
MFDC3655.JPG,4_AEP,Session_5,5/12/2021,11:16:25,TRUE,Session_5__2021-05-12__11-16-25(2).JPG,Odocoileus_virginianus,1,n,
MFDC3656.JPG,4_AEP,Session_5,5/12/2021,11:16:25,TRUE,Session_5__2021-05-12__11-16-25(3).JPG,Odocoileus_virginianus,1,n,
MFDC3657.JPG,4_AEP,Session_5,5/12/2021,11:16:55,TRUE,Session_5__2021-05-12__11-16-55(4).JPG,NA,0,n,
MFDC3658.JPG,4_AEP,Session_5,5/12/2021,11:16:55,TRUE,Session_5__2021-05-12__11-16-55(5).JPG,Odocoileus_virginianus,1,n,
MFDC3659.JPG,4_AEP,Session_5,5/12/2021,11:16:55,TRUE,Session_5__2021-05-12__11-16-55(6).JPG,Odocoileus_virginianus,1,n,
MFDC3660.JPG,4_AEP,Session_5,5/12/2021,19:08:19,TRUE,Session_5__2021-05-12__19-08-19(1).JPG,NA,0,n,
MFDC3661.JPG,4_AEP,Session_5,5/12/2021,19:08:19,TRUE,Session_5__2021-05-12__19-08-19(2).JPG,NA,0,n,
MFDC3662.JPG,4_AEP,Session_5,5/12/2021,19:08:19,TRUE,Session_5__2021-05-12__19-08-19(3).JPG,NA,0,n,
MFDC3663.JPG,4_AEP,Session_5,5/12/2021,19:08:49,TRUE,Session_5__2021-05-12__19-08-49(4).JPG,Odocoileus_virginianus,1,n,
MFDC3664.JPG,4_AEP,Session_5,5/12/2021,19:08:49,TRUE,Session_5__2021-05-12__19-08-49(5).JPG,Odocoileus_virginianus,1,n,
MFDC3665.JPG,4_AEP,Session_5,5/12/2021,19:08:49,TRUE,Session_5__2021-05-12__19-08-49(6).JPG,Odocoileus_virginianus,1,n,
MFDC3666.JPG,4_AEP,Session_5,5/12/2021,19:09:19,TRUE,Session_5__2021-05-12__19-09-19(1).JPG,Odocoileus_virginianus,1,n,
MFDC3667.JPG,4_AEP,Session_5,5/12/2021,19:09:19,TRUE,Session_5__2021-05-12__19-09-19(2).JPG,Odocoileus_virginianus,1,n,
MFDC3668.JPG,4_AEP,Session_5,5/12/2021,19:09:19,TRUE,Session_5__2021-05-12__19-09-19(3).JPG,Odocoileus_virginianus,1,n,
MFDC3669.JPG,4_AEP,Session_5,5/12/2021,19:10:19,TRUE,Session_5__2021-05-12__19-10-19(1).JPG,NA,0,n,
MFDC3670.JPG,4_AEP,Session_5,5/12/2021,19:10:19,TRUE,Session_5__2021-05-12__19-10-19(2).JPG,Odocoileus_virginianus,1,n,
MFDC3671.JPG,4_AEP,Session_5,5/12/2021,19:10:19,TRUE,Session_5__2021-05-12__19-10-19(3).JPG,Odocoileus_virginianus,1,n,
MFDC3672.JPG,4_AEP,Session_5,5/12/2021,21:27:46,TRUE,Session_5__2021-05-12__21-27-46(1).JPG,Unid,1,n,
MFDC3673.JPG,4_AEP,Session_5,5/12/2021,21:27:47,TRUE,Session_5__2021-05-12__21-27-47(3).JPG,Unid,1,n,
MFDC3674.JPG,4_AEP,Session_5,5/12/2021,21:27:46,TRUE,Session_5__2021-05-12__21-27-46(2).JPG,Unid,1,n,
MFDC3675.JPG,4_AEP,Session_5,5/13/2021,4:06:49,TRUE,Session_5__2021-05-13__04-06-49(1).JPG,NA,0,n,
MFDC3676.JPG,4_AEP,Session_5,5/13/2021,4:06:49,TRUE,Session_5__2021-05-13__04-06-49(2).JPG,NA,0,n,
MFDC3677.JPG,4_AEP,Session_5,5/13/2021,4:06:49,TRUE,Session_5__2021-05-13__04-06-49(3).JPG,NA,0,n,
MFDC3678.JPG,4_AEP,Session_5,5/13/2021,22:18:04,TRUE,Session_5__2021-05-13__22-18-04(1).JPG,Procyon_lotor,1,n,
MFDC3679.JPG,4_AEP,Session_5,5/13/2021,22:18:04,TRUE,Session_5__2021-05-13__22-18-04(2).JPG,Procyon_lotor,1,n,
MFDC3680.JPG,4_AEP,Session_5,5/13/2021,22:18:04,TRUE,Session_5__2021-05-13__22-18-04(3).JPG,Procyon_lotor,1,n,
MFDC3681.JPG,4_AEP,Session_5,5/14/2021,2:06:11,TRUE,Session_5__2021-05-14__02-06-11(1).JPG,NA,0,n,
MFDC3682.JPG,4_AEP,Session_5,5/14/2021,2:06:11,TRUE,Session_5__2021-05-14__02-06-11(2).JPG,NA,0,n,
MFDC3683.JPG,4_AEP,Session_5,5/14/2021,2:06:12,TRUE,Session_5__2021-05-14__02-06-12(3).JPG,NA,0,n,
MFDC3684.JPG,4_AEP,Session_5,5/14/2021,2:35:14,TRUE,Session_5__2021-05-14__02-35-14(1).JPG,NA,0,n,
MFDC3685.JPG,4_AEP,Session_5,5/14/2021,2:35:14,TRUE,Session_5__2021-05-14__02-35-14(2).JPG,NA,0,n,
MFDC3686.JPG,4_AEP,Session_5,5/14/2021,2:35:15,TRUE,Session_5__2021-05-14__02-35-15(3).JPG,NA,0,n,
MFDC3687.JPG,4_AEP,Session_5,5/14/2021,3:20:21,TRUE,Session_5__2021-05-14__03-20-21(1).JPG,Didelphis_virginiana,1,n,
MFDC3688.JPG,4_AEP,Session_5,5/14/2021,3:20:22,TRUE,Session_5__2021-05-14__03-20-22(2).JPG,Didelphis_virginiana,1,n,
MFDC3689.JPG,4_AEP,Session_5,5/14/2021,3:20:22,TRUE,Session_5__2021-05-14__03-20-22(3).JPG,Didelphis_virginiana,1,n,
MFDC3690.JPG,4_AEP,Session_5,5/14/2021,8:17:39,TRUE,Session_5__2021-05-14__08-17-39(1).JPG,Sciurus_sp,1,n,
MFDC3691.JPG,4_AEP,Session_5,5/14/2021,8:17:39,TRUE,Session_5__2021-05-14__08-17-39(2).JPG,Sciurus_sp,1,n,
MFDC3692.JPG,4_AEP,Session_5,5/14/2021,8:17:39,TRUE,Session_5__2021-05-14__08-17-39(3).JPG,Sciurus_sp,1,n,
MFDC3693.JPG,4_AEP,Session_5,5/15/2021,7:33:24,TRUE,Session_5__2021-05-15__07-33-24(1).JPG,Sciurus_sp,1,n,
MFDC3694.JPG,4_AEP,Session_5,5/15/2021,7:33:25,TRUE,Session_5__2021-05-15__07-33-25(3).JPG,Sciurus_sp,1,n,
MFDC3695.JPG,4_AEP,Session_5,5/15/2021,7:33:24,TRUE,Session_5__2021-05-15__07-33-24(2).JPG,Sciurus_sp,1,n,
MFDC3696.JPG,4_AEP,Session_5,5/15/2021,21:52:20,TRUE,Session_5__2021-05-15__21-52-20(1).JPG,Unid,1,n,
MFDC3697.JPG,4_AEP,Session_5,5/15/2021,21:52:20,TRUE,Session_5__2021-05-15__21-52-20(2).JPG,Unid,1,n,
MFDC3698.JPG,4_AEP,Session_5,5/15/2021,21:52:21,TRUE,Session_5__2021-05-15__21-52-21(3).JPG,Unid,1,n,
MFDC3699.JPG,4_AEP,Session_5,5/15/2021,22:02:58,TRUE,Session_5__2021-05-15__22-02-58(1).JPG,NA,0,n,
MFDC3700.JPG,4_AEP,Session_5,5/15/2021,22:02:59,TRUE,Session_5__2021-05-15__22-02-59(2).JPG,NA,0,n,
MFDC3701.JPG,4_AEP,Session_5,5/15/2021,22:02:59,TRUE,Session_5__2021-05-15__22-02-59(3).JPG,NA,0,n,
MFDC3702.JPG,4_AEP,Session_5,5/16/2021,0:26:51,TRUE,Session_5__2021-05-16__00-26-51(1).JPG,NA,0,n,
MFDC3703.JPG,4_AEP,Session_5,5/16/2021,0:26:52,TRUE,Session_5__2021-05-16__00-26-52(2).JPG,NA,0,n,
MFDC3704.JPG,4_AEP,Session_5,5/16/2021,0:26:52,TRUE,Session_5__2021-05-16__00-26-52(3).JPG,NA,0,n,
MFDC3705.JPG,4_AEP,Session_5,5/16/2021,2:03:32,TRUE,Session_5__2021-05-16__02-03-32(1).JPG,Procyon_lotor,1,n,
MFDC3706.JPG,4_AEP,Session_5,5/16/2021,2:03:32,TRUE,Session_5__2021-05-16__02-03-32(2).JPG,Procyon_lotor,1,n,
MFDC3707.JPG,4_AEP,Session_5,5/16/2021,2:03:32,TRUE,Session_5__2021-05-16__02-03-32(3).JPG,Procyon_lotor,1,n,
MFDC3708.JPG,4_AEP,Session_5,5/17/2021,8:09:50,TRUE,Session_5__2021-05-17__08-09-50(1).JPG,Sciurus_sp,1,n,
MFDC3709.JPG,4_AEP,Session_5,5/17/2021,8:09:50,TRUE,Session_5__2021-05-17__08-09-50(2).JPG,Sciurus_sp,1,n,
MFDC3710.JPG,4_AEP,Session_5,5/17/2021,8:09:50,TRUE,Session_5__2021-05-17__08-09-50(3).JPG,Sciurus_sp,1,n,
MFDC3711.JPG,4_AEP,Session_5,5/17/2021,11:57:16,TRUE,Session_5__2021-05-17__11-57-16(3).JPG,Meleagris_gallopavo,1,n,
MFDC3712.JPG,4_AEP,Session_5,5/17/2021,11:57:15,TRUE,Session_5__2021-05-17__11-57-15(1).JPG,Meleagris_gallopavo,1,n,
MFDC3713.JPG,4_AEP,Session_5,5/17/2021,11:57:15,TRUE,Session_5__2021-05-17__11-57-15(2).JPG,Meleagris_gallopavo,1,n,
MFDC3714.JPG,4_AEP,Session_5,5/17/2021,17:25:58,TRUE,Session_5__2021-05-17__17-25-58(2).JPG,NA,0,n,
MFDC3715.JPG,4_AEP,Session_5,5/17/2021,17:25:57,TRUE,Session_5__2021-05-17__17-25-57(1).JPG,NA,0,n,
MFDC3716.JPG,4_AEP,Session_5,5/17/2021,17:25:58,TRUE,Session_5__2021-05-17__17-25-58(3).JPG,NA,0,n,
MFDC3717.JPG,4_AEP,Session_5,5/17/2021,21:50:47,TRUE,Session_5__2021-05-17__21-50-47(1).JPG,Procyon_lotor,1,n,
MFDC3718.JPG,4_AEP,Session_5,5/17/2021,21:50:47,TRUE,Session_5__2021-05-17__21-50-47(2).JPG,Procyon_lotor,1,n,
MFDC3719.JPG,4_AEP,Session_5,5/17/2021,21:50:48,TRUE,Session_5__2021-05-17__21-50-48(3).JPG,Procyon_lotor,1,n,
MFDC3720.JPG,4_AEP,Session_5,5/18/2021,21:33:09,TRUE,Session_5__2021-05-18__21-33-09(2).JPG,Procyon_lotor,1,n,
MFDC3721.JPG,4_AEP,Session_5,5/18/2021,21:33:08,TRUE,Session_5__2021-05-18__21-33-08(1).JPG,Procyon_lotor,1,n,
MFDC3722.JPG,4_AEP,Session_5,5/18/2021,21:33:09,TRUE,Session_5__2021-05-18__21-33-09(3).JPG,Procyon_lotor,1,n,
MFDC3723.JPG,4_AEP,Session_5,5/19/2021,6:00:04,TRUE,Session_5__2021-05-19__06-00-04(1).JPG,Procyon_lotor,1,n,
MFDC3724.JPG,4_AEP,Session_5,5/19/2021,6:00:05,TRUE,Session_5__2021-05-19__06-00-05(3).JPG,Procyon_lotor,1,n,
MFDC3725.JPG,4_AEP,Session_5,5/19/2021,6:00:04,TRUE,Session_5__2021-05-19__06-00-04(2).JPG,Procyon_lotor,1,n,
MFDC3726.JPG,4_AEP,Session_5,5/19/2021,6:00:57,TRUE,Session_5__2021-05-19__06-00-57(4).JPG,NA,0,n,flash didn't wprl
MFDC3727.JPG,4_AEP,Session_5,5/19/2021,6:00:57,TRUE,Session_5__2021-05-19__06-00-57(5).JPG,NA,0,n,flash didn't wprl
MFDC3728.JPG,4_AEP,Session_5,5/19/2021,6:00:57,TRUE,Session_5__2021-05-19__06-00-57(6).JPG,NA,0,n,flash didn't wprl
MFDC3729.JPG,4_AEP,Session_5,5/19/2021,6:01:56,TRUE,Session_5__2021-05-19__06-01-56(1).JPG,NA,0,n,
MFDC3730.JPG,4_AEP,Session_5,5/19/2021,6:01:57,TRUE,Session_5__2021-05-19__06-01-57(2).JPG,NA,0,n,
MFDC3731.JPG,4_AEP,Session_5,5/19/2021,6:01:57,TRUE,Session_5__2021-05-19__06-01-57(3).JPG,NA,0,n,
MFDC3732.JPG,4_AEP,Session_5,5/19/2021,7:11:02,TRUE,Session_5__2021-05-19__07-11-02(2).JPG,Meleagris_gallopavo,1,n,
MFDC3733.JPG,4_AEP,Session_5,5/19/2021,7:11:01,TRUE,Session_5__2021-05-19__07-11-01(1).JPG,Meleagris_gallopavo,1,n,
MFDC3734.JPG,4_AEP,Session_5,5/19/2021,7:11:02,TRUE,Session_5__2021-05-19__07-11-02(3).JPG,Meleagris_gallopavo,1,n,
MFDC3735.JPG,4_AEP,Session_5,5/19/2021,8:18:17,TRUE,Session_5__2021-05-19__08-18-17(1).JPG,Sciurus_sp,1,n,
MFDC3736.JPG,4_AEP,Session_5,5/19/2021,8:18:18,TRUE,Session_5__2021-05-19__08-18-18(2).JPG,Sciurus_sp,1,n,
MFDC3737.JPG,4_AEP,Session_5,5/19/2021,8:18:18,TRUE,Session_5__2021-05-19__08-18-18(3).JPG,Sciurus_sp,1,n,
MFDC3738.JPG,4_AEP,Session_5,5/22/2021,21:00:58,TRUE,Session_5__2021-05-22__21-00-58(1).JPG,Procyon_lotor,1,n,
MFDC3739.JPG,4_AEP,Session_5,5/22/2021,21:00:58,TRUE,Session_5__2021-05-22__21-00-58(2).JPG,Procyon_lotor,1,n,
MFDC3740.JPG,4_AEP,Session_5,5/22/2021,21:00:58,TRUE,Session_5__2021-05-22__21-00-58(3).JPG,Procyon_lotor,1,n,
MFDC3741.JPG,4_AEP,Session_5,5/22/2021,21:16:32,TRUE,Session_5__2021-05-22__21-16-32(1).JPG,NA,0,n,
MFDC3742.JPG,4_AEP,Session_5,5/22/2021,21:16:32,TRUE,Session_5__2021-05-22__21-16-32(2).JPG,NA,0,n,
MFDC3743.JPG,4_AEP,Session_5,5/22/2021,21:16:32,TRUE,Session_5__2021-05-22__21-16-32(3).JPG,NA,0,n,
MFDC3744.JPG,4_AEP,Session_5,5/23/2021,0:18:02,TRUE,Session_5__2021-05-23__00-18-02(1).JPG,Unid,1,n,
MFDC3745.JPG,4_AEP,Session_5,5/23/2021,0:18:02,TRUE,Session_5__2021-05-23__00-18-02(2).JPG,Unid,1,n,
MFDC3746.JPG,4_AEP,Session_5,5/23/2021,0:18:02,TRUE,Session_5__2021-05-23__00-18-02(3).JPG,NA,0,n,
MFDC3747.JPG,4_AEP,Session_5,5/23/2021,10:05:58,TRUE,Session_5__2021-05-23__10-05-58(1).JPG,NA,0,n,overexposed
MFDC3748.JPG,4_AEP,Session_5,5/23/2021,10:05:58,TRUE,Session_5__2021-05-23__10-05-58(2).JPG,NA,0,n,overexposed
MFDC3749.JPG,4_AEP,Session_5,5/23/2021,10:05:58,TRUE,Session_5__2021-05-23__10-05-58(3).JPG,NA,0,n,overexposed
MFDC3750.JPG,4_AEP,Session_5,5/23/2021,10:50:49,TRUE,Session_5__2021-05-23__10-50-49(1).JPG,Odocoileus_virginianus,1,n,
MFDC3751.JPG,4_AEP,Session_5,5/23/2021,10:50:50,TRUE,Session_5__2021-05-23__10-50-50(2).JPG,Odocoileus_virginianus,1,n,
MFDC3752.JPG,4_AEP,Session_5,5/23/2021,10:50:50,TRUE,Session_5__2021-05-23__10-50-50(3).JPG,Odocoileus_virginianus,1,n,
MFDC3753.JPG,4_AEP,Session_5,5/24/2021,19:47:57,TRUE,Session_5__2021-05-24__19-47-57(1).JPG,NA,0,n,
MFDC3754.JPG,4_AEP,Session_5,5/24/2021,19:47:58,TRUE,Session_5__2021-05-24__19-47-58(2).JPG,NA,0,n,
MFDC3755.JPG,4_AEP,Session_5,5/24/2021,19:47:59,TRUE,Session_5__2021-05-24__19-47-59(3).JPG,NA,0,n,
MFDC3756.JPG,4_AEP,Session_5,5/24/2021,19:49:36,TRUE,Session_5__2021-05-24__19-49-36(2).JPG,NA,0,n,
MFDC3757.JPG,4_AEP,Session_5,5/24/2021,19:49:35,TRUE,Session_5__2021-05-24__19-49-35(1).JPG,NA,0,n,
MFDC3758.JPG,4_AEP,Session_5,5/24/2021,19:49:36,TRUE,Session_5__2021-05-24__19-49-36(3).JPG,NA,0,n,
MFDC3759.JPG,4_AEP,Session_5,5/25/2021,0:36:37,TRUE,Session_5__2021-05-25__00-36-37(1).JPG,Odocoileus_virginianus,1,n,
MFDC3760.JPG,4_AEP,Session_5,5/25/2021,0:36:38,TRUE,Session_5__2021-05-25__00-36-38(3).JPG,Odocoileus_virginianus,1,n,
MFDC3761.JPG,4_AEP,Session_5,5/25/2021,0:36:37,TRUE,Session_5__2021-05-25__00-36-37(2).JPG,Odocoileus_virginianus,1,n,
MFDC3762.JPG,4_AEP,Session_5,5/25/2021,5:32:23,TRUE,Session_5__2021-05-25__05-32-23(1).JPG,Procyon_lotor,1,n,
MFDC3763.JPG,4_AEP,Session_5,5/25/2021,5:32:23,TRUE,Session_5__2021-05-25__05-32-23(2).JPG,Procyon_lotor,1,n,
MFDC3764.JPG,4_AEP,Session_5,5/25/2021,5:32:24,TRUE,Session_5__2021-05-25__05-32-24(3).JPG,Procyon_lotor,1,n,
MFDC3765.JPG,4_AEP,Session_5,5/25/2021,21:06:02,TRUE,Session_5__2021-05-25__21-06-02(2).JPG,Procyon_lotor,1,n,
MFDC3766.JPG,4_AEP,Session_5,5/25/2021,21:06:01,TRUE,Session_5__2021-05-25__21-06-01(1).JPG,Procyon_lotor,1,n,
MFDC3767.JPG,4_AEP,Session_5,5/25/2021,21:06:02,TRUE,Session_5__2021-05-25__21-06-02(3).JPG,Procyon_lotor,1,n,
MFDC3768.JPG,4_AEP,Session_5,5/25/2021,21:06:38,TRUE,Session_5__2021-05-25__21-06-38(4).JPG,Procyon_lotor,1,n,
MFDC3769.JPG,4_AEP,Session_5,5/25/2021,21:06:38,TRUE,Session_5__2021-05-25__21-06-38(5).JPG,Procyon_lotor,1,n,
MFDC3770.JPG,4_AEP,Session_5,5/25/2021,21:06:38,TRUE,Session_5__2021-05-25__21-06-38(6).JPG,Procyon_lotor,1,n,
MFDC3771.JPG,4_AEP,Session_5,5/26/2021,2:46:04,TRUE,Session_5__2021-05-26__02-46-04(1).JPG,NA,0,n,
MFDC3772.JPG,4_AEP,Session_5,5/26/2021,2:46:06,TRUE,Session_5__2021-05-26__02-46-06(3).JPG,NA,0,n,
MFDC3773.JPG,4_AEP,Session_5,5/26/2021,2:46:05,TRUE,Session_5__2021-05-26__02-46-05(2).JPG,NA,0,n,
MFDC3774.JPG,4_AEP,Session_5,5/26/2021,18:05:26,TRUE,Session_5__2021-05-26__18-05-26(1).JPG,Odocoileus_virginianus,1,n,
MFDC3775.JPG,4_AEP,Session_5,5/26/2021,18:05:26,TRUE,Session_5__2021-05-26__18-05-26(2).JPG,Odocoileus_virginianus,1,n,
MFDC3776.JPG,4_AEP,Session_5,5/26/2021,18:05:27,TRUE,Session_5__2021-05-26__18-05-27(3).JPG,Odocoileus_virginianus,1,n,
MFDC3777.JPG,4_AEP,Session_5,5/26/2021,18:05:55,TRUE,Session_5__2021-05-26__18-05-55(4).JPG,Odocoileus_virginianus,1,n,
MFDC3778.JPG,4_AEP,Session_5,5/26/2021,18:05:56,TRUE,Session_5__2021-05-26__18-05-56(5).JPG,Odocoileus_virginianus,1,n,
MFDC3779.JPG,4_AEP,Session_5,5/26/2021,18:05:57,TRUE,Session_5__2021-05-26__18-05-57(6).JPG,Odocoileus_virginianus,1,n,
MFDC3780.JPG,4_AEP,Session_5,5/26/2021,18:06:32,TRUE,Session_5__2021-05-26__18-06-32(1).JPG,Odocoileus_virginianus,1,n,
MFDC3781.JPG,4_AEP,Session_5,5/26/2021,18:06:32,TRUE,Session_5__2021-05-26__18-06-32(2).JPG,Odocoileus_virginianus,1,n,
MFDC3782.JPG,4_AEP,Session_5,5/26/2021,18:06:32,TRUE,Session_5__2021-05-26__18-06-32(3).JPG,Odocoileus_virginianus,1,n,
MFDC3783.JPG,4_AEP,Session_5,5/26/2021,18:07:01,TRUE,Session_5__2021-05-26__18-07-01(1).JPG,Odocoileus_virginianus,1,n,
MFDC3784.JPG,4_AEP,Session_5,5/26/2021,18:07:02,TRUE,Session_5__2021-05-26__18-07-02(2).JPG,Odocoileus_virginianus,1,n,
MFDC3785.JPG,4_AEP,Session_5,5/26/2021,18:07:03,TRUE,Session_5__2021-05-26__18-07-03(3).JPG,Odocoileus_virginianus,1,n,
MFDC3786.JPG,4_AEP,Session_5,5/27/2021,0:58:17,TRUE,Session_5__2021-05-27__00-58-17(1).JPG,NA,0,n,
MFDC3787.JPG,4_AEP,Session_5,5/27/2021,0:58:17,TRUE,Session_5__2021-05-27__00-58-17(2).JPG,Canis_latrans,1,n,
MFDC3788.JPG,4_AEP,Session_5,5/27/2021,0:58:17,TRUE,Session_5__2021-05-27__00-58-17(3).JPG,Canis_latrans,1,n,
MFDC3789.JPG,4_AEP,Session_5,5/27/2021,7:48:33,TRUE,Session_5__2021-05-27__07-48-33(2).JPG,NA,0,n,
MFDC3790.JPG,4_AEP,Session_5,5/27/2021,7:48:32,TRUE,Session_5__2021-05-27__07-48-32(1).JPG,NA,0,n,
MFDC3791.JPG,4_AEP,Session_5,5/27/2021,7:48:33,TRUE,Session_5__2021-05-27__07-48-33(3).JPG,NA,0,n,
MFDC3792.JPG,4_AEP,Session_5,5/27/2021,20:18:46,TRUE,Session_5__2021-05-27__20-18-46(1).JPG,NA,0,n,
MFDC3793.JPG,4_AEP,Session_5,5/27/2021,20:18:46,TRUE,Session_5__2021-05-27__20-18-46(2).JPG,Unid,1,n,
MFDC3794.JPG,4_AEP,Session_5,5/27/2021,20:18:46,TRUE,Session_5__2021-05-27__20-18-46(3).JPG,Unid,1,n,
MFDC3795.JPG,4_AEP,Session_5,5/28/2021,0:23:39,TRUE,Session_5__2021-05-28__00-23-39(2).JPG,Odocoileus_virginianus,1,n,
MFDC3796.JPG,4_AEP,Session_5,5/28/2021,0:23:38,TRUE,Session_5__2021-05-28__00-23-38(1).JPG,Odocoileus_virginianus,1,n,
MFDC3797.JPG,4_AEP,Session_5,5/28/2021,0:23:39,TRUE,Session_5__2021-05-28__00-23-39(3).JPG,Odocoileus_virginianus,1,n,
MFDC3798.JPG,4_AEP,Session_5,5/28/2021,0:24:08,TRUE,Session_5__2021-05-28__00-24-08(1).JPG,NA,0,n,
MFDC3799.JPG,4_AEP,Session_5,5/28/2021,0:24:08,TRUE,Session_5__2021-05-28__00-24-08(2).JPG,NA,0,n,
MFDC3800.JPG,4_AEP,Session_5,5/28/2021,0:24:08,TRUE,Session_5__2021-05-28__00-24-08(3).JPG,NA,0,n,
MFDC3801.JPG,4_AEP,Session_5,5/28/2021,10:46:20,TRUE,Session_5__2021-05-28__10-46-20(1).JPG,NA,0,n,
MFDC3802.JPG,4_AEP,Session_5,5/28/2021,10:46:21,TRUE,Session_5__2021-05-28__10-46-21(2).JPG,NA,0,n,
MFDC3803.JPG,4_AEP,Session_5,5/28/2021,10:46:21,TRUE,Session_5__2021-05-28__10-46-21(3).JPG,NA,0,n,
MFDC3804.JPG,4_AEP,Session_5,5/28/2021,13:53:14,TRUE,Session_5__2021-05-28__13-53-14(2).JPG,Odocoileus_virginianus,1,n,
MFDC3805.JPG,4_AEP,Session_5,5/28/2021,13:53:13,TRUE,Session_5__2021-05-28__13-53-13(1).JPG,Odocoileus_virginianus,1,n,
MFDC3806.JPG,4_AEP,Session_5,5/28/2021,13:53:14,TRUE,Session_5__2021-05-28__13-53-14(3).JPG,Odocoileus_virginianus,1,n,
MFDC3807.JPG,4_AEP,Session_5,5/28/2021,13:54:09,TRUE,Session_5__2021-05-28__13-54-09(1).JPG,NA,0,n,
MFDC3808.JPG,4_AEP,Session_5,5/28/2021,13:54:10,TRUE,Session_5__2021-05-28__13-54-10(2).JPG,NA,0,n,
MFDC3809.JPG,4_AEP,Session_5,5/28/2021,13:54:11,TRUE,Session_5__2021-05-28__13-54-11(3).JPG,NA,0,n,
MFDC3810.JPG,4_AEP,Session_5,5/28/2021,13:54:39,TRUE,Session_5__2021-05-28__13-54-39(4).JPG,NA,0,n,
MFDC3811.JPG,4_AEP,Session_5,5/28/2021,13:54:40,TRUE,Session_5__2021-05-28__13-54-40(5).JPG,NA,0,n,
MFDC3812.JPG,4_AEP,Session_5,5/28/2021,13:54:40,TRUE,Session_5__2021-05-28__13-54-40(6).JPG,NA,0,n,
MFDC3813.JPG,4_AEP,Session_5,5/29/2021,5:54:54,TRUE,Session_5__2021-05-29__05-54-54(1).JPG,NA,0,n,
MFDC3814.JPG,4_AEP,Session_5,5/29/2021,5:54:54,TRUE,Session_5__2021-05-29__05-54-54(2).JPG,NA,0,n,
MFDC3815.JPG,4_AEP,Session_5,5/29/2021,5:54:54,TRUE,Session_5__2021-05-29__05-54-54(3).JPG,NA,0,n,
MFDC3816.JPG,4_AEP,Session_5,5/29/2021,5:55:25,TRUE,Session_5__2021-05-29__05-55-25(1).JPG,NA,0,n,
MFDC3817.JPG,4_AEP,Session_5,5/29/2021,5:55:26,TRUE,Session_5__2021-05-29__05-55-26(2).JPG,NA,0,n,
MFDC3818.JPG,4_AEP,Session_5,5/29/2021,5:55:26,TRUE,Session_5__2021-05-29__05-55-26(3).JPG,NA,0,n,
MFDC3819.JPG,4_AEP,Session_5,5/29/2021,7:20:15,TRUE,Session_5__2021-05-29__07-20-15(1).JPG,Sciurus_sp,1,n,
MFDC3820.JPG,4_AEP,Session_5,5/29/2021,7:20:15,TRUE,Session_5__2021-05-29__07-20-15(2).JPG,Sciurus_sp,1,n,
MFDC3821.JPG,4_AEP,Session_5,5/29/2021,7:20:15,TRUE,Session_5__2021-05-29__07-20-15(3).JPG,Sciurus_sp,1,n,
MFDC3822.JPG,4_AEP,Session_5,5/29/2021,14:39:28,TRUE,Session_5__2021-05-29__14-39-28(1).JPG,NA,0,n,
MFDC3823.JPG,4_AEP,Session_5,5/29/2021,14:39:29,TRUE,Session_5__2021-05-29__14-39-29(2).JPG,NA,0,n,
MFDC3824.JPG,4_AEP,Session_5,5/29/2021,14:39:29,TRUE,Session_5__2021-05-29__14-39-29(3).JPG,NA,0,n,
MFDC3825.JPG,4_AEP,Session_5,5/29/2021,18:39:57,TRUE,Session_5__2021-05-29__18-39-57(1).JPG,Odocoileus_virginianus,1,n,
MFDC3826.JPG,4_AEP,Session_5,5/29/2021,18:39:57,TRUE,Session_5__2021-05-29__18-39-57(2).JPG,Odocoileus_virginianus,1,n,
MFDC3827.JPG,4_AEP,Session_5,5/29/2021,18:39:57,TRUE,Session_5__2021-05-29__18-39-57(3).JPG,Odocoileus_virginianus,1,n,
MFDC3828.JPG,4_AEP,Session_5,5/29/2021,18:40:28,TRUE,Session_5__2021-05-29__18-40-28(1).JPG,Odocoileus_virginianus,1,n,
MFDC3829.JPG,4_AEP,Session_5,5/29/2021,18:40:28,TRUE,Session_5__2021-05-29__18-40-28(2).JPG,Odocoileus_virginianus,1,n,
MFDC3830.JPG,4_AEP,Session_5,5/29/2021,18:40:28,TRUE,Session_5__2021-05-29__18-40-28(3).JPG,Odocoileus_virginianus,1,n,
MFDC3831.JPG,4_AEP,Session_5,5/29/2021,18:49:22,TRUE,Session_5__2021-05-29__18-49-22(2).JPG,NA,0,n,
MFDC3832.JPG,4_AEP,Session_5,5/29/2021,18:49:21,TRUE,Session_5__2021-05-29__18-49-21(1).JPG,NA,0,n,
MFDC3833.JPG,4_AEP,Session_5,5/29/2021,18:49:22,TRUE,Session_5__2021-05-29__18-49-22(3).JPG,NA,0,n,
MFDC3834.JPG,4_AEP,Session_5,5/30/2021,0:08:19,TRUE,Session_5__2021-05-30__00-08-19(1).JPG,NA,0,n,
MFDC3835.JPG,4_AEP,Session_5,5/30/2021,0:08:21,TRUE,Session_5__2021-05-30__00-08-21(3).JPG,NA,0,n,
MFDC3836.JPG,4_AEP,Session_5,5/30/2021,0:08:20,TRUE,Session_5__2021-05-30__00-08-20(2).JPG,NA,0,n,
MFDC3837.JPG,4_AEP,Session_5,5/30/2021,6:53:51,TRUE,Session_5__2021-05-30__06-53-51(1).JPG,Odocoileus_virginianus,1,n,
MFDC3838.JPG,4_AEP,Session_5,5/30/2021,6:53:51,TRUE,Session_5__2021-05-30__06-53-51(2).JPG,Odocoileus_virginianus,1,n,
MFDC3839.JPG,4_AEP,Session_5,5/30/2021,6:53:52,TRUE,Session_5__2021-05-30__06-53-52(3).JPG,Odocoileus_virginianus,1,n,
MFDC3840.JPG,4_AEP,Session_5,5/31/2021,5:18:35,TRUE,Session_5__2021-05-31__05-18-35(1).JPG,Canis_latrans,1,n,
MFDC3841.JPG,4_AEP,Session_5,5/31/2021,5:18:35,TRUE,Session_5__2021-05-31__05-18-35(2).JPG,Canis_latrans,1,n,
MFDC3842.JPG,4_AEP,Session_5,5/31/2021,5:18:35,TRUE,Session_5__2021-05-31__05-18-35(3).JPG,Canis_latrans,1,n,
MFDC3843.JPG,4_AEP,Session_5,5/31/2021,5:27:28,TRUE,Session_5__2021-05-31__05-27-28(1).JPG,Odocoileus_virginianus,1,n,
MFDC3844.JPG,4_AEP,Session_5,5/31/2021,5:27:28,TRUE,Session_5__2021-05-31__05-27-28(2).JPG,Odocoileus_virginianus,1,n,
MFDC3845.JPG,4_AEP,Session_5,5/31/2021,5:27:28,TRUE,Session_5__2021-05-31__05-27-28(3).JPG,Odocoileus_virginianus,1,n,
MFDC3846.JPG,4_AEP,Session_5,5/31/2021,5:29:11,TRUE,Session_5__2021-05-31__05-29-11(1).JPG,Odocoileus_virginianus,1,n,
MFDC3847.JPG,4_AEP,Session_5,5/31/2021,5:29:11,TRUE,Session_5__2021-05-31__05-29-11(2).JPG,Odocoileus_virginianus,1,n,
MFDC3848.JPG,4_AEP,Session_5,5/31/2021,5:29:11,TRUE,Session_5__2021-05-31__05-29-11(3).JPG,Odocoileus_virginianus,1,n,
MFDC3849.JPG,4_AEP,Session_5,5/31/2021,5:45:33,TRUE,Session_5__2021-05-31__05-45-33(1).JPG,Unid,1,n,
MFDC3850.JPG,4_AEP,Session_5,5/31/2021,5:45:33,TRUE,Session_5__2021-05-31__05-45-33(2).JPG,NA,0,n,
MFDC3851.JPG,4_AEP,Session_5,5/31/2021,5:45:33,TRUE,Session_5__2021-05-31__05-45-33(3).JPG,NA,0,n,
MFDC3852.JPG,4_AEP,Session_5,5/31/2021,7:16:01,TRUE,Session_5__2021-05-31__07-16-01(1).JPG,Odocoileus_virginianus,1,n,
MFDC3853.JPG,4_AEP,Session_5,5/31/2021,7:16:02,TRUE,Session_5__2021-05-31__07-16-02(2).JPG,Odocoileus_virginianus,1,n,
MFDC3854.JPG,4_AEP,Session_5,5/31/2021,7:16:02,TRUE,Session_5__2021-05-31__07-16-02(3).JPG,Odocoileus_virginianus,1,n,
MFDC3855.JPG,4_AEP,Session_5,5/31/2021,7:36:35,TRUE,Session_5__2021-05-31__07-36-35(1).JPG,NA,0,n,
MFDC3856.JPG,4_AEP,Session_5,5/31/2021,7:36:36,TRUE,Session_5__2021-05-31__07-36-36(2).JPG,NA,0,n,
MFDC3857.JPG,4_AEP,Session_5,5/31/2021,7:36:36,TRUE,Session_5__2021-05-31__07-36-36(3).JPG,NA,0,n,
MFDC3858.JPG,4_AEP,Session_5,5/31/2021,19:36:19,TRUE,Session_5__2021-05-31__19-36-19(1).JPG,NA,0,n,
MFDC3859.JPG,4_AEP,Session_5,5/31/2021,19:36:20,TRUE,Session_5__2021-05-31__19-36-20(2).JPG,NA,0,n,
MFDC3860.JPG,4_AEP,Session_5,5/31/2021,19:36:20,TRUE,Session_5__2021-05-31__19-36-20(3).JPG,NA,0,n,
MFDC3861.JPG,4_AEP,Session_5,5/31/2021,22:17:35,TRUE,Session_5__2021-05-31__22-17-35(1).JPG,Procyon_lotor,1,n,
MFDC3862.JPG,4_AEP,Session_5,5/31/2021,22:17:35,TRUE,Session_5__2021-05-31__22-17-35(2).JPG,Procyon_lotor,1,n,
MFDC3863.JPG,4_AEP,Session_5,5/31/2021,22:17:37,TRUE,Session_5__2021-05-31__22-17-37(3).JPG,Procyon_lotor,1,n,
MFDC3864.JPG,4_AEP,Session_5,6/1/2021,8:26:48,TRUE,Session_5__2021-06-01__08-26-48(1).JPG,Odocoileus_virginianus,1,n,
MFDC3865.JPG,4_AEP,Session_5,6/1/2021,8:26:48,TRUE,Session_5__2021-06-01__08-26-48(2).JPG,Odocoileus_virginianus,1,n,
MFDC3866.JPG,4_AEP,Session_5,6/1/2021,8:26:48,TRUE,Session_5__2021-06-01__08-26-48(3).JPG,Odocoileus_virginianus,1,n,
MFDC3867.JPG,4_AEP,Session_5,6/1/2021,19:25:40,TRUE,Session_5__2021-06-01__19-25-40(1).JPG,NA,0,n,
MFDC3868.JPG,4_AEP,Session_5,6/1/2021,19:25:40,TRUE,Session_5__2021-06-01__19-25-40(2).JPG,NA,0,n,
MFDC3869.JPG,4_AEP,Session_5,6/1/2021,19:25:40,TRUE,Session_5__2021-06-01__19-25-40(3).JPG,NA,0,n,
MFDC3870.JPG,4_AEP,Session_5,6/1/2021,21:27:38,TRUE,Session_5__2021-06-01__21-27-38(2).JPG,Procyon_lotor,1,n,
MFDC3871.JPG,4_AEP,Session_5,6/1/2021,21:27:37,TRUE,Session_5__2021-06-01__21-27-37(1).JPG,Procyon_lotor,1,n,
MFDC3872.JPG,4_AEP,Session_5,6/1/2021,21:27:38,TRUE,Session_5__2021-06-01__21-27-38(3).JPG,Procyon_lotor,1,n,
MFDC3873.JPG,4_AEP,Session_5,6/2/2021,0:09:12,TRUE,Session_5__2021-06-02__00-09-12(1).JPG,Procyon_lotor,1,n,
MFDC3874.JPG,4_AEP,Session_5,6/2/2021,0:09:12,TRUE,Session_5__2021-06-02__00-09-12(2).JPG,Procyon_lotor,1,n,
MFDC3875.JPG,4_AEP,Session_5,6/2/2021,0:09:12,TRUE,Session_5__2021-06-02__00-09-12(3).JPG,Procyon_lotor,1,n,
MFDC3876.JPG,4_AEP,Session_5,6/2/2021,17:35:03,TRUE,Session_5__2021-06-02__17-35-03(2).JPG,Odocoileus_virginianus,1,n,
MFDC3877.JPG,4_AEP,Session_5,6/2/2021,17:35:02,TRUE,Session_5__2021-06-02__17-35-02(1).JPG,Odocoileus_virginianus,1,n,
MFDC3878.JPG,4_AEP,Session_5,6/2/2021,17:35:03,TRUE,Session_5__2021-06-02__17-35-03(3).JPG,Odocoileus_virginianus,1,n,
MFDC3879.JPG,4_AEP,Session_5,6/2/2021,17:35:41,TRUE,Session_5__2021-06-02__17-35-41(4).JPG,Odocoileus_virginianus,1,n,
MFDC3880.JPG,4_AEP,Session_5,6/2/2021,17:35:41,TRUE,Session_5__2021-06-02__17-35-41(5).JPG,Odocoileus_virginianus,1,n,
MFDC3881.JPG,4_AEP,Session_5,6/2/2021,17:35:41,TRUE,Session_5__2021-06-02__17-35-41(6).JPG,Odocoileus_virginianus,1,n,
MFDC3882.JPG,4_AEP,Session_5,6/3/2021,22:54:02,TRUE,Session_5__2021-06-03__22-54-02(1).JPG,NA,0,n,
MFDC3883.JPG,4_AEP,Session_5,6/3/2021,22:54:02,TRUE,Session_5__2021-06-03__22-54-02(2).JPG,NA,0,n,
MFDC3884.JPG,4_AEP,Session_5,6/3/2021,22:54:02,TRUE,Session_5__2021-06-03__22-54-02(3).JPG,NA,0,n,
MFDC3885.JPG,4_AEP,Session_5,6/4/2021,4:49:26,TRUE,Session_5__2021-06-04__04-49-26(1).JPG,Procyon_lotor,1,n,
MFDC3886.JPG,4_AEP,Session_5,6/4/2021,4:49:27,TRUE,Session_5__2021-06-04__04-49-27(2).JPG,Procyon_lotor,1,n,
MFDC3887.JPG,4_AEP,Session_5,6/4/2021,4:49:27,TRUE,Session_5__2021-06-04__04-49-27(3).JPG,Procyon_lotor,1,n,
MFDC3888.JPG,4_AEP,Session_5,6/4/2021,22:13:59,TRUE,Session_5__2021-06-04__22-13-59(1).JPG,NA,0,n,
MFDC3889.JPG,4_AEP,Session_5,6/4/2021,22:14:01,TRUE,Session_5__2021-06-04__22-14-01(2).JPG,NA,0,n,
MFDC3890.JPG,4_AEP,Session_5,6/4/2021,22:14:00,TRUE,Session_5__2021-06-04__22-14-00(1).JPG,NA,0,n,
MFDC3891.JPG,4_AEP,Session_5,6/5/2021,1:21:19,TRUE,Session_5__2021-06-05__01-21-19(2).JPG,NA,0,n,
MFDC3892.JPG,4_AEP,Session_5,6/5/2021,1:21:18,TRUE,Session_5__2021-06-05__01-21-18(1).JPG,NA,0,n,
MFDC3893.JPG,4_AEP,Session_5,6/5/2021,1:21:20,TRUE,Session_5__2021-06-05__01-21-20(3).JPG,NA,0,n,
MFDC3894.JPG,4_AEP,Session_5,6/5/2021,3:09:23,TRUE,Session_5__2021-06-05__03-09-23(1).JPG,NA,0,n,
MFDC3895.JPG,4_AEP,Session_5,6/5/2021,3:09:23,TRUE,Session_5__2021-06-05__03-09-23(2).JPG,NA,0,n,
MFDC3896.JPG,4_AEP,Session_5,6/5/2021,3:09:25,TRUE,Session_5__2021-06-05__03-09-25(3).JPG,NA,0,n,
MFDC3897.JPG,4_AEP,Session_5,6/5/2021,6:14:18,TRUE,Session_5__2021-06-05__06-14-18(1).JPG,NA,0,n,
MFDC3898.JPG,4_AEP,Session_5,6/5/2021,6:14:18,TRUE,Session_5__2021-06-05__06-14-18(2).JPG,NA,0,n,
MFDC3899.JPG,4_AEP,Session_5,6/5/2021,6:14:18,TRUE,Session_5__2021-06-05__06-14-18(3).JPG,NA,0,n,
MFDC3900.JPG,4_AEP,Session_5,6/5/2021,18:08:30,TRUE,Session_5__2021-06-05__18-08-30(1).JPG,NA,0,n,
MFDC3901.JPG,4_AEP,Session_5,6/5/2021,18:08:30,TRUE,Session_5__2021-06-05__18-08-30(2).JPG,NA,0,n,
MFDC3902.JPG,4_AEP,Session_5,6/5/2021,18:08:30,TRUE,Session_5__2021-06-05__18-08-30(3).JPG,NA,0,n,
MFDC3903.JPG,4_AEP,Session_5,6/6/2021,0:45:26,TRUE,Session_5__2021-06-06__00-45-26(1).JPG,NA,0,n,
MFDC3904.JPG,4_AEP,Session_5,6/6/2021,0:45:26,TRUE,Session_5__2021-06-06__00-45-26(2).JPG,NA,0,n,
MFDC3905.JPG,4_AEP,Session_5,6/6/2021,0:45:27,TRUE,Session_5__2021-06-06__00-45-27(3).JPG,NA,0,n,
MFDC3906.JPG,4_AEP,Session_5,6/6/2021,1:12:17,TRUE,Session_5__2021-06-06__01-12-17(1).JPG,NA,0,n,
MFDC3907.JPG,4_AEP,Session_5,6/6/2021,1:12:17,TRUE,Session_5__2021-06-06__01-12-17(2).JPG,NA,0,n,
MFDC3908.JPG,4_AEP,Session_5,6/6/2021,1:12:19,TRUE,Session_5__2021-06-06__01-12-19(3).JPG,NA,0,n,
MFDC3909.JPG,4_AEP,Session_5,6/6/2021,2:22:41,TRUE,Session_5__2021-06-06__02-22-41(1).JPG,NA,0,n,
MFDC3910.JPG,4_AEP,Session_5,6/6/2021,2:22:41,TRUE,Session_5__2021-06-06__02-22-41(2).JPG,NA,0,n,
MFDC3911.JPG,4_AEP,Session_5,6/6/2021,2:22:42,TRUE,Session_5__2021-06-06__02-22-42(3).JPG,NA,0,n,
MFDC3912.JPG,4_AEP,Session_5,6/6/2021,2:44:41,TRUE,Session_5__2021-06-06__02-44-41(1).JPG,NA,0,n,
MFDC3913.JPG,4_AEP,Session_5,6/6/2021,2:44:42,TRUE,Session_5__2021-06-06__02-44-42(2).JPG,NA,0,n,
MFDC3914.JPG,4_AEP,Session_5,6/6/2021,2:44:42,TRUE,Session_5__2021-06-06__02-44-42(3).JPG,NA,0,n,
MFDC3915.JPG,4_AEP,Session_5,6/6/2021,2:57:38,TRUE,Session_5__2021-06-06__02-57-38(1).JPG,NA,0,n,
MFDC3916.JPG,4_AEP,Session_5,6/6/2021,2:57:38,TRUE,Session_5__2021-06-06__02-57-38(2).JPG,NA,0,n,
MFDC3917.JPG,4_AEP,Session_5,6/6/2021,2:57:38,TRUE,Session_5__2021-06-06__02-57-38(3).JPG,NA,0,n,
MFDC3918.JPG,4_AEP,Session_5,6/6/2021,3:26:06,TRUE,Session_5__2021-06-06__03-26-06(1).JPG,NA,0,n,
MFDC3919.JPG,4_AEP,Session_5,6/6/2021,3:26:06,TRUE,Session_5__2021-06-06__03-26-06(2).JPG,NA,0,n,
MFDC3920.JPG,4_AEP,Session_5,6/6/2021,3:26:06,TRUE,Session_5__2021-06-06__03-26-06(3).JPG,NA,0,n,
MFDC3921.JPG,4_AEP,Session_5,6/6/2021,3:47:51,TRUE,Session_5__2021-06-06__03-47-51(1).JPG,NA,0,n,
MFDC3922.JPG,4_AEP,Session_5,6/6/2021,3:47:52,TRUE,Session_5__2021-06-06__03-47-52(2).JPG,NA,0,n,
MFDC3923.JPG,4_AEP,Session_5,6/6/2021,3:47:52,TRUE,Session_5__2021-06-06__03-47-52(3).JPG,NA,0,n,
MFDC3924.JPG,4_AEP,Session_5,6/6/2021,20:44:54,TRUE,Session_5__2021-06-06__20-44-54(1).JPG,NA,0,n,
MFDC3925.JPG,4_AEP,Session_5,6/6/2021,20:44:55,TRUE,Session_5__2021-06-06__20-44-55(2).JPG,NA,0,n,
MFDC3926.JPG,4_AEP,Session_5,6/6/2021,20:44:55,TRUE,Session_5__2021-06-06__20-44-55(3).JPG,NA,0,n,
MFDC3927.JPG,4_AEP,Session_5,6/6/2021,21:44:59,TRUE,Session_5__2021-06-06__21-44-59(1).JPG,NA,0,n,
MFDC3928.JPG,4_AEP,Session_5,6/6/2021,21:45:00,TRUE,Session_5__2021-06-06__21-45-00(1).JPG,NA,0,n,
MFDC3929.JPG,4_AEP,Session_5,6/6/2021,21:45:00,TRUE,Session_5__2021-06-06__21-45-00(2).JPG,NA,0,n,
MFDC3930.JPG,4_AEP,Session_5,6/6/2021,22:07:57,TRUE,Session_5__2021-06-06__22-07-57(1).JPG,NA,0,n,
MFDC3931.JPG,4_AEP,Session_5,6/6/2021,22:07:57,TRUE,Session_5__2021-06-06__22-07-57(2).JPG,NA,0,n,
MFDC3932.JPG,4_AEP,Session_5,6/6/2021,22:07:57,TRUE,Session_5__2021-06-06__22-07-57(3).JPG,NA,0,n,
MFDC3933.JPG,4_AEP,Session_5,6/7/2021,0:17:28,TRUE,Session_5__2021-06-07__00-17-28(1).JPG,NA,0,n,
MFDC3934.JPG,4_AEP,Session_5,6/7/2021,0:17:28,TRUE,Session_5__2021-06-07__00-17-28(2).JPG,NA,0,n,
MFDC3935.JPG,4_AEP,Session_5,6/7/2021,0:17:28,TRUE,Session_5__2021-06-07__00-17-28(3).JPG,NA,0,n,
MFDC3936.JPG,4_AEP,Session_5,6/7/2021,0:23:00,TRUE,Session_5__2021-06-07__00-23-00(1).JPG,NA,0,n,
MFDC3937.JPG,4_AEP,Session_5,6/7/2021,0:23:00,TRUE,Session_5__2021-06-07__00-23-00(2).JPG,NA,0,n,
MFDC3938.JPG,4_AEP,Session_5,6/7/2021,0:23:01,TRUE,Session_5__2021-06-07__00-23-01(3).JPG,NA,0,n,
MFDC3939.JPG,4_AEP,Session_5,6/7/2021,3:13:23,TRUE,Session_5__2021-06-07__03-13-23(1).JPG,NA,0,n,
MFDC3940.JPG,4_AEP,Session_5,6/7/2021,3:13:25,TRUE,Session_5__2021-06-07__03-13-25(2).JPG,NA,0,n,
MFDC3941.JPG,4_AEP,Session_5,6/7/2021,3:13:25,TRUE,Session_5__2021-06-07__03-13-25(3).JPG,NA,0,n,
MFDC3942.JPG,4_AEP,Session_5,6/7/2021,8:44:55,TRUE,Session_5__2021-06-07__08-44-55(2).JPG,Sciurus_sp,1,n,
MFDC3943.JPG,4_AEP,Session_5,6/7/2021,8:44:54,TRUE,Session_5__2021-06-07__08-44-54(1).JPG,Sciurus_sp,1,n,
MFDC3944.JPG,4_AEP,Session_5,6/7/2021,8:44:55,TRUE,Session_5__2021-06-07__08-44-55(3).JPG,Sciurus_sp,1,n,
MFDC3945.JPG,4_AEP,Session_5,6/7/2021,8:48:11,TRUE,Session_5__2021-06-07__08-48-11(3).JPG,Sciurus_sp,1,n,
MFDC3946.JPG,4_AEP,Session_5,6/7/2021,8:48:10,TRUE,Session_5__2021-06-07__08-48-10(1).JPG,Sciurus_sp,1,n,
MFDC3947.JPG,4_AEP,Session_5,6/7/2021,8:48:10,TRUE,Session_5__2021-06-07__08-48-10(2).JPG,Sciurus_sp,1,n,
MFDC3948.JPG,4_AEP,Session_5,6/7/2021,15:32:48,TRUE,Session_5__2021-06-07__15-32-48(1).JPG,NA,0,n,
MFDC3949.JPG,4_AEP,Session_5,6/7/2021,15:32:48,TRUE,Session_5__2021-06-07__15-32-48(2).JPG,NA,0,n,
MFDC3950.JPG,4_AEP,Session_5,6/7/2021,15:32:49,TRUE,Session_5__2021-06-07__15-32-49(3).JPG,NA,0,n,
MFDC3951.JPG,4_AEP,Session_5,6/7/2021,22:32:13,TRUE,Session_5__2021-06-07__22-32-13(1).JPG,NA,0,n,
MFDC3952.JPG,4_AEP,Session_5,6/7/2021,22:32:13,TRUE,Session_5__2021-06-07__22-32-13(2).JPG,NA,0,n,
MFDC3953.JPG,4_AEP,Session_5,6/7/2021,22:32:14,TRUE,Session_5__2021-06-07__22-32-14(3).JPG,NA,0,n,
MFDC3954.JPG,4_AEP,Session_5,6/7/2021,23:13:18,TRUE,Session_5__2021-06-07__23-13-18(1).JPG,NA,0,n,
MFDC3955.JPG,4_AEP,Session_5,6/7/2021,23:13:18,TRUE,Session_5__2021-06-07__23-13-18(2).JPG,NA,0,n,
MFDC3956.JPG,4_AEP,Session_5,6/7/2021,23:13:18,TRUE,Session_5__2021-06-07__23-13-18(3).JPG,NA,0,n,
MFDC3957.JPG,4_AEP,Session_5,6/9/2021,0:39:55,TRUE,Session_5__2021-06-09__00-39-55(1).JPG,NA,0,n,
MFDC3958.JPG,4_AEP,Session_5,6/9/2021,0:39:55,TRUE,Session_5__2021-06-09__00-39-55(2).JPG,NA,0,n,
MFDC3959.JPG,4_AEP,Session_5,6/9/2021,0:39:55,TRUE,Session_5__2021-06-09__00-39-55(3).JPG,NA,0,n,
MFDC3960.JPG,4_AEP,Session_5,6/9/2021,8:28:02,TRUE,Session_5__2021-06-09__08-28-02(1).JPG,Odocoileus_virginianus,1,n,
MFDC3961.JPG,4_AEP,Session_5,6/9/2021,8:28:02,TRUE,Session_5__2021-06-09__08-28-02(2).JPG,Odocoileus_virginianus,1,n,
MFDC3962.JPG,4_AEP,Session_5,6/9/2021,8:28:02,TRUE,Session_5__2021-06-09__08-28-02(3).JPG,Odocoileus_virginianus,1,n,
MFDC3963.JPG,4_AEP,Session_5,6/9/2021,20:53:39,TRUE,Session_5__2021-06-09__20-53-39(1).JPG,Procyon_lotor,1,n,
MFDC3964.JPG,4_AEP,Session_5,6/9/2021,20:53:39,TRUE,Session_5__2021-06-09__20-53-39(2).JPG,Procyon_lotor,1,n,
MFDC3965.JPG,4_AEP,Session_5,6/9/2021,20:53:41,TRUE,Session_5__2021-06-09__20-53-41(3).JPG,Procyon_lotor,1,n,
MFDC3966.JPG,4_AEP,Session_5,6/10/2021,7:12:39,TRUE,Session_5__2021-06-10__07-12-39(1).JPG,Sciurus_sp,1,n,
MFDC3967.JPG,4_AEP,Session_5,6/10/2021,7:12:39,TRUE,Session_5__2021-06-10__07-12-39(2).JPG,Sciurus_sp,1,n,
MFDC3968.JPG,4_AEP,Session_5,6/10/2021,7:12:40,TRUE,Session_5__2021-06-10__07-12-40(3).JPG,Sciurus_sp,1,n,
MFDC3969.JPG,4_AEP,Session_5,6/11/2021,3:24:54,TRUE,Session_5__2021-06-11__03-24-54(1).JPG,Procyon_lotor,1,n,
MFDC3970.JPG,4_AEP,Session_5,6/11/2021,3:24:55,TRUE,Session_5__2021-06-11__03-24-55(2).JPG,Procyon_lotor,1,n,
MFDC3971.JPG,4_AEP,Session_5,6/11/2021,3:24:55,TRUE,Session_5__2021-06-11__03-24-55(3).JPG,Procyon_lotor,1,n,
MFDC3972.JPG,4_AEP,Session_5,6/12/2021,3:56:19,TRUE,Session_5__2021-06-12__03-56-19(1).JPG,NA,0,n,
MFDC3973.JPG,4_AEP,Session_5,6/12/2021,3:56:19,TRUE,Session_5__2021-06-12__03-56-19(2).JPG,NA,0,n,
MFDC3974.JPG,4_AEP,Session_5,6/12/2021,3:56:19,TRUE,Session_5__2021-06-12__03-56-19(3).JPG,NA,0,n,
MFDC3975.JPG,4_AEP,Session_5,6/12/2021,12:56:44,TRUE,Session_5__2021-06-12__12-56-44(1).JPG,NA,0,n,
MFDC3976.JPG,4_AEP,Session_5,6/12/2021,12:56:44,TRUE,Session_5__2021-06-12__12-56-44(2).JPG,NA,0,n,
MFDC3977.JPG,4_AEP,Session_5,6/12/2021,12:56:45,TRUE,Session_5__2021-06-12__12-56-45(3).JPG,NA,0,n,
MFDC3978.JPG,4_AEP,Session_5,6/13/2021,15:53:53,TRUE,Session_5__2021-06-13__15-53-53(1).JPG,NA,0,n,
MFDC3979.JPG,4_AEP,Session_5,6/13/2021,15:53:54,TRUE,Session_5__2021-06-13__15-53-54(3).JPG,NA,0,n,
MFDC3980.JPG,4_AEP,Session_5,6/13/2021,15:53:53,TRUE,Session_5__2021-06-13__15-53-53(2).JPG,NA,0,n,
MFDC3981.JPG,4_AEP,Session_5,6/13/2021,15:54:30,TRUE,Session_5__2021-06-13__15-54-30(2).JPG,NA,0,n,
MFDC3982.JPG,4_AEP,Session_5,6/13/2021,15:54:29,TRUE,Session_5__2021-06-13__15-54-29(1).JPG,NA,0,n,
MFDC3983.JPG,4_AEP,Session_5,6/13/2021,15:54:30,TRUE,Session_5__2021-06-13__15-54-30(3).JPG,NA,0,n,
MFDC3984.JPG,4_AEP,Session_5,6/13/2021,15:55:50,TRUE,Session_5__2021-06-13__15-55-50(2).JPG,NA,0,n,
MFDC3985.JPG,4_AEP,Session_5,6/13/2021,15:55:49,TRUE,Session_5__2021-06-13__15-55-49(1).JPG,NA,0,n,
MFDC3986.JPG,4_AEP,Session_5,6/13/2021,15:55:50,TRUE,Session_5__2021-06-13__15-55-50(3).JPG,NA,0,n,
MFDC3987.JPG,4_AEP,Session_5,6/13/2021,15:58:46,TRUE,Session_5__2021-06-13__15-58-46(1).JPG,NA,0,n,
MFDC3988.JPG,4_AEP,Session_5,6/13/2021,15:58:46,TRUE,Session_5__2021-06-13__15-58-46(2).JPG,NA,0,n,
MFDC3989.JPG,4_AEP,Session_5,6/13/2021,15:58:46,TRUE,Session_5__2021-06-13__15-58-46(3).JPG,NA,0,n,
MFDC3990.JPG,4_AEP,Session_5,6/13/2021,15:59:48,TRUE,Session_5__2021-06-13__15-59-48(1).JPG,NA,0,n,
MFDC3991.JPG,4_AEP,Session_5,6/13/2021,15:59:50,TRUE,Session_5__2021-06-13__15-59-50(3).JPG,NA,0,n,
MFDC3992.JPG,4_AEP,Session_5,6/13/2021,15:59:49,TRUE,Session_5__2021-06-13__15-59-49(2).JPG,NA,0,n,
MFDC3993.JPG,4_AEP,Session_5,6/13/2021,16:00:34,TRUE,Session_5__2021-06-13__16-00-34(1).JPG,NA,0,n,
MFDC3994.JPG,4_AEP,Session_5,6/13/2021,16:00:34,TRUE,Session_5__2021-06-13__16-00-34(2).JPG,NA,0,n,
MFDC3995.JPG,4_AEP,Session_5,6/13/2021,16:00:34,TRUE,Session_5__2021-06-13__16-00-34(3).JPG,NA,0,n,
MFDC3996.JPG,4_AEP,Session_5,6/14/2021,13:04:04,TRUE,Session_5__2021-06-14__13-04-04(1).JPG,NA,0,n,
MFDC3997.JPG,4_AEP,Session_5,6/14/2021,13:04:05,TRUE,Session_5__2021-06-14__13-04-05(2).JPG,NA,0,n,
MFDC3998.JPG,4_AEP,Session_5,6/14/2021,13:04:05,TRUE,Session_5__2021-06-14__13-04-05(3).JPG,NA,0,n,
MFDC3999.JPG,4_AEP,Session_5,6/14/2021,14:02:22,TRUE,Session_5__2021-06-14__14-02-22(1).JPG,Meleagris_gallopavo,1,n,
MFDC4000.JPG,4_AEP,Session_5,6/14/2021,14:02:22,TRUE,Session_5__2021-06-14__14-02-22(2).JPG,Meleagris_gallopavo,1,n,
MFDC4001.JPG,4_AEP,Session_5,6/14/2021,14:02:22,TRUE,Session_5__2021-06-14__14-02-22(3).JPG,Meleagris_gallopavo,1,n,
MFDC4002.JPG,4_AEP,Session_5,6/14/2021,14:02:53,TRUE,Session_5__2021-06-14__14-02-53(4).JPG,Meleagris_gallopavo,1,n,
MFDC4003.JPG,4_AEP,Session_5,6/14/2021,14:02:54,TRUE,Session_5__2021-06-14__14-02-54(5).JPG,Meleagris_gallopavo,1,n,
MFDC4004.JPG,4_AEP,Session_5,6/14/2021,14:02:54,TRUE,Session_5__2021-06-14__14-02-54(6).JPG,Meleagris_gallopavo,1,n,
MFDC4005.JPG,4_AEP,Session_5,6/14/2021,14:04:17,TRUE,Session_5__2021-06-14__14-04-17(1).JPG,Meleagris_gallopavo,1,n,
MFDC4006.JPG,4_AEP,Session_5,6/14/2021,14:04:17,TRUE,Session_5__2021-06-14__14-04-17(2).JPG,Meleagris_gallopavo,1,n,
MFDC4007.JPG,4_AEP,Session_5,6/14/2021,14:04:17,TRUE,Session_5__2021-06-14__14-04-17(3).JPG,Meleagris_gallopavo,1,n,
MFDC4008.JPG,4_AEP,Session_5,6/14/2021,22:03:58,TRUE,Session_5__2021-06-14__22-03-58(1).JPG,Procyon_lotor,1,n,
MFDC4009.JPG,4_AEP,Session_5,6/14/2021,22:03:58,TRUE,Session_5__2021-06-14__22-03-58(2).JPG,Procyon_lotor,1,n,
MFDC4010.JPG,4_AEP,Session_5,6/14/2021,22:03:58,TRUE,Session_5__2021-06-14__22-03-58(3).JPG,Procyon_lotor,1,n,
MFDC4011.JPG,4_AEP,Session_5,6/15/2021,12:16:54,TRUE,Session_5__2021-06-15__12-16-54(1).JPG,NA,0,n,
MFDC4012.JPG,4_AEP,Session_5,6/15/2021,12:16:55,TRUE,Session_5__2021-06-15__12-16-55(2).JPG,NA,0,n,
