FileName,Station,Session,Date,Time,DateReadable,filename_new,Species,Number_animals,Favorite (y),Notes
MFDC0556.JPG,1_AEP,Session_1,1/14/2021,20:38:25,TRUE,Session 1__2021-01-14__20-38-25(1).JPG,Unid,1,n,
MFDC0557.JPG,1_AEP,Session_1,1/14/2021,21:04:06,TRUE,Session 1__2021-01-14__21-04-06(1).JPG,Didelphis_virginiana,1,n,
MFDC0560.JPG,1_AEP,Session_1,1/15/2021,7:51:13,TRUE,Session 1__2021-01-15__07-51-13(1).JPG,Odocoileus_virginianus,1,n,
MFDC0561.JPG,1_AEP,Session_1,1/15/2021,7:51:48,TRUE,Session 1__2021-01-15__07-51-48(2).JPG,Odocoileus_virginianus,2,n,
MFDC0562.JPG,1_AEP,Session_1,1/15/2021,7:52:26,TRUE,Session 1__2021-01-15__07-52-26(1).JPG,Odocoileus_virginianus,1,n,
MFDC0563.JPG,1_AEP,Session_1,1/15/2021,7:52:28,TRUE,Session 1__2021-01-15__07-52-28(2).JPG,Odocoileus_virginianus,1,n,
MFDC0564.JPG,1_AEP,Session_1,1/15/2021,7:52:31,TRUE,Session 1__2021-01-15__07-52-31(3).JPG,Odocoileus_virginianus,1,n,
MFDC0565.JPG,1_AEP,Session_1,1/15/2021,7:53:03,TRUE,Session 1__2021-01-15__07-53-03(1).JPG,Odocoileus_virginianus,1,n,
MFDC0566.JPG,1_AEP,Session_1,1/15/2021,7:53:34,TRUE,Session 1__2021-01-15__07-53-34(2).JPG,Odocoileus_virginianus,2,n,
MFDC0568.JPG,1_AEP,Session_1,1/15/2021,7:55:10,TRUE,Session 1__2021-01-15__07-55-10(1).JPG,Odocoileus_virginianus,1,n,
MFDC0569.JPG,1_AEP,Session_1,1/15/2021,7:55:12,TRUE,Session 1__2021-01-15__07-55-12(2).JPG,Odocoileus_virginianus,1,n,
MFDC0570.JPG,1_AEP,Session_1,1/15/2021,7:55:41,TRUE,Session 1__2021-01-15__07-55-41(3).JPG,Odocoileus_virginianus,1,n,
MFDC0571.JPG,1_AEP,Session_1,1/15/2021,7:55:44,TRUE,Session 1__2021-01-15__07-55-44(4).JPG,Odocoileus_virginianus,1,n,
MFDC0572.JPG,1_AEP,Session_1,1/15/2021,7:56:15,TRUE,Session 1__2021-01-15__07-56-15(1).JPG,Odocoileus_virginianus,1,n,
MFDC0573.JPG,1_AEP,Session_1,1/15/2021,7:56:17,TRUE,Session 1__2021-01-15__07-56-17(2).JPG,Odocoileus_virginianus,1,n,
MFDC0574.JPG,1_AEP,Session_1,1/15/2021,7:56:19,TRUE,Session 1__2021-01-15__07-56-19(3).JPG,Odocoileus_virginianus,1,n,
MFDC0575.JPG,1_AEP,Session_1,1/15/2021,7:56:48,TRUE,Session 1__2021-01-15__07-56-48(4).JPG,Odocoileus_virginianus,1,n,
MFDC0578.JPG,1_AEP,Session_1,1/15/2021,18:43:44,TRUE,Session 1__2021-01-15__18-43-44(1).JPG,Didelphis_virginiana,1,n,
MFDC0582.JPG,1_AEP,Session_1,1/17/2021,18:55:26,TRUE,Session 1__2021-01-17__18-55-26(1).JPG,Didelphis_virginiana,1,n,
MFDC0583.JPG,1_AEP,Session_1,1/17/2021,18:55:29,TRUE,Session 1__2021-01-17__18-55-29(2).JPG,Didelphis_virginiana,1,n,
MFDC0586.JPG,1_AEP,Session_1,1/19/2021,7:51:52,TRUE,Session 1__2021-01-19__07-51-52(1).JPG,Odocoileus_virginianus,1,n,
MFDC0587.JPG,1_AEP,Session_1,1/20/2021,5:20:12,TRUE,Session 1__2021-01-20__05-20-12(1).JPG,Canis_latrans,1,n,
MFDC0588.JPG,1_AEP,Session_1,1/20/2021,5:20:14,TRUE,Session 1__2021-01-20__05-20-14(2).JPG,Canis_latrans,1,n,
MFDC0589.JPG,1_AEP,Session_1,1/20/2021,5:20:16,TRUE,Session 1__2021-01-20__05-20-16(3).JPG,Canis_latrans,1,n,
MFDC0590.JPG,1_AEP,Session_1,1/20/2021,5:20:45,TRUE,Session 1__2021-01-20__05-20-45(4).JPG,Canis_latrans,1,n,
MFDC0591.JPG,1_AEP,Session_1,1/20/2021,5:20:47,TRUE,Session 1__2021-01-20__05-20-47(5).JPG,Canis_latrans,1,n,
MFDC0592.JPG,1_AEP,Session_1,1/20/2021,5:20:49,TRUE,Session 1__2021-01-20__05-20-49(6).JPG,Canis_latrans,1,n,
MFDC0594.JPG,1_AEP,Session_1,1/21/2021,17:36:01,TRUE,Session 1__2021-01-21__17-36-01(1).JPG,Odocoileus_virginianus,1,n,
MFDC0595.JPG,1_AEP,Session_1,1/21/2021,17:36:05,TRUE,Session 1__2021-01-21__17-36-05(2).JPG,Odocoileus_virginianus,1,n,
MFDC0596.JPG,1_AEP,Session_1,1/21/2021,17:36:05,TRUE,Session 1__2021-01-21__17-36-05(3).JPG,Odocoileus_virginianus,2,n,
MFDC0597.JPG,1_AEP,Session_1,1/21/2021,17:36:45,TRUE,Session 1__2021-01-21__17-36-45(4).JPG,Odocoileus_virginianus,2,n,
MFDC0598.JPG,1_AEP,Session_1,1/21/2021,17:36:48,TRUE,Session 1__2021-01-21__17-36-48(5).JPG,Odocoileus_virginianus,2,n,
MFDC0599.JPG,1_AEP,Session_1,1/21/2021,17:36:50,TRUE,Session 1__2021-01-21__17-36-50(6).JPG,Odocoileus_virginianus,2,n,
MFDC0600.JPG,1_AEP,Session_1,1/21/2021,17:37:20,TRUE,Session 1__2021-01-21__17-37-20(1).JPG,Odocoileus_virginianus,2,n,
MFDC0601.JPG,1_AEP,Session_1,1/21/2021,17:37:22,TRUE,Session 1__2021-01-21__17-37-22(2).JPG,Odocoileus_virginianus,1,n,
MFDC0602.JPG,1_AEP,Session_1,1/22/2021,16:59:50,TRUE,Session 1__2021-01-22__16-59-50(1).JPG,Odocoileus_virginianus,1,n,
MFDC0603.JPG,1_AEP,Session_1,1/22/2021,16:59:53,TRUE,Session 1__2021-01-22__16-59-53(2).JPG,Odocoileus_virginianus,1,n,
MFDC0604.JPG,1_AEP,Session_1,1/22/2021,16:59:54,TRUE,Session 1__2021-01-22__16-59-54(3).JPG,Odocoileus_virginianus,1,n,
MFDC0605.JPG,1_AEP,Session_1,1/22/2021,17:00:23,TRUE,Session 1__2021-01-22__17-00-23(1).JPG,Odocoileus_virginianus,1,n,
MFDC0606.JPG,1_AEP,Session_1,1/22/2021,17:00:26,TRUE,Session 1__2021-01-22__17-00-26(2).JPG,Odocoileus_virginianus,1,n,
MFDC0607.JPG,1_AEP,Session_1,1/22/2021,17:00:56,TRUE,Session 1__2021-01-22__17-00-56(3).JPG,Odocoileus_virginianus,1,n,
MFDC0608.JPG,1_AEP,Session_1,1/23/2021,2:17:17,TRUE,Session 1__2021-01-23__02-17-17(1).JPG,Odocoileus_virginianus,1,n,
MFDC0609.JPG,1_AEP,Session_1,1/23/2021,2:17:46,TRUE,Session 1__2021-01-23__02-17-46(2).JPG,Odocoileus_virginianus,1,n,
MFDC0610.JPG,1_AEP,Session_1,1/23/2021,2:18:18,TRUE,Session 1__2021-01-23__02-18-18(1).JPG,Odocoileus_virginianus,1,n,
MFDC0611.JPG,1_AEP,Session_1,1/23/2021,2:18:51,TRUE,Session 1__2021-01-23__02-18-51(2).JPG,Odocoileus_virginianus,1,n,
MFDC0612.JPG,1_AEP,Session_1,1/23/2021,2:36:43,TRUE,Session 1__2021-01-23__02-36-43(1).JPG,Odocoileus_virginianus,1,n,
MFDC0613.JPG,1_AEP,Session_1,1/23/2021,2:36:45,TRUE,Session 1__2021-01-23__02-36-45(2).JPG,Odocoileus_virginianus,1,n,
MFDC0614.JPG,1_AEP,Session_1,1/23/2021,2:36:48,TRUE,Session 1__2021-01-23__02-36-48(3).JPG,Odocoileus_virginianus,1,n,
MFDC0616.JPG,1_AEP,Session_1,1/24/2021,15:49:17,TRUE,Session 1__2021-01-24__15-49-17(1).JPG,Odocoileus_virginianus,1,n,
MFDC0617.JPG,1_AEP,Session_1,1/25/2021,8:24:28,TRUE,Session 1__2021-01-25__08-24-28(1).JPG,Odocoileus_virginianus,1,n,
MFDC0618.JPG,1_AEP,Session_1,1/25/2021,8:24:58,TRUE,Session 1__2021-01-25__08-24-58(2).JPG,Odocoileus_virginianus,1,n,
MFDC0620.JPG,1_AEP,Session_1,1/25/2021,8:27:46,TRUE,Session 1__2021-01-25__08-27-46(1).JPG,Odocoileus_virginianus,1,n,
MFDC0621.JPG,1_AEP,Session_1,1/25/2021,8:27:49,TRUE,Session 1__2021-01-25__08-27-49(2).JPG,Odocoileus_virginianus,1,n,
MFDC0622.JPG,1_AEP,Session_1,1/25/2021,8:28:18,TRUE,Session 1__2021-01-25__08-28-18(1).JPG,Odocoileus_virginianus,1,n,
MFDC0623.JPG,1_AEP,Session_1,1/25/2021,8:28:21,TRUE,Session 1__2021-01-25__08-28-21(2).JPG,Odocoileus_virginianus,1,n,
MFDC0624.JPG,1_AEP,Session_1,1/25/2021,8:28:23,TRUE,Session 1__2021-01-25__08-28-23(3).JPG,Odocoileus_virginianus,1,n,
MFDC0625.JPG,1_AEP,Session_1,1/25/2021,8:29:08,TRUE,Session 1__2021-01-25__08-29-08(1).JPG,Odocoileus_virginianus,1,n,
MFDC0626.JPG,1_AEP,Session_1,1/25/2021,8:29:10,TRUE,Session 1__2021-01-25__08-29-10(2).JPG,Odocoileus_virginianus,1,n,
MFDC0627.JPG,1_AEP,Session_1,1/25/2021,8:29:12,TRUE,Session 1__2021-01-25__08-29-12(3).JPG,Odocoileus_virginianus,1,n,
MFDC0628.JPG,1_AEP,Session_1,1/25/2021,8:29:52,TRUE,Session 1__2021-01-25__08-29-52(4).JPG,Odocoileus_virginianus,1,n,
MFDC0629.JPG,1_AEP,Session_1,1/25/2021,8:30:24,TRUE,Session 1__2021-01-25__08-30-24(1).JPG,Odocoileus_virginianus,1,n,
MFDC0630.JPG,1_AEP,Session_1,1/25/2021,8:30:27,TRUE,Session 1__2021-01-25__08-30-27(2).JPG,Odocoileus_virginianus,1,n,
MFDC0631.JPG,1_AEP,Session_1,1/25/2021,8:30:29,TRUE,Session 1__2021-01-25__08-30-29(3).JPG,Odocoileus_virginianus,1,n,
MFDC0632.JPG,1_AEP,Session_1,1/25/2021,8:30:59,TRUE,Session 1__2021-01-25__08-30-59(4).JPG,Odocoileus_virginianus,1,n,
MFDC0633.JPG,1_AEP,Session_1,1/25/2021,8:31:03,TRUE,Session 1__2021-01-25__08-31-03(1).JPG,Odocoileus_virginianus,1,n,
MFDC0635.JPG,1_AEP,Session_1,1/25/2021,19:09:46,TRUE,Session 1__2021-01-25__19-09-46(1).JPG,Didelphis_virginiana,1,n,
MFDC0636.JPG,1_AEP,Session_1,1/25/2021,19:09:49,TRUE,Session 1__2021-01-25__19-09-49(2).JPG,Didelphis_virginiana,1,n,
MFDC0639.JPG,1_AEP,Session_1,1/27/2021,2:14:11,TRUE,Session 1__2021-01-27__02-14-11(1).JPG,Didelphis_virginiana,1,n,
MFDC0641.JPG,1_AEP,Session_1,1/27/2021,5:33:33,TRUE,Session 1__2021-01-27__05-33-33(1).JPG,Lynx_rufus,1,n,
MFDC0642.JPG,1_AEP,Session_1,1/27/2021,5:33:34,TRUE,Session 1__2021-01-27__05-33-34(2).JPG,Lynx_rufus,1,n,
MFDC0643.JPG,1_AEP,Session_1,1/28/2021,18:19:27,TRUE,Session 1__2021-01-28__18-19-27(1).JPG,Procyon_lotor,1,n,
MFDC0644.JPG,1_AEP,Session_1,1/28/2021,18:19:29,TRUE,Session 1__2021-01-28__18-19-29(2).JPG,Procyon_lotor,1,n,
MFDC0649.JPG,1_AEP,Session_1,1/29/2021,3:55:22,TRUE,Session 1__2021-01-29__03-55-22(1).JPG,Odocoileus_virginianus,1,n,
MFDC0650.JPG,1_AEP,Session_1,1/29/2021,3:55:55,TRUE,Session 1__2021-01-29__03-55-55(2).JPG,Odocoileus_virginianus,1,n,
MFDC0651.JPG,1_AEP,Session_1,1/29/2021,3:55:58,TRUE,Session 1__2021-01-29__03-55-58(3).JPG,Odocoileus_virginianus,1,n,
MFDC0652.JPG,1_AEP,Session_1,1/29/2021,3:55:58,TRUE,Session 1__2021-01-29__03-55-58(4).JPG,Odocoileus_virginianus,1,n,
MFDC0653.JPG,1_AEP,Session_1,1/29/2021,3:56:28,TRUE,Session 1__2021-01-29__03-56-28(1).JPG,Odocoileus_virginianus,1,n,
MFDC0654.JPG,1_AEP,Session_1,1/29/2021,3:56:30,TRUE,Session 1__2021-01-29__03-56-30(2).JPG,Odocoileus_virginianus,1,n,
MFDC0655.JPG,1_AEP,Session_1,1/29/2021,3:56:32,TRUE,Session 1__2021-01-29__03-56-32(3).JPG,Odocoileus_virginianus,1,n,
MFDC0656.JPG,1_AEP,Session_1,1/29/2021,3:57:01,TRUE,Session 1__2021-01-29__03-57-01(1).JPG,Odocoileus_virginianus,1,n,
MFDC0657.JPG,1_AEP,Session_1,1/29/2021,3:57:03,TRUE,Session 1__2021-01-29__03-57-03(2).JPG,Odocoileus_virginianus,1,n,
MFDC0658.JPG,1_AEP,Session_1,1/29/2021,3:57:04,TRUE,Session 1__2021-01-29__03-57-04(3).JPG,Odocoileus_virginianus,1,n,
MFDC0659.JPG,1_AEP,Session_1,1/29/2021,3:57:36,TRUE,Session 1__2021-01-29__03-57-36(4).JPG,Odocoileus_virginianus,1,n,
MFDC0660.JPG,1_AEP,Session_1,1/29/2021,3:57:38,TRUE,Session 1__2021-01-29__03-57-38(5).JPG,Odocoileus_virginianus,1,n,
MFDC0661.JPG,1_AEP,Session_1,1/29/2021,3:57:39,TRUE,Session 1__2021-01-29__03-57-39(6).JPG,Odocoileus_virginianus,1,n,
MFDC0662.JPG,1_AEP,Session_1,1/29/2021,3:58:09,TRUE,Session 1__2021-01-29__03-58-09(1).JPG,Odocoileus_virginianus,1,n,
MFDC0663.JPG,1_AEP,Session_1,1/29/2021,3:58:12,TRUE,Session 1__2021-01-29__03-58-12(2).JPG,Odocoileus_virginianus,1,n,
MFDC0665.JPG,1_AEP,Session_1,1/29/2021,4:00:43,TRUE,Session 1__2021-01-29__04-00-43(1).JPG,Odocoileus_virginianus,1,n,
MFDC0666.JPG,1_AEP,Session_1,1/29/2021,4:00:46,TRUE,Session 1__2021-01-29__04-00-46(2).JPG,Odocoileus_virginianus,1,n,
MFDC0667.JPG,1_AEP,Session_1,1/29/2021,4:00:47,TRUE,Session 1__2021-01-29__04-00-47(3).JPG,Odocoileus_virginianus,1,n,
MFDC0668.JPG,1_AEP,Session_1,1/29/2021,4:01:23,TRUE,Session 1__2021-01-29__04-01-23(1).JPG,Odocoileus_virginianus,1,n,
MFDC0669.JPG,1_AEP,Session_1,1/29/2021,4:01:25,TRUE,Session 1__2021-01-29__04-01-25(2).JPG,NA,0,n,
MFDC0670.JPG,1_AEP,Session_1,1/29/2021,4:36:04,TRUE,Session 1__2021-01-29__04-36-04(1).JPG,Odocoileus_virginianus,1,n,
MFDC0671.JPG,1_AEP,Session_1,1/29/2021,7:22:43,TRUE,Session 1__2021-01-29__07-22-43(1).JPG,Odocoileus_virginianus,1,n,
MFDC0672.JPG,1_AEP,Session_1,1/29/2021,7:22:47,TRUE,Session 1__2021-01-29__07-22-47(2).JPG,Odocoileus_virginianus,1,n,
MFDC0673.JPG,1_AEP,Session_1,1/29/2021,7:22:47,TRUE,Session 1__2021-01-29__07-22-47(3).JPG,Odocoileus_virginianus,1,n,
MFDC0674.JPG,1_AEP,Session_1,1/29/2021,7:23:57,TRUE,Session 1__2021-01-29__07-23-57(1).JPG,Odocoileus_virginianus,1,n,
MFDC0675.JPG,1_AEP,Session_1,1/29/2021,7:23:59,TRUE,Session 1__2021-01-29__07-23-59(2).JPG,Odocoileus_virginianus,1,n,
MFDC0677.JPG,1_AEP,Session_1,1/29/2021,7:51:26,TRUE,Session 1__2021-01-29__07-51-26(1).JPG,Odocoileus_virginianus,1,n,
MFDC0678.JPG,1_AEP,Session_1,1/29/2021,7:51:27,TRUE,Session 1__2021-01-29__07-51-27(2).JPG,Odocoileus_virginianus,1,n,
MFDC0679.JPG,1_AEP,Session_1,1/29/2021,7:52:03,TRUE,Session 1__2021-01-29__07-52-03(1).JPG,Odocoileus_virginianus,1,n,
MFDC0680.JPG,1_AEP,Session_1,1/29/2021,7:54:57,TRUE,Session 1__2021-01-29__07-54-57(1).JPG,Odocoileus_virginianus,1,n,
MFDC0681.JPG,1_AEP,Session_1,1/29/2021,16:16:44,TRUE,Session 1__2021-01-29__16-16-44(1).JPG,Odocoileus_virginianus,1,n,
MFDC0682.JPG,1_AEP,Session_1,1/29/2021,16:16:46,TRUE,Session 1__2021-01-29__16-16-46(2).JPG,Odocoileus_virginianus,1,n,
MFDC0683.JPG,1_AEP,Session_1,1/29/2021,16:16:47,TRUE,Session 1__2021-01-29__16-16-47(3).JPG,Odocoileus_virginianus,1,n,
MFDC0684.JPG,1_AEP,Session_1,1/29/2021,16:18:50,TRUE,Session 1__2021-01-29__16-18-50(1).JPG,Odocoileus_virginianus,1,n,
MFDC0685.JPG,1_AEP,Session_1,1/30/2021,1:51:59,TRUE,Session 1__2021-01-30__01-51-59(1).JPG,NA,0,n,
MFDC0686.JPG,1_AEP,Session_1,1/30/2021,8:53:24,TRUE,Session 1__2021-01-30__08-53-24(1).JPG,Odocoileus_virginianus,1,n,
MFDC0687.JPG,1_AEP,Session_1,1/30/2021,8:53:27,TRUE,Session 1__2021-01-30__08-53-27(2).JPG,Odocoileus_virginianus,1,n,
MFDC0688.JPG,1_AEP,Session_1,1/30/2021,8:54:02,TRUE,Session 1__2021-01-30__08-54-02(1).JPG,Odocoileus_virginianus,1,n,
MFDC0689.JPG,1_AEP,Session_1,1/30/2021,8:54:04,TRUE,Session 1__2021-01-30__08-54-04(2).JPG,NA,0,n,
MFDC0690.JPG,1_AEP,Session_1,1/30/2021,8:54:06,TRUE,Session 1__2021-01-30__08-54-06(3).JPG,NA,0,n,
MFDC0691.JPG,1_AEP,Session_1,1/30/2021,8:55:06,TRUE,Session 1__2021-01-30__08-55-06(1).JPG,Odocoileus_virginianus,2,n,
MFDC0692.JPG,1_AEP,Session_1,1/30/2021,17:19:39,TRUE,Session 1__2021-01-30__17-19-39(1).JPG,NA,0,n,
MFDC0693.JPG,1_AEP,Session_1,1/30/2021,17:20:20,TRUE,Session 1__2021-01-30__17-20-20(1).JPG,NA,0,n,
MFDC0694.JPG,1_AEP,Session_1,1/31/2021,0:49:28,TRUE,Session 1__2021-01-31__00-49-28(1).JPG,NA,0,n,
MFDC0695.JPG,1_AEP,Session_1,1/31/2021,4:36:06,TRUE,Session 1__2021-01-31__04-36-06(1).JPG,Odocoileus_virginianus,1,n,
MFDC0696.JPG,1_AEP,Session_1,1/31/2021,4:36:41,TRUE,Session 1__2021-01-31__04-36-41(2).JPG,Odocoileus_virginianus,1,n,
MFDC0697.JPG,1_AEP,Session_1,1/31/2021,5:13:29,TRUE,Session 1__2021-01-31__05-13-29(1).JPG,Odocoileus_virginianus,1,n,
MFDC0698.JPG,1_AEP,Session_1,1/31/2021,5:33:48,TRUE,Session 1__2021-01-31__05-33-48(1).JPG,NA,0,n,
MFDC0699.JPG,1_AEP,Session_1,1/31/2021,5:34:19,TRUE,Session 1__2021-01-31__05-34-19(1).JPG,Odocoileus_virginianus,1,n,
MFDC0700.JPG,1_AEP,Session_1,1/31/2021,5:34:22,TRUE,Session 1__2021-01-31__05-34-22(2).JPG,Odocoileus_virginianus,1,n,
MFDC0701.JPG,1_AEP,Session_1,1/31/2021,5:34:23,TRUE,Session 1__2021-01-31__05-34-23(3).JPG,Odocoileus_virginianus,1,n,
MFDC0702.JPG,1_AEP,Session_1,1/31/2021,5:34:53,TRUE,Session 1__2021-01-31__05-34-53(4).JPG,Odocoileus_virginianus,1,n,
MFDC0703.JPG,1_AEP,Session_1,1/31/2021,5:34:55,TRUE,Session 1__2021-01-31__05-34-55(5).JPG,Odocoileus_virginianus,1,n,
MFDC0704.JPG,1_AEP,Session_1,1/31/2021,5:34:57,TRUE,Session 1__2021-01-31__05-34-57(6).JPG,Odocoileus_virginianus,1,n,
MFDC0705.JPG,1_AEP,Session_1,1/31/2021,5:35:29,TRUE,Session 1__2021-01-31__05-35-29(1).JPG,Odocoileus_virginianus,1,n,
MFDC0706.JPG,1_AEP,Session_1,1/31/2021,5:35:32,TRUE,Session 1__2021-01-31__05-35-32(2).JPG,Odocoileus_virginianus,1,n,
MFDC0707.JPG,1_AEP,Session_1,1/31/2021,5:35:32,TRUE,Session 1__2021-01-31__05-35-32(3).JPG,Odocoileus_virginianus,1,n,
MFDC0708.JPG,1_AEP,Session_1,1/31/2021,5:36:04,TRUE,Session 1__2021-01-31__05-36-04(1).JPG,Odocoileus_virginianus,1,n,
MFDC0709.JPG,1_AEP,Session_1,1/31/2021,5:36:06,TRUE,Session 1__2021-01-31__05-36-06(2).JPG,Odocoileus_virginianus,1,n,
MFDC0710.JPG,1_AEP,Session_1,1/31/2021,5:36:40,TRUE,Session 1__2021-01-31__05-36-40(3).JPG,NA,0,n,
MFDC0711.JPG,1_AEP,Session_1,1/31/2021,5:36:42,TRUE,Session 1__2021-01-31__05-36-42(4).JPG,NA,0,n,
MFDC0712.JPG,1_AEP,Session_1,2/1/2021,0:54:09,TRUE,Session 1__2021-02-01__00-54-09(1).JPG,Odocoileus_virginianus,1,n,
MFDC0713.JPG,1_AEP,Session_1,2/1/2021,0:54:12,TRUE,Session 1__2021-02-01__00-54-12(2).JPG,NA,0,n,
MFDC0714.JPG,1_AEP,Session_1,2/1/2021,22:46:05,TRUE,Session 1__2021-02-01__22-46-05(1).JPG,Odocoileus_virginianus,2,n,
MFDC0715.JPG,1_AEP,Session_1,2/1/2021,22:46:07,TRUE,Session 1__2021-02-01__22-46-07(2).JPG,Odocoileus_virginianus,2,n,
MFDC0716.JPG,1_AEP,Session_1,2/1/2021,22:46:09,TRUE,Session 1__2021-02-01__22-46-09(3).JPG,Odocoileus_virginianus,2,n,
MFDC0717.JPG,1_AEP,Session_1,2/2/2021,14:20:09,TRUE,Session 1__2021-02-02__14-20-09(1).JPG,NA,0,n,
MFDC0718.JPG,1_AEP,Session_1,2/3/2021,23:22:44,TRUE,Session 1__2021-02-03__23-22-44(1).JPG,NA,0,n,
MFDC0719.JPG,1_AEP,Session_1,2/4/2021,2:04:06,TRUE,Session 1__2021-02-04__02-04-06(1).JPG,Canis_latrans,1,n,
MFDC0720.JPG,1_AEP,Session_1,2/4/2021,2:04:47,TRUE,Session 1__2021-02-04__02-04-47(2).JPG,Canis_latrans,1,n,
MFDC0721.JPG,1_AEP,Session_1,2/4/2021,2:05:18,TRUE,Session 1__2021-02-04__02-05-18(1).JPG,Canis_latrans,1,n,
MFDC0722.JPG,1_AEP,Session_1,2/4/2021,2:05:20,TRUE,Session 1__2021-02-04__02-05-20(2).JPG,Canis_latrans,1,n,
MFDC0723.JPG,1_AEP,Session_1,2/4/2021,2:05:21,TRUE,Session 1__2021-02-04__02-05-21(3).JPG,Canis_latrans,1,n,
MFDC0724.JPG,1_AEP,Session_1,2/5/2021,12:51:23,TRUE,Session 1__2021-02-05__12-51-23(1).JPG,NA,0,n,
MFDC0725.JPG,1_AEP,Session_1,2/6/2021,4:54:19,TRUE,Session 1__2021-02-06__04-54-19(1).JPG,Odocoileus_virginianus,1,n,
MFDC0726.JPG,1_AEP,Session_1,2/6/2021,4:54:22,TRUE,Session 1__2021-02-06__04-54-22(2).JPG,Odocoileus_virginianus,1,n,
MFDC0729.JPG,1_AEP,Session_1,2/6/2021,14:18:48,TRUE,Session 1__2021-02-06__14-18-48(1).JPG,Homo_sapiens,1,n,
MFDC0731.JPG,1_AEP,Session_1,2/6/2021,14:19:20,TRUE,Session 1__2021-02-06__14-19-20(1).JPG,Homo_sapiens,1,n,
MFDC0733.JPG,1_AEP,Session_2,2/6/2021,14:22:34,TRUE,Session 2__2021-02-06__14-22-34(1).JPG,Canis_familiaris,2,n,
MFDC0734.JPG,1_AEP,Session_2,2/6/2021,14:22:36,TRUE,Session 2__2021-02-06__14-22-36(2).JPG,Canis_familiaris,2,n,
MFDC0735.JPG,1_AEP,Session_2,2/6/2021,14:22:38,TRUE,Session 2__2021-02-06__14-22-38(3).JPG,Canis_familiaris,2,n,
MFDC0736.JPG,1_AEP,Session_2,2/7/2021,3:27:29,TRUE,Session 2__2021-02-07__03-27-29(1).JPG,NA,0,n,
MFDC0737.JPG,1_AEP,Session_2,2/7/2021,20:07:02,TRUE,Session 2__2021-02-07__20-07-02(1).JPG,NA,0,n,
MFDC0738.JPG,1_AEP,Session_2,2/8/2021,19:03:53,TRUE,Session 2__2021-02-08__19-03-53(1).JPG,NA,0,n,
MFDC0739.JPG,1_AEP,Session_2,2/9/2021,18:09:52,TRUE,Session 2__2021-02-09__18-09-52(1).JPG,NA,0,n,
MFDC0740.JPG,1_AEP,Session_2,2/9/2021,18:42:22,TRUE,Session 2__2021-02-09__18-42-22(1).JPG,Odocoileus_virginianus,1,n,
MFDC0741.JPG,1_AEP,Session_2,2/9/2021,18:42:24,TRUE,Session 2__2021-02-09__18-42-24(2).JPG,Odocoileus_virginianus,1,n,
MFDC0742.JPG,1_AEP,Session_2,2/9/2021,18:42:26,TRUE,Session 2__2021-02-09__18-42-26(3).JPG,Odocoileus_virginianus,1,n,
MFDC0743.JPG,1_AEP,Session_2,2/11/2021,16:58:07,TRUE,Session 2__2021-02-11__16-58-07(1).JPG,Odocoileus_virginianus,1,n,
MFDC0744.JPG,1_AEP,Session_2,2/11/2021,16:58:51,TRUE,Session 2__2021-02-11__16-58-51(2).JPG,Odocoileus_virginianus,2,n,
MFDC0745.JPG,1_AEP,Session_2,2/11/2021,16:58:52,TRUE,Session 2__2021-02-11__16-58-52(3).JPG,Odocoileus_virginianus,2,n,
MFDC0746.JPG,1_AEP,Session_2,2/11/2021,16:58:55,TRUE,Session 2__2021-02-11__16-58-55(4).JPG,Odocoileus_virginianus,2,n,
MFDC0747.JPG,1_AEP,Session_2,2/11/2021,16:59:32,TRUE,Session 2__2021-02-11__16-59-32(1).JPG,Odocoileus_virginianus,2,n,
MFDC0748.JPG,1_AEP,Session_2,2/11/2021,17:00:32,TRUE,Session 2__2021-02-11__17-00-32(1).JPG,Odocoileus_virginianus,1,n,
MFDC0749.JPG,1_AEP,Session_2,2/11/2021,17:00:35,TRUE,Session 2__2021-02-11__17-00-35(2).JPG,Odocoileus_virginianus,1,n,
MFDC0750.JPG,1_AEP,Session_2,2/13/2021,17:39:43,TRUE,Session 2__2021-02-13__17-39-43(1).JPG,Odocoileus_virginianus,1,n,
MFDC0751.JPG,1_AEP,Session_2,2/13/2021,17:39:46,TRUE,Session 2__2021-02-13__17-39-46(2).JPG,Odocoileus_virginianus,1,n,
MFDC0752.JPG,1_AEP,Session_2,2/13/2021,17:39:47,TRUE,Session 2__2021-02-13__17-39-47(3).JPG,Odocoileus_virginianus,2,n,
MFDC0753.JPG,1_AEP,Session_2,2/13/2021,17:40:16,TRUE,Session 2__2021-02-13__17-40-16(1).JPG,Odocoileus_virginianus,1,n,
MFDC0754.JPG,1_AEP,Session_2,2/13/2021,17:40:19,TRUE,Session 2__2021-02-13__17-40-19(2).JPG,Odocoileus_virginianus,1,n,
MFDC0755.JPG,1_AEP,Session_2,2/14/2021,4:39:55,TRUE,Session 2__2021-02-14__04-39-55(1).JPG,Odocoileus_virginianus,1,n,
MFDC0756.JPG,1_AEP,Session_2,2/14/2021,4:41:10,TRUE,Session 2__2021-02-14__04-41-10(1).JPG,Odocoileus_virginianus,1,n,
MFDC0757.JPG,1_AEP,Session_2,2/14/2021,19:31:32,TRUE,Session 2__2021-02-14__19-31-32(1).JPG,NA,0,n,
MFDC0758.JPG,1_AEP,Session_2,2/16/2021,4:59:28,TRUE,Session 2__2021-02-16__04-59-28(1).JPG,NA,0,n,
MFDC0759.JPG,1_AEP,Session_2,2/16/2021,16:08:07,TRUE,Session 2__2021-02-16__16-08-07(1).JPG,NA,0,n,
MFDC0760.JPG,1_AEP,Session_2,2/16/2021,18:27:42,TRUE,Session 2__2021-02-16__18-27-42(1).JPG,NA,0,n,
MFDC0761.JPG,1_AEP,Session_2,2/17/2021,4:08:06,TRUE,Session 2__2021-02-17__04-08-06(1).JPG,NA,0,n,
MFDC0762.JPG,1_AEP,Session_2,2/17/2021,5:18:22,TRUE,Session 2__2021-02-17__05-18-22(1).JPG,NA,0,n,
MFDC0763.JPG,1_AEP,Session_2,2/17/2021,7:40:29,TRUE,Session 2__2021-02-17__07-40-29(1).JPG,NA,0,n,
MFDC0764.JPG,1_AEP,Session_2,2/17/2021,16:04:53,TRUE,Session 2__2021-02-17__16-04-53(1).JPG,NA,0,n,
MFDC0765.JPG,1_AEP,Session_2,2/18/2021,18:08:52,TRUE,Session 2__2021-02-18__18-08-52(1).JPG,NA,0,n,
MFDC0766.JPG,1_AEP,Session_2,2/19/2021,0:10:41,TRUE,Session 2__2021-02-19__00-10-41(1).JPG,Sylvilagus_floridanus,1,n,
MFDC0767.JPG,1_AEP,Session_2,2/19/2021,3:39:43,TRUE,Session 2__2021-02-19__03-39-43(1).JPG,NA,0,n,
MFDC0768.JPG,1_AEP,Session_2,2/19/2021,14:26:49,TRUE,Session 2__2021-02-19__14-26-49(1).JPG,NA,0,n,
MFDC0769.JPG,1_AEP,Session_2,2/19/2021,20:47:58,TRUE,Session 2__2021-02-19__20-47-58(1).JPG,Unid,1,n,
MFDC0770.JPG,1_AEP,Session_2,2/19/2021,20:48:54,TRUE,Session 2__2021-02-19__20-48-54(1).JPG,NA,0,n,
MFDC0771.JPG,1_AEP,Session_2,2/20/2021,21:20:17,TRUE,Session 2__2021-02-20__21-20-17(1).JPG,Canis_latrans,1,n,
MFDC0772.JPG,1_AEP,Session_2,2/21/2021,6:50:27,TRUE,Session 2__2021-02-21__06-50-27(1).JPG,NA,0,n,
MFDC0773.JPG,1_AEP,Session_2,2/22/2021,5:54:09,TRUE,Session 2__2021-02-22__05-54-09(1).JPG,Lynx_rufus,1,n,
MFDC0774.JPG,1_AEP,Session_2,2/22/2021,5:54:12,TRUE,Session 2__2021-02-22__05-54-12(2).JPG,NA,0,n,
MFDC0775.JPG,1_AEP,Session_2,2/22/2021,7:43:55,TRUE,Session 2__2021-02-22__07-43-55(1).JPG,NA,0,n,
MFDC0776.JPG,1_AEP,Session_2,2/23/2021,12:28:48,TRUE,Session 2__2021-02-23__12-28-48(1).JPG,NA,0,n,
MFDC0777.JPG,1_AEP,Session_2,2/23/2021,12:48:54,TRUE,Session 2__2021-02-23__12-48-54(1).JPG,NA,0,n,
MFDC0778.JPG,1_AEP,Session_2,2/23/2021,12:49:27,TRUE,Session 2__2021-02-23__12-49-27(1).JPG,NA,0,n,
MFDC0779.JPG,1_AEP,Session_2,2/23/2021,12:59:31,TRUE,Session 2__2021-02-23__12-59-31(1).JPG,NA,0,n,
MFDC0780.JPG,1_AEP,Session_2,2/23/2021,13:00:18,TRUE,Session 2__2021-02-23__13-00-18(1).JPG,NA,0,n,
MFDC0781.JPG,1_AEP,Session_2,2/23/2021,13:35:41,TRUE,Session 2__2021-02-23__13-35-41(1).JPG,NA,0,n,
MFDC0782.JPG,1_AEP,Session_2,2/23/2021,21:43:06,TRUE,Session 2__2021-02-23__21-43-06(1).JPG,NA,0,n,
MFDC0783.JPG,1_AEP,Session_2,2/24/2021,13:31:48,TRUE,Session 2__2021-02-24__13-31-48(1).JPG,NA,0,n,
MFDC0784.JPG,1_AEP,Session_2,2/24/2021,13:31:52,TRUE,Session 2__2021-02-24__13-31-52(2).JPG,Odocoileus_virginianus,1,n,
MFDC0785.JPG,1_AEP,Session_2,2/24/2021,13:31:52,TRUE,Session 2__2021-02-24__13-31-52(3).JPG,Odocoileus_virginianus,1,n,
MFDC0786.JPG,1_AEP,Session_2,2/25/2021,20:33:05,TRUE,Session 2__2021-02-25__20-33-05(1).JPG,NA,0,n,
MFDC0787.JPG,1_AEP,Session_2,2/26/2021,1:43:44,TRUE,Session 2__2021-02-26__01-43-44(1).JPG,NA,0,n,
MFDC0788.JPG,1_AEP,Session_2,2/26/2021,5:47:15,TRUE,Session 2__2021-02-26__05-47-15(1).JPG,NA,0,n,
MFDC0789.JPG,1_AEP,Session_2,2/26/2021,7:46:26,TRUE,Session 2__2021-02-26__07-46-26(1).JPG,Odocoileus_virginianus,1,n,
MFDC0790.JPG,1_AEP,Session_2,2/26/2021,7:47:08,TRUE,Session 2__2021-02-26__07-47-08(1).JPG,Odocoileus_virginianus,1,n,
MFDC0791.JPG,1_AEP,Session_2,2/26/2021,7:47:09,TRUE,Session 2__2021-02-26__07-47-09(2).JPG,Odocoileus_virginianus,1,n,
MFDC0792.JPG,1_AEP,Session_2,2/26/2021,7:47:12,TRUE,Session 2__2021-02-26__07-47-12(3).JPG,Odocoileus_virginianus,1,n,
MFDC0793.JPG,1_AEP,Session_2,2/26/2021,18:14:19,TRUE,Session 2__2021-02-26__18-14-19(1).JPG,NA,0,n,
MFDC0794.JPG,1_AEP,Session_2,2/26/2021,22:19:34,TRUE,Session 2__2021-02-26__22-19-34(1).JPG,Odocoileus_virginianus,1,n,
MFDC0795.JPG,1_AEP,Session_2,2/26/2021,22:19:36,TRUE,Session 2__2021-02-26__22-19-36(2).JPG,Odocoileus_virginianus,1,n,
MFDC0796.JPG,1_AEP,Session_2,2/27/2021,1:59:47,TRUE,Session 2__2021-02-27__01-59-47(1).JPG,Odocoileus_virginianus,1,n,
MFDC0797.JPG,1_AEP,Session_2,2/27/2021,1:59:49,TRUE,Session 2__2021-02-27__01-59-49(2).JPG,Odocoileus_virginianus,1,n,
MFDC0798.JPG,1_AEP,Session_2,2/27/2021,1:59:51,TRUE,Session 2__2021-02-27__01-59-51(3).JPG,Odocoileus_virginianus,1,n,
MFDC0799.JPG,1_AEP,Session_2,2/27/2021,2:01:29,TRUE,Session 2__2021-02-27__02-01-29(1).JPG,Odocoileus_virginianus,1,n,
MFDC0800.JPG,1_AEP,Session_2,2/27/2021,2:01:31,TRUE,Session 2__2021-02-27__02-01-31(2).JPG,Odocoileus_virginianus,1,n,
MFDC0801.JPG,1_AEP,Session_2,2/27/2021,2:01:32,TRUE,Session 2__2021-02-27__02-01-32(3).JPG,Odocoileus_virginianus,1,n,
MFDC0802.JPG,1_AEP,Session_2,2/27/2021,8:08:27,TRUE,Session 2__2021-02-27__08-08-27(1).JPG,NA,0,n,
MFDC0803.JPG,1_AEP,Session_2,2/27/2021,12:48:15,TRUE,Session 2__2021-02-27__12-48-15(1).JPG,NA,0,n,
MFDC0804.JPG,1_AEP,Session_2,2/27/2021,18:39:00,TRUE,Session 2__2021-02-27__18-39-00(1).JPG,Odocoileus_virginianus,1,n,
MFDC0805.JPG,1_AEP,Session_2,2/27/2021,18:39:03,TRUE,Session 2__2021-02-27__18-39-03(2).JPG,Odocoileus_virginianus,1,n,
MFDC0806.JPG,1_AEP,Session_2,2/27/2021,18:39:04,TRUE,Session 2__2021-02-27__18-39-04(3).JPG,Odocoileus_virginianus,1,n,
MFDC0807.JPG,1_AEP,Session_2,2/27/2021,20:38:09,TRUE,Session 2__2021-02-27__20-38-09(1).JPG,Didelphis_virginiana,1,n,
MFDC0808.JPG,1_AEP,Session_2,2/27/2021,20:38:13,TRUE,Session 2__2021-02-27__20-38-13(2).JPG,Didelphis_virginiana,1,n,
MFDC0809.JPG,1_AEP,Session_2,2/27/2021,20:55:58,TRUE,Session 2__2021-02-27__20-55-58(1).JPG,Odocoileus_virginianus,1,n,
MFDC0810.JPG,1_AEP,Session_2,2/27/2021,20:56:00,TRUE,Session 2__2021-02-27__20-56-00(1).JPG,Odocoileus_virginianus,1,n,
MFDC0811.JPG,1_AEP,Session_2,2/27/2021,20:56:03,TRUE,Session 2__2021-02-27__20-56-03(2).JPG,Odocoileus_virginianus,1,n,
MFDC0812.JPG,1_AEP,Session_2,2/27/2021,22:24:40,TRUE,Session 2__2021-02-27__22-24-40(1).JPG,Didelphis_virginiana,1,n,
MFDC0813.JPG,1_AEP,Session_2,2/27/2021,22:42:42,TRUE,Session 2__2021-02-27__22-42-42(1).JPG,Sylvilagus_floridanus,1,n,
MFDC0814.JPG,1_AEP,Session_2,2/27/2021,22:42:44,TRUE,Session 2__2021-02-27__22-42-44(2).JPG,Sylvilagus_floridanus,1,n,
MFDC0815.JPG,1_AEP,Session_2,2/28/2021,0:46:27,TRUE,Session 2__2021-02-28__00-46-27(1).JPG,NA,0,n,
MFDC0816.JPG,1_AEP,Session_2,2/28/2021,3:32:43,TRUE,Session 2__2021-02-28__03-32-43(1).JPG,Unid,1,n,
MFDC0817.JPG,1_AEP,Session_2,3/1/2021,6:14:24,TRUE,Session 2__2021-03-01__06-14-24(1).JPG,Didelphis_virginiana,1,n,
MFDC0818.JPG,1_AEP,Session_2,3/1/2021,7:08:21,TRUE,Session 2__2021-03-01__07-08-21(1).JPG,Sciurus_sp,1,n,
MFDC0819.JPG,1_AEP,Session_2,3/1/2021,7:08:25,TRUE,Session 2__2021-03-01__07-08-25(2).JPG,NA,0,n,
MFDC0820.JPG,1_AEP,Session_2,3/1/2021,12:56:39,TRUE,Session 2__2021-03-01__12-56-39(1).JPG,NA,0,n,
MFDC0821.JPG,1_AEP,Session_2,3/1/2021,12:58:53,TRUE,Session 2__2021-03-01__12-58-53(1).JPG,NA,0,n,
MFDC0822.JPG,1_AEP,Session_2,3/1/2021,13:06:51,TRUE,Session 2__2021-03-01__13-06-51(1).JPG,NA,0,n,
MFDC0823.JPG,1_AEP,Session_2,3/1/2021,13:50:47,TRUE,Session 2__2021-03-01__13-50-47(1).JPG,Odocoileus_virginianus,1,n,
MFDC0824.JPG,1_AEP,Session_2,3/1/2021,13:50:49,TRUE,Session 2__2021-03-01__13-50-49(2).JPG,NA,0,n,
MFDC0825.JPG,1_AEP,Session_2,3/1/2021,13:50:50,TRUE,Session 2__2021-03-01__13-50-50(3).JPG,NA,0,n,
MFDC0826.JPG,1_AEP,Session_2,3/1/2021,22:31:12,TRUE,Session 2__2021-03-01__22-31-12(1).JPG,Odocoileus_virginianus,1,n,
MFDC0827.JPG,1_AEP,Session_2,3/1/2021,22:31:15,TRUE,Session 2__2021-03-01__22-31-15(2).JPG,Odocoileus_virginianus,1,n,
MFDC0828.JPG,1_AEP,Session_2,3/1/2021,22:31:16,TRUE,Session 2__2021-03-01__22-31-16(3).JPG,Odocoileus_virginianus,1,n,
MFDC0829.JPG,1_AEP,Session_2,3/2/2021,0:32:14,TRUE,Session 2__2021-03-02__00-32-14(1).JPG,Procyon_lotor,1,n,
MFDC0830.JPG,1_AEP,Session_2,3/2/2021,1:11:53,TRUE,Session 2__2021-03-02__01-11-53(1).JPG,Odocoileus_virginianus,1,n,
MFDC0831.JPG,1_AEP,Session_2,3/2/2021,1:11:56,TRUE,Session 2__2021-03-02__01-11-56(2).JPG,Odocoileus_virginianus,1,n,
MFDC0832.JPG,1_AEP,Session_2,3/2/2021,4:28:52,TRUE,Session 2__2021-03-02__04-28-52(1).JPG,NA,0,n,
MFDC0833.JPG,1_AEP,Session_2,3/2/2021,5:10:49,TRUE,Session 2__2021-03-02__05-10-49(1).JPG,NA,0,n,
MFDC0834.JPG,1_AEP,Session_2,3/2/2021,9:18:58,TRUE,Session 2__2021-03-02__09-18-58(1).JPG,NA,0,n,
MFDC0835.JPG,1_AEP,Session_2,3/2/2021,9:19:00,TRUE,Session 2__2021-03-02__09-19-00(1).JPG,NA,0,n,
MFDC0836.JPG,1_AEP,Session_2,3/3/2021,2:15:55,TRUE,Session 2__2021-03-03__02-15-55(1).JPG,Odocoileus_virginianus,1,n,
MFDC0837.JPG,1_AEP,Session_2,3/3/2021,4:10:32,TRUE,Session 2__2021-03-03__04-10-32(1).JPG,Odocoileus_virginianus,1,n,
MFDC0838.JPG,1_AEP,Session_2,3/3/2021,4:10:35,TRUE,Session 2__2021-03-03__04-10-35(2).JPG,Odocoileus_virginianus,1,n,
MFDC0839.JPG,1_AEP,Session_2,3/3/2021,4:10:35,TRUE,Session 2__2021-03-03__04-10-35(3).JPG,Odocoileus_virginianus,2,n,
MFDC0840.JPG,1_AEP,Session_2,3/3/2021,4:11:27,TRUE,Session 2__2021-03-03__04-11-27(1).JPG,Odocoileus_virginianus,1,n,
MFDC0841.JPG,1_AEP,Session_2,3/3/2021,4:11:30,TRUE,Session 2__2021-03-03__04-11-30(2).JPG,Odocoileus_virginianus,1,n,
MFDC0842.JPG,1_AEP,Session_2,3/3/2021,5:14:48,TRUE,Session 2__2021-03-03__05-14-48(1).JPG,Odocoileus_virginianus,1,n,
MFDC0843.JPG,1_AEP,Session_2,3/3/2021,5:14:50,TRUE,Session 2__2021-03-03__05-14-50(2).JPG,Odocoileus_virginianus,1,n,
MFDC0844.JPG,1_AEP,Session_2,3/3/2021,5:14:52,TRUE,Session 2__2021-03-03__05-14-52(3).JPG,Odocoileus_virginianus,1,n,
MFDC0845.JPG,1_AEP,Session_2,3/3/2021,6:39:03,TRUE,Session 2__2021-03-03__06-39-03(1).JPG,NA,0,n,
MFDC0846.JPG,1_AEP,Session_2,3/3/2021,7:05:20,TRUE,Session 2__2021-03-03__07-05-20(1).JPG,Odocoileus_virginianus,1,n,
MFDC0847.JPG,1_AEP,Session_2,3/3/2021,7:05:22,TRUE,Session 2__2021-03-03__07-05-22(2).JPG,Odocoileus_virginianus,1,n,
MFDC0848.JPG,1_AEP,Session_2,3/3/2021,7:05:24,TRUE,Session 2__2021-03-03__07-05-24(3).JPG,Odocoileus_virginianus,1,n,
MFDC0849.JPG,1_AEP,Session_2,3/3/2021,9:57:25,TRUE,Session 2__2021-03-03__09-57-25(1).JPG,Odocoileus_virginianus,1,n,
MFDC0850.JPG,1_AEP,Session_2,3/3/2021,9:57:28,TRUE,Session 2__2021-03-03__09-57-28(2).JPG,Odocoileus_virginianus,1,n,
MFDC0851.JPG,1_AEP,Session_2,3/3/2021,9:57:29,TRUE,Session 2__2021-03-03__09-57-29(3).JPG,Odocoileus_virginianus,1,n,
MFDC0852.JPG,1_AEP,Session_2,3/3/2021,9:57:58,TRUE,Session 2__2021-03-03__09-57-58(4).JPG,Odocoileus_virginianus,2,n,
MFDC0853.JPG,1_AEP,Session_2,3/3/2021,9:58:02,TRUE,Session 2__2021-03-03__09-58-02(1).JPG,Odocoileus_virginianus,3,n,
MFDC0854.JPG,1_AEP,Session_2,3/3/2021,9:58:02,TRUE,Session 2__2021-03-03__09-58-02(2).JPG,Odocoileus_virginianus,3,n,
MFDC0855.JPG,1_AEP,Session_2,3/3/2021,15:25:33,TRUE,Session 2__2021-03-03__15-25-33(1).JPG,Odocoileus_virginianus,1,n,
MFDC0856.JPG,1_AEP,Session_2,3/3/2021,15:27:22,TRUE,Session 2__2021-03-03__15-27-22(1).JPG,Odocoileus_virginianus,1,n,
MFDC0857.JPG,1_AEP,Session_2,3/3/2021,15:27:24,TRUE,Session 2__2021-03-03__15-27-24(2).JPG,Odocoileus_virginianus,1,n,
MFDC0858.JPG,1_AEP,Session_2,3/3/2021,18:55:39,TRUE,Session 2__2021-03-03__18-55-39(1).JPG,NA,0,n,
MFDC0859.JPG,1_AEP,Session_2,3/3/2021,22:21:48,TRUE,Session 2__2021-03-03__22-21-48(1).JPG,Procyon_lotor,1,n,
MFDC0860.JPG,1_AEP,Session_2,3/4/2021,0:06:07,TRUE,Session 2__2021-03-04__00-06-07(1).JPG,Didelphis_virginiana,1,n,
MFDC0861.JPG,1_AEP,Session_2,3/4/2021,1:19:10,TRUE,Session 2__2021-03-04__01-19-10(1).JPG,NA,0,n,
MFDC0862.JPG,1_AEP,Session_2,3/4/2021,2:05:10,TRUE,Session 2__2021-03-04__02-05-10(1).JPG,Unid,1,n,
MFDC0863.JPG,1_AEP,Session_2,3/4/2021,2:05:12,TRUE,Session 2__2021-03-04__02-05-12(2).JPG,NA,0,n,
MFDC0864.JPG,1_AEP,Session_2,3/4/2021,5:18:58,TRUE,Session 2__2021-03-04__05-18-58(1).JPG,Procyon_lotor,1,n,
MFDC0865.JPG,1_AEP,Session_2,3/4/2021,5:19:01,TRUE,Session 2__2021-03-04__05-19-01(1).JPG,Procyon_lotor,2,n,
MFDC0866.JPG,1_AEP,Session_2,3/4/2021,5:19:02,TRUE,Session 2__2021-03-04__05-19-02(2).JPG,Procyon_lotor,2,y,
MFDC0867.JPG,1_AEP,Session_2,3/4/2021,5:19:57,TRUE,Session 2__2021-03-04__05-19-57(3).JPG,NA,0,n,
MFDC0868.JPG,1_AEP,Session_2,3/4/2021,7:53:35,TRUE,Session 2__2021-03-04__07-53-35(1).JPG,Odocoileus_virginianus,1,n,
MFDC0869.JPG,1_AEP,Session_2,3/4/2021,7:53:38,TRUE,Session 2__2021-03-04__07-53-38(2).JPG,Odocoileus_virginianus,1,n,
MFDC0870.JPG,1_AEP,Session_2,3/4/2021,7:53:40,TRUE,Session 2__2021-03-04__07-53-40(3).JPG,Odocoileus_virginianus,1,n,
MFDC0871.JPG,1_AEP,Session_2,3/4/2021,7:54:08,TRUE,Session 2__2021-03-04__07-54-08(1).JPG,Odocoileus_virginianus,1,n,
MFDC0872.JPG,1_AEP,Session_2,3/4/2021,7:54:12,TRUE,Session 2__2021-03-04__07-54-12(2).JPG,Odocoileus_virginianus,1,n,
MFDC0873.JPG,1_AEP,Session_2,3/4/2021,7:54:41,TRUE,Session 2__2021-03-04__07-54-41(3).JPG,Odocoileus_virginianus,1,n,
MFDC0874.JPG,1_AEP,Session_2,3/4/2021,7:55:13,TRUE,Session 2__2021-03-04__07-55-13(1).JPG,Odocoileus_virginianus,2,n,
MFDC0875.JPG,1_AEP,Session_2,3/4/2021,7:55:16,TRUE,Session 2__2021-03-04__07-55-16(2).JPG,Odocoileus_virginianus,1,n,
MFDC0876.JPG,1_AEP,Session_2,3/4/2021,7:55:17,TRUE,Session 2__2021-03-04__07-55-17(3).JPG,Odocoileus_virginianus,1,n,
MFDC0877.JPG,1_AEP,Session_2,3/4/2021,7:55:55,TRUE,Session 2__2021-03-04__07-55-55(4).JPG,Odocoileus_virginianus,1,n,
MFDC0878.JPG,1_AEP,Session_2,3/4/2021,16:51:34,TRUE,Session 2__2021-03-04__16-51-34(1).JPG,NA,0,n,
MFDC0879.JPG,1_AEP,Session_2,3/4/2021,18:19:48,TRUE,Session 2__2021-03-04__18-19-48(1).JPG,NA,0,n,
MFDC0880.JPG,1_AEP,Session_2,3/4/2021,20:54:57,TRUE,Session 2__2021-03-04__20-54-57(1).JPG,Canis_latrans,1,n,
MFDC0881.JPG,1_AEP,Session_2,3/4/2021,20:55:00,TRUE,Session 2__2021-03-04__20-55-00(1).JPG,Canis_latrans,1,n,
MFDC0882.JPG,1_AEP,Session_2,3/4/2021,20:55:29,TRUE,Session 2__2021-03-04__20-55-29(2).JPG,Canis_latrans,1,n,
MFDC0883.JPG,1_AEP,Session_2,3/4/2021,20:55:31,TRUE,Session 2__2021-03-04__20-55-31(3).JPG,Canis_latrans,1,n,
MFDC0884.JPG,1_AEP,Session_2,3/5/2021,2:26:40,TRUE,Session 2__2021-03-05__02-26-40(1).JPG,Odocoileus_virginianus,1,n,
MFDC0885.JPG,1_AEP,Session_2,3/5/2021,2:26:42,TRUE,Session 2__2021-03-05__02-26-42(2).JPG,Odocoileus_virginianus,1,n,
MFDC0886.JPG,1_AEP,Session_2,3/5/2021,2:26:44,TRUE,Session 2__2021-03-05__02-26-44(3).JPG,Odocoileus_virginianus,1,n,
MFDC0887.JPG,1_AEP,Session_2,3/5/2021,3:56:34,TRUE,Session 2__2021-03-05__03-56-34(1).JPG,Sylvilagus_floridanus,1,n,
MFDC0888.JPG,1_AEP,Session_2,3/5/2021,6:33:57,TRUE,Session 2__2021-03-05__06-33-57(1).JPG,Odocoileus_virginianus,1,n,
MFDC0889.JPG,1_AEP,Session_2,3/5/2021,6:34:28,TRUE,Session 2__2021-03-05__06-34-28(1).JPG,Odocoileus_virginianus,1,n,
MFDC0890.JPG,1_AEP,Session_2,3/5/2021,13:27:32,TRUE,Session 2__2021-03-05__13-27-32(1).JPG,NA,0,n,
MFDC0891.JPG,1_AEP,Session_2,3/5/2021,13:27:34,TRUE,Session 2__2021-03-05__13-27-34(2).JPG,NA,0,n,
MFDC0892.JPG,1_AEP,Session_2,3/5/2021,14:37:45,TRUE,Session 2__2021-03-05__14-37-45(1).JPG,NA,0,n,
MFDC0893.JPG,1_AEP,Session_2,3/5/2021,18:10:05,TRUE,Session 2__2021-03-05__18-10-05(1).JPG,NA,0,n,
MFDC0894.JPG,1_AEP,Session_2,3/6/2021,4:10:38,TRUE,Session 2__2021-03-06__04-10-38(1).JPG,NA,0,n,
MFDC0895.JPG,1_AEP,Session_2,3/6/2021,6:30:09,TRUE,Session 2__2021-03-06__06-30-09(1).JPG,Odocoileus_virginianus,1,n,
MFDC0896.JPG,1_AEP,Session_2,3/6/2021,17:53:43,TRUE,Session 2__2021-03-06__17-53-43(1).JPG,NA,0,n,
MFDC0897.JPG,1_AEP,Session_2,3/7/2021,11:06:48,TRUE,Session 2__2021-03-07__11-06-48(1).JPG,NA,0,n,
MFDC0898.JPG,1_AEP,Session_2,3/7/2021,17:50:31,TRUE,Session 2__2021-03-07__17-50-31(1).JPG,NA,0,n,
MFDC0899.JPG,1_AEP,Session_2,3/7/2021,18:25:31,TRUE,Session 2__2021-03-07__18-25-31(1).JPG,Sciurus_sp,1,n,
MFDC0900.JPG,1_AEP,Session_2,3/7/2021,18:26:19,TRUE,Session 2__2021-03-07__18-26-19(1).JPG,NA,0,n,
MFDC0901.JPG,1_AEP,Session_2,3/8/2021,1:18:55,TRUE,Session 2__2021-03-08__01-18-55(1).JPG,Lynx_rufus,1,n,
MFDC0902.JPG,1_AEP,Session_2,3/8/2021,1:18:58,TRUE,Session 2__2021-03-08__01-18-58(2).JPG,Lynx_rufus,1,n,
MFDC0903.JPG,1_AEP,Session_2,3/8/2021,1:18:58,TRUE,Session 2__2021-03-08__01-18-58(3).JPG,Lynx_rufus,1,n,
MFDC0904.JPG,1_AEP,Session_2,3/8/2021,15:11:41,TRUE,Session 2__2021-03-08__15-11-41(1).JPG,NA,0,n,
MFDC0905.JPG,1_AEP,Session_2,3/8/2021,15:12:24,TRUE,Session 2__2021-03-08__15-12-24(1).JPG,Odocoileus_virginianus,1,n,
MFDC0906.JPG,1_AEP,Session_2,3/8/2021,15:13:18,TRUE,Session 2__2021-03-08__15-13-18(1).JPG,Odocoileus_virginianus,1,n,
MFDC0907.JPG,1_AEP,Session_2,3/8/2021,15:18:55,TRUE,Session 2__2021-03-08__15-18-55(1).JPG,Odocoileus_virginianus,1,n,
MFDC0908.JPG,1_AEP,Session_2,3/8/2021,15:18:58,TRUE,Session 2__2021-03-08__15-18-58(2).JPG,Odocoileus_virginianus,1,n,
MFDC0909.JPG,1_AEP,Session_2,3/8/2021,15:18:59,TRUE,Session 2__2021-03-08__15-18-59(3).JPG,Odocoileus_virginianus,1,n,
MFDC0910.JPG,1_AEP,Session_2,3/8/2021,16:15:11,TRUE,Session 2__2021-03-08__16-15-11(1).JPG,NA,0,n,
MFDC0911.JPG,1_AEP,Session_2,3/8/2021,20:51:37,TRUE,Session 2__2021-03-08__20-51-37(1).JPG,Didelphis_virginiana,1,n,
MFDC0912.JPG,1_AEP,Session_2,3/8/2021,20:51:39,TRUE,Session 2__2021-03-08__20-51-39(2).JPG,Didelphis_virginiana,1,n,
MFDC0913.JPG,1_AEP,Session_2,3/8/2021,20:51:41,TRUE,Session 2__2021-03-08__20-51-41(3).JPG,Didelphis_virginiana,1,n,
MFDC0914.JPG,1_AEP,Session_2,3/8/2021,22:03:44,TRUE,Session 2__2021-03-08__22-03-44(1).JPG,NA,0,n,
MFDC0915.JPG,1_AEP,Session_2,3/9/2021,2:44:36,TRUE,Session 2__2021-03-09__02-44-36(1).JPG,NA,0,n,
MFDC0916.JPG,1_AEP,Session_2,3/9/2021,3:37:00,TRUE,Session 2__2021-03-09__03-37-00(1).JPG,NA,0,n,
MFDC0917.JPG,1_AEP,Session_2,3/9/2021,20:59:27,TRUE,Session 2__2021-03-09__20-59-27(1).JPG,Sylvilagus_floridanus,1,n,
MFDC0918.JPG,1_AEP,Session_2,3/10/2021,2:30:26,TRUE,Session 2__2021-03-10__02-30-26(1).JPG,NA,0,n,
MFDC0919.JPG,1_AEP,Session_2,3/10/2021,6:39:03,TRUE,Session 2__2021-03-10__06-39-03(1).JPG,NA,0,n,
MFDC0920.JPG,1_AEP,Session_2,3/10/2021,7:02:42,TRUE,Session 2__2021-03-10__07-02-42(1).JPG,NA,0,n,
MFDC0921 2.JPG,1_AEP,Session_2,3/10/2021,7:06:13,TRUE,Session 2__2021-03-10__07-06-13(3).JPG,NA,0,n,
MFDC0921.JPG,1_AEP,Session_2,3/10/2021,7:06:05,TRUE,Session 2__2021-03-10__07-06-05(1).JPG,Sciurus_sp,1,n,
MFDC0922 2.JPG,1_AEP,Session_2,3/10/2021,19:56:53,TRUE,Session 2__2021-03-10__19-56-53(1).JPG,NA,0,n,
MFDC0922.JPG,1_AEP,Session_2,3/10/2021,7:06:07,TRUE,Session 2__2021-03-10__07-06-07(2).JPG,Sciurus_sp,1,n,
MFDC0923.JPG,1_AEP,Session_2,3/13/2021,1:10:13,TRUE,Session 2__2021-03-13__01-10-13(1).JPG,Sylvilagus_floridanus,1,n,
MFDC0924.JPG,1_AEP,Session_2,3/13/2021,1:10:51,TRUE,Session 2__2021-03-13__01-10-51(2).JPG,NA,0,n,
MFDC0925.JPG,1_AEP,Session_2,3/13/2021,2:29:51,TRUE,Session 2__2021-03-13__02-29-51(1).JPG,NA,0,n,
MFDC0926.JPG,1_AEP,Session_2,3/13/2021,3:20:15,TRUE,Session 2__2021-03-13__03-20-15(1).JPG,NA,0,n,
MFDC0927.JPG,1_AEP,Session_2,3/14/2021,5:05:13,TRUE,Session 2__2021-03-14__05-05-13(1).JPG,NA,0,n,
MFDC0928.JPG,1_AEP,Session_2,3/14/2021,7:04:24,TRUE,Session 2__2021-03-14__07-04-24(1).JPG,NA,0,n,
MFDC0929.JPG,1_AEP,Session_2,3/14/2021,7:04:26,TRUE,Session 2__2021-03-14__07-04-26(2).JPG,NA,0,n,
MFDC0930.JPG,1_AEP,Session_2,3/14/2021,7:05:59,TRUE,Session 2__2021-03-14__07-05-59(1).JPG,Sciurus_sp,1,n,
MFDC0931.JPG,1_AEP,Session_2,3/14/2021,7:06:02,TRUE,Session 2__2021-03-14__07-06-02(1).JPG,Sciurus_sp,1,n,
MFDC0932.JPG,1_AEP,Session_2,3/14/2021,7:06:03,TRUE,Session 2__2021-03-14__07-06-03(2).JPG,NA,0,n,
MFDC0933.JPG,1_AEP,Session_2,3/14/2021,12:54:34,TRUE,Session 2__2021-03-14__12-54-34(1).JPG,Homo_sapiens,1,n,
MFDC0934.JPG,1_AEP,Session_2,3/14/2021,12:54:38,TRUE,Session 2__2021-03-14__12-54-38(2).JPG,Homo_sapiens,1,n,
MFDC0935.JPG,1_AEP,Session_2,3/14/2021,12:54:39,TRUE,Session 2__2021-03-14__12-54-39(3).JPG,Homo_sapiens,1,n,
MFDC0936.JPG,1_AEP,Session_2,3/14/2021,12:55:09,TRUE,Session 2__2021-03-14__12-55-09(1).JPG,Homo_sapiens,1,n,
MFDC0937.JPG,1_AEP,Session_2,3/14/2021,12:55:11,TRUE,Session 2__2021-03-14__12-55-11(2).JPG,Homo_sapiens,1,n,
MFDC0938.JPG,1_AEP,Session_2,3/14/2021,12:55:13,TRUE,Session 2__2021-03-14__12-55-13(3).JPG,Homo_sapiens,1,n,
MFDC0940.JPG,1_AEP,Session_3,3/14/2021,13:57:43,TRUE,Session_3__2021-03-14__13-57-43(1).JPG,Canis_familiaris,1,n,
MFDC0945.JPG,1_AEP,Session_3,3/15/2021,23:09:16,TRUE,Session_3__2021-03-15__23-09-16(1).JPG,Procyon_lotor,1,n,
MFDC0946.JPG,1_AEP,Session_3,3/15/2021,23:09:18,TRUE,Session_3__2021-03-15__23-09-18(2).JPG,Procyon_lotor,1,n,
MFDC0947.JPG,1_AEP,Session_3,3/15/2021,23:09:18,TRUE,Session_3__2021-03-15__23-09-18(3).JPG,Procyon_lotor,1,n,
MFDC0948.JPG,1_AEP,Session_3,3/15/2021,23:09:47,TRUE,Session_3__2021-03-15__23-09-47(4).JPG,Procyon_lotor,1,n,
MFDC0949.JPG,1_AEP,Session_3,3/15/2021,23:09:48,TRUE,Session_3__2021-03-15__23-09-48(6).JPG,Procyon_lotor,1,n,
MFDC0950.JPG,1_AEP,Session_3,3/15/2021,23:09:47,TRUE,Session_3__2021-03-15__23-09-47(5).JPG,Procyon_lotor,1,n,
MFDC0951.JPG,1_AEP,Session_3,3/16/2021,1:24:15,TRUE,Session_3__2021-03-16__01-24-15(1).JPG,Didelphis_virginiana,1,y,
MFDC0952.JPG,1_AEP,Session_3,3/16/2021,1:24:15,TRUE,Session_3__2021-03-16__01-24-15(2).JPG,Didelphis_virginiana,1,n,
MFDC0953.JPG,1_AEP,Session_3,3/16/2021,1:24:17,TRUE,Session_3__2021-03-16__01-24-17(3).JPG,Didelphis_virginiana,1,n,
MFDC0954.JPG,1_AEP,Session_3,3/16/2021,2:01:04,TRUE,Session_3__2021-03-16__02-01-04(1).JPG,Didelphis_virginiana,1,n,
MFDC0955.JPG,1_AEP,Session_3,3/16/2021,2:01:04,TRUE,Session_3__2021-03-16__02-01-04(2).JPG,Didelphis_virginiana,1,n,
MFDC0956.JPG,1_AEP,Session_3,3/16/2021,2:01:05,TRUE,Session_3__2021-03-16__02-01-05(3).JPG,Didelphis_virginiana,1,n,
MFDC0957.JPG,1_AEP,Session_3,3/16/2021,2:25:29,TRUE,Session_3__2021-03-16__02-25-29(1).JPG,Didelphis_virginiana,1,n,
MFDC0958.JPG,1_AEP,Session_3,3/16/2021,2:25:29,TRUE,Session_3__2021-03-16__02-25-29(2).JPG,Didelphis_virginiana,1,n,
MFDC0959.JPG,1_AEP,Session_3,3/16/2021,2:25:30,TRUE,Session_3__2021-03-16__02-25-30(3).JPG,Didelphis_virginiana,1,n,
MFDC0960.JPG,1_AEP,Session_3,3/16/2021,4:37:53,TRUE,Session_3__2021-03-16__04-37-53(1).JPG,Didelphis_virginiana,1,n,
MFDC0961.JPG,1_AEP,Session_3,3/16/2021,4:37:53,TRUE,Session_3__2021-03-16__04-37-53(2).JPG,Didelphis_virginiana,1,n,
MFDC0962.JPG,1_AEP,Session_3,3/16/2021,4:37:53,TRUE,Session_3__2021-03-16__04-37-53(3).JPG,Didelphis_virginiana,1,n,
MFDC0963.JPG,1_AEP,Session_3,3/16/2021,4:58:11,TRUE,Session_3__2021-03-16__04-58-11(1).JPG,Didelphis_virginiana,1,n,
MFDC0964.JPG,1_AEP,Session_3,3/16/2021,4:58:13,TRUE,Session_3__2021-03-16__04-58-13(3).JPG,Didelphis_virginiana,1,n,
MFDC0965.JPG,1_AEP,Session_3,3/16/2021,4:58:12,TRUE,Session_3__2021-03-16__04-58-12(2).JPG,Didelphis_virginiana,1,n,
MFDC0968.JPG,1_AEP,Session_3,3/16/2021,16:40:08,TRUE,Session_3__2021-03-16__16-40-08(1).JPG,NA,0,n,
MFDC0969.JPG,1_AEP,Session_3,3/16/2021,20:42:06,TRUE,Session_3__2021-03-16__20-42-06(1).JPG,Didelphis_virginiana,1,n,
MFDC0970.JPG,1_AEP,Session_3,3/16/2021,20:42:06,TRUE,Session_3__2021-03-16__20-42-06(2).JPG,Didelphis_virginiana,1,n,
MFDC0971.JPG,1_AEP,Session_3,3/16/2021,20:42:06,TRUE,Session_3__2021-03-16__20-42-06(3).JPG,Didelphis_virginiana,1,n,
MFDC0972.JPG,1_AEP,Session_3,3/16/2021,20:57:07,TRUE,Session_3__2021-03-16__20-57-07(1).JPG,Didelphis_virginiana,1,n,
MFDC0973.JPG,1_AEP,Session_3,3/16/2021,20:57:07,TRUE,Session_3__2021-03-16__20-57-07(2).JPG,Didelphis_virginiana,1,n,
MFDC0974.JPG,1_AEP,Session_3,3/16/2021,20:57:08,TRUE,Session_3__2021-03-16__20-57-08(3).JPG,Didelphis_virginiana,1,n,
MFDC0975.JPG,1_AEP,Session_3,3/16/2021,21:13:45,TRUE,Session_3__2021-03-16__21-13-45(1).JPG,Didelphis_virginiana,1,n,
MFDC0976.JPG,1_AEP,Session_3,3/16/2021,21:13:46,TRUE,Session_3__2021-03-16__21-13-46(2).JPG,Didelphis_virginiana,1,n,
MFDC0977.JPG,1_AEP,Session_3,3/16/2021,21:13:46,TRUE,Session_3__2021-03-16__21-13-46(3).JPG,Didelphis_virginiana,1,n,
MFDC0981.JPG,1_AEP,Session_3,3/17/2021,1:33:32,TRUE,Session_3__2021-03-17__01-33-32(1).JPG,Didelphis_virginiana,1,n,
MFDC0982.JPG,1_AEP,Session_3,3/17/2021,1:33:33,TRUE,Session_3__2021-03-17__01-33-33(2).JPG,Didelphis_virginiana,1,n,
MFDC0983.JPG,1_AEP,Session_3,3/17/2021,1:33:33,TRUE,Session_3__2021-03-17__01-33-33(3).JPG,Didelphis_virginiana,1,n,
MFDC0984.JPG,1_AEP,Session_3,3/17/2021,2:03:52,TRUE,Session_3__2021-03-17__02-03-52(1).JPG,Didelphis_virginiana,1,n,
MFDC0985.JPG,1_AEP,Session_3,3/17/2021,2:03:52,TRUE,Session_3__2021-03-17__02-03-52(2).JPG,Didelphis_virginiana,1,n,
MFDC0986.JPG,1_AEP,Session_3,3/17/2021,2:03:53,TRUE,Session_3__2021-03-17__02-03-53(3).JPG,Didelphis_virginiana,1,n,
MFDC0987.JPG,1_AEP,Session_3,3/17/2021,3:01:54,TRUE,Session_3__2021-03-17__03-01-54(1).JPG,Didelphis_virginiana,1,n,
MFDC0988.JPG,1_AEP,Session_3,3/17/2021,3:01:54,TRUE,Session_3__2021-03-17__03-01-54(2).JPG,Didelphis_virginiana,1,n,
MFDC0989.JPG,1_AEP,Session_3,3/17/2021,3:01:54,TRUE,Session_3__2021-03-17__03-01-54(3).JPG,Didelphis_virginiana,1,n,
MFDC0996.JPG,1_AEP,Session_3,3/17/2021,19:40:45,TRUE,Session_3__2021-03-17__19-40-45(1).JPG,Odocoileus_virginianus,1,n,
MFDC0997.JPG,1_AEP,Session_3,3/17/2021,19:40:47,TRUE,Session_3__2021-03-17__19-40-47(3).JPG,Odocoileus_virginianus,1,n,
MFDC0998.JPG,1_AEP,Session_3,3/17/2021,19:40:46,TRUE,Session_3__2021-03-17__19-40-46(2).JPG,Odocoileus_virginianus,1,n,
MFDC0999.JPG,1_AEP,Session_3,3/17/2021,19:44:32,TRUE,Session_3__2021-03-17__19-44-32(1).JPG,Odocoileus_virginianus,1,n,
MFDC1000.JPG,1_AEP,Session_3,3/17/2021,19:44:32,TRUE,Session_3__2021-03-17__19-44-32(2).JPG,Odocoileus_virginianus,1,n,
MFDC1001.JPG,1_AEP,Session_3,3/17/2021,19:44:32,TRUE,Session_3__2021-03-17__19-44-32(3).JPG,Odocoileus_virginianus,1,n,
MFDC1005.JPG,1_AEP,Session_3,3/17/2021,20:51:17,TRUE,Session_3__2021-03-17__20-51-17(1).JPG,Procyon_lotor,1,n,
MFDC1006.JPG,1_AEP,Session_3,3/17/2021,20:51:17,TRUE,Session_3__2021-03-17__20-51-17(2).JPG,Procyon_lotor,1,n,
MFDC1007.JPG,1_AEP,Session_3,3/17/2021,20:51:18,TRUE,Session_3__2021-03-17__20-51-18(3).JPG,Procyon_lotor,1,n,
MFDC1008.JPG,1_AEP,Session_3,3/17/2021,20:52:49,TRUE,Session_3__2021-03-17__20-52-49(1).JPG,Procyon_lotor,1,n,
MFDC1009.JPG,1_AEP,Session_3,3/17/2021,20:52:51,TRUE,Session_3__2021-03-17__20-52-51(3).JPG,Procyon_lotor,1,n,
MFDC1010.JPG,1_AEP,Session_3,3/17/2021,20:52:50,TRUE,Session_3__2021-03-17__20-52-50(2).JPG,Procyon_lotor,1,n,
MFDC1011.JPG,1_AEP,Session_3,3/18/2021,3:21:01,TRUE,Session_3__2021-03-18__03-21-01(1).JPG,Didelphis_virginiana,1,n,
MFDC1012.JPG,1_AEP,Session_3,3/18/2021,3:21:03,TRUE,Session_3__2021-03-18__03-21-03(2).JPG,Didelphis_virginiana,1,n,
MFDC1013.JPG,1_AEP,Session_3,3/18/2021,3:21:03,TRUE,Session_3__2021-03-18__03-21-03(3).JPG,Didelphis_virginiana,1,n,
MFDC1014.JPG,1_AEP,Session_3,3/18/2021,19:08:40,TRUE,Session_3__2021-03-18__19-08-40(1).JPG,Odocoileus_virginianus,1,n,
MFDC1015.JPG,1_AEP,Session_3,3/18/2021,19:08:41,TRUE,Session_3__2021-03-18__19-08-41(2).JPG,Odocoileus_virginianus,1,n,
MFDC1016.JPG,1_AEP,Session_3,3/18/2021,19:08:41,TRUE,Session_3__2021-03-18__19-08-41(3).JPG,Odocoileus_virginianus,1,n,
MFDC1035.JPG,1_AEP,Session_3,3/19/2021,21:20:29,TRUE,Session_3__2021-03-19__21-20-29(1).JPG,Didelphis_virginiana,1,n,
MFDC1036.JPG,1_AEP,Session_3,3/19/2021,21:20:29,TRUE,Session_3__2021-03-19__21-20-29(2).JPG,Didelphis_virginiana,1,n,
MFDC1037.JPG,1_AEP,Session_3,3/19/2021,21:20:31,TRUE,Session_3__2021-03-19__21-20-31(3).JPG,Didelphis_virginiana,1,n,
MFDC1038.JPG,1_AEP,Session_3,3/19/2021,21:23:17,TRUE,Session_3__2021-03-19__21-23-17(1).JPG,Didelphis_virginiana,1,n,
MFDC1039.JPG,1_AEP,Session_3,3/19/2021,21:23:17,TRUE,Session_3__2021-03-19__21-23-17(2).JPG,Didelphis_virginiana,1,n,
MFDC1040.JPG,1_AEP,Session_3,3/19/2021,21:23:18,TRUE,Session_3__2021-03-19__21-23-18(3).JPG,Didelphis_virginiana,1,n,
MFDC1041.JPG,1_AEP,Session_3,3/19/2021,22:11:13,TRUE,Session_3__2021-03-19__22-11-13(1).JPG,NA,0,n,
MFDC1044.JPG,1_AEP,Session_3,3/20/2021,16:01:20,TRUE,Session_3__2021-03-20__16-01-20(1).JPG,Sciurus_sp,1,n,
MFDC1045.JPG,1_AEP,Session_3,3/20/2021,16:01:20,TRUE,Session_3__2021-03-20__16-01-20(2).JPG,Sciurus_sp,1,n,
MFDC1046.JPG,1_AEP,Session_3,3/20/2021,16:01:20,TRUE,Session_3__2021-03-20__16-01-20(3).JPG,Sciurus_sp,1,n,
MFDC1047.JPG,1_AEP,Session_3,3/20/2021,16:33:47,TRUE,Session_3__2021-03-20__16-33-47(1).JPG,Sciurus_sp,1,n,
MFDC1048.JPG,1_AEP,Session_3,3/20/2021,16:33:47,TRUE,Session_3__2021-03-20__16-33-47(2).JPG,Sciurus_sp,1,n,
MFDC1049.JPG,1_AEP,Session_3,3/20/2021,16:33:47,TRUE,Session_3__2021-03-20__16-33-47(3).JPG,Sciurus_sp,1,n,
MFDC1050.JPG,1_AEP,Session_3,3/20/2021,21:52:38,TRUE,Session_3__2021-03-20__21-52-38(1).JPG,Procyon_lotor,1,n,
MFDC1051.JPG,1_AEP,Session_3,3/20/2021,21:52:38,TRUE,Session_3__2021-03-20__21-52-38(2).JPG,Procyon_lotor,1,n,
MFDC1052.JPG,1_AEP,Session_3,3/20/2021,21:52:38,TRUE,Session_3__2021-03-20__21-52-38(3).JPG,Procyon_lotor,1,n,
MFDC1053.JPG,1_AEP,Session_3,3/20/2021,22:43:19,TRUE,Session_3__2021-03-20__22-43-19(2).JPG,Didelphis_virginiana,1,n,
MFDC1054.JPG,1_AEP,Session_3,3/20/2021,22:43:18,TRUE,Session_3__2021-03-20__22-43-18(1).JPG,Didelphis_virginiana,1,n,
MFDC1055.JPG,1_AEP,Session_3,3/20/2021,22:43:20,TRUE,Session_3__2021-03-20__22-43-20(3).JPG,Didelphis_virginiana,1,n,
MFDC1059.JPG,1_AEP,Session_3,3/21/2021,16:07:15,TRUE,Session_3__2021-03-21__16-07-15(1).JPG,Meleagris_gallopavo,1,n,
MFDC1060.JPG,1_AEP,Session_3,3/21/2021,16:07:16,TRUE,Session_3__2021-03-21__16-07-16(2).JPG,Meleagris_gallopavo,1,n,
MFDC1061.JPG,1_AEP,Session_3,3/21/2021,16:07:16,TRUE,Session_3__2021-03-21__16-07-16(3).JPG,Meleagris_gallopavo,1,n,
MFDC1062.JPG,1_AEP,Session_3,3/21/2021,21:32:58,TRUE,Session_3__2021-03-21__21-32-58(1).JPG,Didelphis_virginiana,1,n,
MFDC1063.JPG,1_AEP,Session_3,3/21/2021,21:32:59,TRUE,Session_3__2021-03-21__21-32-59(3).JPG,Didelphis_virginiana,1,n,
MFDC1064.JPG,1_AEP,Session_3,3/21/2021,21:32:58,TRUE,Session_3__2021-03-21__21-32-58(2).JPG,Didelphis_virginiana,1,n,
MFDC1068.JPG,1_AEP,Session_3,3/21/2021,22:57:00,TRUE,Session_3__2021-03-21__22-57-00(1).JPG,NA,0,n,
MFDC1069.JPG,1_AEP,Session_3,3/21/2021,22:57:00,TRUE,Session_3__2021-03-21__22-57-00(2).JPG,NA,0,n,
MFDC1074.JPG,1_AEP,Session_3,3/21/2021,23:53:47,TRUE,Session_3__2021-03-21__23-53-47(1).JPG,Procyon_lotor,1,n,
MFDC1075.JPG,1_AEP,Session_3,3/21/2021,23:53:47,TRUE,Session_3__2021-03-21__23-53-47(2).JPG,Procyon_lotor,1,n,
MFDC1076.JPG,1_AEP,Session_3,3/21/2021,23:53:48,TRUE,Session_3__2021-03-21__23-53-48(3).JPG,Procyon_lotor,1,n,
MFDC1080.JPG,1_AEP,Session_3,3/22/2021,16:29:25,TRUE,Session_3__2021-03-22__16-29-25(1).JPG,Odocoileus_virginianus,1,n,
MFDC1081.JPG,1_AEP,Session_3,3/22/2021,16:29:25,TRUE,Session_3__2021-03-22__16-29-25(2).JPG,Odocoileus_virginianus,1,n,
MFDC1082.JPG,1_AEP,Session_3,3/22/2021,16:29:25,TRUE,Session_3__2021-03-22__16-29-25(3).JPG,Odocoileus_virginianus,1,n,
MFDC1086.JPG,1_AEP,Session_3,3/22/2021,20:14:22,TRUE,Session_3__2021-03-22__20-14-22(1).JPG,Owl_sp,1,n,
MFDC1087.JPG,1_AEP,Session_3,3/22/2021,20:14:22,TRUE,Session_3__2021-03-22__20-14-22(2).JPG,Owl_sp,1,n,
MFDC1088.JPG,1_AEP,Session_3,3/22/2021,20:14:23,TRUE,Session_3__2021-03-22__20-14-23(3).JPG,Owl_sp,1,n,
MFDC1104.JPG,1_AEP,Session_3,3/23/2021,3:02:16,TRUE,Session_3__2021-03-23__03-02-16(1).JPG,Didelphis_virginiana,1,n,
MFDC1105.JPG,1_AEP,Session_3,3/23/2021,3:02:16,TRUE,Session_3__2021-03-23__03-02-16(2).JPG,Didelphis_virginiana,1,n,
MFDC1106.JPG,1_AEP,Session_3,3/23/2021,3:02:17,TRUE,Session_3__2021-03-23__03-02-17(3).JPG,Didelphis_virginiana,1,n,
MFDC1107.JPG,1_AEP,Session_3,3/23/2021,5:48:33,TRUE,Session_3__2021-03-23__05-48-33(1).JPG,Procyon_lotor,1,n,
MFDC1108.JPG,1_AEP,Session_3,3/23/2021,5:48:33,TRUE,Session_3__2021-03-23__05-48-33(2).JPG,Procyon_lotor,1,n,
MFDC1109.JPG,1_AEP,Session_3,3/23/2021,5:48:33,TRUE,Session_3__2021-03-23__05-48-33(3).JPG,Procyon_lotor,1,n,
MFDC1110.JPG,1_AEP,Session_3,3/23/2021,20:32:06,TRUE,Session_3__2021-03-23__20-32-06(1).JPG,Didelphis_virginiana,1,n,
MFDC1111.JPG,1_AEP,Session_3,3/23/2021,20:32:06,TRUE,Session_3__2021-03-23__20-32-06(2).JPG,Didelphis_virginiana,1,n,
MFDC1112.JPG,1_AEP,Session_3,3/23/2021,20:32:06,TRUE,Session_3__2021-03-23__20-32-06(3).JPG,Didelphis_virginiana,1,n,
MFDC1113.JPG,1_AEP,Session_3,3/23/2021,20:32:40,TRUE,Session_3__2021-03-23__20-32-40(4).JPG,Didelphis_virginiana,1,n,
MFDC1114.JPG,1_AEP,Session_3,3/23/2021,20:32:40,TRUE,Session_3__2021-03-23__20-32-40(5).JPG,Didelphis_virginiana,1,n,
MFDC1115.JPG,1_AEP,Session_3,3/23/2021,20:32:42,TRUE,Session_3__2021-03-23__20-32-42(6).JPG,Didelphis_virginiana,1,n,
MFDC1116.JPG,1_AEP,Session_3,3/23/2021,21:22:08,TRUE,Session_3__2021-03-23__21-22-08(1).JPG,Didelphis_virginiana,1,n,
MFDC1117.JPG,1_AEP,Session_3,3/23/2021,21:22:08,TRUE,Session_3__2021-03-23__21-22-08(2).JPG,Didelphis_virginiana,1,n,
MFDC1118.JPG,1_AEP,Session_3,3/23/2021,21:22:09,TRUE,Session_3__2021-03-23__21-22-09(3).JPG,Didelphis_virginiana,1,n,
MFDC1119.JPG,1_AEP,Session_3,3/23/2021,21:58:10,TRUE,Session_3__2021-03-23__21-58-10(1).JPG,Didelphis_virginiana,1,n,
MFDC1120.JPG,1_AEP,Session_3,3/23/2021,21:58:10,TRUE,Session_3__2021-03-23__21-58-10(2).JPG,Didelphis_virginiana,1,n,
MFDC1121.JPG,1_AEP,Session_3,3/23/2021,21:58:10,TRUE,Session_3__2021-03-23__21-58-10(3).JPG,Didelphis_virginiana,1,n,
MFDC1125.JPG,1_AEP,Session_3,3/24/2021,18:54:52,TRUE,Session_3__2021-03-24__18-54-52(1).JPG,Sciurus_sp,1,n,
MFDC1126.JPG,1_AEP,Session_3,3/24/2021,18:54:52,TRUE,Session_3__2021-03-24__18-54-52(2).JPG,Sciurus_sp,1,n,
MFDC1127.JPG,1_AEP,Session_3,3/24/2021,18:54:52,TRUE,Session_3__2021-03-24__18-54-52(3).JPG,Sciurus_sp,1,n,
MFDC1131.JPG,1_AEP,Session_3,3/25/2021,4:07:23,TRUE,Session_3__2021-03-25__04-07-23(1).JPG,Didelphis_virginiana,1,n,
MFDC1132.JPG,1_AEP,Session_3,3/25/2021,4:07:23,TRUE,Session_3__2021-03-25__04-07-23(2).JPG,Didelphis_virginiana,1,n,
MFDC1133.JPG,1_AEP,Session_3,3/25/2021,4:07:23,TRUE,Session_3__2021-03-25__04-07-23(3).JPG,Didelphis_virginiana,1,n,
MFDC1135.JPG,1_AEP,Session_3,3/25/2021,5:27:38,TRUE,Session_3__2021-03-25__05-27-38(1).JPG,NA,0,n,
MFDC1137.JPG,1_AEP,Session_3,3/25/2021,22:18:30,TRUE,Session_3__2021-03-25__22-18-30(1).JPG,Didelphis_virginiana,1,n,
MFDC1138.JPG,1_AEP,Session_3,3/25/2021,22:18:30,TRUE,Session_3__2021-03-25__22-18-30(2).JPG,Didelphis_virginiana,1,n,
MFDC1139.JPG,1_AEP,Session_3,3/25/2021,22:18:31,TRUE,Session_3__2021-03-25__22-18-31(3).JPG,Didelphis_virginiana,1,n,
MFDC1140.JPG,1_AEP,Session_3,3/26/2021,21:43:28,TRUE,Session_3__2021-03-26__21-43-28(1).JPG,Didelphis_virginiana,1,n,
MFDC1141.JPG,1_AEP,Session_3,3/26/2021,21:43:29,TRUE,Session_3__2021-03-26__21-43-29(2).JPG,Didelphis_virginiana,1,n,
MFDC1142.JPG,1_AEP,Session_3,3/26/2021,21:43:29,TRUE,Session_3__2021-03-26__21-43-29(3).JPG,Didelphis_virginiana,1,n,
MFDC1149.JPG,1_AEP,Session_3,3/27/2021,3:37:10,TRUE,Session_3__2021-03-27__03-37-10(1).JPG,Didelphis_virginiana,1,n,
MFDC1150.JPG,1_AEP,Session_3,3/27/2021,3:37:10,TRUE,Session_3__2021-03-27__03-37-10(2).JPG,Didelphis_virginiana,1,n,
MFDC1151.JPG,1_AEP,Session_3,3/27/2021,3:37:11,TRUE,Session_3__2021-03-27__03-37-11(3).JPG,Didelphis_virginiana,1,n,
MFDC1152.JPG,1_AEP,Session_3,3/27/2021,6:03:58,TRUE,Session_3__2021-03-27__06-03-58(1).JPG,Procyon_lotor,1,n,
MFDC1153.JPG,1_AEP,Session_3,3/27/2021,6:03:58,TRUE,Session_3__2021-03-27__06-03-58(2).JPG,Procyon_lotor,1,n,
MFDC1154.JPG,1_AEP,Session_3,3/27/2021,6:03:59,TRUE,Session_3__2021-03-27__06-03-59(3).JPG,Procyon_lotor,1,n,
MFDC1158.JPG,1_AEP,Session_3,3/27/2021,8:58:12,TRUE,Session_3__2021-03-27__08-58-12(1).JPG,Sciurus_sp,1,n,
MFDC1163.JPG,1_AEP,Session_3,3/27/2021,19:43:48,TRUE,Session_3__2021-03-27__19-43-48(1).JPG,Sciurus_sp,1,n,
MFDC1167.JPG,1_AEP,Session_3,3/28/2021,6:15:51,TRUE,Session_3__2021-03-28__06-15-51(1).JPG,Unid,1,n,
MFDC1168.JPG,1_AEP,Session_3,3/28/2021,6:15:51,TRUE,Session_3__2021-03-28__06-15-51(2).JPG,Unid,1,n,
MFDC1170.JPG,1_AEP,Session_3,3/28/2021,10:56:47,TRUE,Session_3__2021-03-28__10-56-47(1).JPG,Didelphis_virginiana,1,n,
MFDC1171.JPG,1_AEP,Session_3,3/28/2021,10:56:48,TRUE,Session_3__2021-03-28__10-56-48(2).JPG,Didelphis_virginiana,1,n,
MFDC1172.JPG,1_AEP,Session_3,3/28/2021,10:56:48,TRUE,Session_3__2021-03-28__10-56-48(3).JPG,Didelphis_virginiana,1,n,
MFDC1209.JPG,1_AEP,Session_3,3/28/2021,22:06:14,TRUE,Session_3__2021-03-28__22-06-14(1).JPG,Didelphis_virginiana,1,n,
MFDC1210.JPG,1_AEP,Session_3,3/28/2021,22:06:14,TRUE,Session_3__2021-03-28__22-06-14(2).JPG,Didelphis_virginiana,1,n,
MFDC1211.JPG,1_AEP,Session_3,3/28/2021,22:06:14,TRUE,Session_3__2021-03-28__22-06-14(3).JPG,NA,0,n,
MFDC1212.JPG,1_AEP,Session_3,3/28/2021,23:56:09,TRUE,Session_3__2021-03-28__23-56-09(2).JPG,Didelphis_virginiana,1,n,
MFDC1213.JPG,1_AEP,Session_3,3/28/2021,23:56:08,TRUE,Session_3__2021-03-28__23-56-08(1).JPG,Didelphis_virginiana,1,n,
MFDC1214.JPG,1_AEP,Session_3,3/28/2021,23:56:10,TRUE,Session_3__2021-03-28__23-56-10(3).JPG,Didelphis_virginiana,1,n,
MFDC1243.JPG,1_AEP,Session_3,3/30/2021,15:00:06,TRUE,Session_3__2021-03-30__15-00-06(1).JPG,NA,0,n,
MFDC1245.JPG,1_AEP,Session_3,3/30/2021,21:15:52,TRUE,Session_3__2021-03-30__21-15-52(1).JPG,Didelphis_virginiana,1,n,
MFDC1246.JPG,1_AEP,Session_3,3/30/2021,21:15:52,TRUE,Session_3__2021-03-30__21-15-52(2).JPG,Didelphis_virginiana,1,n,
MFDC1247.JPG,1_AEP,Session_3,3/30/2021,21:15:53,TRUE,Session_3__2021-03-30__21-15-53(3).JPG,Didelphis_virginiana,1,n,
MFDC1257.JPG,1_AEP,Session_3,3/31/2021,7:37:58,TRUE,Session_3__2021-03-31__07-37-58(1).JPG,Sciurus_sp,1,n,
MFDC1258.JPG,1_AEP,Session_3,3/31/2021,7:37:58,TRUE,Session_3__2021-03-31__07-37-58(2).JPG,Sciurus_sp,1,n,
MFDC1259.JPG,1_AEP,Session_3,3/31/2021,7:37:58,TRUE,Session_3__2021-03-31__07-37-58(3).JPG,Sciurus_sp,1,n,
MFDC1260.JPG,1_AEP,Session_3,3/31/2021,7:48:07,TRUE,Session_3__2021-03-31__07-48-07(1).JPG,NA,0,n,
MFDC1261.JPG,1_AEP,Session_3,3/31/2021,7:48:07,TRUE,Session_3__2021-03-31__07-48-07(2).JPG,NA,0,n,
MFDC1262.JPG,1_AEP,Session_3,3/31/2021,7:48:07,TRUE,Session_3__2021-03-31__07-48-07(3).JPG,NA,0,n,
MFDC1263.JPG,1_AEP,Session_3,3/31/2021,8:17:46,TRUE,Session_3__2021-03-31__08-17-46(3).JPG,Sciurus_sp,1,n,
MFDC1264.JPG,1_AEP,Session_3,3/31/2021,8:17:45,TRUE,Session_3__2021-03-31__08-17-45(1).JPG,Sciurus_sp,1,n,
MFDC1265.JPG,1_AEP,Session_3,3/31/2021,8:17:45,TRUE,Session_3__2021-03-31__08-17-45(2).JPG,Sciurus_sp,1,n,
MFDC1266.JPG,1_AEP,Session_3,3/31/2021,20:47:38,TRUE,Session_3__2021-03-31__20-47-38(2).JPG,Owl_sp,1,n,
MFDC1267.JPG,1_AEP,Session_3,3/31/2021,20:47:37,TRUE,Session_3__2021-03-31__20-47-37(1).JPG,Owl_sp,1,n,
MFDC1268.JPG,1_AEP,Session_3,3/31/2021,20:47:38,TRUE,Session_3__2021-03-31__20-47-38(3).JPG,Owl_sp,1,n,
MFDC1278.JPG,1_AEP,Session_3,4/3/2021,7:04:37,TRUE,Session_3__2021-04-03__07-04-37(1).JPG,Odocoileus_virginianus,2,n,
MFDC1279.JPG,1_AEP,Session_3,4/3/2021,7:04:37,TRUE,Session_3__2021-04-03__07-04-37(2).JPG,Odocoileus_virginianus,2,n,
MFDC1280.JPG,1_AEP,Session_3,4/3/2021,7:04:38,TRUE,Session_3__2021-04-03__07-04-38(3).JPG,Odocoileus_virginianus,2,n,
MFDC1281.JPG,1_AEP,Session_3,4/3/2021,7:06:23,TRUE,Session_3__2021-04-03__07-06-23(1).JPG,Odocoileus_virginianus,1,n,
MFDC1282.JPG,1_AEP,Session_3,4/3/2021,7:06:24,TRUE,Session_3__2021-04-03__07-06-24(2).JPG,Odocoileus_virginianus,1,n,
MFDC1287.JPG,1_AEP,Session_3,4/3/2021,22:29:05,TRUE,Session_3__2021-04-03__22-29-05(2).JPG,Didelphis_virginiana,1,n,
MFDC1288.JPG,1_AEP,Session_3,4/3/2021,22:29:04,TRUE,Session_3__2021-04-03__22-29-04(1).JPG,Didelphis_virginiana,1,n,
MFDC1289.JPG,1_AEP,Session_3,4/3/2021,22:29:05,TRUE,Session_3__2021-04-03__22-29-05(3).JPG,Didelphis_virginiana,1,n,
MFDC1290.JPG,1_AEP,Session_3,4/3/2021,22:43:03,TRUE,Session_3__2021-04-03__22-43-03(1).JPG,Didelphis_virginiana,1,n,
MFDC1291.JPG,1_AEP,Session_3,4/3/2021,22:43:04,TRUE,Session_3__2021-04-03__22-43-04(3).JPG,Didelphis_virginiana,1,n,
MFDC1292.JPG,1_AEP,Session_3,4/3/2021,22:43:03,TRUE,Session_3__2021-04-03__22-43-03(2).JPG,Didelphis_virginiana,1,n,
MFDC1296.JPG,1_AEP,Session_3,4/4/2021,7:24:38,TRUE,Session_3__2021-04-04__07-24-38(3).JPG,Sciurus_sp,1,n,
MFDC1297.JPG,1_AEP,Session_3,4/4/2021,7:24:37,TRUE,Session_3__2021-04-04__07-24-37(1).JPG,Sciurus_sp,1,n,
MFDC1298.JPG,1_AEP,Session_3,4/4/2021,7:24:37,TRUE,Session_3__2021-04-04__07-24-37(2).JPG,Sciurus_sp,1,n,
MFDC1302.JPG,1_AEP,Session_3,4/5/2021,1:15:31,TRUE,Session_3__2021-04-05__01-15-31(1).JPG,Procyon_lotor,1,n,
MFDC1303.JPG,1_AEP,Session_3,4/5/2021,1:15:31,TRUE,Session_3__2021-04-05__01-15-31(2).JPG,Procyon_lotor,1,n,
MFDC1304.JPG,1_AEP,Session_3,4/5/2021,1:15:31,TRUE,Session_3__2021-04-05__01-15-31(3).JPG,Procyon_lotor,1,n,
MFDC1308.JPG,1_AEP,Session_3,4/5/2021,20:15:26,TRUE,Session_3__2021-04-05__20-15-26(1).JPG,Unid,1,n,
MFDC1309.JPG,1_AEP,Session_3,4/5/2021,20:15:26,TRUE,Session_3__2021-04-05__20-15-26(2).JPG,Unid,1,n,
MFDC1310.JPG,1_AEP,Session_3,4/5/2021,20:15:27,TRUE,Session_3__2021-04-05__20-15-27(3).JPG,Unid,1,n,
MFDC1314.JPG,1_AEP,Session_3,4/5/2021,22:47:45,TRUE,Session_3__2021-04-05__22-47-45(1).JPG,Didelphis_virginiana,1,n,
MFDC1315.JPG,1_AEP,Session_3,4/5/2021,22:47:45,TRUE,Session_3__2021-04-05__22-47-45(2).JPG,Didelphis_virginiana,1,n,
MFDC1316.JPG,1_AEP,Session_3,4/5/2021,22:47:46,TRUE,Session_3__2021-04-05__22-47-46(3).JPG,Didelphis_virginiana,1,n,
MFDC1323.JPG,1_AEP,Session_3,4/6/2021,0:58:45,TRUE,Session_3__2021-04-06__00-58-45(1).JPG,Owl_sp,1,n,
MFDC1324.JPG,1_AEP,Session_3,4/6/2021,0:58:45,TRUE,Session_3__2021-04-06__00-58-45(2).JPG,Owl_sp,1,n,
MFDC1325.JPG,1_AEP,Session_3,4/6/2021,0:58:45,TRUE,Session_3__2021-04-06__00-58-45(3).JPG,Owl_sp,1,n,
MFDC1326.JPG,1_AEP,Session_3,4/6/2021,17:40:15,TRUE,Session_3__2021-04-06__17-40-15(1).JPG,Odocoileus_virginianus,1,n,
MFDC1327.JPG,1_AEP,Session_3,4/6/2021,17:40:16,TRUE,Session_3__2021-04-06__17-40-16(2).JPG,Odocoileus_virginianus,1,n,
MFDC1328.JPG,1_AEP,Session_3,4/6/2021,17:40:16,TRUE,Session_3__2021-04-06__17-40-16(3).JPG,Odocoileus_virginianus,1,n,
MFDC1329.JPG,1_AEP,Session_3,4/6/2021,17:40:58,TRUE,Session_3__2021-04-06__17-40-58(6).JPG,Odocoileus_virginianus,1,n,
MFDC1330.JPG,1_AEP,Session_3,4/6/2021,17:40:57,TRUE,Session_3__2021-04-06__17-40-57(4).JPG,Odocoileus_virginianus,1,n,
MFDC1331.JPG,1_AEP,Session_3,4/6/2021,17:40:57,TRUE,Session_3__2021-04-06__17-40-57(5).JPG,Odocoileus_virginianus,1,n,
MFDC1335.JPG,1_AEP,Session_3,4/7/2021,8:24:52,TRUE,Session_3__2021-04-07__08-24-52(1).JPG,Sciurus_sp,1,n,
MFDC1336.JPG,1_AEP,Session_3,4/7/2021,8:24:54,TRUE,Session_3__2021-04-07__08-24-54(3).JPG,Sciurus_sp,1,n,
MFDC1337.JPG,1_AEP,Session_3,4/7/2021,8:24:53,TRUE,Session_3__2021-04-07__08-24-53(2).JPG,Sciurus_sp,1,n,
MFDC1344.JPG,1_AEP,Session_3,4/8/2021,7:34:30,TRUE,Session_3__2021-04-08__07-34-30(1).JPG,Sciurus_sp,1,n,
MFDC1345.JPG,1_AEP,Session_3,4/8/2021,7:34:31,TRUE,Session_3__2021-04-08__07-34-31(2).JPG,Sciurus_sp,1,n,
MFDC1346.JPG,1_AEP,Session_3,4/8/2021,7:34:31,TRUE,Session_3__2021-04-08__07-34-31(3).JPG,Sciurus_sp,1,n,
MFDC1347.JPG,1_AEP,Session_3,4/8/2021,7:45:45,TRUE,Session_3__2021-04-08__07-45-45(1).JPG,Odocoileus_virginianus,1,n,
MFDC1348.JPG,1_AEP,Session_3,4/8/2021,7:45:45,TRUE,Session_3__2021-04-08__07-45-45(2).JPG,Odocoileus_virginianus,1,n,
MFDC1349.JPG,1_AEP,Session_3,4/8/2021,7:45:47,TRUE,Session_3__2021-04-08__07-45-47(3).JPG,Odocoileus_virginianus,1,n,
MFDC1350.JPG,1_AEP,Session_3,4/8/2021,7:46:16,TRUE,Session_3__2021-04-08__07-46-16(1).JPG,Odocoileus_virginianus,1,n,
MFDC1351.JPG,1_AEP,Session_3,4/8/2021,7:46:16,TRUE,Session_3__2021-04-08__07-46-16(2).JPG,Odocoileus_virginianus,1,n,
MFDC1352.JPG,1_AEP,Session_3,4/8/2021,7:46:17,TRUE,Session_3__2021-04-08__07-46-17(3).JPG,Odocoileus_virginianus,1,n,
MFDC1362.JPG,1_AEP,Session_3,4/8/2021,21:52:56,TRUE,Session_3__2021-04-08__21-52-56(1).JPG,Didelphis_virginiana,1,n,
MFDC1363.JPG,1_AEP,Session_3,4/8/2021,21:52:56,TRUE,Session_3__2021-04-08__21-52-56(2).JPG,Didelphis_virginiana,1,n,
MFDC1364.JPG,1_AEP,Session_3,4/8/2021,21:52:56,TRUE,Session_3__2021-04-08__21-52-56(3).JPG,Didelphis_virginiana,1,n,
MFDC1368.JPG,1_AEP,Session_3,4/9/2021,20:26:28,TRUE,Session_3__2021-04-09__20-26-28(1).JPG,Owl_sp,1,n,
MFDC1369.JPG,1_AEP,Session_3,4/9/2021,20:26:28,TRUE,Session_3__2021-04-09__20-26-28(2).JPG,Owl_sp,1,n,
MFDC1370.JPG,1_AEP,Session_3,4/9/2021,20:26:28,TRUE,Session_3__2021-04-09__20-26-28(3).JPG,Owl_sp,1,n,
MFDC1380.JPG,1_AEP,Session_3,4/11/2021,13:26:42,TRUE,Session_3__2021-04-11__13-26-42(1).JPG,Homo_sapiens,1,n,
MFDC1381.JPG,1_AEP,Session_3,4/11/2021,13:26:42,TRUE,Session_3__2021-04-11__13-26-42(2).JPG,Homo_sapiens,1,n,
MFDC1382.JPG,1_AEP,Session_3,4/11/2021,13:26:42,TRUE,Session_3__2021-04-11__13-26-42(3).JPG,Homo_sapiens,1,n,
MFDC1383.JPG,1_AEP,Session_3,4/11/2021,13:27:12,TRUE,Session_3__2021-04-11__13-27-12(1).JPG,Homo_sapiens,2,n,
MFDC1386.JPG,1_AEP,Session_4,4/11/2021,13:29:48,TRUE,Session_4__2021-04-11__13-29-48(1).JPG,Canis_familiaris,1,n,
MFDC1387.JPG,1_AEP,Session_4,4/11/2021,13:29:49,TRUE,Session_4__2021-04-11__13-29-49(3).JPG,Canis_familiaris,1,n,
MFDC1388.JPG,1_AEP,Session_4,4/11/2021,13:29:48,TRUE,Session_4__2021-04-11__13-29-48(2).JPG,Canis_familiaris,1,n,
MFDC1389.JPG,1_AEP,Session_4,4/11/2021,20:24:52,TRUE,Session_4__2021-04-11__20-24-52(1).JPG,Owl_sp,1,n,
MFDC1390.JPG,1_AEP,Session_4,4/11/2021,20:24:52,TRUE,Session_4__2021-04-11__20-24-52(2).JPG,Owl_sp,1,n,
MFDC1391.JPG,1_AEP,Session_4,4/11/2021,20:24:52,TRUE,Session_4__2021-04-11__20-24-52(3).JPG,Owl_sp,1,n,
MFDC1392.JPG,1_AEP,Session_4,4/11/2021,21:37:18,TRUE,Session_4__2021-04-11__21-37-18(1).JPG,Didelphis_virginiana,1,n,
MFDC1393.JPG,1_AEP,Session_4,4/11/2021,21:37:18,TRUE,Session_4__2021-04-11__21-37-18(2).JPG,Didelphis_virginiana,1,n,
MFDC1394.JPG,1_AEP,Session_4,4/11/2021,21:37:19,TRUE,Session_4__2021-04-11__21-37-19(3).JPG,Didelphis_virginiana,1,n,
MFDC1395.JPG,1_AEP,Session_4,4/12/2021,4:46:14,TRUE,Session_4__2021-04-12__04-46-14(1).JPG,NA,0,n,
MFDC1396.JPG,1_AEP,Session_4,4/12/2021,4:46:14,TRUE,Session_4__2021-04-12__04-46-14(2).JPG,NA,0,n,
MFDC1397.JPG,1_AEP,Session_4,4/12/2021,4:46:14,TRUE,Session_4__2021-04-12__04-46-14(3).JPG,NA,0,n,
MFDC1398.JPG,1_AEP,Session_4,4/12/2021,6:33:08,TRUE,Session_4__2021-04-12__06-33-08(1).JPG,Owl_sp,1,n,
MFDC1399.JPG,1_AEP,Session_4,4/12/2021,6:33:08,TRUE,Session_4__2021-04-12__06-33-08(2).JPG,Owl_sp,1,n,
MFDC1400.JPG,1_AEP,Session_4,4/12/2021,6:33:08,TRUE,Session_4__2021-04-12__06-33-08(3).JPG,Owl_sp,1,n,
MFDC1404.JPG,1_AEP,Session_4,4/12/2021,7:30:03,TRUE,Session_4__2021-04-12__07-30-03(1).JPG,Odocoileus_virginianus,1,n,
MFDC1405.JPG,1_AEP,Session_4,4/12/2021,7:30:03,TRUE,Session_4__2021-04-12__07-30-03(2).JPG,Odocoileus_virginianus,1,n,
MFDC1406.JPG,1_AEP,Session_4,4/12/2021,7:30:04,TRUE,Session_4__2021-04-12__07-30-04(3).JPG,Odocoileus_virginianus,1,n,
MFDC1407.JPG,1_AEP,Session_4,4/12/2021,7:30:33,TRUE,Session_4__2021-04-12__07-30-33(4).JPG,Odocoileus_virginianus,2,n,
MFDC1408.JPG,1_AEP,Session_4,4/12/2021,7:30:33,TRUE,Session_4__2021-04-12__07-30-33(5).JPG,Odocoileus_virginianus,2,n,
MFDC1409.JPG,1_AEP,Session_4,4/12/2021,7:30:33,TRUE,Session_4__2021-04-12__07-30-33(6).JPG,Odocoileus_virginianus,2,n,
MFDC1413.JPG,1_AEP,Session_4,4/12/2021,7:32:18,TRUE,Session_4__2021-04-12__07-32-18(1).JPG,Odocoileus_virginianus,1,n,
MFDC1414.JPG,1_AEP,Session_4,4/12/2021,7:32:18,TRUE,Session_4__2021-04-12__07-32-18(2).JPG,Odocoileus_virginianus,1,n,
MFDC1415.JPG,1_AEP,Session_4,4/12/2021,7:32:18,TRUE,Session_4__2021-04-12__07-32-18(3).JPG,Odocoileus_virginianus,1,n,
MFDC1416.JPG,1_AEP,Session_4,4/12/2021,7:32:48,TRUE,Session_4__2021-04-12__07-32-48(4).JPG,Odocoileus_virginianus,1,n,
MFDC1417.JPG,1_AEP,Session_4,4/12/2021,7:32:48,TRUE,Session_4__2021-04-12__07-32-48(5).JPG,Odocoileus_virginianus,1,n,
MFDC1418.JPG,1_AEP,Session_4,4/12/2021,7:32:49,TRUE,Session_4__2021-04-12__07-32-49(6).JPG,Odocoileus_virginianus,1,n,
MFDC1419.JPG,1_AEP,Session_4,4/12/2021,7:33:19,TRUE,Session_4__2021-04-12__07-33-19(1).JPG,Odocoileus_virginianus,1,n,
MFDC1420.JPG,1_AEP,Session_4,4/12/2021,7:33:19,TRUE,Session_4__2021-04-12__07-33-19(2).JPG,Odocoileus_virginianus,1,n,
MFDC1421.JPG,1_AEP,Session_4,4/12/2021,7:33:20,TRUE,Session_4__2021-04-12__07-33-20(3).JPG,Odocoileus_virginianus,1,n,
MFDC1425.JPG,1_AEP,Session_4,4/12/2021,20:31:23,TRUE,Session_4__2021-04-12__20-31-23(1).JPG,Owl_sp,1,n,
MFDC1426.JPG,1_AEP,Session_4,4/12/2021,20:31:24,TRUE,Session_4__2021-04-12__20-31-24(2).JPG,Owl_sp,1,n,
MFDC1427.JPG,1_AEP,Session_4,4/12/2021,20:31:24,TRUE,Session_4__2021-04-12__20-31-24(3).JPG,Owl_sp,1,n,
MFDC1434.JPG,1_AEP,Session_4,4/13/2021,3:41:46,TRUE,Session_4__2021-04-13__03-41-46(1).JPG,Didelphis_virginiana,1,n,
MFDC1435.JPG,1_AEP,Session_4,4/13/2021,3:41:46,TRUE,Session_4__2021-04-13__03-41-46(2).JPG,Didelphis_virginiana,1,n,
MFDC1436.JPG,1_AEP,Session_4,4/13/2021,3:41:46,TRUE,Session_4__2021-04-13__03-41-46(3).JPG,Didelphis_virginiana,1,n,
MFDC1437.JPG,1_AEP,Session_4,4/13/2021,3:42:51,TRUE,Session_4__2021-04-13__03-42-51(1).JPG,Didelphis_virginiana,1,n,
MFDC1438.JPG,1_AEP,Session_4,4/13/2021,3:42:53,TRUE,Session_4__2021-04-13__03-42-53(3).JPG,Didelphis_virginiana,1,n,
MFDC1439.JPG,1_AEP,Session_4,4/13/2021,3:42:52,TRUE,Session_4__2021-04-13__03-42-52(2).JPG,Didelphis_virginiana,1,n,
MFDC1443.JPG,1_AEP,Session_4,4/13/2021,20:32:28,TRUE,Session_4__2021-04-13__20-32-28(1).JPG,NA,0,n,
MFDC1444.JPG,1_AEP,Session_4,4/13/2021,20:32:28,TRUE,Session_4__2021-04-13__20-32-28(2).JPG,NA,0,n,
MFDC1445.JPG,1_AEP,Session_4,4/13/2021,20:32:29,TRUE,Session_4__2021-04-13__20-32-29(3).JPG,NA,0,n,
MFDC1446.JPG,1_AEP,Session_4,4/14/2021,1:51:29,TRUE,Session_4__2021-04-14__01-51-29(1).JPG,Didelphis_virginiana,1,n,
MFDC1447.JPG,1_AEP,Session_4,4/14/2021,1:51:29,TRUE,Session_4__2021-04-14__01-51-29(2).JPG,Didelphis_virginiana,1,n,
MFDC1448.JPG,1_AEP,Session_4,4/14/2021,1:51:29,TRUE,Session_4__2021-04-14__01-51-29(3).JPG,Didelphis_virginiana,1,n,
MFDC1452.JPG,1_AEP,Session_4,4/16/2021,1:34:58,TRUE,Session_4__2021-04-16__01-34-58(1).JPG,Didelphis_virginiana,1,n,
MFDC1453.JPG,1_AEP,Session_4,4/16/2021,1:34:58,TRUE,Session_4__2021-04-16__01-34-58(2).JPG,Didelphis_virginiana,1,n,
MFDC1454.JPG,1_AEP,Session_4,4/16/2021,1:34:58,TRUE,Session_4__2021-04-16__01-34-58(3).JPG,Didelphis_virginiana,1,n,
MFDC1491.JPG,1_AEP,Session_4,4/24/2021,15:29:54,TRUE,Session_4__2021-04-24__15-29-54(3).JPG,Homo_sapiens,1,n,
MFDC1492.JPG,1_AEP,Session_4,4/24/2021,15:29:53,TRUE,Session_4__2021-04-24__15-29-53(1).JPG,Homo_sapiens,1,n,
MFDC1493.JPG,1_AEP,Session_4,4/24/2021,15:29:53,TRUE,Session_4__2021-04-24__15-29-53(2).JPG,Homo_sapiens,1,n,
MFDC1494.JPG,1_AEP,Session_4,4/24/2021,21:57:46,TRUE,Session_4__2021-04-24__21-57-46(1).JPG,Didelphis_virginiana,1,n,
MFDC1495.JPG,1_AEP,Session_4,4/24/2021,21:57:47,TRUE,Session_4__2021-04-24__21-57-47(2).JPG,Didelphis_virginiana,1,n,
MFDC1496.JPG,1_AEP,Session_4,4/24/2021,21:57:48,TRUE,Session_4__2021-04-24__21-57-48(3).JPG,Didelphis_virginiana,1,n,
MFDC1497.JPG,1_AEP,Session_4,4/25/2021,2:45:43,TRUE,Session_4__2021-04-25__02-45-43(1).JPG,Sylvilagus_floridanus,1,n,
MFDC1498.JPG,1_AEP,Session_4,4/25/2021,2:45:43,TRUE,Session_4__2021-04-25__02-45-43(2).JPG,NA,0,n,
MFDC1499.JPG,1_AEP,Session_4,4/25/2021,2:45:44,TRUE,Session_4__2021-04-25__02-45-44(3).JPG,NA,0,n,
MFDC1500.JPG,1_AEP,Session_4,4/25/2021,8:51:08,TRUE,Session_4__2021-04-25__08-51-08(1).JPG,Homo_sapiens,1,n,
MFDC1506.JPG,1_AEP,Session_4,4/25/2021,17:12:10,TRUE,Session_4__2021-04-25__17-12-10(1).JPG,Homo_sapiens,1,n,
MFDC1507.JPG,1_AEP,Session_4,4/25/2021,17:12:10,TRUE,Session_4__2021-04-25__17-12-10(2).JPG,Homo_sapiens,1,n,
MFDC1508.JPG,1_AEP,Session_4,4/25/2021,17:12:10,TRUE,Session_4__2021-04-25__17-12-10(3).JPG,Homo_sapiens,1,n,
MFDC1509.JPG,1_AEP,Session_4,4/25/2021,17:12:39,TRUE,Session_4__2021-04-25__17-12-39(4).JPG,Homo_sapiens,1,n,
MFDC1510.JPG,1_AEP,Session_4,4/25/2021,17:12:40,TRUE,Session_4__2021-04-25__17-12-40(5).JPG,Homo_sapiens,1,n,
MFDC1511.JPG,1_AEP,Session_4,4/25/2021,17:12:40,TRUE,Session_4__2021-04-25__17-12-40(6).JPG,Homo_sapiens,1,n,
MFDC1512.JPG,1_AEP,Session_4,4/25/2021,22:12:20,TRUE,Session_4__2021-04-25__22-12-20(2).JPG,Didelphis_virginiana,1,n,
MFDC1513.JPG,1_AEP,Session_4,4/25/2021,22:12:19,TRUE,Session_4__2021-04-25__22-12-19(1).JPG,Didelphis_virginiana,1,n,
MFDC1514.JPG,1_AEP,Session_4,4/25/2021,22:12:20,TRUE,Session_4__2021-04-25__22-12-20(3).JPG,Didelphis_virginiana,1,n,
MFDC1517.JPG,1_AEP,Session_4,4/27/2021,15:06:13,TRUE,Session_4__2021-04-27__15-06-13(1).JPG,Insect_sp,1,y,bee
MFDC1524.JPG,1_AEP,Session_4,4/28/2021,20:14:41,TRUE,Session_4__2021-04-28__20-14-41(1).JPG,Odocoileus_virginianus,1,n,
MFDC1525.JPG,1_AEP,Session_4,4/28/2021,20:14:41,TRUE,Session_4__2021-04-28__20-14-41(2).JPG,Odocoileus_virginianus,1,n,
MFDC1526.JPG,1_AEP,Session_4,4/28/2021,20:14:41,TRUE,Session_4__2021-04-28__20-14-41(3).JPG,Odocoileus_virginianus,1,n,
MFDC1527.JPG,1_AEP,Session_4,4/28/2021,21:30:03,TRUE,Session_4__2021-04-28__21-30-03(1).JPG,Odocoileus_virginianus,1,n,
MFDC1528.JPG,1_AEP,Session_4,4/28/2021,21:30:03,TRUE,Session_4__2021-04-28__21-30-03(2).JPG,Odocoileus_virginianus,1,n,
MFDC1529.JPG,1_AEP,Session_4,4/28/2021,21:30:03,TRUE,Session_4__2021-04-28__21-30-03(3).JPG,Odocoileus_virginianus,1,n,
MFDC1557.JPG,1_AEP,Session_4,5/5/2021,20:22:43,TRUE,Session_4__2021-05-05__20-22-43(1).JPG,Odocoileus_virginianus,1,n,
MFDC1558.JPG,1_AEP,Session_4,5/5/2021,20:22:43,TRUE,Session_4__2021-05-05__20-22-43(2).JPG,Odocoileus_virginianus,1,n,
MFDC1559.JPG,1_AEP,Session_4,5/5/2021,20:22:43,TRUE,Session_4__2021-05-05__20-22-43(3).JPG,Odocoileus_virginianus,1,n,
MFDC1566.JPG,1_AEP,Session_4,5/6/2021,17:06:10,TRUE,Session_4__2021-05-06__17-06-10(1).JPG,Odocoileus_virginianus,1,n,
MFDC1567.JPG,1_AEP,Session_4,5/6/2021,17:06:10,TRUE,Session_4__2021-05-06__17-06-10(2).JPG,Odocoileus_virginianus,1,n,
MFDC1568.JPG,1_AEP,Session_4,5/6/2021,17:06:10,TRUE,Session_4__2021-05-06__17-06-10(3).JPG,Odocoileus_virginianus,1,n,
MFDC1569.JPG,1_AEP,Session_4,5/6/2021,17:14:21,TRUE,Session_4__2021-05-06__17-14-21(1).JPG,Odocoileus_virginianus,1,n,
MFDC1570.JPG,1_AEP,Session_4,5/6/2021,17:14:21,TRUE,Session_4__2021-05-06__17-14-21(2).JPG,Odocoileus_virginianus,1,n,
MFDC1571.JPG,1_AEP,Session_4,5/6/2021,17:14:21,TRUE,Session_4__2021-05-06__17-14-21(3).JPG,Odocoileus_virginianus,1,n,
MFDC1591.JPG,1_AEP,Session_4,5/9/2021,6:33:12,TRUE,Session_4__2021-05-09__06-33-12(1).JPG,NA,0,n,
MFDC1592.JPG,1_AEP,Session_4,5/9/2021,6:33:12,TRUE,Session_4__2021-05-09__06-33-12(2).JPG,NA,0,n,
MFDC1629.JPG,1_AEP,Session_4,5/11/2021,6:12:16,TRUE,Session_4__2021-05-11__06-12-16(1).JPG,NA,0,n,
MFDC1630.JPG,1_AEP,Session_4,5/11/2021,6:12:17,TRUE,Session_4__2021-05-11__06-12-17(2).JPG,NA,0,n,
MFDC1631.JPG,1_AEP,Session_4,5/11/2021,6:12:17,TRUE,Session_4__2021-05-11__06-12-17(3).JPG,NA,0,n,
MFDC1632.JPG,1_AEP,Session_4,5/11/2021,7:53:16,TRUE,Session_4__2021-05-11__07-53-16(2).JPG,Odocoileus_virginianus,1,n,
MFDC1633.JPG,1_AEP,Session_4,5/11/2021,7:53:15,TRUE,Session_4__2021-05-11__07-53-15(1).JPG,Odocoileus_virginianus,1,n,
MFDC1634.JPG,1_AEP,Session_4,5/11/2021,7:53:16,TRUE,Session_4__2021-05-11__07-53-16(3).JPG,Odocoileus_virginianus,1,n,
MFDC1800.JPG,1_AEP,Session_4,5/12/2021,13:54:48,TRUE,Session_4__2021-05-12__13-54-48(1).JPG,Homo_sapiens,1,n,
MFDC1801.JPG,1_AEP,Session_4,5/12/2021,13:54:49,TRUE,Session_4__2021-05-12__13-54-49(2).JPG,Homo_sapiens,1,n,
MFDC1802.JPG,1_AEP,Session_4,5/12/2021,13:54:49,TRUE,Session_4__2021-05-12__13-54-49(3).JPG,Homo_sapiens,1,n,
MFDC1803.JPG,1_AEP,Session_4,5/12/2021,13:55:18,TRUE,Session_4__2021-05-12__13-55-18(1).JPG,Homo_sapiens,1,n,
MFDC1804.JPG,1_AEP,Session_4,5/12/2021,13:55:19,TRUE,Session_4__2021-05-12__13-55-19(2).JPG,Homo_sapiens,1,n,
MFDC1805.JPG,1_AEP,Session_4,5/12/2021,13:55:20,TRUE,Session_4__2021-05-12__13-55-20(3).JPG,Homo_sapiens,1,n,
MFDC1806.JPG,1_AEP,Session_5,5/12/2021,13:57:55,TRUE,Session_5__2021-05-12__13-57-55(1).JPG,Canis_familiaris,1,n,
MFDC1807.JPG,1_AEP,Session_5,5/12/2021,13:57:56,TRUE,Session_5__2021-05-12__13-57-56(2).JPG,Canis_familiaris,1,n,
MFDC1808.JPG,1_AEP,Session_5,5/12/2021,13:57:56,TRUE,Session_5__2021-05-12__13-57-56(3).JPG,Canis_familiaris,1,n,
MFDC1809.JPG,1_AEP,Session_5,5/12/2021,14:59:39,TRUE,Session_5__2021-05-12__14-59-39(1).JPG,NA,0,n,
MFDC1810.JPG,1_AEP,Session_5,5/12/2021,14:59:39,TRUE,Session_5__2021-05-12__14-59-39(2).JPG,NA,0,n,
MFDC1811.JPG,1_AEP,Session_5,5/12/2021,14:59:40,TRUE,Session_5__2021-05-12__14-59-40(3).JPG,NA,0,n,
MFDC1812.JPG,1_AEP,Session_5,5/12/2021,19:00:18,TRUE,Session_5__2021-05-12__19-00-18(1).JPG,Odocoileus_virginianus,1,n,
MFDC1813.JPG,1_AEP,Session_5,5/12/2021,19:00:18,TRUE,Session_5__2021-05-12__19-00-18(2).JPG,Odocoileus_virginianus,1,n,
MFDC1814.JPG,1_AEP,Session_5,5/12/2021,19:00:18,TRUE,Session_5__2021-05-12__19-00-18(3).JPG,Odocoileus_virginianus,1,n,
MFDC1815.JPG,1_AEP,Session_5,5/12/2021,19:00:48,TRUE,Session_5__2021-05-12__19-00-48(4).JPG,Odocoileus_virginianus,1,n,
MFDC1816.JPG,1_AEP,Session_5,5/12/2021,19:00:48,TRUE,Session_5__2021-05-12__19-00-48(5).JPG,Odocoileus_virginianus,1,n,
MFDC1817.JPG,1_AEP,Session_5,5/12/2021,19:00:48,TRUE,Session_5__2021-05-12__19-00-48(6).JPG,Odocoileus_virginianus,1,n,
MFDC1818.JPG,1_AEP,Session_5,5/12/2021,19:01:18,TRUE,Session_5__2021-05-12__19-01-18(1).JPG,Odocoileus_virginianus,1,n,
MFDC1819.JPG,1_AEP,Session_5,5/12/2021,19:01:18,TRUE,Session_5__2021-05-12__19-01-18(2).JPG,Odocoileus_virginianus,1,n,
MFDC1820.JPG,1_AEP,Session_5,5/12/2021,19:01:18,TRUE,Session_5__2021-05-12__19-01-18(3).JPG,Odocoileus_virginianus,1,n,
MFDC1821.JPG,1_AEP,Session_5,5/12/2021,19:01:49,TRUE,Session_5__2021-05-12__19-01-49(4).JPG,Odocoileus_virginianus,1,n,
MFDC1822.JPG,1_AEP,Session_5,5/12/2021,19:01:49,TRUE,Session_5__2021-05-12__19-01-49(5).JPG,Odocoileus_virginianus,1,n,
MFDC1823.JPG,1_AEP,Session_5,5/12/2021,19:01:49,TRUE,Session_5__2021-05-12__19-01-49(6).JPG,Odocoileus_virginianus,1,n,
MFDC1824.JPG,1_AEP,Session_5,5/13/2021,8:07:00,TRUE,Session_5__2021-05-13__08-07-00(1).JPG,Odocoileus_virginianus,1,n,
MFDC1825.JPG,1_AEP,Session_5,5/13/2021,8:07:00,TRUE,Session_5__2021-05-13__08-07-00(2).JPG,Odocoileus_virginianus,1,n,
MFDC1826.JPG,1_AEP,Session_5,5/13/2021,8:07:00,TRUE,Session_5__2021-05-13__08-07-00(3).JPG,Odocoileus_virginianus,1,n,
MFDC1827.JPG,1_AEP,Session_5,5/13/2021,8:11:27,TRUE,Session_5__2021-05-13__08-11-27(1).JPG,Odocoileus_virginianus,1,n,
MFDC1828.JPG,1_AEP,Session_5,5/13/2021,8:11:28,TRUE,Session_5__2021-05-13__08-11-28(2).JPG,Odocoileus_virginianus,1,n,
MFDC1829.JPG,1_AEP,Session_5,5/13/2021,8:11:28,TRUE,Session_5__2021-05-13__08-11-28(3).JPG,Odocoileus_virginianus,1,n,
MFDC1830.JPG,1_AEP,Session_5,5/13/2021,8:15:38,TRUE,Session_5__2021-05-13__08-15-38(1).JPG,Odocoileus_virginianus,1,n,
MFDC1831.JPG,1_AEP,Session_5,5/13/2021,8:15:38,TRUE,Session_5__2021-05-13__08-15-38(2).JPG,NA,0,n,
MFDC1832.JPG,1_AEP,Session_5,5/13/2021,8:15:38,TRUE,Session_5__2021-05-13__08-15-38(3).JPG,NA,0,n,
MFDC1833.JPG,1_AEP,Session_5,5/13/2021,13:49:42,TRUE,Session_5__2021-05-13__13-49-42(2).JPG,NA,0,n,
MFDC1834.JPG,1_AEP,Session_5,5/13/2021,13:49:41,TRUE,Session_5__2021-05-13__13-49-41(1).JPG,NA,0,n,
MFDC1835.JPG,1_AEP,Session_5,5/13/2021,13:49:42,TRUE,Session_5__2021-05-13__13-49-42(3).JPG,NA,0,n,
MFDC1836.JPG,1_AEP,Session_5,5/13/2021,19:44:50,TRUE,Session_5__2021-05-13__19-44-50(1).JPG,Odocoileus_virginianus,1,n,
MFDC1837.JPG,1_AEP,Session_5,5/13/2021,19:44:51,TRUE,Session_5__2021-05-13__19-44-51(2).JPG,Odocoileus_virginianus,1,n,
MFDC1838.JPG,1_AEP,Session_5,5/13/2021,19:44:51,TRUE,Session_5__2021-05-13__19-44-51(3).JPG,Odocoileus_virginianus,1,n,
MFDC1839.JPG,1_AEP,Session_5,5/14/2021,13:00:42,TRUE,Session_5__2021-05-14__13-00-42(1).JPG,NA,0,n,
MFDC1840.JPG,1_AEP,Session_5,5/14/2021,13:00:43,TRUE,Session_5__2021-05-14__13-00-43(2).JPG,NA,0,n,
MFDC1841.JPG,1_AEP,Session_5,5/14/2021,13:00:44,TRUE,Session_5__2021-05-14__13-00-44(3).JPG,NA,0,n,
MFDC1842.JPG,1_AEP,Session_5,5/14/2021,13:12:14,TRUE,Session_5__2021-05-14__13-12-14(1).JPG,NA,0,n,
MFDC1843.JPG,1_AEP,Session_5,5/14/2021,13:12:15,TRUE,Session_5__2021-05-14__13-12-15(2).JPG,NA,0,n,
MFDC1844.JPG,1_AEP,Session_5,5/14/2021,13:12:15,TRUE,Session_5__2021-05-14__13-12-15(3).JPG,NA,0,n,
MFDC1845.JPG,1_AEP,Session_5,5/14/2021,15:35:40,TRUE,Session_5__2021-05-14__15-35-40(1).JPG,NA,0,n,
MFDC1846.JPG,1_AEP,Session_5,5/14/2021,15:35:41,TRUE,Session_5__2021-05-14__15-35-41(3).JPG,NA,0,n,
MFDC1847.JPG,1_AEP,Session_5,5/14/2021,15:35:40,TRUE,Session_5__2021-05-14__15-35-40(2).JPG,NA,0,n,
MFDC1848.JPG,1_AEP,Session_5,5/14/2021,17:08:34,TRUE,Session_5__2021-05-14__17-08-34(1).JPG,NA,0,n,
MFDC1849.JPG,1_AEP,Session_5,5/14/2021,17:08:35,TRUE,Session_5__2021-05-14__17-08-35(2).JPG,NA,0,n,
MFDC1850.JPG,1_AEP,Session_5,5/14/2021,17:08:35,TRUE,Session_5__2021-05-14__17-08-35(3).JPG,NA,0,n,
MFDC1851.JPG,1_AEP,Session_5,5/15/2021,11:54:57,TRUE,Session_5__2021-05-15__11-54-57(1).JPG,NA,0,n,
MFDC1852.JPG,1_AEP,Session_5,5/15/2021,11:54:58,TRUE,Session_5__2021-05-15__11-54-58(2).JPG,NA,0,n,
MFDC1853.JPG,1_AEP,Session_5,5/15/2021,11:54:58,TRUE,Session_5__2021-05-15__11-54-58(3).JPG,NA,0,n,
MFDC1854.JPG,1_AEP,Session_5,5/16/2021,12:42:54,TRUE,Session_5__2021-05-16__12-42-54(2).JPG,NA,0,n,
MFDC1855.JPG,1_AEP,Session_5,5/16/2021,12:42:53,TRUE,Session_5__2021-05-16__12-42-53(1).JPG,NA,0,n,
MFDC1856.JPG,1_AEP,Session_5,5/16/2021,12:42:54,TRUE,Session_5__2021-05-16__12-42-54(3).JPG,NA,0,n,
MFDC1857.JPG,1_AEP,Session_5,5/16/2021,13:16:57,TRUE,Session_5__2021-05-16__13-16-57(1).JPG,NA,0,n,
MFDC1858.JPG,1_AEP,Session_5,5/16/2021,13:16:58,TRUE,Session_5__2021-05-16__13-16-58(2).JPG,NA,0,n,
MFDC1859.JPG,1_AEP,Session_5,5/16/2021,13:16:58,TRUE,Session_5__2021-05-16__13-16-58(3).JPG,NA,0,n,
MFDC1860.JPG,1_AEP,Session_5,5/17/2021,7:48:37,TRUE,Session_5__2021-05-17__07-48-37(1).JPG,Odocoileus_virginianus,1,n,
MFDC1861.JPG,1_AEP,Session_5,5/17/2021,7:48:37,TRUE,Session_5__2021-05-17__07-48-37(2).JPG,Odocoileus_virginianus,1,n,
MFDC1862.JPG,1_AEP,Session_5,5/17/2021,7:48:37,TRUE,Session_5__2021-05-17__07-48-37(3).JPG,Odocoileus_virginianus,1,n,
MFDC1863.JPG,1_AEP,Session_5,5/17/2021,7:49:07,TRUE,Session_5__2021-05-17__07-49-07(1).JPG,Odocoileus_virginianus,1,n,
MFDC1864.JPG,1_AEP,Session_5,5/17/2021,7:49:07,TRUE,Session_5__2021-05-17__07-49-07(2).JPG,Odocoileus_virginianus,1,n,
MFDC1865.JPG,1_AEP,Session_5,5/17/2021,7:49:09,TRUE,Session_5__2021-05-17__07-49-09(3).JPG,Odocoileus_virginianus,1,n,
MFDC1866.JPG,1_AEP,Session_5,5/17/2021,7:49:37,TRUE,Session_5__2021-05-17__07-49-37(4).JPG,Odocoileus_virginianus,1,n,
MFDC1867.JPG,1_AEP,Session_5,5/17/2021,7:49:37,TRUE,Session_5__2021-05-17__07-49-37(5).JPG,NA,0,n,
MFDC1868.JPG,1_AEP,Session_5,5/17/2021,7:49:37,TRUE,Session_5__2021-05-17__07-49-37(6).JPG,NA,0,n,
MFDC1869.JPG,1_AEP,Session_5,5/17/2021,15:30:35,TRUE,Session_5__2021-05-17__15-30-35(1).JPG,NA,0,n,
MFDC1870.JPG,1_AEP,Session_5,5/17/2021,15:30:35,TRUE,Session_5__2021-05-17__15-30-35(2).JPG,NA,0,n,
MFDC1871.JPG,1_AEP,Session_5,5/17/2021,15:30:35,TRUE,Session_5__2021-05-17__15-30-35(3).JPG,NA,0,n,
MFDC1872.JPG,1_AEP,Session_5,5/18/2021,14:30:55,TRUE,Session_5__2021-05-18__14-30-55(1).JPG,NA,0,n,
MFDC1873.JPG,1_AEP,Session_5,5/18/2021,14:30:55,TRUE,Session_5__2021-05-18__14-30-55(2).JPG,NA,0,n,
MFDC1874.JPG,1_AEP,Session_5,5/18/2021,14:30:56,TRUE,Session_5__2021-05-18__14-30-56(3).JPG,NA,0,n,
MFDC1875.JPG,1_AEP,Session_5,5/18/2021,15:15:29,TRUE,Session_5__2021-05-18__15-15-29(1).JPG,NA,0,n,
MFDC1876.JPG,1_AEP,Session_5,5/18/2021,15:15:30,TRUE,Session_5__2021-05-18__15-15-30(2).JPG,NA,0,n,
MFDC1877.JPG,1_AEP,Session_5,5/18/2021,15:15:31,TRUE,Session_5__2021-05-18__15-15-31(3).JPG,NA,0,n,
MFDC1878.JPG,1_AEP,Session_5,5/18/2021,15:22:02,TRUE,Session_5__2021-05-18__15-22-02(1).JPG,NA,0,n,
MFDC1879.JPG,1_AEP,Session_5,5/18/2021,15:22:02,TRUE,Session_5__2021-05-18__15-22-02(2).JPG,NA,0,n,
MFDC1880.JPG,1_AEP,Session_5,5/18/2021,15:22:02,TRUE,Session_5__2021-05-18__15-22-02(3).JPG,NA,0,n,
MFDC1881.JPG,1_AEP,Session_5,5/18/2021,16:03:01,TRUE,Session_5__2021-05-18__16-03-01(3).JPG,NA,0,n,
MFDC1882.JPG,1_AEP,Session_5,5/18/2021,16:03:00,TRUE,Session_5__2021-05-18__16-03-00(1).JPG,NA,0,n,
MFDC1883.JPG,1_AEP,Session_5,5/18/2021,16:03:00,TRUE,Session_5__2021-05-18__16-03-00(2).JPG,NA,0,n,
MFDC1884.JPG,1_AEP,Session_5,5/19/2021,12:10:16,TRUE,Session_5__2021-05-19__12-10-16(1).JPG,NA,0,n,
MFDC1885.JPG,1_AEP,Session_5,5/19/2021,12:10:16,TRUE,Session_5__2021-05-19__12-10-16(2).JPG,NA,0,n,
MFDC1886.JPG,1_AEP,Session_5,5/19/2021,12:10:17,TRUE,Session_5__2021-05-19__12-10-17(3).JPG,NA,0,n,
MFDC1887.JPG,1_AEP,Session_5,5/19/2021,12:38:07,TRUE,Session_5__2021-05-19__12-38-07(2).JPG,NA,0,n,
MFDC1888.JPG,1_AEP,Session_5,5/19/2021,12:38:06,TRUE,Session_5__2021-05-19__12-38-06(1).JPG,NA,0,n,
MFDC1889.JPG,1_AEP,Session_5,5/19/2021,12:38:07,TRUE,Session_5__2021-05-19__12-38-07(3).JPG,NA,0,n,
MFDC1890.JPG,1_AEP,Session_5,5/19/2021,13:30:59,TRUE,Session_5__2021-05-19__13-30-59(1).JPG,NA,0,n,
MFDC1891.JPG,1_AEP,Session_5,5/19/2021,13:31:01,TRUE,Session_5__2021-05-19__13-31-01(2).JPG,NA,0,n,
MFDC1892.JPG,1_AEP,Session_5,5/19/2021,13:31:00,TRUE,Session_5__2021-05-19__13-31-00(1).JPG,NA,0,n,
MFDC1893.JPG,1_AEP,Session_5,5/19/2021,21:27:51,TRUE,Session_5__2021-05-19__21-27-51(1).JPG,Odocoileus_virginianus,1,n,
MFDC1894.JPG,1_AEP,Session_5,5/19/2021,21:27:52,TRUE,Session_5__2021-05-19__21-27-52(3).JPG,Odocoileus_virginianus,1,n,
MFDC1895.JPG,1_AEP,Session_5,5/19/2021,21:27:51,TRUE,Session_5__2021-05-19__21-27-51(2).JPG,Odocoileus_virginianus,1,n,
MFDC1896.JPG,1_AEP,Session_5,5/20/2021,6:23:54,TRUE,Session_5__2021-05-20__06-23-54(1).JPG,NA,0,n,
MFDC1897.JPG,1_AEP,Session_5,5/20/2021,6:23:55,TRUE,Session_5__2021-05-20__06-23-55(2).JPG,NA,0,n,
MFDC1898.JPG,1_AEP,Session_5,5/20/2021,6:23:55,TRUE,Session_5__2021-05-20__06-23-55(3).JPG,NA,0,n,
MFDC1899.JPG,1_AEP,Session_5,5/20/2021,10:26:42,TRUE,Session_5__2021-05-20__10-26-42(1).JPG,NA,0,n,
MFDC1900.JPG,1_AEP,Session_5,5/20/2021,10:26:43,TRUE,Session_5__2021-05-20__10-26-43(2).JPG,NA,0,n,
MFDC1901.JPG,1_AEP,Session_5,5/20/2021,10:26:43,TRUE,Session_5__2021-05-20__10-26-43(3).JPG,NA,0,n,
MFDC1902.JPG,1_AEP,Session_5,5/20/2021,12:29:53,TRUE,Session_5__2021-05-20__12-29-53(1).JPG,NA,0,n,
MFDC1903.JPG,1_AEP,Session_5,5/20/2021,12:29:54,TRUE,Session_5__2021-05-20__12-29-54(2).JPG,NA,0,n,
MFDC1904.JPG,1_AEP,Session_5,5/20/2021,12:29:55,TRUE,Session_5__2021-05-20__12-29-55(3).JPG,NA,0,n,
MFDC1905.JPG,1_AEP,Session_5,5/20/2021,12:31:12,TRUE,Session_5__2021-05-20__12-31-12(1).JPG,NA,0,n,
MFDC1906.JPG,1_AEP,Session_5,5/20/2021,12:31:12,TRUE,Session_5__2021-05-20__12-31-12(2).JPG,NA,0,n,
MFDC1907.JPG,1_AEP,Session_5,5/20/2021,12:31:12,TRUE,Session_5__2021-05-20__12-31-12(3).JPG,NA,0,n,
MFDC1908.JPG,1_AEP,Session_5,5/20/2021,12:48:14,TRUE,Session_5__2021-05-20__12-48-14(1).JPG,NA,0,n,
MFDC1909.JPG,1_AEP,Session_5,5/20/2021,12:48:15,TRUE,Session_5__2021-05-20__12-48-15(2).JPG,NA,0,n,
MFDC1910.JPG,1_AEP,Session_5,5/20/2021,12:48:15,TRUE,Session_5__2021-05-20__12-48-15(3).JPG,NA,0,n,
MFDC1911.JPG,1_AEP,Session_5,5/20/2021,14:34:32,TRUE,Session_5__2021-05-20__14-34-32(3).JPG,NA,0,n,
MFDC1912.JPG,1_AEP,Session_5,5/20/2021,14:34:31,TRUE,Session_5__2021-05-20__14-34-31(1).JPG,NA,0,n,
MFDC1913.JPG,1_AEP,Session_5,5/20/2021,14:34:31,TRUE,Session_5__2021-05-20__14-34-31(2).JPG,NA,0,n,
MFDC1914.JPG,1_AEP,Session_5,5/20/2021,15:08:03,TRUE,Session_5__2021-05-20__15-08-03(1).JPG,NA,0,n,
MFDC1915.JPG,1_AEP,Session_5,5/20/2021,15:08:03,TRUE,Session_5__2021-05-20__15-08-03(2).JPG,NA,0,n,
MFDC1916.JPG,1_AEP,Session_5,5/20/2021,15:08:03,TRUE,Session_5__2021-05-20__15-08-03(3).JPG,NA,0,n,
MFDC1917.JPG,1_AEP,Session_5,5/20/2021,15:13:18,TRUE,Session_5__2021-05-20__15-13-18(1).JPG,NA,0,n,
MFDC1918.JPG,1_AEP,Session_5,5/20/2021,15:13:19,TRUE,Session_5__2021-05-20__15-13-19(2).JPG,NA,0,n,
MFDC1919.JPG,1_AEP,Session_5,5/20/2021,15:13:19,TRUE,Session_5__2021-05-20__15-13-19(3).JPG,NA,0,n,
MFDC1920.JPG,1_AEP,Session_5,5/20/2021,15:21:22,TRUE,Session_5__2021-05-20__15-21-22(2).JPG,NA,0,n,
MFDC1921.JPG,1_AEP,Session_5,5/20/2021,15:21:21,TRUE,Session_5__2021-05-20__15-21-21(1).JPG,NA,0,n,
MFDC1922.JPG,1_AEP,Session_5,5/20/2021,15:21:22,TRUE,Session_5__2021-05-20__15-21-22(3).JPG,NA,0,n,
MFDC1923.JPG,1_AEP,Session_5,5/20/2021,16:28:45,TRUE,Session_5__2021-05-20__16-28-45(1).JPG,NA,0,n,
MFDC1924.JPG,1_AEP,Session_5,5/20/2021,16:28:45,TRUE,Session_5__2021-05-20__16-28-45(2).JPG,NA,0,n,
MFDC1925.JPG,1_AEP,Session_5,5/20/2021,16:28:45,TRUE,Session_5__2021-05-20__16-28-45(3).JPG,NA,0,n,
MFDC1926.JPG,1_AEP,Session_5,5/20/2021,17:15:59,TRUE,Session_5__2021-05-20__17-15-59(3).JPG,NA,0,n,
MFDC1927.JPG,1_AEP,Session_5,5/20/2021,17:15:58,TRUE,Session_5__2021-05-20__17-15-58(1).JPG,NA,0,n,
MFDC1928.JPG,1_AEP,Session_5,5/20/2021,17:15:58,TRUE,Session_5__2021-05-20__17-15-58(2).JPG,NA,0,n,
MFDC1929.JPG,1_AEP,Session_5,5/21/2021,11:59:52,TRUE,Session_5__2021-05-21__11-59-52(1).JPG,NA,0,n,
MFDC1930.JPG,1_AEP,Session_5,5/21/2021,11:59:52,TRUE,Session_5__2021-05-21__11-59-52(2).JPG,NA,0,n,
MFDC1931.JPG,1_AEP,Session_5,5/21/2021,11:59:53,TRUE,Session_5__2021-05-21__11-59-53(3).JPG,NA,0,n,
MFDC1932.JPG,1_AEP,Session_5,5/21/2021,12:00:53,TRUE,Session_5__2021-05-21__12-00-53(1).JPG,NA,0,n,
MFDC1933.JPG,1_AEP,Session_5,5/21/2021,12:00:53,TRUE,Session_5__2021-05-21__12-00-53(2).JPG,NA,0,n,
MFDC1934.JPG,1_AEP,Session_5,5/21/2021,12:00:53,TRUE,Session_5__2021-05-21__12-00-53(3).JPG,NA,0,n,
MFDC1935.JPG,1_AEP,Session_5,5/21/2021,12:01:40,TRUE,Session_5__2021-05-21__12-01-40(1).JPG,NA,0,n,
MFDC1936.JPG,1_AEP,Session_5,5/21/2021,12:01:42,TRUE,Session_5__2021-05-21__12-01-42(3).JPG,NA,0,n,
MFDC1937.JPG,1_AEP,Session_5,5/21/2021,12:01:41,TRUE,Session_5__2021-05-21__12-01-41(2).JPG,NA,0,n,
MFDC1938.JPG,1_AEP,Session_5,5/21/2021,12:02:33,TRUE,Session_5__2021-05-21__12-02-33(1).JPG,NA,0,n,
MFDC1939.JPG,1_AEP,Session_5,5/21/2021,12:02:33,TRUE,Session_5__2021-05-21__12-02-33(2).JPG,NA,0,n,
MFDC1940.JPG,1_AEP,Session_5,5/21/2021,12:02:33,TRUE,Session_5__2021-05-21__12-02-33(3).JPG,NA,0,n,
MFDC1941.JPG,1_AEP,Session_5,5/21/2021,12:11:46,TRUE,Session_5__2021-05-21__12-11-46(1).JPG,NA,0,n,
MFDC1942.JPG,1_AEP,Session_5,5/21/2021,12:11:46,TRUE,Session_5__2021-05-21__12-11-46(2).JPG,NA,0,n,
MFDC1943.JPG,1_AEP,Session_5,5/21/2021,12:11:46,TRUE,Session_5__2021-05-21__12-11-46(3).JPG,NA,0,n,
MFDC1944.JPG,1_AEP,Session_5,5/21/2021,12:24:02,TRUE,Session_5__2021-05-21__12-24-02(1).JPG,NA,0,n,
MFDC1945.JPG,1_AEP,Session_5,5/21/2021,12:24:02,TRUE,Session_5__2021-05-21__12-24-02(2).JPG,NA,0,n,
MFDC1946.JPG,1_AEP,Session_5,5/21/2021,12:24:03,TRUE,Session_5__2021-05-21__12-24-03(3).JPG,NA,0,n,
MFDC1947.JPG,1_AEP,Session_5,5/21/2021,12:38:50,TRUE,Session_5__2021-05-21__12-38-50(1).JPG,NA,0,n,
MFDC1948.JPG,1_AEP,Session_5,5/21/2021,12:38:51,TRUE,Session_5__2021-05-21__12-38-51(2).JPG,NA,0,n,
MFDC1949.JPG,1_AEP,Session_5,5/21/2021,12:38:51,TRUE,Session_5__2021-05-21__12-38-51(3).JPG,NA,0,n,
MFDC1950.JPG,1_AEP,Session_5,5/21/2021,13:20:01,TRUE,Session_5__2021-05-21__13-20-01(1).JPG,NA,0,n,
MFDC1951.JPG,1_AEP,Session_5,5/21/2021,13:20:01,TRUE,Session_5__2021-05-21__13-20-01(2).JPG,NA,0,n,
MFDC1952.JPG,1_AEP,Session_5,5/21/2021,13:20:02,TRUE,Session_5__2021-05-21__13-20-02(3).JPG,NA,0,n,
MFDC1953.JPG,1_AEP,Session_5,5/21/2021,14:55:07,TRUE,Session_5__2021-05-21__14-55-07(1).JPG,NA,0,n,
MFDC1954.JPG,1_AEP,Session_5,5/21/2021,14:55:07,TRUE,Session_5__2021-05-21__14-55-07(2).JPG,NA,0,n,
MFDC1955.JPG,1_AEP,Session_5,5/21/2021,14:55:08,TRUE,Session_5__2021-05-21__14-55-08(3).JPG,NA,0,n,
MFDC1956.JPG,1_AEP,Session_5,5/21/2021,16:48:53,TRUE,Session_5__2021-05-21__16-48-53(1).JPG,NA,0,n,
MFDC1957.JPG,1_AEP,Session_5,5/21/2021,16:48:53,TRUE,Session_5__2021-05-21__16-48-53(2).JPG,NA,0,n,
MFDC1958.JPG,1_AEP,Session_5,5/21/2021,16:48:53,TRUE,Session_5__2021-05-21__16-48-53(3).JPG,NA,0,n,
MFDC1959.JPG,1_AEP,Session_5,5/21/2021,17:00:02,TRUE,Session_5__2021-05-21__17-00-02(2).JPG,NA,0,n,
MFDC1960.JPG,1_AEP,Session_5,5/21/2021,17:00:01,TRUE,Session_5__2021-05-21__17-00-01(1).JPG,NA,0,n,
MFDC1961.JPG,1_AEP,Session_5,5/21/2021,17:00:02,TRUE,Session_5__2021-05-21__17-00-02(3).JPG,NA,0,n,
MFDC1962.JPG,1_AEP,Session_5,5/21/2021,19:50:11,TRUE,Session_5__2021-05-21__19-50-11(1).JPG,NA,0,n,
MFDC1963.JPG,1_AEP,Session_5,5/21/2021,19:50:12,TRUE,Session_5__2021-05-21__19-50-12(2).JPG,NA,0,n,
MFDC1964.JPG,1_AEP,Session_5,5/21/2021,19:50:12,TRUE,Session_5__2021-05-21__19-50-12(3).JPG,NA,0,n,
MFDC1965.JPG,1_AEP,Session_5,5/22/2021,11:02:30,TRUE,Session_5__2021-05-22__11-02-30(1).JPG,NA,0,n,
MFDC1966.JPG,1_AEP,Session_5,5/22/2021,11:02:30,TRUE,Session_5__2021-05-22__11-02-30(2).JPG,NA,0,n,
MFDC1967.JPG,1_AEP,Session_5,5/22/2021,11:02:31,TRUE,Session_5__2021-05-22__11-02-31(3).JPG,NA,0,n,
MFDC1968.JPG,1_AEP,Session_5,5/22/2021,11:48:43,TRUE,Session_5__2021-05-22__11-48-43(1).JPG,NA,0,n,
MFDC1969.JPG,1_AEP,Session_5,5/22/2021,11:48:44,TRUE,Session_5__2021-05-22__11-48-44(2).JPG,NA,0,n,
MFDC1970.JPG,1_AEP,Session_5,5/22/2021,11:48:44,TRUE,Session_5__2021-05-22__11-48-44(3).JPG,NA,0,n,
MFDC1971.JPG,1_AEP,Session_5,5/22/2021,11:52:54,TRUE,Session_5__2021-05-22__11-52-54(1).JPG,NA,0,n,
MFDC1972.JPG,1_AEP,Session_5,5/22/2021,11:52:54,TRUE,Session_5__2021-05-22__11-52-54(2).JPG,NA,0,n,
MFDC1973.JPG,1_AEP,Session_5,5/22/2021,11:52:56,TRUE,Session_5__2021-05-22__11-52-56(3).JPG,NA,0,n,
MFDC1974.JPG,1_AEP,Session_5,5/22/2021,12:47:55,TRUE,Session_5__2021-05-22__12-47-55(1).JPG,NA,0,n,
MFDC1975.JPG,1_AEP,Session_5,5/22/2021,12:47:56,TRUE,Session_5__2021-05-22__12-47-56(2).JPG,NA,0,n,
MFDC1976.JPG,1_AEP,Session_5,5/22/2021,12:47:56,TRUE,Session_5__2021-05-22__12-47-56(3).JPG,NA,0,n,
MFDC1977.JPG,1_AEP,Session_5,5/22/2021,17:25:23,TRUE,Session_5__2021-05-22__17-25-23(3).JPG,Meleagris_gallopavo,1,y,
MFDC1978.JPG,1_AEP,Session_5,5/22/2021,17:25:22,TRUE,Session_5__2021-05-22__17-25-22(1).JPG,Meleagris_gallopavo,1,n,
MFDC1979.JPG,1_AEP,Session_5,5/22/2021,17:25:22,TRUE,Session_5__2021-05-22__17-25-22(2).JPG,Meleagris_gallopavo,1,n,
MFDC1980.JPG,1_AEP,Session_5,5/22/2021,17:25:56,TRUE,Session_5__2021-05-22__17-25-56(6).JPG,Meleagris_gallopavo,1,n,
MFDC1981.JPG,1_AEP,Session_5,5/22/2021,17:25:55,TRUE,Session_5__2021-05-22__17-25-55(4).JPG,Meleagris_gallopavo,1,n,
MFDC1982.JPG,1_AEP,Session_5,5/22/2021,17:25:55,TRUE,Session_5__2021-05-22__17-25-55(5).JPG,Meleagris_gallopavo,1,n,
MFDC1983.JPG,1_AEP,Session_5,5/22/2021,19:43:51,TRUE,Session_5__2021-05-22__19-43-51(1).JPG,NA,0,n,
MFDC1984.JPG,1_AEP,Session_5,5/22/2021,19:43:52,TRUE,Session_5__2021-05-22__19-43-52(2).JPG,NA,0,n,
MFDC1985.JPG,1_AEP,Session_5,5/22/2021,19:43:52,TRUE,Session_5__2021-05-22__19-43-52(3).JPG,NA,0,n,
MFDC1986.JPG,1_AEP,Session_5,5/23/2021,5:30:02,TRUE,Session_5__2021-05-23__05-30-02(1).JPG,NA,0,n,
MFDC1987.JPG,1_AEP,Session_5,5/23/2021,5:30:03,TRUE,Session_5__2021-05-23__05-30-03(3).JPG,NA,0,n,
MFDC1988.JPG,1_AEP,Session_5,5/23/2021,5:30:02,TRUE,Session_5__2021-05-23__05-30-02(2).JPG,NA,0,n,
MFDC1989.JPG,1_AEP,Session_5,5/23/2021,5:38:32,TRUE,Session_5__2021-05-23__05-38-32(1).JPG,NA,0,n,
MFDC1990.JPG,1_AEP,Session_5,5/23/2021,5:38:33,TRUE,Session_5__2021-05-23__05-38-33(2).JPG,NA,0,n,
MFDC1991.JPG,1_AEP,Session_5,5/23/2021,5:38:33,TRUE,Session_5__2021-05-23__05-38-33(3).JPG,NA,0,n,
MFDC1992.JPG,1_AEP,Session_5,5/23/2021,11:27:19,TRUE,Session_5__2021-05-23__11-27-19(1).JPG,NA,0,n,
MFDC1993.JPG,1_AEP,Session_5,5/23/2021,11:27:21,TRUE,Session_5__2021-05-23__11-27-21(3).JPG,NA,0,n,
MFDC1994.JPG,1_AEP,Session_5,5/23/2021,11:27:20,TRUE,Session_5__2021-05-23__11-27-20(2).JPG,NA,0,n,
MFDC1995.JPG,1_AEP,Session_5,5/23/2021,11:28:21,TRUE,Session_5__2021-05-23__11-28-21(1).JPG,NA,0,n,
MFDC1996.JPG,1_AEP,Session_5,5/23/2021,11:28:22,TRUE,Session_5__2021-05-23__11-28-22(2).JPG,NA,0,n,
MFDC1997.JPG,1_AEP,Session_5,5/23/2021,11:28:22,TRUE,Session_5__2021-05-23__11-28-22(3).JPG,NA,0,n,
MFDC1998.JPG,1_AEP,Session_5,5/23/2021,12:09:24,TRUE,Session_5__2021-05-23__12-09-24(1).JPG,NA,0,n,
MFDC1999.JPG,1_AEP,Session_5,5/23/2021,12:09:25,TRUE,Session_5__2021-05-23__12-09-25(2).JPG,NA,0,n,
MFDC2000.JPG,1_AEP,Session_5,5/23/2021,12:09:25,TRUE,Session_5__2021-05-23__12-09-25(3).JPG,NA,0,n,
MFDC2001.JPG,1_AEP,Session_5,5/23/2021,12:50:00,TRUE,Session_5__2021-05-23__12-50-00(1).JPG,NA,0,n,
MFDC2002.JPG,1_AEP,Session_5,5/23/2021,12:50:02,TRUE,Session_5__2021-05-23__12-50-02(3).JPG,NA,0,n,
MFDC2003.JPG,1_AEP,Session_5,5/23/2021,12:50:01,TRUE,Session_5__2021-05-23__12-50-01(2).JPG,NA,0,n,
MFDC2004.JPG,1_AEP,Session_5,5/23/2021,14:19:48,TRUE,Session_5__2021-05-23__14-19-48(1).JPG,NA,0,n,
MFDC2005.JPG,1_AEP,Session_5,5/23/2021,14:19:49,TRUE,Session_5__2021-05-23__14-19-49(2).JPG,NA,0,n,
MFDC2006.JPG,1_AEP,Session_5,5/23/2021,14:19:49,TRUE,Session_5__2021-05-23__14-19-49(3).JPG,NA,0,n,
MFDC2007.JPG,1_AEP,Session_5,5/23/2021,15:07:56,TRUE,Session_5__2021-05-23__15-07-56(1).JPG,NA,0,n,
MFDC2008.JPG,1_AEP,Session_5,5/23/2021,15:07:56,TRUE,Session_5__2021-05-23__15-07-56(2).JPG,NA,0,n,
MFDC2009.JPG,1_AEP,Session_5,5/23/2021,15:07:56,TRUE,Session_5__2021-05-23__15-07-56(3).JPG,NA,0,n,
MFDC2010.JPG,1_AEP,Session_5,5/23/2021,15:08:28,TRUE,Session_5__2021-05-23__15-08-28(1).JPG,NA,0,n,
MFDC2011.JPG,1_AEP,Session_5,5/23/2021,15:08:28,TRUE,Session_5__2021-05-23__15-08-28(2).JPG,NA,0,n,
MFDC2012.JPG,1_AEP,Session_5,5/23/2021,15:08:29,TRUE,Session_5__2021-05-23__15-08-29(3).JPG,NA,0,n,
MFDC2013.JPG,1_AEP,Session_5,5/23/2021,17:49:17,TRUE,Session_5__2021-05-23__17-49-17(1).JPG,Odocoileus_virginianus,1,n,
MFDC2014.JPG,1_AEP,Session_5,5/23/2021,17:49:17,TRUE,Session_5__2021-05-23__17-49-17(2).JPG,Odocoileus_virginianus,1,n,
MFDC2015.JPG,1_AEP,Session_5,5/23/2021,17:49:18,TRUE,Session_5__2021-05-23__17-49-18(3).JPG,Odocoileus_virginianus,1,n,
MFDC2016.JPG,1_AEP,Session_5,5/24/2021,8:22:07,TRUE,Session_5__2021-05-24__08-22-07(1).JPG,NA,0,n,
MFDC2017.JPG,1_AEP,Session_5,5/24/2021,8:22:07,TRUE,Session_5__2021-05-24__08-22-07(2).JPG,NA,0,n,
MFDC2018.JPG,1_AEP,Session_5,5/24/2021,8:22:07,TRUE,Session_5__2021-05-24__08-22-07(3).JPG,NA,0,n,
MFDC2019.JPG,1_AEP,Session_5,5/24/2021,8:22:48,TRUE,Session_5__2021-05-24__08-22-48(4).JPG,Canis_latrans,1,n,
MFDC2020.JPG,1_AEP,Session_5,5/24/2021,8:22:49,TRUE,Session_5__2021-05-24__08-22-49(6).JPG,Canis_latrans,1,n,
MFDC2021.JPG,1_AEP,Session_5,5/24/2021,8:22:48,TRUE,Session_5__2021-05-24__08-22-48(5).JPG,Canis_latrans,1,n,
MFDC2022.JPG,1_AEP,Session_5,5/24/2021,8:23:20,TRUE,Session_5__2021-05-24__08-23-20(1).JPG,Canis_latrans,1,n,
MFDC2023.JPG,1_AEP,Session_5,5/24/2021,8:23:20,TRUE,Session_5__2021-05-24__08-23-20(2).JPG,Canis_latrans,1,n,
MFDC2024.JPG,1_AEP,Session_5,5/24/2021,8:23:20,TRUE,Session_5__2021-05-24__08-23-20(3).JPG,Canis_latrans,1,n,
MFDC2025.JPG,1_AEP,Session_5,5/24/2021,10:23:02,TRUE,Session_5__2021-05-24__10-23-02(1).JPG,NA,0,n,
MFDC2026.JPG,1_AEP,Session_5,5/24/2021,10:23:04,TRUE,Session_5__2021-05-24__10-23-04(3).JPG,NA,0,n,
MFDC2027.JPG,1_AEP,Session_5,5/24/2021,10:23:03,TRUE,Session_5__2021-05-24__10-23-03(2).JPG,NA,0,n,
MFDC2028.JPG,1_AEP,Session_5,5/24/2021,12:31:53,TRUE,Session_5__2021-05-24__12-31-53(2).JPG,NA,0,n,
MFDC2029.JPG,1_AEP,Session_5,5/24/2021,12:31:52,TRUE,Session_5__2021-05-24__12-31-52(1).JPG,NA,0,n,
MFDC2030.JPG,1_AEP,Session_5,5/24/2021,12:31:53,TRUE,Session_5__2021-05-24__12-31-53(3).JPG,NA,0,n,
