FileName,Station,Session,Date,Time,DateReadable,filename_new,Species,Number_animals,Favorite (y/n),Notes
MFDC2963.JPG,5_AEP,Session_1,1/14/2021,6:48:28,TRUE,Session_1__2021-01-14__06-48-28(1).JPG,Odocoileus_virginianus,1,n,
MFDC2967.JPG,5_AEP,Session_1,1/15/2021,16:41:08,TRUE,Session_1__2021-01-15__16-41-08(1).JPG,Sciurus_sp,1,n,
MFDC2968.JPG,5_AEP,Session_1,1/17/2021,8:36:38,TRUE,Session_1__2021-01-17__08-36-38(1).JPG,Sciurus_sp,1,n,
MFDC2969.JPG,5_AEP,Session_1,1/18/2021,8:45:29,TRUE,Session_1__2021-01-18__08-45-29(1).JPG,Odocoileus_virginianus,1,n,
MFDC2972.JPG,5_AEP,Session_1,1/22/2021,8:16:08,TRUE,Session_1__2021-01-22__08-16-08(1).JPG,Odocoileus_virginianus,1,n,
MFDC2973.JPG,5_AEP,Session_1,1/22/2021,8:16:09,TRUE,Session_1__2021-01-22__08-16-09(2).JPG,Odocoileus_virginianus,1,n,
MFDC2974.JPG,5_AEP,Session_1,1/22/2021,8:16:38,TRUE,Session_1__2021-01-22__08-16-38(3).JPG,Odocoileus_virginianus,1,n,
MFDC2975.JPG,5_AEP,Session_1,1/22/2021,8:16:41,TRUE,Session_1__2021-01-22__08-16-41(4).JPG,Odocoileus_virginianus,1,n,
MFDC2976.JPG,5_AEP,Session_1,1/22/2021,8:16:42,TRUE,Session_1__2021-01-22__08-16-42(5).JPG,Odocoileus_virginianus,1,n,
MFDC2978.JPG,5_AEP,Session_1,1/22/2021,14:49:37,TRUE,Session_1__2021-01-22__14-49-37(1).JPG,Odocoileus_virginianus,1,n,
MFDC2979.JPG,5_AEP,Session_1,1/22/2021,14:49:40,TRUE,Session_1__2021-01-22__14-49-40(2).JPG,Odocoileus_virginianus,1,n,
MFDC2980.JPG,5_AEP,Session_1,1/22/2021,14:50:50,TRUE,Session_1__2021-01-22__14-50-50(1).JPG,Odocoileus_virginianus,1,n,
MFDC2981.JPG,5_AEP,Session_1,1/22/2021,14:50:54,TRUE,Session_1__2021-01-22__14-50-54(2).JPG,Odocoileus_virginianus,1,n,
MFDC2982.JPG,5_AEP,Session_1,1/22/2021,14:51:23,TRUE,Session_1__2021-01-22__14-51-23(1).JPG,Odocoileus_virginianus,1,n,
MFDC2985.JPG,5_AEP,Session_1,1/24/2021,17:59:19,TRUE,Session_1__2021-01-24__17-59-19(1).JPG,Odocoileus_virginianus,2,n,
MFDC2986.JPG,5_AEP,Session_1,1/24/2021,17:59:22,TRUE,Session_1__2021-01-24__17-59-22(2).JPG,Odocoileus_virginianus,2,n,
MFDC2987.JPG,5_AEP,Session_1,1/24/2021,17:59:56,TRUE,Session_1__2021-01-24__17-59-56(3).JPG,Odocoileus_virginianus,2,n,
MFDC2988.JPG,5_AEP,Session_1,1/24/2021,17:59:59,TRUE,Session_1__2021-01-24__17-59-59(4).JPG,Odocoileus_virginianus,2,n,
MFDC2989.JPG,5_AEP,Session_1,1/24/2021,17:59:59,TRUE,Session_1__2021-01-24__17-59-59(5).JPG,Odocoileus_virginianus,2,n,
MFDC2992.JPG,5_AEP,Session_1,1/27/2021,0:35:42,TRUE,Session_1__2021-01-27__00-35-42(1).JPG,Odocoileus_virginianus,1,n,
MFDC2994.JPG,5_AEP,Session_1,1/27/2021,0:36:24,TRUE,Session_1__2021-01-27__00-36-24(1).JPG,Odocoileus_virginianus,1,n,
MFDC2995.JPG,5_AEP,Session_1,1/27/2021,0:36:26,TRUE,Session_1__2021-01-27__00-36-26(2).JPG,Odocoileus_virginianus,1,n,
MFDC2996.JPG,5_AEP,Session_1,1/27/2021,0:36:27,TRUE,Session_1__2021-01-27__00-36-27(3).JPG,Odocoileus_virginianus,1,n,
MFDC2997.JPG,5_AEP,Session_1,1/27/2021,0:36:58,TRUE,Session_1__2021-01-27__00-36-58(4).JPG,Odocoileus_virginianus,1,n,
MFDC2998.JPG,5_AEP,Session_1,1/27/2021,0:37:00,TRUE,Session_1__2021-01-27__00-37-00(1).JPG,Odocoileus_virginianus,1,n,
MFDC2999.JPG,5_AEP,Session_1,1/27/2021,0:37:02,TRUE,Session_1__2021-01-27__00-37-02(2).JPG,Odocoileus_virginianus,1,n,
MFDC3000.JPG,5_AEP,Session_1,1/27/2021,0:37:36,TRUE,Session_1__2021-01-27__00-37-36(3).JPG,Odocoileus_virginianus,1,n,
MFDC3001.JPG,5_AEP,Session_1,1/27/2021,0:38:13,TRUE,Session_1__2021-01-27__00-38-13(1).JPG,Odocoileus_virginianus,1,n,
MFDC3002.JPG,5_AEP,Session_1,1/27/2021,0:38:46,TRUE,Session_1__2021-01-27__00-38-46(2).JPG,Odocoileus_virginianus,1,n,
MFDC3003.JPG,5_AEP,Session_1,1/27/2021,0:38:49,TRUE,Session_1__2021-01-27__00-38-49(3).JPG,Odocoileus_virginianus,1,n,
MFDC3004.JPG,5_AEP,Session_1,1/27/2021,0:38:50,TRUE,Session_1__2021-01-27__00-38-50(4).JPG,Odocoileus_virginianus,1,n,
MFDC3005.JPG,5_AEP,Session_1,1/27/2021,0:39:32,TRUE,Session_1__2021-01-27__00-39-32(1).JPG,Odocoileus_virginianus,1,n,
MFDC3006.JPG,5_AEP,Session_1,1/31/2021,8:15:35,TRUE,Session_1__2021-01-31__08-15-35(1).JPG,Sciurus_sp,1,n,
MFDC3007.JPG,5_AEP,Session_1,1/31/2021,8:15:37,TRUE,Session_1__2021-01-31__08-15-37(2).JPG,Sciurus_sp,1,n,
MFDC3012.JPG,5_AEP,Session_1,2/5/2021,0:23:32,TRUE,Session_1__2021-02-05__00-23-32(1).JPG,Odocoileus_virginianus,1,n,
MFDC3013.JPG,5_AEP,Session_1,2/5/2021,0:23:34,TRUE,Session_1__2021-02-05__00-23-34(2).JPG,Odocoileus_virginianus,1,n,
MFDC3014.JPG,5_AEP,Session_1,2/5/2021,0:23:36,TRUE,Session_1__2021-02-05__00-23-36(3).JPG,Odocoileus_virginianus,1,n,
MFDC3015.JPG,5_AEP,Session_1,2/5/2021,0:24:30,TRUE,Session_1__2021-02-05__00-24-30(1).JPG,Odocoileus_virginianus,1,n,
MFDC3016.JPG,5_AEP,Session_1,2/5/2021,0:25:01,TRUE,Session_1__2021-02-05__00-25-01(1).JPG,Odocoileus_virginianus,1,n,
MFDC3017.JPG,5_AEP,Session_1,2/5/2021,0:25:03,TRUE,Session_1__2021-02-05__00-25-03(2).JPG,Odocoileus_virginianus,1,n,
MFDC3018.JPG,5_AEP,Session_1,2/5/2021,0:25:04,TRUE,Session_1__2021-02-05__00-25-04(3).JPG,Odocoileus_virginianus,1,n,
MFDC3026.JPG,5_AEP,Session_2,2/6/2021,11:18:40,TRUE,Session_2__2021-02-06__11-18-40(1).JPG,NA,0,n,
MFDC3027.JPG,5_AEP,Session_2,2/8/2021,2:07:06,TRUE,Session_2__2021-02-08__02-07-06(1).JPG,Canis_latrans,1,n,
MFDC3028.JPG,5_AEP,Session_2,2/8/2021,10:56:12,TRUE,Session_2__2021-02-08__10-56-12(1).JPG,Canis_familiaris,1,n,hound
MFDC3029.JPG,5_AEP,Session_2,2/8/2021,10:58:50,TRUE,Session_2__2021-02-08__10-58-50(1).JPG,Canis_familiaris,1,n,hound
MFDC3030.JPG,5_AEP,Session_2,2/9/2021,11:11:18,TRUE,Session_2__2021-02-09__11-11-18(1).JPG,NA,0,n,
MFDC3031.JPG,5_AEP,Session_2,2/10/2021,17:57:44,TRUE,Session_2__2021-02-10__17-57-44(1).JPG,Sciurus_sp,1,n,
MFDC3032.JPG,5_AEP,Session_2,2/11/2021,12:45:37,TRUE,Session_2__2021-02-11__12-45-37(1).JPG,NA,0,n,
MFDC3033.JPG,5_AEP,Session_2,2/11/2021,23:10:06,TRUE,Session_2__2021-02-11__23-10-06(1).JPG,NA,0,n,
MFDC3034.JPG,5_AEP,Session_2,2/12/2021,11:23:10,TRUE,Session_2__2021-02-12__11-23-10(1).JPG,NA,0,n,
MFDC3035.JPG,5_AEP,Session_2,2/13/2021,22:51:51,TRUE,Session_2__2021-02-13__22-51-51(1).JPG,NA,0,n,
MFDC3036.JPG,5_AEP,Session_2,2/14/2021,17:46:47,TRUE,Session_2__2021-02-14__17-46-47(1).JPG,NA,0,n,
MFDC3038.JPG,5_AEP,Session_2,2/14/2021,17:47:24,TRUE,Session_2__2021-02-14__17-47-24(1).JPG,Odocoileus_virginianus,1,n,
MFDC3039.JPG,5_AEP,Session_2,2/14/2021,17:47:24,TRUE,Session_2__2021-02-14__17-47-24(2).JPG,Odocoileus_virginianus,1,n,
MFDC3040.JPG,5_AEP,Session_2,2/14/2021,17:47:54,TRUE,Session_2__2021-02-14__17-47-54(3).JPG,Odocoileus_virginianus,1,n,
MFDC3041.JPG,5_AEP,Session_2,2/14/2021,17:47:56,TRUE,Session_2__2021-02-14__17-47-56(4).JPG,Odocoileus_virginianus,1,n,
MFDC3042.JPG,5_AEP,Session_2,2/14/2021,17:47:57,TRUE,Session_2__2021-02-14__17-47-57(5).JPG,Odocoileus_virginianus,1,n,
MFDC3043.JPG,5_AEP,Session_2,2/16/2021,11:14:15,TRUE,Session_2__2021-02-16__11-14-15(1).JPG,NA,0,n,
MFDC3044.JPG,5_AEP,Session_2,2/18/2021,22:16:34,TRUE,Session_2__2021-02-18__22-16-34(1).JPG,Sylvilagus_floridanus,1,n,
MFDC3045.JPG,5_AEP,Session_2,2/19/2021,3:44:39,TRUE,Session_2__2021-02-19__03-44-39(1).JPG,NA,0,n,
MFDC3046.JPG,5_AEP,Session_2,2/21/2021,0:12:52,TRUE,Session_2__2021-02-21__00-12-52(1).JPG,NA,0,n,
MFDC3047.JPG,5_AEP,Session_2,2/21/2021,13:12:36,TRUE,Session_2__2021-02-21__13-12-36(1).JPG,NA,0,n,
MFDC3048.JPG,5_AEP,Session_2,2/23/2021,14:14:01,TRUE,Session_2__2021-02-23__14-14-01(1).JPG,NA,0,n,
MFDC3049.JPG,5_AEP,Session_2,2/23/2021,14:14:34,TRUE,Session_2__2021-02-23__14-14-34(2).JPG,NA,0,n,
MFDC3050.JPG,5_AEP,Session_2,2/23/2021,14:14:37,TRUE,Session_2__2021-02-23__14-14-37(3).JPG,NA,0,n,
MFDC3051.JPG,5_AEP,Session_2,2/23/2021,14:14:38,TRUE,Session_2__2021-02-23__14-14-38(4).JPG,NA,0,n,
MFDC3052.JPG,5_AEP,Session_2,2/24/2021,17:40:41,TRUE,Session_2__2021-02-24__17-40-41(1).JPG,NA,0,n,
MFDC3053.JPG,5_AEP,Session_2,2/24/2021,17:51:17,TRUE,Session_2__2021-02-24__17-51-17(1).JPG,NA,0,n,
MFDC3054.JPG,5_AEP,Session_2,2/26/2021,11:45:33,TRUE,Session_2__2021-02-26__11-45-33(1).JPG,Homo_sapiens,1,n,
MFDC3055.JPG,5_AEP,Session_2,2/26/2021,11:45:36,TRUE,Session_2__2021-02-26__11-45-36(2).JPG,Homo_sapiens,1,n,
MFDC3056.JPG,5_AEP,Session_2,2/26/2021,11:45:38,TRUE,Session_2__2021-02-26__11-45-38(3).JPG,NA,0,n,
MFDC3057.JPG,5_AEP,Session_2,2/26/2021,11:46:18,TRUE,Session_2__2021-02-26__11-46-18(1).JPG,Homo_sapiens,1,n,
MFDC3058.JPG,5_AEP,Session_2,2/26/2021,11:46:21,TRUE,Session_2__2021-02-26__11-46-21(2).JPG,NA,0,n,
MFDC3059.JPG,5_AEP,Session_2,2/26/2021,15:02:30,TRUE,Session_2__2021-02-26__15-02-30(1).JPG,Odocoileus_virginianus,1,n,
MFDC3060.JPG,5_AEP,Session_2,2/26/2021,15:02:32,TRUE,Session_2__2021-02-26__15-02-32(2).JPG,Odocoileus_virginianus,1,n,
MFDC3061.JPG,5_AEP,Session_2,2/26/2021,15:02:34,TRUE,Session_2__2021-02-26__15-02-34(3).JPG,Odocoileus_virginianus,1,n,
MFDC3062.JPG,5_AEP,Session_2,2/26/2021,15:03:10,TRUE,Session_2__2021-02-26__15-03-10(1).JPG,Odocoileus_virginianus,1,n,
MFDC3063.JPG,5_AEP,Session_2,2/26/2021,15:03:11,TRUE,Session_2__2021-02-26__15-03-11(2).JPG,Odocoileus_virginianus,1,n,
MFDC3064.JPG,5_AEP,Session_2,2/27/2021,22:20:08,TRUE,Session_2__2021-02-27__22-20-08(1).JPG,NA,0,n,
MFDC3065.JPG,5_AEP,Session_2,2/28/2021,9:38:38,TRUE,Session_2__2021-02-28__09-38-38(1).JPG,NA,0,n,
MFDC3066.JPG,5_AEP,Session_2,2/28/2021,9:50:30,TRUE,Session_2__2021-02-28__09-50-30(1).JPG,NA,0,n,
MFDC3067.JPG,5_AEP,Session_2,2/28/2021,10:54:23,TRUE,Session_2__2021-02-28__10-54-23(1).JPG,NA,0,n,
MFDC3068.JPG,5_AEP,Session_2,2/28/2021,11:04:00,TRUE,Session_2__2021-02-28__11-04-00(1).JPG,NA,0,n,
MFDC3069.JPG,5_AEP,Session_2,2/28/2021,11:11:11,TRUE,Session_2__2021-02-28__11-11-11(1).JPG,NA,0,n,
MFDC3070.JPG,5_AEP,Session_2,2/28/2021,11:15:38,TRUE,Session_2__2021-02-28__11-15-38(1).JPG,NA,0,n,
MFDC3071.JPG,5_AEP,Session_2,2/28/2021,11:17:21,TRUE,Session_2__2021-02-28__11-17-21(1).JPG,NA,0,n,
MFDC3072.JPG,5_AEP,Session_2,2/28/2021,12:34:57,TRUE,Session_2__2021-02-28__12-34-57(1).JPG,NA,0,n,
MFDC3073.JPG,5_AEP,Session_2,3/2/2021,1:12:35,TRUE,Session_2__2021-03-02__01-12-35(1).JPG,Odocoileus_virginianus,1,n,
MFDC3074.JPG,5_AEP,Session_2,3/2/2021,1:12:37,TRUE,Session_2__2021-03-02__01-12-37(2).JPG,Odocoileus_virginianus,1,n,
MFDC3075.JPG,5_AEP,Session_2,3/2/2021,1:13:07,TRUE,Session_2__2021-03-02__01-13-07(1).JPG,Odocoileus_virginianus,1,n,
MFDC3076.JPG,5_AEP,Session_2,3/2/2021,1:13:09,TRUE,Session_2__2021-03-02__01-13-09(2).JPG,Odocoileus_virginianus,1,n,
MFDC3077.JPG,5_AEP,Session_2,3/2/2021,1:13:10,TRUE,Session_2__2021-03-02__01-13-10(3).JPG,Odocoileus_virginianus,1,n,
MFDC3078.JPG,5_AEP,Session_2,3/2/2021,6:52:30,TRUE,Session_2__2021-03-02__06-52-30(1).JPG,Sciurus_sp,1,n,
MFDC3079.JPG,5_AEP,Session_2,3/2/2021,10:31:45,TRUE,Session_2__2021-03-02__10-31-45(1).JPG,NA,0,n,
MFDC3080.JPG,5_AEP,Session_2,3/2/2021,10:32:24,TRUE,Session_2__2021-03-02__10-32-24(1).JPG,NA,0,n,
MFDC3081.JPG,5_AEP,Session_2,3/3/2021,13:51:48,TRUE,Session_2__2021-03-03__13-51-48(1).JPG,NA,0,n,
MFDC3082.JPG,5_AEP,Session_2,3/4/2021,15:11:27,TRUE,Session_2__2021-03-04__15-11-27(1).JPG,NA,0,n,
MFDC3083.JPG,5_AEP,Session_2,3/5/2021,17:57:07,TRUE,Session_2__2021-03-05__17-57-07(1).JPG,Odocoileus_virginianus,1,n,
MFDC3084.JPG,5_AEP,Session_2,3/6/2021,0:24:40,TRUE,Session_2__2021-03-06__00-24-40(1).JPG,Procyon_lotor,1,n,
MFDC3085.JPG,5_AEP,Session_2,3/7/2021,3:08:23,TRUE,Session_2__2021-03-07__03-08-23(1).JPG,NA,0,n,
MFDC3086.JPG,5_AEP,Session_2,3/7/2021,10:29:02,TRUE,Session_2__2021-03-07__10-29-02(1).JPG,Odocoileus_virginianus,1,n,
MFDC3087.JPG,5_AEP,Session_2,3/7/2021,10:29:04,TRUE,Session_2__2021-03-07__10-29-04(2).JPG,Odocoileus_virginianus,1,n,
MFDC3088.JPG,5_AEP,Session_2,3/7/2021,10:29:06,TRUE,Session_2__2021-03-07__10-29-06(3).JPG,Odocoileus_virginianus,1,n,
MFDC3089.JPG,5_AEP,Session_2,3/7/2021,10:29:35,TRUE,Session_2__2021-03-07__10-29-35(4).JPG,Odocoileus_virginianus,1,n,
MFDC3090.JPG,5_AEP,Session_2,3/7/2021,10:29:38,TRUE,Session_2__2021-03-07__10-29-38(5).JPG,Odocoileus_virginianus,1,n,
MFDC3091.JPG,5_AEP,Session_2,3/7/2021,10:29:39,TRUE,Session_2__2021-03-07__10-29-39(6).JPG,Odocoileus_virginianus,1,n,
MFDC3092.JPG,5_AEP,Session_2,3/10/2021,17:58:35,TRUE,Session_2__2021-03-10__17-58-35(1).JPG,Sciurus_sp,1,n,
MFDC3093.JPG,5_AEP,Session_2,3/10/2021,18:51:35,TRUE,Session_2__2021-03-10__18-51-35(1).JPG,NA,0,n,
MFDC3094.JPG,5_AEP,Session_2,3/10/2021,18:52:26,TRUE,Session_2__2021-03-10__18-52-26(1).JPG,NA,0,n,
MFDC3095.JPG,5_AEP,Session_2,3/11/2021,0:09:21,TRUE,Session_2__2021-03-11__00-09-21(1).JPG,Owl_sp,1,n,
MFDC3096.JPG,5_AEP,Session_2,3/11/2021,0:11:15,TRUE,Session_2__2021-03-11__00-11-15(1).JPG,NA,0,n,
MFDC3097.JPG,5_AEP,Session_2,3/11/2021,0:12:16,TRUE,Session_2__2021-03-11__00-12-16(1).JPG,Owl_sp,1,n,
MFDC3098.JPG,5_AEP,Session_2,3/11/2021,0:18:33,TRUE,Session_2__2021-03-11__00-18-33(1).JPG,NA,0,n,
MFDC3099.JPG,5_AEP,Session_2,3/11/2021,0:27:12,TRUE,Session_2__2021-03-11__00-27-12(1).JPG,Owl_sp,1,n,
MFDC3100.JPG,5_AEP,Session_2,3/11/2021,0:28:02,TRUE,Session_2__2021-03-11__00-28-02(1).JPG,Owl_sp,1,n,
MFDC3101.JPG,5_AEP,Session_2,3/11/2021,1:09:38,TRUE,Session_2__2021-03-11__01-09-38(1).JPG,NA,0,n,
MFDC3102.JPG,5_AEP,Session_2,3/11/2021,1:17:05,TRUE,Session_2__2021-03-11__01-17-05(1).JPG,NA,0,n,
MFDC3103.JPG,5_AEP,Session_2,3/11/2021,20:11:48,TRUE,Session_2__2021-03-11__20-11-48(1).JPG,Odocoileus_virginianus,1,n,
MFDC3104.JPG,5_AEP,Session_2,3/11/2021,20:11:50,TRUE,Session_2__2021-03-11__20-11-50(2).JPG,Odocoileus_virginianus,1,n,
MFDC3105.JPG,5_AEP,Session_2,3/11/2021,20:37:19,TRUE,Session_2__2021-03-11__20-37-19(1).JPG,NA,0,n,
MFDC3106.JPG,5_AEP,Session_2,3/11/2021,21:49:19,TRUE,Session_2__2021-03-11__21-49-19(1).JPG,NA,0,n,
MFDC3107.JPG,5_AEP,Session_2,3/12/2021,5:47:26,TRUE,Session_2__2021-03-12__05-47-26(1).JPG,NA,0,n,
MFDC3108.JPG,5_AEP,Session_2,3/13/2021,2:48:27,TRUE,Session_2__2021-03-13__02-48-27(1).JPG,NA,0,n,
MFDC3109.JPG,5_AEP,Session_2,3/14/2021,9:13:14,TRUE,Session_2__2021-03-14__09-13-14(1).JPG,Canis_familiaris,1,n,
MFDC3110.JPG,5_AEP,Session_2,3/14/2021,9:13:44,TRUE,Session_2__2021-03-14__09-13-44(2).JPG,Homo_sapiens,1,n,
MFDC3111.JPG,5_AEP,Session_2,3/14/2021,9:13:46,TRUE,Session_2__2021-03-14__09-13-46(3).JPG,Homo_sapiens,1,n,
MFDC3112.JPG,5_AEP,Session_2,3/14/2021,9:14:15,TRUE,Session_2__2021-03-14__09-14-15(1).JPG,Homo_sapiens,1,n,
MFDC3113.JPG,5_AEP,Session_2,3/14/2021,9:14:18,TRUE,Session_2__2021-03-14__09-14-18(2).JPG,Homo_sapiens,1,n,
MFDC3114.JPG,5_AEP,Session_2,3/14/2021,9:14:19,TRUE,Session_2__2021-03-14__09-14-19(3).JPG,Homo_sapiens,1,n,
MFDC3115.JPG,5_AEP,Session_3,3/14/2021,10:16:56,TRUE,Session_3__2021-03-14__10-16-56(1).JPG,Canis_familiaris,1,n,
MFDC3118.JPG,5_AEP,Session_3,3/14/2021,10:17:28,TRUE,Session_3__2021-03-14__10-17-28(1).JPG,NA,0,n,
MFDC3124.JPG,5_AEP,Session_3,3/14/2021,19:22:49,TRUE,Session_3__2021-03-14__19-22-49(1).JPG,Sciurus_sp,1,n,
MFDC3125.JPG,5_AEP,Session_3,3/14/2021,19:22:49,TRUE,Session_3__2021-03-14__19-22-49(2).JPG,Sciurus_sp,1,n,
MFDC3126.JPG,5_AEP,Session_3,3/14/2021,19:22:49,TRUE,Session_3__2021-03-14__19-22-49(3).JPG,Sciurus_sp,1,n,
MFDC3130.JPG,5_AEP,Session_3,3/15/2021,0:20:56,TRUE,Session_3__2021-03-15__00-20-56(1).JPG,NA,0,n,
MFDC3133.JPG,5_AEP,Session_3,3/15/2021,0:21:24,TRUE,Session_3__2021-03-15__00-21-24(1).JPG,Odocoileus_virginianus,1,n,
MFDC3134.JPG,5_AEP,Session_3,3/15/2021,0:21:25,TRUE,Session_3__2021-03-15__00-21-25(2).JPG,Odocoileus_virginianus,1,n,
MFDC3135.JPG,5_AEP,Session_3,3/15/2021,0:21:25,TRUE,Session_3__2021-03-15__00-21-25(3).JPG,Odocoileus_virginianus,1,n,
MFDC3136.JPG,5_AEP,Session_3,3/15/2021,0:21:56,TRUE,Session_3__2021-03-15__00-21-56(4).JPG,Odocoileus_virginianus,1,n,
MFDC3137.JPG,5_AEP,Session_3,3/15/2021,0:21:56,TRUE,Session_3__2021-03-15__00-21-56(5).JPG,Odocoileus_virginianus,1,n,
MFDC3138.JPG,5_AEP,Session_3,3/15/2021,0:21:56,TRUE,Session_3__2021-03-15__00-21-56(6).JPG,Odocoileus_virginianus,1,n,
MFDC3142.JPG,5_AEP,Session_3,3/15/2021,21:20:48,TRUE,Session_3__2021-03-15__21-20-48(1).JPG,Odocoileus_virginianus,1,n,
MFDC3143.JPG,5_AEP,Session_3,3/15/2021,21:20:49,TRUE,Session_3__2021-03-15__21-20-49(2).JPG,Odocoileus_virginianus,1,n,
MFDC3144.JPG,5_AEP,Session_3,3/15/2021,21:20:49,TRUE,Session_3__2021-03-15__21-20-49(3).JPG,Odocoileus_virginianus,1,n,
MFDC3145.JPG,5_AEP,Session_3,3/18/2021,19:39:19,TRUE,Session_3__2021-03-18__19-39-19(1).JPG,Didelphis_virginiana,1,n,
MFDC3146.JPG,5_AEP,Session_3,3/18/2021,19:39:20,TRUE,Session_3__2021-03-18__19-39-20(2).JPG,Lynx_rufus,1,n,
MFDC3147.JPG,5_AEP,Session_3,3/18/2021,19:39:20,TRUE,Session_3__2021-03-18__19-39-20(3).JPG,Lynx_rufus,1,n,
MFDC3151.JPG,5_AEP,Session_3,3/20/2021,19:29:12,TRUE,Session_3__2021-03-20__19-29-12(1).JPG,Lynx_rufus,1,n,
MFDC3152.JPG,5_AEP,Session_3,3/20/2021,19:29:13,TRUE,Session_3__2021-03-20__19-29-13(2).JPG,Odocoileus_virginianus,1,n,
MFDC3153.JPG,5_AEP,Session_3,3/20/2021,19:29:13,TRUE,Session_3__2021-03-20__19-29-13(3).JPG,Odocoileus_virginianus,1,n,
MFDC3154.JPG,5_AEP,Session_3,3/20/2021,19:29:42,TRUE,Session_3__2021-03-20__19-29-42(4).JPG,Odocoileus_virginianus,1,n,
MFDC3155.JPG,5_AEP,Session_3,3/20/2021,19:29:42,TRUE,Session_3__2021-03-20__19-29-42(5).JPG,Odocoileus_virginianus,1,n,
MFDC3156.JPG,5_AEP,Session_3,3/20/2021,19:29:42,TRUE,Session_3__2021-03-20__19-29-42(6).JPG,Odocoileus_virginianus,1,n,
MFDC3157.JPG,5_AEP,Session_3,3/20/2021,19:30:11,TRUE,Session_3__2021-03-20__19-30-11(1).JPG,Odocoileus_virginianus,3,n,
MFDC3158.JPG,5_AEP,Session_3,3/20/2021,19:30:12,TRUE,Session_3__2021-03-20__19-30-12(2).JPG,Odocoileus_virginianus,3,n,
MFDC3159.JPG,5_AEP,Session_3,3/20/2021,19:30:12,TRUE,Session_3__2021-03-20__19-30-12(3).JPG,Odocoileus_virginianus,3,n,
MFDC3160.JPG,5_AEP,Session_3,3/20/2021,19:30:42,TRUE,Session_3__2021-03-20__19-30-42(4).JPG,Odocoileus_virginianus,3,n,
MFDC3161.JPG,5_AEP,Session_3,3/20/2021,19:30:42,TRUE,Session_3__2021-03-20__19-30-42(5).JPG,Odocoileus_virginianus,3,n,
MFDC3162.JPG,5_AEP,Session_3,3/20/2021,19:30:42,TRUE,Session_3__2021-03-20__19-30-42(6).JPG,Odocoileus_virginianus,3,n,
MFDC3163.JPG,5_AEP,Session_3,3/20/2021,19:31:11,TRUE,Session_3__2021-03-20__19-31-11(1).JPG,Odocoileus_virginianus,1,n,
MFDC3164.JPG,5_AEP,Session_3,3/20/2021,19:31:12,TRUE,Session_3__2021-03-20__19-31-12(2).JPG,Odocoileus_virginianus,1,n,
MFDC3165.JPG,5_AEP,Session_3,3/20/2021,19:31:12,TRUE,Session_3__2021-03-20__19-31-12(3).JPG,Odocoileus_virginianus,1,n,
MFDC3166.JPG,5_AEP,Session_3,3/20/2021,19:32:13,TRUE,Session_3__2021-03-20__19-32-13(1).JPG,Odocoileus_virginianus,1,n,
MFDC3167.JPG,5_AEP,Session_3,3/20/2021,19:32:14,TRUE,Session_3__2021-03-20__19-32-14(2).JPG,Odocoileus_virginianus,1,n,
MFDC3168.JPG,5_AEP,Session_3,3/20/2021,19:32:14,TRUE,Session_3__2021-03-20__19-32-14(3).JPG,Odocoileus_virginianus,1,n,
MFDC3169.JPG,5_AEP,Session_3,3/20/2021,19:33:44,TRUE,Session_3__2021-03-20__19-33-44(1).JPG,Odocoileus_virginianus,1,n,
MFDC3170.JPG,5_AEP,Session_3,3/20/2021,19:33:44,TRUE,Session_3__2021-03-20__19-33-44(2).JPG,Odocoileus_virginianus,1,n,
MFDC3171.JPG,5_AEP,Session_3,3/20/2021,19:33:44,TRUE,Session_3__2021-03-20__19-33-44(3).JPG,Odocoileus_virginianus,1,n,
MFDC3172.JPG,5_AEP,Session_3,3/20/2021,19:34:48,TRUE,Session_3__2021-03-20__19-34-48(1).JPG,Odocoileus_virginianus,1,n,
MFDC3173.JPG,5_AEP,Session_3,3/20/2021,19:34:48,TRUE,Session_3__2021-03-20__19-34-48(2).JPG,Odocoileus_virginianus,1,n,
MFDC3174.JPG,5_AEP,Session_3,3/20/2021,19:34:49,TRUE,Session_3__2021-03-20__19-34-49(3).JPG,Odocoileus_virginianus,1,n,
MFDC3175.JPG,5_AEP,Session_3,3/20/2021,19:37:05,TRUE,Session_3__2021-03-20__19-37-05(1).JPG,Odocoileus_virginianus,1,n,
MFDC3176.JPG,5_AEP,Session_3,3/20/2021,19:37:05,TRUE,Session_3__2021-03-20__19-37-05(2).JPG,Odocoileus_virginianus,1,n,
MFDC3177.JPG,5_AEP,Session_3,3/20/2021,19:37:05,TRUE,Session_3__2021-03-20__19-37-05(3).JPG,Odocoileus_virginianus,1,n,
MFDC3178.JPG,5_AEP,Session_3,3/23/2021,3:01:28,TRUE,Session_3__2021-03-23__03-01-28(1).JPG,Procyon_lotor,1,n,
MFDC3179.JPG,5_AEP,Session_3,3/23/2021,3:01:29,TRUE,Session_3__2021-03-23__03-01-29(2).JPG,Procyon_lotor,1,n,
MFDC3180.JPG,5_AEP,Session_3,3/23/2021,3:01:29,TRUE,Session_3__2021-03-23__03-01-29(3).JPG,Procyon_lotor,1,n,
MFDC3181.JPG,5_AEP,Session_3,3/23/2021,18:27:54,TRUE,Session_3__2021-03-23__18-27-54(1).JPG,Sciurus_sp,1,n,
MFDC3182.JPG,5_AEP,Session_3,3/23/2021,18:27:54,TRUE,Session_3__2021-03-23__18-27-54(2).JPG,Sciurus_sp,1,n,
MFDC3183.JPG,5_AEP,Session_3,3/23/2021,18:27:55,TRUE,Session_3__2021-03-23__18-27-55(3).JPG,Sciurus_sp,1,n,
MFDC3184.JPG,5_AEP,Session_3,3/24/2021,18:50:26,TRUE,Session_3__2021-03-24__18-50-26(1).JPG,Sciurus_sp,1,n,
MFDC3185.JPG,5_AEP,Session_3,3/24/2021,18:50:26,TRUE,Session_3__2021-03-24__18-50-26(2).JPG,Sciurus_sp,1,n,
MFDC3186.JPG,5_AEP,Session_3,3/24/2021,18:50:26,TRUE,Session_3__2021-03-24__18-50-26(3).JPG,Sciurus_sp,1,n,
MFDC3187.JPG,5_AEP,Session_3,3/26/2021,5:48:44,TRUE,Session_3__2021-03-26__05-48-44(1).JPG,Unid,1,n,
MFDC3188.JPG,5_AEP,Session_3,3/26/2021,5:48:44,TRUE,Session_3__2021-03-26__05-48-44(2).JPG,Unid,1,n,
MFDC3190.JPG,5_AEP,Session_3,3/27/2021,8:09:46,TRUE,Session_3__2021-03-27__08-09-46(1).JPG,Canis_latrans,1,n,
MFDC3191.JPG,5_AEP,Session_3,3/27/2021,8:09:46,TRUE,Session_3__2021-03-27__08-09-46(2).JPG,Canis_latrans,1,n,
MFDC3192.JPG,5_AEP,Session_3,3/27/2021,8:09:46,TRUE,Session_3__2021-03-27__08-09-46(3).JPG,Canis_latrans,1,n,
MFDC3193.JPG,5_AEP,Session_3,3/27/2021,8:59:30,TRUE,Session_3__2021-03-27__08-59-30(1).JPG,Meleagris_gallopavo,1,n,
MFDC3194.JPG,5_AEP,Session_3,3/27/2021,8:59:31,TRUE,Session_3__2021-03-27__08-59-31(2).JPG,Meleagris_gallopavo,1,n,
MFDC3195.JPG,5_AEP,Session_3,3/27/2021,8:59:31,TRUE,Session_3__2021-03-27__08-59-31(3).JPG,Meleagris_gallopavo,1,n,
MFDC3205.JPG,5_AEP,Session_3,3/30/2021,7:09:42,TRUE,Session_3__2021-03-30__07-09-42(1).JPG,Sciurus_sp,1,n,
MFDC3206.JPG,5_AEP,Session_3,3/30/2021,7:09:42,TRUE,Session_3__2021-03-30__07-09-42(2).JPG,Sciurus_sp,1,n,
MFDC3207.JPG,5_AEP,Session_3,3/30/2021,7:09:42,TRUE,Session_3__2021-03-30__07-09-42(3).JPG,Sciurus_sp,1,n,
MFDC3229.JPG,5_AEP,Session_3,4/1/2021,5:14:32,TRUE,Session_3__2021-04-01__05-14-32(1).JPG,Procyon_lotor,1,n,
MFDC3230.JPG,5_AEP,Session_3,4/1/2021,5:14:32,TRUE,Session_3__2021-04-01__05-14-32(2).JPG,Procyon_lotor,1,n,
MFDC3240.JPG,5_AEP,Session_3,4/1/2021,11:48:25,TRUE,Session_3__2021-04-01__11-48-25(1).JPG,NA,0,n,
MFDC3241.JPG,5_AEP,Session_3,4/1/2021,19:49:52,TRUE,Session_3__2021-04-01__19-49-52(1).JPG,Sciurus_sp,1,n,
MFDC3242.JPG,5_AEP,Session_3,4/1/2021,19:49:54,TRUE,Session_3__2021-04-01__19-49-54(3).JPG,Sciurus_sp,1,n,
MFDC3243.JPG,5_AEP,Session_3,4/1/2021,19:49:53,TRUE,Session_3__2021-04-01__19-49-53(2).JPG,Sciurus_sp,1,n,
MFDC3247.JPG,5_AEP,Session_3,4/3/2021,19:06:34,TRUE,Session_3__2021-04-03__19-06-34(1).JPG,Odocoileus_virginianus,1,n,
MFDC3248.JPG,5_AEP,Session_3,4/3/2021,19:06:34,TRUE,Session_3__2021-04-03__19-06-34(2).JPG,Odocoileus_virginianus,1,n,
MFDC3249.JPG,5_AEP,Session_3,4/3/2021,19:06:35,TRUE,Session_3__2021-04-03__19-06-35(3).JPG,Odocoileus_virginianus,1,n,
MFDC3250.JPG,5_AEP,Session_3,4/3/2021,19:08:21,TRUE,Session_3__2021-04-03__19-08-21(1).JPG,Odocoileus_virginianus,1,n,
MFDC3251.JPG,5_AEP,Session_3,4/3/2021,19:08:21,TRUE,Session_3__2021-04-03__19-08-21(2).JPG,Odocoileus_virginianus,1,n,
MFDC3252.JPG,5_AEP,Session_3,4/3/2021,19:08:21,TRUE,Session_3__2021-04-03__19-08-21(3).JPG,Odocoileus_virginianus,1,n,
MFDC3253.JPG,5_AEP,Session_3,4/3/2021,19:09:57,TRUE,Session_3__2021-04-03__19-09-57(1).JPG,Odocoileus_virginianus,1,n,
MFDC3254.JPG,5_AEP,Session_3,4/3/2021,19:09:57,TRUE,Session_3__2021-04-03__19-09-57(2).JPG,Odocoileus_virginianus,1,n,
MFDC3255.JPG,5_AEP,Session_3,4/3/2021,19:09:58,TRUE,Session_3__2021-04-03__19-09-58(3).JPG,Odocoileus_virginianus,1,n,
MFDC3256.JPG,5_AEP,Session_3,4/3/2021,19:10:37,TRUE,Session_3__2021-04-03__19-10-37(1).JPG,Odocoileus_virginianus,1,n,
MFDC3257.JPG,5_AEP,Session_3,4/3/2021,19:10:37,TRUE,Session_3__2021-04-03__19-10-37(2).JPG,Odocoileus_virginianus,1,n,
MFDC3258.JPG,5_AEP,Session_3,4/3/2021,19:10:37,TRUE,Session_3__2021-04-03__19-10-37(3).JPG,Odocoileus_virginianus,1,n,
MFDC3265.JPG,5_AEP,Session_3,4/3/2021,19:15:17,TRUE,Session_3__2021-04-03__19-15-17(1).JPG,Odocoileus_virginianus,1,n,
MFDC3266.JPG,5_AEP,Session_3,4/3/2021,19:15:17,TRUE,Session_3__2021-04-03__19-15-17(2).JPG,Odocoileus_virginianus,1,n,
MFDC3267.JPG,5_AEP,Session_3,4/3/2021,19:15:17,TRUE,Session_3__2021-04-03__19-15-17(3).JPG,Odocoileus_virginianus,1,n,
MFDC3268.JPG,5_AEP,Session_3,4/3/2021,19:15:51,TRUE,Session_3__2021-04-03__19-15-51(4).JPG,Odocoileus_virginianus,1,n,
MFDC3269.JPG,5_AEP,Session_3,4/3/2021,19:15:51,TRUE,Session_3__2021-04-03__19-15-51(5).JPG,Odocoileus_virginianus,1,n,
MFDC3270.JPG,5_AEP,Session_3,4/3/2021,19:15:52,TRUE,Session_3__2021-04-03__19-15-52(6).JPG,Odocoileus_virginianus,1,n,
MFDC3271.JPG,5_AEP,Session_3,4/3/2021,23:22:24,TRUE,Session_3__2021-04-03__23-22-24(1).JPG,Didelphis_virginiana,1,n,
MFDC3272.JPG,5_AEP,Session_3,4/3/2021,23:22:24,TRUE,Session_3__2021-04-03__23-22-24(2).JPG,Didelphis_virginiana,1,n,
MFDC3273.JPG,5_AEP,Session_3,4/3/2021,23:22:24,TRUE,Session_3__2021-04-03__23-22-24(3).JPG,Didelphis_virginiana,1,n,
MFDC3274.JPG,5_AEP,Session_3,4/6/2021,3:21:07,TRUE,Session_3__2021-04-06__03-21-07(1).JPG,Procyon_lotor,1,n,
MFDC3275.JPG,5_AEP,Session_3,4/6/2021,3:21:07,TRUE,Session_3__2021-04-06__03-21-07(2).JPG,Procyon_lotor,1,n,
MFDC3276.JPG,5_AEP,Session_3,4/6/2021,3:21:07,TRUE,Session_3__2021-04-06__03-21-07(3).JPG,Procyon_lotor,1,n,
MFDC3277.JPG,5_AEP,Session_3,4/6/2021,3:21:51,TRUE,Session_3__2021-04-06__03-21-51(4).JPG,Procyon_lotor,1,n,
MFDC3278.JPG,5_AEP,Session_3,4/6/2021,3:21:52,TRUE,Session_3__2021-04-06__03-21-52(5).JPG,Procyon_lotor,1,n,
MFDC3279.JPG,5_AEP,Session_3,4/6/2021,3:21:52,TRUE,Session_3__2021-04-06__03-21-52(6).JPG,Procyon_lotor,1,n,
MFDC3280.JPG,5_AEP,Session_3,4/6/2021,3:23:33,TRUE,Session_3__2021-04-06__03-23-33(2).JPG,Procyon_lotor,1,n,
MFDC3281.JPG,5_AEP,Session_3,4/6/2021,3:23:32,TRUE,Session_3__2021-04-06__03-23-32(1).JPG,Procyon_lotor,1,n,
MFDC3282.JPG,5_AEP,Session_3,4/6/2021,3:23:33,TRUE,Session_3__2021-04-06__03-23-33(3).JPG,Procyon_lotor,1,n,
MFDC3283.JPG,5_AEP,Session_3,4/6/2021,4:06:53,TRUE,Session_3__2021-04-06__04-06-53(1).JPG,Procyon_lotor,1,n,
MFDC3284.JPG,5_AEP,Session_3,4/6/2021,4:06:54,TRUE,Session_3__2021-04-06__04-06-54(2).JPG,Procyon_lotor,1,n,
MFDC3285.JPG,5_AEP,Session_3,4/6/2021,4:06:54,TRUE,Session_3__2021-04-06__04-06-54(3).JPG,Procyon_lotor,1,n,
MFDC3286.JPG,5_AEP,Session_3,4/6/2021,19:58:53,TRUE,Session_3__2021-04-06__19-58-53(1).JPG,Odocoileus_virginianus,1,n,
MFDC3287.JPG,5_AEP,Session_3,4/6/2021,19:58:53,TRUE,Session_3__2021-04-06__19-58-53(2).JPG,Odocoileus_virginianus,1,n,
MFDC3288.JPG,5_AEP,Session_3,4/6/2021,19:58:53,TRUE,Session_3__2021-04-06__19-58-53(3).JPG,Odocoileus_virginianus,1,n,
MFDC3289.JPG,5_AEP,Session_3,4/6/2021,19:59:43,TRUE,Session_3__2021-04-06__19-59-43(1).JPG,Odocoileus_virginianus,1,n,
MFDC3290.JPG,5_AEP,Session_3,4/6/2021,19:59:43,TRUE,Session_3__2021-04-06__19-59-43(2).JPG,Odocoileus_virginianus,1,n,
MFDC3291.JPG,5_AEP,Session_3,4/6/2021,19:59:45,TRUE,Session_3__2021-04-06__19-59-45(3).JPG,Odocoileus_virginianus,1,n,
MFDC3292.JPG,5_AEP,Session_3,4/6/2021,20:00:15,TRUE,Session_3__2021-04-06__20-00-15(1).JPG,Procyon_lotor,1,n,
MFDC3293.JPG,5_AEP,Session_3,4/6/2021,20:00:15,TRUE,Session_3__2021-04-06__20-00-15(2).JPG,Procyon_lotor,1,n,
MFDC3294.JPG,5_AEP,Session_3,4/6/2021,20:00:15,TRUE,Session_3__2021-04-06__20-00-15(3).JPG,Procyon_lotor,1,n,
MFDC3298.JPG,5_AEP,Session_3,4/7/2021,22:00:18,TRUE,Session_3__2021-04-07__22-00-18(1).JPG,Procyon_lotor,1,n,
MFDC3299.JPG,5_AEP,Session_3,4/7/2021,22:00:18,TRUE,Session_3__2021-04-07__22-00-18(2).JPG,Procyon_lotor,1,n,
MFDC3300.JPG,5_AEP,Session_3,4/7/2021,22:00:18,TRUE,Session_3__2021-04-07__22-00-18(3).JPG,Procyon_lotor,1,n,
MFDC3301.JPG,5_AEP,Session_3,4/7/2021,22:40:33,TRUE,Session_3__2021-04-07__22-40-33(1).JPG,Procyon_lotor,1,n,
MFDC3302.JPG,5_AEP,Session_3,4/7/2021,22:40:33,TRUE,Session_3__2021-04-07__22-40-33(2).JPG,Procyon_lotor,1,n,
MFDC3303.JPG,5_AEP,Session_3,4/7/2021,22:40:34,TRUE,Session_3__2021-04-07__22-40-34(3).JPG,Procyon_lotor,1,n,
MFDC3334.JPG,5_AEP,Session_3,4/10/2021,18:54:59,TRUE,Session_3__2021-04-10__18-54-59(1).JPG,Odocoileus_virginianus,1,n,
MFDC3335.JPG,5_AEP,Session_3,4/10/2021,18:54:59,TRUE,Session_3__2021-04-10__18-54-59(2).JPG,Odocoileus_virginianus,1,n,
MFDC3336.JPG,5_AEP,Session_3,4/10/2021,18:54:59,TRUE,Session_3__2021-04-10__18-54-59(3).JPG,Odocoileus_virginianus,1,n,
MFDC3355.JPG,5_AEP,Session_3,4/11/2021,10:34:53,TRUE,Session_3__2021-04-11__10-34-53(1).JPG,Homo_sapiens,1,n,
MFDC3356.JPG,5_AEP,Session_3,4/11/2021,10:34:55,TRUE,Session_3__2021-04-11__10-34-55(3).JPG,Homo_sapiens,1,n,
MFDC3357.JPG,5_AEP,Session_3,4/11/2021,10:34:54,TRUE,Session_3__2021-04-11__10-34-54(2).JPG,Homo_sapiens,1,n,
MFDC3361.JPG,5_AEP,Session_4,4/11/2021,10:39:50,TRUE,Session_4__2021-04-11__10-39-50(1).JPG,NA,0,n,
MFDC3367.JPG,5_AEP,Session_4,4/12/2021,0:45:13,TRUE,Session_4__2021-04-12__00-45-13(1).JPG,Procyon_lotor,1,n,
MFDC3368.JPG,5_AEP,Session_4,4/12/2021,0:45:14,TRUE,Session_4__2021-04-12__00-45-14(3).JPG,Procyon_lotor,1,n,
MFDC3369.JPG,5_AEP,Session_4,4/12/2021,0:45:13,TRUE,Session_4__2021-04-12__00-45-13(2).JPG,Procyon_lotor,1,n,
MFDC3373.JPG,5_AEP,Session_4,4/12/2021,3:46:50,TRUE,Session_4__2021-04-12__03-46-50(1).JPG,Unid,1,n,
MFDC3374.JPG,5_AEP,Session_4,4/12/2021,3:46:50,TRUE,Session_4__2021-04-12__03-46-50(2).JPG,Unid,1,n,
MFDC3375.JPG,5_AEP,Session_4,4/12/2021,3:46:51,TRUE,Session_4__2021-04-12__03-46-51(3).JPG,Unid,1,n,
MFDC3379.JPG,5_AEP,Session_4,4/12/2021,15:29:36,TRUE,Session_4__2021-04-12__15-29-36(3).JPG,Odocoileus_virginianus,1,n,
MFDC3380.JPG,5_AEP,Session_4,4/12/2021,15:29:35,TRUE,Session_4__2021-04-12__15-29-35(1).JPG,Odocoileus_virginianus,1,n,
MFDC3381.JPG,5_AEP,Session_4,4/12/2021,15:29:35,TRUE,Session_4__2021-04-12__15-29-35(2).JPG,Odocoileus_virginianus,1,n,
MFDC3382.JPG,5_AEP,Session_4,4/13/2021,10:54:09,TRUE,Session_4__2021-04-13__10-54-09(1).JPG,Meleagris_gallopavo,1,n,
MFDC3383.JPG,5_AEP,Session_4,4/13/2021,10:54:11,TRUE,Session_4__2021-04-13__10-54-11(3).JPG,Meleagris_gallopavo,1,n,
MFDC3384.JPG,5_AEP,Session_4,4/13/2021,10:54:10,TRUE,Session_4__2021-04-13__10-54-10(2).JPG,Meleagris_gallopavo,1,n,
MFDC3392.JPG,5_AEP,Session_4,4/14/2021,2:42:52,TRUE,Session_4__2021-04-14__02-42-52(2).JPG,Canis_latrans,1,n,
MFDC3393.JPG,5_AEP,Session_4,4/14/2021,2:42:51,TRUE,Session_4__2021-04-14__02-42-51(1).JPG,Canis_latrans,1,n,
MFDC3400.JPG,5_AEP,Session_4,4/14/2021,21:02:03,TRUE,Session_4__2021-04-14__21-02-03(1).JPG,Lynx_rufus,1,n,
MFDC3401.JPG,5_AEP,Session_4,4/14/2021,21:02:03,TRUE,Session_4__2021-04-14__21-02-03(2).JPG,Lynx_rufus,1,n,
MFDC3402.JPG,5_AEP,Session_4,4/14/2021,21:02:03,TRUE,Session_4__2021-04-14__21-02-03(3).JPG,Lynx_rufus,1,n,
MFDC3409.JPG,5_AEP,Session_4,4/15/2021,19:29:37,TRUE,Session_4__2021-04-15__19-29-37(1).JPG,Odocoileus_virginianus,1,n,
MFDC3410.JPG,5_AEP,Session_4,4/15/2021,19:29:39,TRUE,Session_4__2021-04-15__19-29-39(3).JPG,Odocoileus_virginianus,1,n,
MFDC3411.JPG,5_AEP,Session_4,4/15/2021,19:29:38,TRUE,Session_4__2021-04-15__19-29-38(2).JPG,Odocoileus_virginianus,1,n,
MFDC3415.JPG,5_AEP,Session_4,4/16/2021,7:55:03,TRUE,Session_4__2021-04-16__07-55-03(1).JPG,Odocoileus_virginianus,1,n,
MFDC3416.JPG,5_AEP,Session_4,4/16/2021,7:55:03,TRUE,Session_4__2021-04-16__07-55-03(2).JPG,Odocoileus_virginianus,1,n,
MFDC3417.JPG,5_AEP,Session_4,4/16/2021,7:55:04,TRUE,Session_4__2021-04-16__07-55-04(3).JPG,Odocoileus_virginianus,1,n,
MFDC3418.JPG,5_AEP,Session_4,4/16/2021,7:55:36,TRUE,Session_4__2021-04-16__07-55-36(4).JPG,Odocoileus_virginianus,1,n,
MFDC3419.JPG,5_AEP,Session_4,4/16/2021,7:55:36,TRUE,Session_4__2021-04-16__07-55-36(5).JPG,Odocoileus_virginianus,1,n,
MFDC3420.JPG,5_AEP,Session_4,4/16/2021,7:55:36,TRUE,Session_4__2021-04-16__07-55-36(6).JPG,Odocoileus_virginianus,1,n,
MFDC3421.JPG,5_AEP,Session_4,4/16/2021,7:56:06,TRUE,Session_4__2021-04-16__07-56-06(1).JPG,Odocoileus_virginianus,1,n,
MFDC3422.JPG,5_AEP,Session_4,4/16/2021,7:56:07,TRUE,Session_4__2021-04-16__07-56-07(2).JPG,Odocoileus_virginianus,1,n,
MFDC3423.JPG,5_AEP,Session_4,4/16/2021,7:56:07,TRUE,Session_4__2021-04-16__07-56-07(3).JPG,Odocoileus_virginianus,1,n,
MFDC3424.JPG,5_AEP,Session_4,4/16/2021,16:12:18,TRUE,Session_4__2021-04-16__16-12-18(1).JPG,Lynx_rufus,1,n,
MFDC3425.JPG,5_AEP,Session_4,4/16/2021,16:12:18,TRUE,Session_4__2021-04-16__16-12-18(2).JPG,Lynx_rufus,1,n,
MFDC3426.JPG,5_AEP,Session_4,4/16/2021,16:12:18,TRUE,Session_4__2021-04-16__16-12-18(3).JPG,Lynx_rufus,1,n,
MFDC3427.JPG,5_AEP,Session_4,4/16/2021,16:12:51,TRUE,Session_4__2021-04-16__16-12-51(4).JPG,Lynx_rufus,1,n,
MFDC3428.JPG,5_AEP,Session_4,4/16/2021,16:12:51,TRUE,Session_4__2021-04-16__16-12-51(5).JPG,Lynx_rufus,1,n,
MFDC3429.JPG,5_AEP,Session_4,4/16/2021,16:12:51,TRUE,Session_4__2021-04-16__16-12-51(6).JPG,Lynx_rufus,1,y,
MFDC3430.JPG,5_AEP,Session_4,4/17/2021,9:02:30,TRUE,Session_4__2021-04-17__09-02-30(1).JPG,Odocoileus_virginianus,1,n,
MFDC3431.JPG,5_AEP,Session_4,4/17/2021,9:02:31,TRUE,Session_4__2021-04-17__09-02-31(2).JPG,Odocoileus_virginianus,1,n,
MFDC3432.JPG,5_AEP,Session_4,4/17/2021,9:02:31,TRUE,Session_4__2021-04-17__09-02-31(3).JPG,Odocoileus_virginianus,1,n,
MFDC3433.JPG,5_AEP,Session_4,4/17/2021,9:03:00,TRUE,Session_4__2021-04-17__09-03-00(1).JPG,Odocoileus_virginianus,1,n,
MFDC3434.JPG,5_AEP,Session_4,4/17/2021,9:03:01,TRUE,Session_4__2021-04-17__09-03-01(2).JPG,Odocoileus_virginianus,1,n,
MFDC3435.JPG,5_AEP,Session_4,4/17/2021,9:03:02,TRUE,Session_4__2021-04-17__09-03-02(3).JPG,Odocoileus_virginianus,1,n,
MFDC3436.JPG,5_AEP,Session_4,4/17/2021,9:03:30,TRUE,Session_4__2021-04-17__09-03-30(4).JPG,Odocoileus_virginianus,1,n,
MFDC3437.JPG,5_AEP,Session_4,4/17/2021,9:03:31,TRUE,Session_4__2021-04-17__09-03-31(5).JPG,Odocoileus_virginianus,1,n,
MFDC3438.JPG,5_AEP,Session_4,4/17/2021,9:03:31,TRUE,Session_4__2021-04-17__09-03-31(6).JPG,Odocoileus_virginianus,1,n,
MFDC3439.JPG,5_AEP,Session_4,4/17/2021,11:33:36,TRUE,Session_4__2021-04-17__11-33-36(1).JPG,Avian_sp,1,n,Cardinal
MFDC3440.JPG,5_AEP,Session_4,4/17/2021,11:33:36,TRUE,Session_4__2021-04-17__11-33-36(2).JPG,Avian_sp,1,n,Cardinal
MFDC3441.JPG,5_AEP,Session_4,4/17/2021,11:33:36,TRUE,Session_4__2021-04-17__11-33-36(3).JPG,Avian_sp,1,n,Cardinal
MFDC3448.JPG,5_AEP,Session_4,4/18/2021,7:59:36,TRUE,Session_4__2021-04-18__07-59-36(1).JPG,Odocoileus_virginianus,1,n,
MFDC3449.JPG,5_AEP,Session_4,4/18/2021,7:59:37,TRUE,Session_4__2021-04-18__07-59-37(2).JPG,Odocoileus_virginianus,1,n,
MFDC3450.JPG,5_AEP,Session_4,4/18/2021,7:59:37,TRUE,Session_4__2021-04-18__07-59-37(3).JPG,Odocoileus_virginianus,1,n,
MFDC3451.JPG,5_AEP,Session_4,4/18/2021,8:00:20,TRUE,Session_4__2021-04-18__08-00-20(1).JPG,Odocoileus_virginianus,1,n,
MFDC3452.JPG,5_AEP,Session_4,4/18/2021,8:00:20,TRUE,Session_4__2021-04-18__08-00-20(2).JPG,Odocoileus_virginianus,1,n,
MFDC3453.JPG,5_AEP,Session_4,4/18/2021,8:00:20,TRUE,Session_4__2021-04-18__08-00-20(3).JPG,Odocoileus_virginianus,1,n,
MFDC3457.JPG,5_AEP,Session_4,4/18/2021,8:01:50,TRUE,Session_4__2021-04-18__08-01-50(1).JPG,Odocoileus_virginianus,1,n,
MFDC3458.JPG,5_AEP,Session_4,4/18/2021,8:01:51,TRUE,Session_4__2021-04-18__08-01-51(3).JPG,Odocoileus_virginianus,1,n,
MFDC3459.JPG,5_AEP,Session_4,4/18/2021,8:01:50,TRUE,Session_4__2021-04-18__08-01-50(2).JPG,Odocoileus_virginianus,1,n,
MFDC3460.JPG,5_AEP,Session_4,4/18/2021,8:02:27,TRUE,Session_4__2021-04-18__08-02-27(1).JPG,Odocoileus_virginianus,1,n,
MFDC3461.JPG,5_AEP,Session_4,4/18/2021,8:02:27,TRUE,Session_4__2021-04-18__08-02-27(2).JPG,Odocoileus_virginianus,1,n,
MFDC3462.JPG,5_AEP,Session_4,4/18/2021,8:02:27,TRUE,Session_4__2021-04-18__08-02-27(3).JPG,Odocoileus_virginianus,1,n,
MFDC3463.JPG,5_AEP,Session_4,4/18/2021,8:02:58,TRUE,Session_4__2021-04-18__08-02-58(4).JPG,Odocoileus_virginianus,1,n,
MFDC3464.JPG,5_AEP,Session_4,4/18/2021,8:02:58,TRUE,Session_4__2021-04-18__08-02-58(5).JPG,Odocoileus_virginianus,1,n,
MFDC3465.JPG,5_AEP,Session_4,4/18/2021,8:02:58,TRUE,Session_4__2021-04-18__08-02-58(6).JPG,Odocoileus_virginianus,1,n,
MFDC3466.JPG,5_AEP,Session_4,4/19/2021,6:23:38,TRUE,Session_4__2021-04-19__06-23-38(1).JPG,Odocoileus_virginianus,1,n,
MFDC3467.JPG,5_AEP,Session_4,4/19/2021,6:23:38,TRUE,Session_4__2021-04-19__06-23-38(2).JPG,Odocoileus_virginianus,1,n,
MFDC3468.JPG,5_AEP,Session_4,4/19/2021,6:23:38,TRUE,Session_4__2021-04-19__06-23-38(3).JPG,Odocoileus_virginianus,1,n,
MFDC3475.JPG,5_AEP,Session_4,4/20/2021,8:04:26,TRUE,Session_4__2021-04-20__08-04-26(1).JPG,NA,0,n,
MFDC3476.JPG,5_AEP,Session_4,4/20/2021,8:04:26,TRUE,Session_4__2021-04-20__08-04-26(2).JPG,NA,0,n,
MFDC3477.JPG,5_AEP,Session_4,4/20/2021,8:04:26,TRUE,Session_4__2021-04-20__08-04-26(3).JPG,NA,0,n,
MFDC3478.JPG,5_AEP,Session_4,4/20/2021,17:50:32,TRUE,Session_4__2021-04-20__17-50-32(1).JPG,Lynx_rufus,1,n,
MFDC3479.JPG,5_AEP,Session_4,4/20/2021,17:50:32,TRUE,Session_4__2021-04-20__17-50-32(2).JPG,Lynx_rufus,1,y,
MFDC3480.JPG,5_AEP,Session_4,4/20/2021,17:50:33,TRUE,Session_4__2021-04-20__17-50-33(3).JPG,Lynx_rufus,1,y,
MFDC3481.JPG,5_AEP,Session_4,4/20/2021,17:53:39,TRUE,Session_4__2021-04-20__17-53-39(1).JPG,Lynx_rufus,1,n,
MFDC3529.JPG,5_AEP,Session_4,4/23/2021,19:29:22,TRUE,Session_4__2021-04-23__19-29-22(1).JPG,Sciurus_sp,1,n,
MFDC3530.JPG,5_AEP,Session_4,4/23/2021,19:29:22,TRUE,Session_4__2021-04-23__19-29-22(2).JPG,Sciurus_sp,1,n,
MFDC3531.JPG,5_AEP,Session_4,4/23/2021,19:29:22,TRUE,Session_4__2021-04-23__19-29-22(3).JPG,Sciurus_sp,1,n,
MFDC3547.JPG,5_AEP,Session_4,4/26/2021,9:05:01,TRUE,Session_4__2021-04-26__09-05-01(1).JPG,Sciurus_sp,1,n,
MFDC3548.JPG,5_AEP,Session_4,4/26/2021,9:05:02,TRUE,Session_4__2021-04-26__09-05-02(2).JPG,Sciurus_sp,1,n,
MFDC3559.JPG,5_AEP,Session_4,4/27/2021,9:09:46,TRUE,Session_4__2021-04-27__09-09-46(1).JPG,Odocoileus_virginianus,1,n,
MFDC3560.JPG,5_AEP,Session_4,4/27/2021,9:09:48,TRUE,Session_4__2021-04-27__09-09-48(3).JPG,Odocoileus_virginianus,1,n,
MFDC3561.JPG,5_AEP,Session_4,4/27/2021,9:09:47,TRUE,Session_4__2021-04-27__09-09-47(2).JPG,Odocoileus_virginianus,1,n,
MFDC3613.JPG,5_AEP,Session_4,5/2/2021,9:34:01,TRUE,Session_4__2021-05-02__09-34-01(1).JPG,Homo_sapiens,1,n,hunter
MFDC3614.JPG,5_AEP,Session_4,5/2/2021,9:34:01,TRUE,Session_4__2021-05-02__09-34-01(2).JPG,Homo_sapiens,1,n,hunter
MFDC3615.JPG,5_AEP,Session_4,5/2/2021,9:34:01,TRUE,Session_4__2021-05-02__09-34-01(3).JPG,Homo_sapiens,1,n,hunter
MFDC3622.JPG,5_AEP,Session_4,5/3/2021,2:33:37,TRUE,Session_4__2021-05-03__02-33-37(1).JPG,Odocoileus_virginianus,1,n,
MFDC3623.JPG,5_AEP,Session_4,5/3/2021,2:33:37,TRUE,Session_4__2021-05-03__02-33-37(2).JPG,Odocoileus_virginianus,1,n,
MFDC3624.JPG,5_AEP,Session_4,5/3/2021,2:33:38,TRUE,Session_4__2021-05-03__02-33-38(3).JPG,Odocoileus_virginianus,1,n,
MFDC3628.JPG,5_AEP,Session_4,5/3/2021,3:56:55,TRUE,Session_4__2021-05-03__03-56-55(1).JPG,Odocoileus_virginianus,1,n,
MFDC3629.JPG,5_AEP,Session_4,5/3/2021,3:56:56,TRUE,Session_4__2021-05-03__03-56-56(3).JPG,Odocoileus_virginianus,1,n,
MFDC3630.JPG,5_AEP,Session_4,5/3/2021,3:56:55,TRUE,Session_4__2021-05-03__03-56-55(2).JPG,Odocoileus_virginianus,1,n,
MFDC3634.JPG,5_AEP,Session_4,5/4/2021,18:15:38,TRUE,Session_4__2021-05-04__18-15-38(1).JPG,Odocoileus_virginianus,1,n,
MFDC3635.JPG,5_AEP,Session_4,5/4/2021,18:15:39,TRUE,Session_4__2021-05-04__18-15-39(2).JPG,Odocoileus_virginianus,1,n,
MFDC3636.JPG,5_AEP,Session_4,5/4/2021,18:15:40,TRUE,Session_4__2021-05-04__18-15-40(3).JPG,Odocoileus_virginianus,1,n,
MFDC3637.JPG,5_AEP,Session_4,5/4/2021,18:16:11,TRUE,Session_4__2021-05-04__18-16-11(1).JPG,Odocoileus_virginianus,1,n,
MFDC3638.JPG,5_AEP,Session_4,5/4/2021,18:16:13,TRUE,Session_4__2021-05-04__18-16-13(3).JPG,Odocoileus_virginianus,1,n,
MFDC3639.JPG,5_AEP,Session_4,5/4/2021,18:16:12,TRUE,Session_4__2021-05-04__18-16-12(2).JPG,Odocoileus_virginianus,1,n,
MFDC3640.JPG,5_AEP,Session_4,5/4/2021,18:16:44,TRUE,Session_4__2021-05-04__18-16-44(6).JPG,Odocoileus_virginianus,1,n,
MFDC3641.JPG,5_AEP,Session_4,5/4/2021,18:16:43,TRUE,Session_4__2021-05-04__18-16-43(4).JPG,Odocoileus_virginianus,1,n,
MFDC3642.JPG,5_AEP,Session_4,5/4/2021,18:16:43,TRUE,Session_4__2021-05-04__18-16-43(5).JPG,Odocoileus_virginianus,1,n,
MFDC3643.JPG,5_AEP,Session_4,5/4/2021,18:17:12,TRUE,Session_4__2021-05-04__18-17-12(1).JPG,Odocoileus_virginianus,1,n,
MFDC3644.JPG,5_AEP,Session_4,5/4/2021,18:17:13,TRUE,Session_4__2021-05-04__18-17-13(2).JPG,Odocoileus_virginianus,1,n,
MFDC3645.JPG,5_AEP,Session_4,5/4/2021,18:17:13,TRUE,Session_4__2021-05-04__18-17-13(3).JPG,Odocoileus_virginianus,1,n,
MFDC3673.JPG,5_AEP,Session_4,5/5/2021,20:24:51,TRUE,Session_4__2021-05-05__20-24-51(1).JPG,Odocoileus_virginianus,1,n,
MFDC3674.JPG,5_AEP,Session_4,5/5/2021,20:24:51,TRUE,Session_4__2021-05-05__20-24-51(2).JPG,Odocoileus_virginianus,1,n,
MFDC3675.JPG,5_AEP,Session_4,5/5/2021,20:24:51,TRUE,Session_4__2021-05-05__20-24-51(3).JPG,Odocoileus_virginianus,1,n,
MFDC3676.JPG,5_AEP,Session_4,5/6/2021,8:10:12,TRUE,Session_4__2021-05-06__08-10-12(2).JPG,Odocoileus_virginianus,1,n,
MFDC3677.JPG,5_AEP,Session_4,5/6/2021,8:10:11,TRUE,Session_4__2021-05-06__08-10-11(1).JPG,Odocoileus_virginianus,1,n,
MFDC3678.JPG,5_AEP,Session_4,5/6/2021,8:10:12,TRUE,Session_4__2021-05-06__08-10-12(3).JPG,Odocoileus_virginianus,1,n,
MFDC3730.JPG,5_AEP,Session_4,5/11/2021,6:45:48,TRUE,Session_4__2021-05-11__06-45-48(1).JPG,Odocoileus_virginianus,1,n,
MFDC3731.JPG,5_AEP,Session_4,5/11/2021,6:45:49,TRUE,Session_4__2021-05-11__06-45-49(2).JPG,Odocoileus_virginianus,1,n,
MFDC3732.JPG,5_AEP,Session_4,5/11/2021,6:45:49,TRUE,Session_4__2021-05-11__06-45-49(3).JPG,Odocoileus_virginianus,1,n,
MFDC3733.JPG,5_AEP,Session_4,5/11/2021,6:46:20,TRUE,Session_4__2021-05-11__06-46-20(1).JPG,Odocoileus_virginianus,1,n,
MFDC3734.JPG,5_AEP,Session_4,5/11/2021,6:46:21,TRUE,Session_4__2021-05-11__06-46-21(2).JPG,Odocoileus_virginianus,1,n,
MFDC3735.JPG,5_AEP,Session_4,5/11/2021,6:46:21,TRUE,Session_4__2021-05-11__06-46-21(3).JPG,Odocoileus_virginianus,1,n,
MFDC3736.JPG,5_AEP,Session_4,5/11/2021,6:55:59,TRUE,Session_4__2021-05-11__06-55-59(3).JPG,Odocoileus_virginianus,1,n,
MFDC3737.JPG,5_AEP,Session_4,5/11/2021,6:55:58,TRUE,Session_4__2021-05-11__06-55-58(1).JPG,Odocoileus_virginianus,1,n,
MFDC3738.JPG,5_AEP,Session_4,5/11/2021,6:55:58,TRUE,Session_4__2021-05-11__06-55-58(2).JPG,Odocoileus_virginianus,1,n,
MFDC3739.JPG,5_AEP,Session_4,5/11/2021,7:32:27,TRUE,Session_4__2021-05-11__07-32-27(1).JPG,Odocoileus_virginianus,1,n,
MFDC3740.JPG,5_AEP,Session_4,5/11/2021,7:32:28,TRUE,Session_4__2021-05-11__07-32-28(2).JPG,Odocoileus_virginianus,1,n,
MFDC3741.JPG,5_AEP,Session_4,5/11/2021,7:32:29,TRUE,Session_4__2021-05-11__07-32-29(3).JPG,Odocoileus_virginianus,1,n,
MFDC3745.JPG,5_AEP,Session_4,5/11/2021,19:33:22,TRUE,Session_4__2021-05-11__19-33-22(1).JPG,Odocoileus_virginianus,1,n,
MFDC3746.JPG,5_AEP,Session_4,5/11/2021,19:33:23,TRUE,Session_4__2021-05-11__19-33-23(2).JPG,Odocoileus_virginianus,1,n,
MFDC3747.JPG,5_AEP,Session_4,5/11/2021,19:33:24,TRUE,Session_4__2021-05-11__19-33-24(3).JPG,Odocoileus_virginianus,1,n,
MFDC3748.JPG,5_AEP,Session_4,5/11/2021,19:33:52,TRUE,Session_4__2021-05-11__19-33-52(4).JPG,Odocoileus_virginianus,1,n,
MFDC3749.JPG,5_AEP,Session_4,5/11/2021,19:33:53,TRUE,Session_4__2021-05-11__19-33-53(5).JPG,Odocoileus_virginianus,1,n,
MFDC3750.JPG,5_AEP,Session_4,5/11/2021,19:33:53,TRUE,Session_4__2021-05-11__19-33-53(6).JPG,Odocoileus_virginianus,1,n,
MFDC3751.JPG,5_AEP,Session_4,5/11/2021,19:44:21,TRUE,Session_4__2021-05-11__19-44-21(1).JPG,Sciurus_sp,1,n,
MFDC3754.JPG,5_AEP,Session_4,5/12/2021,9:39:37,TRUE,Session_4__2021-05-12__09-39-37(1).JPG,Odocoileus_virginianus,1,n,
MFDC3755.JPG,5_AEP,Session_4,5/12/2021,9:39:37,TRUE,Session_4__2021-05-12__09-39-37(2).JPG,Odocoileus_virginianus,1,n,
MFDC3756.JPG,5_AEP,Session_4,5/12/2021,9:39:38,TRUE,Session_4__2021-05-12__09-39-38(3).JPG,Odocoileus_virginianus,1,n,
MFDC3757.JPG,5_AEP,Session_4,5/12/2021,9:40:09,TRUE,Session_4__2021-05-12__09-40-09(1).JPG,Odocoileus_virginianus,1,n,
MFDC3758.JPG,5_AEP,Session_4,5/12/2021,9:40:09,TRUE,Session_4__2021-05-12__09-40-09(2).JPG,Odocoileus_virginianus,1,n,
MFDC3759.JPG,5_AEP,Session_4,5/12/2021,9:40:09,TRUE,Session_4__2021-05-12__09-40-09(3).JPG,Odocoileus_virginianus,1,n,
MFDC3771.JPG,5_AEP,Session_4,5/12/2021,11:10:12,TRUE,Session_4__2021-05-12__11-10-12(1).JPG,Homo_sapiens,1,n,
MFDC3772.JPG,5_AEP,Session_4,5/12/2021,11:10:42,TRUE,Session_4__2021-05-12__11-10-42(2).JPG,Homo_sapiens,1,n,
MFDC3773.JPG,5_AEP,Session_4,5/12/2021,11:10:42,TRUE,Session_4__2021-05-12__11-10-42(3).JPG,Homo_sapiens,1,n,
MFDC3774.JPG,5_AEP,Session_4,5/12/2021,11:10:42,TRUE,Session_4__2021-05-12__11-10-42(4).JPG,Homo_sapiens,1,n,
MFDC3775.JPG,5_AEP,Session_4,5/12/2021,11:11:12,TRUE,Session_4__2021-05-12__11-11-12(1).JPG,Homo_sapiens,1,n,
MFDC3776.JPG,5_AEP,Session_4,5/12/2021,11:11:12,TRUE,Session_4__2021-05-12__11-11-12(2).JPG,Homo_sapiens,1,n,
MFDC3777.JPG,5_AEP,Session_4,5/12/2021,11:11:12,TRUE,Session_4__2021-05-12__11-11-12(3).JPG,Homo_sapiens,1,n,
MFDC3778.JPG,5_AEP,Session_4,5/12/2021,11:11:42,TRUE,Session_4__2021-05-12__11-11-42(4).JPG,Homo_sapiens,1,n,
MFDC3779.JPG,5_AEP,Session_4,5/12/2021,11:11:42,TRUE,Session_4__2021-05-12__11-11-42(5).JPG,Homo_sapiens,1,n,
MFDC3780.JPG,5_AEP,Session_4,5/12/2021,11:11:42,TRUE,Session_4__2021-05-12__11-11-42(6).JPG,Homo_sapiens,1,n,
PICT0500.JPG,5_AEP,Session_4,4/27/2021,12:22:18,TRUE,Session_4__2021-04-27__12-22-18(1).JPG,NA,0,n,
PICT0501.JPG,5_AEP,Session_4,4/27/2021,12:22:23,TRUE,Session_4__2021-04-27__12-22-23(2).JPG,NA,0,n,
PICT0502.JPG,5_AEP,Session_4,4/27/2021,12:29:02,TRUE,Session_4__2021-04-27__12-29-02(1).JPG,NA,0,n,
PICT0503.JPG,5_AEP,Session_4,4/27/2021,12:29:06,TRUE,Session_4__2021-04-27__12-29-06(2).JPG,NA,0,n,
PICT0504.JPG,5_AEP,Session_4,4/27/2021,12:29:11,TRUE,Session_4__2021-04-27__12-29-11(3).JPG,NA,0,n,
PICT0505.JPG,5_AEP,Session_4,4/27/2021,12:32:03,TRUE,Session_4__2021-04-27__12-32-03(1).JPG,NA,0,n,
PICT0506.JPG,5_AEP,Session_4,4/27/2021,12:32:08,TRUE,Session_4__2021-04-27__12-32-08(2).JPG,NA,0,n,
PICT0507.JPG,5_AEP,Session_4,4/27/2021,12:32:13,TRUE,Session_4__2021-04-27__12-32-13(3).JPG,NA,0,n,
PICT0508.JPG,5_AEP,Session_4,4/27/2021,13:19:37,TRUE,Session_4__2021-04-27__13-19-37(1).JPG,NA,0,n,
PICT0509.JPG,5_AEP,Session_4,4/27/2021,13:19:41,TRUE,Session_4__2021-04-27__13-19-41(2).JPG,NA,0,n,
PICT0510.JPG,5_AEP,Session_4,4/27/2021,13:19:46,TRUE,Session_4__2021-04-27__13-19-46(3).JPG,NA,0,n,
PICT0511.JPG,5_AEP,Session_4,4/27/2021,13:23:59,TRUE,Session_4__2021-04-27__13-23-59(1).JPG,NA,0,n,
PICT0512.JPG,5_AEP,Session_4,4/27/2021,13:24:03,TRUE,Session_4__2021-04-27__13-24-03(1).JPG,NA,0,n,
PICT0513.JPG,5_AEP,Session_4,4/27/2021,13:24:08,TRUE,Session_4__2021-04-27__13-24-08(2).JPG,NA,0,n,
PICT0514.JPG,5_AEP,Session_4,4/27/2021,13:29:11,TRUE,Session_4__2021-04-27__13-29-11(1).JPG,NA,0,n,
PICT0515.JPG,5_AEP,Session_4,4/27/2021,13:29:15,TRUE,Session_4__2021-04-27__13-29-15(2).JPG,NA,0,n,
PICT0516.JPG,5_AEP,Session_4,4/27/2021,13:29:20,TRUE,Session_4__2021-04-27__13-29-20(3).JPG,NA,0,n,
PICT0517.JPG,5_AEP,Session_4,4/27/2021,13:31:32,TRUE,Session_4__2021-04-27__13-31-32(1).JPG,NA,0,n,
PICT0518.JPG,5_AEP,Session_4,4/27/2021,13:31:36,TRUE,Session_4__2021-04-27__13-31-36(2).JPG,NA,0,n,
PICT0519.JPG,5_AEP,Session_4,4/27/2021,13:31:41,TRUE,Session_4__2021-04-27__13-31-41(3).JPG,NA,0,n,
PICT0520.JPG,5_AEP,Session_4,4/27/2021,13:37:13,TRUE,Session_4__2021-04-27__13-37-13(1).JPG,NA,0,n,
PICT0521.JPG,5_AEP,Session_4,4/27/2021,13:37:18,TRUE,Session_4__2021-04-27__13-37-18(2).JPG,NA,0,n,
PICT0522.JPG,5_AEP,Session_4,4/27/2021,13:37:23,TRUE,Session_4__2021-04-27__13-37-23(3).JPG,NA,0,n,
PICT0523.JPG,5_AEP,Session_4,4/27/2021,13:40:35,TRUE,Session_4__2021-04-27__13-40-35(1).JPG,NA,0,n,
PICT0524.JPG,5_AEP,Session_4,4/27/2021,13:40:39,TRUE,Session_4__2021-04-27__13-40-39(2).JPG,NA,0,n,
PICT0525.JPG,5_AEP,Session_4,4/27/2021,13:40:44,TRUE,Session_4__2021-04-27__13-40-44(3).JPG,NA,0,n,
PICT0526.JPG,5_AEP,Session_4,4/27/2021,14:09:11,TRUE,Session_4__2021-04-27__14-09-11(1).JPG,NA,0,n,
PICT0527.JPG,5_AEP,Session_4,4/27/2021,14:09:14,TRUE,Session_4__2021-04-27__14-09-14(2).JPG,NA,0,n,
PICT0528.JPG,5_AEP,Session_4,4/27/2021,14:09:19,TRUE,Session_4__2021-04-27__14-09-19(3).JPG,NA,0,n,
PICT0529.JPG,5_AEP,Session_4,4/27/2021,14:21:54,TRUE,Session_4__2021-04-27__14-21-54(1).JPG,NA,0,n,
PICT0530.JPG,5_AEP,Session_4,4/27/2021,14:21:58,TRUE,Session_4__2021-04-27__14-21-58(2).JPG,NA,0,n,
PICT0531.JPG,5_AEP,Session_4,4/27/2021,14:22:03,TRUE,Session_4__2021-04-27__14-22-03(1).JPG,NA,0,n,
PICT0532.JPG,5_AEP,Session_4,4/27/2021,14:24:41,TRUE,Session_4__2021-04-27__14-24-41(1).JPG,NA,0,n,
PICT0533.JPG,5_AEP,Session_4,4/27/2021,14:24:45,TRUE,Session_4__2021-04-27__14-24-45(2).JPG,NA,0,n,
PICT0534.JPG,5_AEP,Session_4,4/27/2021,14:24:50,TRUE,Session_4__2021-04-27__14-24-50(3).JPG,NA,0,n,
PICT0535.JPG,5_AEP,Session_4,4/27/2021,14:28:35,TRUE,Session_4__2021-04-27__14-28-35(1).JPG,NA,0,n,
PICT0536.JPG,5_AEP,Session_4,4/27/2021,14:28:39,TRUE,Session_4__2021-04-27__14-28-39(2).JPG,NA,0,n,
PICT0537.JPG,5_AEP,Session_4,4/27/2021,14:28:44,TRUE,Session_4__2021-04-27__14-28-44(3).JPG,NA,0,n,
PICT0538.JPG,5_AEP,Session_4,4/27/2021,14:36:33,TRUE,Session_4__2021-04-27__14-36-33(1).JPG,NA,0,n,
PICT0539.JPG,5_AEP,Session_4,4/27/2021,14:36:37,TRUE,Session_4__2021-04-27__14-36-37(2).JPG,NA,0,n,
PICT0540.JPG,5_AEP,Session_4,4/27/2021,14:36:42,TRUE,Session_4__2021-04-27__14-36-42(3).JPG,NA,0,n,
PICT0541.JPG,5_AEP,Session_4,4/27/2021,14:38:26,TRUE,Session_4__2021-04-27__14-38-26(1).JPG,NA,0,n,
PICT0542.JPG,5_AEP,Session_4,4/27/2021,14:38:30,TRUE,Session_4__2021-04-27__14-38-30(2).JPG,NA,0,n,
PICT0543.JPG,5_AEP,Session_4,4/27/2021,14:38:35,TRUE,Session_4__2021-04-27__14-38-35(3).JPG,NA,0,n,
PICT0544.JPG,5_AEP,Session_4,4/27/2021,14:39:51,TRUE,Session_4__2021-04-27__14-39-51(1).JPG,NA,0,n,
PICT0545.JPG,5_AEP,Session_4,4/27/2021,14:39:56,TRUE,Session_4__2021-04-27__14-39-56(2).JPG,NA,0,n,
PICT0546.JPG,5_AEP,Session_4,4/27/2021,14:40:01,TRUE,Session_4__2021-04-27__14-40-01(1).JPG,NA,0,n,
PICT0547.JPG,5_AEP,Session_4,4/27/2021,14:51:33,TRUE,Session_4__2021-04-27__14-51-33(1).JPG,NA,0,n,
PICT0548.JPG,5_AEP,Session_4,4/27/2021,14:51:36,TRUE,Session_4__2021-04-27__14-51-36(2).JPG,NA,0,n,
PICT0549.JPG,5_AEP,Session_4,4/27/2021,14:51:42,TRUE,Session_4__2021-04-27__14-51-42(3).JPG,NA,0,n,
PICT0550.JPG,5_AEP,Session_4,4/27/2021,15:03:33,TRUE,Session_4__2021-04-27__15-03-33(1).JPG,NA,0,n,
PICT0551.JPG,5_AEP,Session_4,4/27/2021,15:03:38,TRUE,Session_4__2021-04-27__15-03-38(2).JPG,NA,0,n,
PICT0552.JPG,5_AEP,Session_4,4/27/2021,15:03:43,TRUE,Session_4__2021-04-27__15-03-43(3).JPG,NA,0,n,
PICT0553.JPG,5_AEP,Session_4,4/27/2021,15:08:31,TRUE,Session_4__2021-04-27__15-08-31(1).JPG,NA,0,n,
PICT0554.JPG,5_AEP,Session_4,4/27/2021,15:08:36,TRUE,Session_4__2021-04-27__15-08-36(2).JPG,NA,0,n,
PICT0555.JPG,5_AEP,Session_4,4/27/2021,15:08:41,TRUE,Session_4__2021-04-27__15-08-41(3).JPG,NA,0,n,
PICT0556.JPG,5_AEP,Session_4,4/27/2021,15:13:13,TRUE,Session_4__2021-04-27__15-13-13(1).JPG,NA,0,n,
PICT0557.JPG,5_AEP,Session_4,4/27/2021,15:13:18,TRUE,Session_4__2021-04-27__15-13-18(2).JPG,NA,0,n,
PICT0558.JPG,5_AEP,Session_4,4/27/2021,15:13:23,TRUE,Session_4__2021-04-27__15-13-23(3).JPG,NA,0,n,
PICT0559.JPG,5_AEP,Session_4,4/27/2021,15:16:51,TRUE,Session_4__2021-04-27__15-16-51(1).JPG,NA,0,n,
PICT0560.JPG,5_AEP,Session_4,4/27/2021,15:16:56,TRUE,Session_4__2021-04-27__15-16-56(2).JPG,NA,0,n,
PICT0561.JPG,5_AEP,Session_4,4/27/2021,15:17:01,TRUE,Session_4__2021-04-27__15-17-01(1).JPG,NA,0,n,
PICT0562.JPG,5_AEP,Session_4,4/27/2021,15:29:49,TRUE,Session_4__2021-04-27__15-29-49(1).JPG,NA,0,n,
PICT0563.JPG,5_AEP,Session_4,4/27/2021,15:29:54,TRUE,Session_4__2021-04-27__15-29-54(2).JPG,NA,0,n,
PICT0564.JPG,5_AEP,Session_4,4/27/2021,15:29:59,TRUE,Session_4__2021-04-27__15-29-59(3).JPG,NA,0,n,
PICT0565.JPG,5_AEP,Session_4,4/27/2021,15:40:26,TRUE,Session_4__2021-04-27__15-40-26(1).JPG,NA,0,n,
PICT0566.JPG,5_AEP,Session_4,4/27/2021,15:40:31,TRUE,Session_4__2021-04-27__15-40-31(2).JPG,NA,0,n,
PICT0567.JPG,5_AEP,Session_4,4/27/2021,15:40:36,TRUE,Session_4__2021-04-27__15-40-36(3).JPG,NA,0,n,
PICT0568.JPG,5_AEP,Session_4,4/27/2021,15:45:08,TRUE,Session_4__2021-04-27__15-45-08(1).JPG,NA,0,n,
PICT0569.JPG,5_AEP,Session_4,4/27/2021,15:45:13,TRUE,Session_4__2021-04-27__15-45-13(2).JPG,NA,0,n,
PICT0570.JPG,5_AEP,Session_4,4/27/2021,15:45:18,TRUE,Session_4__2021-04-27__15-45-18(3).JPG,NA,0,n,
PICT0571.JPG,5_AEP,Session_4,4/27/2021,20:50:43,TRUE,Session_4__2021-04-27__20-50-43(1).JPG,NA,0,n,
PICT0572.JPG,5_AEP,Session_4,4/27/2021,20:50:48,TRUE,Session_4__2021-04-27__20-50-48(2).JPG,NA,0,n,
PICT0573.JPG,5_AEP,Session_4,4/27/2021,20:50:52,TRUE,Session_4__2021-04-27__20-50-52(3).JPG,NA,0,n,
PICT0574.JPG,5_AEP,Session_4,4/28/2021,13:59:55,TRUE,Session_4__2021-04-28__13-59-55(1).JPG,NA,0,n,
PICT0575.JPG,5_AEP,Session_4,4/28/2021,14:23:30,TRUE,Session_4__2021-04-28__14-23-30(1).JPG,NA,0,n,
PICT0576.JPG,5_AEP,Session_4,4/28/2021,14:23:34,TRUE,Session_4__2021-04-28__14-23-34(2).JPG,NA,0,n,
PICT0577.JPG,5_AEP,Session_4,4/28/2021,14:23:39,TRUE,Session_4__2021-04-28__14-23-39(3).JPG,NA,0,n,
PICT0578.JPG,5_AEP,Session_4,4/28/2021,21:48:13,TRUE,Session_4__2021-04-28__21-48-13(1).JPG,Lynx_rufus,1,n,
PICT0579.JPG,5_AEP,Session_4,4/28/2021,21:48:17,TRUE,Session_4__2021-04-28__21-48-17(2).JPG,NA,0,n,
PICT0580.JPG,5_AEP,Session_4,4/28/2021,21:48:22,TRUE,Session_4__2021-04-28__21-48-22(3).JPG,NA,0,n,
PICT0581.JPG,5_AEP,Session_4,4/29/2021,13:57:59,TRUE,Session_4__2021-04-29__13-57-59(1).JPG,Sciurus_sp,1,n,
PICT0582.JPG,5_AEP,Session_4,4/29/2021,13:58:03,TRUE,Session_4__2021-04-29__13-58-03(1).JPG,NA,0,n,
PICT0583.JPG,5_AEP,Session_4,4/29/2021,13:58:08,TRUE,Session_4__2021-04-29__13-58-08(2).JPG,NA,0,n,
PICT0584.JPG,5_AEP,Session_4,4/30/2021,8:48:16,TRUE,Session_4__2021-04-30__08-48-16(1).JPG,NA,0,n,
PICT0585.JPG,5_AEP,Session_4,4/30/2021,8:48:20,TRUE,Session_4__2021-04-30__08-48-20(2).JPG,NA,0,n,
PICT0586.JPG,5_AEP,Session_4,4/30/2021,8:48:25,TRUE,Session_4__2021-04-30__08-48-25(3).JPG,NA,0,n,
PICT0587.JPG,5_AEP,Session_4,4/30/2021,8:56:18,TRUE,Session_4__2021-04-30__08-56-18(1).JPG,NA,0,n,
PICT0588.JPG,5_AEP,Session_4,4/30/2021,8:56:22,TRUE,Session_4__2021-04-30__08-56-22(2).JPG,NA,0,n,
PICT0589.JPG,5_AEP,Session_4,4/30/2021,8:56:28,TRUE,Session_4__2021-04-30__08-56-28(3).JPG,NA,0,n,
PICT0590.JPG,5_AEP,Session_4,4/30/2021,8:58:48,TRUE,Session_4__2021-04-30__08-58-48(1).JPG,NA,0,n,
PICT0591.JPG,5_AEP,Session_4,4/30/2021,8:58:52,TRUE,Session_4__2021-04-30__08-58-52(2).JPG,NA,0,n,
PICT0592.JPG,5_AEP,Session_4,4/30/2021,8:58:58,TRUE,Session_4__2021-04-30__08-58-58(3).JPG,NA,0,n,
PICT0593.JPG,5_AEP,Session_4,4/30/2021,8:59:58,TRUE,Session_4__2021-04-30__08-59-58(1).JPG,NA,0,n,
PICT0594.JPG,5_AEP,Session_4,4/30/2021,9:00:03,TRUE,Session_4__2021-04-30__09-00-03(1).JPG,NA,0,n,
PICT0595.JPG,5_AEP,Session_4,4/30/2021,9:00:08,TRUE,Session_4__2021-04-30__09-00-08(2).JPG,NA,0,n,
PICT0596.JPG,5_AEP,Session_4,4/30/2021,9:03:31,TRUE,Session_4__2021-04-30__09-03-31(1).JPG,NA,0,n,
PICT0597.JPG,5_AEP,Session_4,4/30/2021,9:03:35,TRUE,Session_4__2021-04-30__09-03-35(2).JPG,NA,0,n,
PICT0598.JPG,5_AEP,Session_4,4/30/2021,9:03:40,TRUE,Session_4__2021-04-30__09-03-40(3).JPG,NA,0,n,
PICT0599.JPG,5_AEP,Session_4,4/30/2021,9:34:21,TRUE,Session_4__2021-04-30__09-34-21(1).JPG,NA,0,n,
PICT0600.JPG,5_AEP,Session_4,4/30/2021,9:34:24,TRUE,Session_4__2021-04-30__09-34-24(2).JPG,NA,0,n,
PICT0601.JPG,5_AEP,Session_4,4/30/2021,9:34:29,TRUE,Session_4__2021-04-30__09-34-29(3).JPG,NA,0,n,
PICT0602.JPG,5_AEP,Session_4,4/30/2021,9:39:58,TRUE,Session_4__2021-04-30__09-39-58(1).JPG,NA,0,n,
PICT0603.JPG,5_AEP,Session_4,4/30/2021,9:40:02,TRUE,Session_4__2021-04-30__09-40-02(1).JPG,NA,0,n,
PICT0604.JPG,5_AEP,Session_4,4/30/2021,9:40:07,TRUE,Session_4__2021-04-30__09-40-07(2).JPG,NA,0,n,
PICT0605.JPG,5_AEP,Session_4,4/30/2021,9:41:14,TRUE,Session_4__2021-04-30__09-41-14(1).JPG,NA,0,n,
PICT0606.JPG,5_AEP,Session_4,4/30/2021,9:41:18,TRUE,Session_4__2021-04-30__09-41-18(2).JPG,NA,0,n,
PICT0607.JPG,5_AEP,Session_4,4/30/2021,9:41:23,TRUE,Session_4__2021-04-30__09-41-23(3).JPG,NA,0,n,
PICT0608.JPG,5_AEP,Session_4,4/30/2021,9:43:59,TRUE,Session_4__2021-04-30__09-43-59(1).JPG,NA,0,n,
PICT0609.JPG,5_AEP,Session_4,4/30/2021,9:44:03,TRUE,Session_4__2021-04-30__09-44-03(1).JPG,NA,0,n,
PICT0610.JPG,5_AEP,Session_4,4/30/2021,9:44:08,TRUE,Session_4__2021-04-30__09-44-08(2).JPG,NA,0,n,
PICT0611.JPG,5_AEP,Session_4,4/30/2021,9:46:18,TRUE,Session_4__2021-04-30__09-46-18(1).JPG,NA,0,n,
PICT0612.JPG,5_AEP,Session_4,4/30/2021,9:46:22,TRUE,Session_4__2021-04-30__09-46-22(2).JPG,NA,0,n,
PICT0613.JPG,5_AEP,Session_4,4/30/2021,9:46:27,TRUE,Session_4__2021-04-30__09-46-27(3).JPG,NA,0,n,
PICT0614.JPG,5_AEP,Session_4,4/30/2021,9:47:31,TRUE,Session_4__2021-04-30__09-47-31(1).JPG,NA,0,n,
PICT0615.JPG,5_AEP,Session_4,4/30/2021,9:47:35,TRUE,Session_4__2021-04-30__09-47-35(2).JPG,NA,0,n,
PICT0616.JPG,5_AEP,Session_4,4/30/2021,9:47:40,TRUE,Session_4__2021-04-30__09-47-40(3).JPG,NA,0,n,
PICT0617.JPG,5_AEP,Session_4,4/30/2021,9:50:37,TRUE,Session_4__2021-04-30__09-50-37(1).JPG,NA,0,n,
PICT0618.JPG,5_AEP,Session_4,4/30/2021,9:50:41,TRUE,Session_4__2021-04-30__09-50-41(2).JPG,NA,0,n,
PICT0619.JPG,5_AEP,Session_4,4/30/2021,9:50:47,TRUE,Session_4__2021-04-30__09-50-47(3).JPG,NA,0,n,
PICT0620.JPG,5_AEP,Session_4,4/30/2021,9:52:32,TRUE,Session_4__2021-04-30__09-52-32(1).JPG,NA,0,n,
PICT0621.JPG,5_AEP,Session_4,4/30/2021,9:52:37,TRUE,Session_4__2021-04-30__09-52-37(2).JPG,NA,0,n,
PICT0622.JPG,5_AEP,Session_4,4/30/2021,9:52:41,TRUE,Session_4__2021-04-30__09-52-41(3).JPG,NA,0,n,
PICT0623.JPG,5_AEP,Session_4,4/30/2021,9:55:10,TRUE,Session_4__2021-04-30__09-55-10(1).JPG,NA,0,n,
PICT0624.JPG,5_AEP,Session_4,4/30/2021,9:55:15,TRUE,Session_4__2021-04-30__09-55-15(2).JPG,NA,0,n,
PICT0625.JPG,5_AEP,Session_4,4/30/2021,9:55:20,TRUE,Session_4__2021-04-30__09-55-20(3).JPG,NA,0,n,
PICT0626.JPG,5_AEP,Session_4,4/30/2021,10:00:24,TRUE,Session_4__2021-04-30__10-00-24(1).JPG,NA,0,n,
PICT0627.JPG,5_AEP,Session_4,4/30/2021,10:00:29,TRUE,Session_4__2021-04-30__10-00-29(2).JPG,NA,0,n,
PICT0628.JPG,5_AEP,Session_4,4/30/2021,10:00:34,TRUE,Session_4__2021-04-30__10-00-34(3).JPG,NA,0,n,
PICT0629.JPG,5_AEP,Session_4,4/30/2021,10:01:35,TRUE,Session_4__2021-04-30__10-01-35(1).JPG,NA,0,n,
PICT0630.JPG,5_AEP,Session_4,4/30/2021,10:01:40,TRUE,Session_4__2021-04-30__10-01-40(2).JPG,NA,0,n,
PICT0631.JPG,5_AEP,Session_4,4/30/2021,10:01:45,TRUE,Session_4__2021-04-30__10-01-45(3).JPG,NA,0,n,
PICT0632.JPG,5_AEP,Session_4,4/30/2021,10:05:00,TRUE,Session_4__2021-04-30__10-05-00(1).JPG,NA,0,n,
PICT0633.JPG,5_AEP,Session_4,4/30/2021,10:05:06,TRUE,Session_4__2021-04-30__10-05-06(2).JPG,NA,0,n,
PICT0634.JPG,5_AEP,Session_4,4/30/2021,10:05:11,TRUE,Session_4__2021-04-30__10-05-11(3).JPG,NA,0,n,
PICT0635.JPG,5_AEP,Session_4,4/30/2021,10:07:01,TRUE,Session_4__2021-04-30__10-07-01(1).JPG,NA,0,n,
PICT0636.JPG,5_AEP,Session_4,4/30/2021,10:07:06,TRUE,Session_4__2021-04-30__10-07-06(2).JPG,NA,0,n,
PICT0637.JPG,5_AEP,Session_4,4/30/2021,10:07:11,TRUE,Session_4__2021-04-30__10-07-11(3).JPG,NA,0,n,
PICT0638.JPG,5_AEP,Session_4,4/30/2021,10:09:27,TRUE,Session_4__2021-04-30__10-09-27(1).JPG,NA,0,n,
PICT0639.JPG,5_AEP,Session_4,4/30/2021,10:09:32,TRUE,Session_4__2021-04-30__10-09-32(2).JPG,NA,0,n,
PICT0640.JPG,5_AEP,Session_4,4/30/2021,10:09:37,TRUE,Session_4__2021-04-30__10-09-37(3).JPG,NA,0,n,
PICT0641.JPG,5_AEP,Session_4,4/30/2021,10:11:02,TRUE,Session_4__2021-04-30__10-11-02(1).JPG,NA,0,n,
PICT0642.JPG,5_AEP,Session_4,4/30/2021,10:11:07,TRUE,Session_4__2021-04-30__10-11-07(2).JPG,NA,0,n,
PICT0643.JPG,5_AEP,Session_4,4/30/2021,10:11:12,TRUE,Session_4__2021-04-30__10-11-12(3).JPG,NA,0,n,
PICT0644.JPG,5_AEP,Session_4,4/30/2021,10:12:12,TRUE,Session_4__2021-04-30__10-12-12(1).JPG,NA,0,n,
PICT0645.JPG,5_AEP,Session_4,4/30/2021,10:12:17,TRUE,Session_4__2021-04-30__10-12-17(2).JPG,NA,0,n,
PICT0646.JPG,5_AEP,Session_4,4/30/2021,10:12:22,TRUE,Session_4__2021-04-30__10-12-22(3).JPG,NA,0,n,
PICT0647.JPG,5_AEP,Session_4,4/30/2021,10:13:27,TRUE,Session_4__2021-04-30__10-13-27(1).JPG,NA,0,n,
PICT0648.JPG,5_AEP,Session_4,4/30/2021,10:13:32,TRUE,Session_4__2021-04-30__10-13-32(2).JPG,NA,0,n,
PICT0649.JPG,5_AEP,Session_4,4/30/2021,10:13:37,TRUE,Session_4__2021-04-30__10-13-37(3).JPG,NA,0,n,
PICT0650.JPG,5_AEP,Session_4,4/30/2021,10:16:36,TRUE,Session_4__2021-04-30__10-16-36(1).JPG,NA,0,n,
PICT0651.JPG,5_AEP,Session_4,4/30/2021,10:16:41,TRUE,Session_4__2021-04-30__10-16-41(2).JPG,NA,0,n,
PICT0652.JPG,5_AEP,Session_4,4/30/2021,10:16:46,TRUE,Session_4__2021-04-30__10-16-46(3).JPG,NA,0,n,
PICT0653.JPG,5_AEP,Session_4,4/30/2021,10:18:59,TRUE,Session_4__2021-04-30__10-18-59(1).JPG,NA,0,n,
PICT0654.JPG,5_AEP,Session_4,4/30/2021,10:19:04,TRUE,Session_4__2021-04-30__10-19-04(1).JPG,NA,0,n,
PICT0655.JPG,5_AEP,Session_4,4/30/2021,10:19:09,TRUE,Session_4__2021-04-30__10-19-09(2).JPG,NA,0,n,
PICT0656.JPG,5_AEP,Session_4,4/30/2021,10:20:10,TRUE,Session_4__2021-04-30__10-20-10(1).JPG,NA,0,n,
PICT0657.JPG,5_AEP,Session_4,4/30/2021,10:20:15,TRUE,Session_4__2021-04-30__10-20-15(2).JPG,NA,0,n,
PICT0658.JPG,5_AEP,Session_4,4/30/2021,10:20:20,TRUE,Session_4__2021-04-30__10-20-20(3).JPG,NA,0,n,
PICT0659.JPG,5_AEP,Session_4,4/30/2021,10:23:21,TRUE,Session_4__2021-04-30__10-23-21(1).JPG,NA,0,n,
PICT0660.JPG,5_AEP,Session_4,4/30/2021,10:23:26,TRUE,Session_4__2021-04-30__10-23-26(2).JPG,NA,0,n,
PICT0661.JPG,5_AEP,Session_4,4/30/2021,10:23:31,TRUE,Session_4__2021-04-30__10-23-31(3).JPG,NA,0,n,
PICT0662.JPG,5_AEP,Session_4,4/30/2021,10:24:32,TRUE,Session_4__2021-04-30__10-24-32(1).JPG,NA,0,n,
PICT0663.JPG,5_AEP,Session_4,4/30/2021,10:24:37,TRUE,Session_4__2021-04-30__10-24-37(2).JPG,NA,0,n,
PICT0664.JPG,5_AEP,Session_4,4/30/2021,10:24:42,TRUE,Session_4__2021-04-30__10-24-42(3).JPG,NA,0,n,
PICT0665.JPG,5_AEP,Session_4,4/30/2021,10:27:43,TRUE,Session_4__2021-04-30__10-27-43(1).JPG,NA,0,n,
PICT0666.JPG,5_AEP,Session_4,4/30/2021,10:27:48,TRUE,Session_4__2021-04-30__10-27-48(2).JPG,NA,0,n,
PICT0667.JPG,5_AEP,Session_4,4/30/2021,10:27:53,TRUE,Session_4__2021-04-30__10-27-53(3).JPG,NA,0,n,
PICT0668.JPG,5_AEP,Session_4,4/30/2021,10:29:33,TRUE,Session_4__2021-04-30__10-29-33(1).JPG,NA,0,n,
PICT0669.JPG,5_AEP,Session_4,4/30/2021,10:29:38,TRUE,Session_4__2021-04-30__10-29-38(2).JPG,NA,0,n,
PICT0670.JPG,5_AEP,Session_4,4/30/2021,10:29:43,TRUE,Session_4__2021-04-30__10-29-43(3).JPG,NA,0,n,
PICT0671.JPG,5_AEP,Session_4,4/30/2021,10:31:12,TRUE,Session_4__2021-04-30__10-31-12(1).JPG,NA,0,n,
PICT0672.JPG,5_AEP,Session_4,4/30/2021,10:31:17,TRUE,Session_4__2021-04-30__10-31-17(2).JPG,NA,0,n,
PICT0673.JPG,5_AEP,Session_4,4/30/2021,10:31:22,TRUE,Session_4__2021-04-30__10-31-22(3).JPG,NA,0,n,
PICT0674.JPG,5_AEP,Session_4,4/30/2021,10:32:38,TRUE,Session_4__2021-04-30__10-32-38(1).JPG,NA,0,n,
PICT0675.JPG,5_AEP,Session_4,4/30/2021,10:32:43,TRUE,Session_4__2021-04-30__10-32-43(2).JPG,NA,0,n,
PICT0676.JPG,5_AEP,Session_4,4/30/2021,10:32:48,TRUE,Session_4__2021-04-30__10-32-48(3).JPG,NA,0,n,
PICT0677.JPG,5_AEP,Session_4,4/30/2021,10:34:40,TRUE,Session_4__2021-04-30__10-34-40(1).JPG,NA,0,n,
PICT0678.JPG,5_AEP,Session_4,4/30/2021,10:34:45,TRUE,Session_4__2021-04-30__10-34-45(2).JPG,NA,0,n,
PICT0679.JPG,5_AEP,Session_4,4/30/2021,10:34:50,TRUE,Session_4__2021-04-30__10-34-50(3).JPG,NA,0,n,
PICT0680.JPG,5_AEP,Session_4,4/30/2021,10:36:08,TRUE,Session_4__2021-04-30__10-36-08(1).JPG,NA,0,n,
PICT0681.JPG,5_AEP,Session_4,4/30/2021,10:36:13,TRUE,Session_4__2021-04-30__10-36-13(2).JPG,NA,0,n,
PICT0682.JPG,5_AEP,Session_4,4/30/2021,10:36:18,TRUE,Session_4__2021-04-30__10-36-18(3).JPG,NA,0,n,
PICT0683.JPG,5_AEP,Session_4,4/30/2021,10:38:37,TRUE,Session_4__2021-04-30__10-38-37(1).JPG,NA,0,n,
PICT0684.JPG,5_AEP,Session_4,4/30/2021,10:38:42,TRUE,Session_4__2021-04-30__10-38-42(2).JPG,NA,0,n,
PICT0685.JPG,5_AEP,Session_4,4/30/2021,10:38:47,TRUE,Session_4__2021-04-30__10-38-47(3).JPG,NA,0,n,
PICT0686.JPG,5_AEP,Session_4,4/30/2021,10:42:01,TRUE,Session_4__2021-04-30__10-42-01(1).JPG,NA,0,n,
PICT0687.JPG,5_AEP,Session_4,4/30/2021,10:42:06,TRUE,Session_4__2021-04-30__10-42-06(2).JPG,NA,0,n,
PICT0688.JPG,5_AEP,Session_4,4/30/2021,10:42:11,TRUE,Session_4__2021-04-30__10-42-11(3).JPG,NA,0,n,
PICT0689.JPG,5_AEP,Session_4,4/30/2021,10:50:26,TRUE,Session_4__2021-04-30__10-50-26(1).JPG,NA,0,n,
PICT0690.JPG,5_AEP,Session_4,4/30/2021,10:50:31,TRUE,Session_4__2021-04-30__10-50-31(2).JPG,NA,0,n,
PICT0691.JPG,5_AEP,Session_4,4/30/2021,10:50:36,TRUE,Session_4__2021-04-30__10-50-36(3).JPG,NA,0,n,
PICT0692.JPG,5_AEP,Session_4,4/30/2021,10:51:55,TRUE,Session_4__2021-04-30__10-51-55(1).JPG,NA,0,n,
PICT0693.JPG,5_AEP,Session_4,4/30/2021,10:52:00,TRUE,Session_4__2021-04-30__10-52-00(1).JPG,NA,0,n,
PICT0694.JPG,5_AEP,Session_4,4/30/2021,10:52:05,TRUE,Session_4__2021-04-30__10-52-05(2).JPG,NA,0,n,
PICT0695.JPG,5_AEP,Session_4,4/30/2021,10:54:08,TRUE,Session_4__2021-04-30__10-54-08(1).JPG,NA,0,n,
PICT0696.JPG,5_AEP,Session_4,4/30/2021,10:54:13,TRUE,Session_4__2021-04-30__10-54-13(2).JPG,NA,0,n,
PICT0697.JPG,5_AEP,Session_4,4/30/2021,10:54:18,TRUE,Session_4__2021-04-30__10-54-18(3).JPG,NA,0,n,
PICT0698.JPG,5_AEP,Session_4,4/30/2021,10:55:53,TRUE,Session_4__2021-04-30__10-55-53(1).JPG,NA,0,n,
PICT0699.JPG,5_AEP,Session_4,4/30/2021,10:55:58,TRUE,Session_4__2021-04-30__10-55-58(2).JPG,NA,0,n,
PICT0700.JPG,5_AEP,Session_4,4/30/2021,10:56:03,TRUE,Session_4__2021-04-30__10-56-03(1).JPG,NA,0,n,
PICT0701.JPG,5_AEP,Session_4,4/30/2021,10:58:11,TRUE,Session_4__2021-04-30__10-58-11(1).JPG,NA,0,n,
PICT0702.JPG,5_AEP,Session_4,4/30/2021,10:58:16,TRUE,Session_4__2021-04-30__10-58-16(2).JPG,NA,0,n,
PICT0703.JPG,5_AEP,Session_4,4/30/2021,10:58:21,TRUE,Session_4__2021-04-30__10-58-21(3).JPG,NA,0,n,
PICT0704.JPG,5_AEP,Session_4,4/30/2021,11:01:12,TRUE,Session_4__2021-04-30__11-01-12(1).JPG,NA,0,n,
PICT0705.JPG,5_AEP,Session_4,4/30/2021,11:01:16,TRUE,Session_4__2021-04-30__11-01-16(2).JPG,NA,0,n,
PICT0706.JPG,5_AEP,Session_4,4/30/2021,11:01:21,TRUE,Session_4__2021-04-30__11-01-21(3).JPG,NA,0,n,
PICT0707.JPG,5_AEP,Session_4,4/30/2021,11:12:51,TRUE,Session_4__2021-04-30__11-12-51(1).JPG,NA,0,n,
PICT0708.JPG,5_AEP,Session_4,4/30/2021,11:12:56,TRUE,Session_4__2021-04-30__11-12-56(2).JPG,NA,0,n,
PICT0709.JPG,5_AEP,Session_4,4/30/2021,11:13:01,TRUE,Session_4__2021-04-30__11-13-01(1).JPG,NA,0,n,
PICT0710.JPG,5_AEP,Session_4,4/30/2021,11:14:43,TRUE,Session_4__2021-04-30__11-14-43(1).JPG,NA,0,n,
PICT0711.JPG,5_AEP,Session_4,4/30/2021,11:14:48,TRUE,Session_4__2021-04-30__11-14-48(2).JPG,NA,0,n,
PICT0712.JPG,5_AEP,Session_4,4/30/2021,11:14:53,TRUE,Session_4__2021-04-30__11-14-53(3).JPG,NA,0,n,
PICT0713.JPG,5_AEP,Session_4,4/30/2021,11:21:40,TRUE,Session_4__2021-04-30__11-21-40(1).JPG,NA,0,n,
PICT0714.JPG,5_AEP,Session_4,4/30/2021,11:21:45,TRUE,Session_4__2021-04-30__11-21-45(2).JPG,NA,0,n,
PICT0715.JPG,5_AEP,Session_4,4/30/2021,11:21:50,TRUE,Session_4__2021-04-30__11-21-50(3).JPG,NA,0,n,
PICT0716.JPG,5_AEP,Session_4,4/30/2021,11:24:42,TRUE,Session_4__2021-04-30__11-24-42(1).JPG,NA,0,n,
PICT0717.JPG,5_AEP,Session_4,4/30/2021,11:24:47,TRUE,Session_4__2021-04-30__11-24-47(2).JPG,NA,0,n,
PICT0718.JPG,5_AEP,Session_4,4/30/2021,11:24:52,TRUE,Session_4__2021-04-30__11-24-52(3).JPG,NA,0,n,
PICT0719.JPG,5_AEP,Session_4,4/30/2021,11:27:57,TRUE,Session_4__2021-04-30__11-27-57(1).JPG,NA,0,n,
PICT0720.JPG,5_AEP,Session_4,4/30/2021,11:28:02,TRUE,Session_4__2021-04-30__11-28-02(1).JPG,NA,0,n,
PICT0721.JPG,5_AEP,Session_4,4/30/2021,11:28:07,TRUE,Session_4__2021-04-30__11-28-07(2).JPG,NA,0,n,
PICT0722.JPG,5_AEP,Session_4,4/30/2021,11:29:10,TRUE,Session_4__2021-04-30__11-29-10(1).JPG,NA,0,n,
PICT0723.JPG,5_AEP,Session_4,4/30/2021,11:29:14,TRUE,Session_4__2021-04-30__11-29-14(2).JPG,NA,0,n,
PICT0724.JPG,5_AEP,Session_4,4/30/2021,11:29:19,TRUE,Session_4__2021-04-30__11-29-19(3).JPG,NA,0,n,
PICT0725.JPG,5_AEP,Session_4,4/30/2021,11:48:04,TRUE,Session_4__2021-04-30__11-48-04(1).JPG,NA,0,n,
PICT0726.JPG,5_AEP,Session_4,4/30/2021,11:48:09,TRUE,Session_4__2021-04-30__11-48-09(2).JPG,NA,0,n,
PICT0727.JPG,5_AEP,Session_4,4/30/2021,11:48:14,TRUE,Session_4__2021-04-30__11-48-14(3).JPG,NA,0,n,
PICT0728.JPG,5_AEP,Session_4,4/30/2021,11:49:15,TRUE,Session_4__2021-04-30__11-49-15(1).JPG,NA,0,n,
PICT0729.JPG,5_AEP,Session_4,4/30/2021,11:49:20,TRUE,Session_4__2021-04-30__11-49-20(2).JPG,NA,0,n,
PICT0730.JPG,5_AEP,Session_4,4/30/2021,11:49:25,TRUE,Session_4__2021-04-30__11-49-25(3).JPG,NA,0,n,
PICT0731.JPG,5_AEP,Session_4,4/30/2021,11:51:12,TRUE,Session_4__2021-04-30__11-51-12(1).JPG,NA,0,n,
PICT0732.JPG,5_AEP,Session_4,4/30/2021,11:51:17,TRUE,Session_4__2021-04-30__11-51-17(2).JPG,NA,0,n,
PICT0733.JPG,5_AEP,Session_4,4/30/2021,11:51:22,TRUE,Session_4__2021-04-30__11-51-22(3).JPG,NA,0,n,
PICT0734.JPG,5_AEP,Session_4,4/30/2021,11:54:26,TRUE,Session_4__2021-04-30__11-54-26(1).JPG,NA,0,n,
PICT0735.JPG,5_AEP,Session_4,4/30/2021,11:54:31,TRUE,Session_4__2021-04-30__11-54-31(2).JPG,NA,0,n,
PICT0736.JPG,5_AEP,Session_4,4/30/2021,11:54:36,TRUE,Session_4__2021-04-30__11-54-36(3).JPG,NA,0,n,
PICT0737.JPG,5_AEP,Session_4,4/30/2021,11:56:06,TRUE,Session_4__2021-04-30__11-56-06(1).JPG,NA,0,n,
PICT0738.JPG,5_AEP,Session_4,4/30/2021,11:56:11,TRUE,Session_4__2021-04-30__11-56-11(2).JPG,NA,0,n,
PICT0739.JPG,5_AEP,Session_4,4/30/2021,11:56:16,TRUE,Session_4__2021-04-30__11-56-16(3).JPG,NA,0,n,
PICT0740.JPG,5_AEP,Session_4,4/30/2021,12:08:16,TRUE,Session_4__2021-04-30__12-08-16(1).JPG,NA,0,n,
PICT0741.JPG,5_AEP,Session_4,4/30/2021,12:08:21,TRUE,Session_4__2021-04-30__12-08-21(2).JPG,NA,0,n,
PICT0742.JPG,5_AEP,Session_4,4/30/2021,12:08:26,TRUE,Session_4__2021-04-30__12-08-26(3).JPG,NA,0,n,
PICT0743.JPG,5_AEP,Session_4,4/30/2021,12:16:34,TRUE,Session_4__2021-04-30__12-16-34(1).JPG,NA,0,n,
PICT0744.JPG,5_AEP,Session_4,4/30/2021,12:16:38,TRUE,Session_4__2021-04-30__12-16-38(2).JPG,NA,0,n,
PICT0745.JPG,5_AEP,Session_4,4/30/2021,12:16:43,TRUE,Session_4__2021-04-30__12-16-43(3).JPG,NA,0,n,
PICT0746.JPG,5_AEP,Session_4,4/30/2021,12:23:17,TRUE,Session_4__2021-04-30__12-23-17(1).JPG,NA,0,n,
PICT0747.JPG,5_AEP,Session_4,4/30/2021,12:23:22,TRUE,Session_4__2021-04-30__12-23-22(2).JPG,NA,0,n,
PICT0748.JPG,5_AEP,Session_4,4/30/2021,12:23:27,TRUE,Session_4__2021-04-30__12-23-27(3).JPG,NA,0,n,
PICT0749.JPG,5_AEP,Session_4,4/30/2021,12:27:18,TRUE,Session_4__2021-04-30__12-27-18(1).JPG,NA,0,n,
PICT0750.JPG,5_AEP,Session_4,4/30/2021,12:27:23,TRUE,Session_4__2021-04-30__12-27-23(2).JPG,NA,0,n,
PICT0751.JPG,5_AEP,Session_4,4/30/2021,12:27:28,TRUE,Session_4__2021-04-30__12-27-28(3).JPG,NA,0,n,
PICT0752.JPG,5_AEP,Session_4,4/30/2021,12:33:09,TRUE,Session_4__2021-04-30__12-33-09(1).JPG,NA,0,n,
PICT0753.JPG,5_AEP,Session_4,4/30/2021,12:33:14,TRUE,Session_4__2021-04-30__12-33-14(2).JPG,NA,0,n,
PICT0754.JPG,5_AEP,Session_4,4/30/2021,12:33:19,TRUE,Session_4__2021-04-30__12-33-19(3).JPG,NA,0,n,
PICT0755.JPG,5_AEP,Session_4,4/30/2021,12:34:40,TRUE,Session_4__2021-04-30__12-34-40(1).JPG,NA,0,n,
PICT0756.JPG,5_AEP,Session_4,4/30/2021,12:34:45,TRUE,Session_4__2021-04-30__12-34-45(2).JPG,NA,0,n,
PICT0757.JPG,5_AEP,Session_4,4/30/2021,12:34:50,TRUE,Session_4__2021-04-30__12-34-50(3).JPG,NA,0,n,
PICT0758.JPG,5_AEP,Session_4,4/30/2021,12:36:03,TRUE,Session_4__2021-04-30__12-36-03(1).JPG,NA,0,n,
PICT0759.JPG,5_AEP,Session_4,4/30/2021,12:36:08,TRUE,Session_4__2021-04-30__12-36-08(2).JPG,NA,0,n,
PICT0760.JPG,5_AEP,Session_4,4/30/2021,12:36:13,TRUE,Session_4__2021-04-30__12-36-13(3).JPG,NA,0,n,
PICT0761.JPG,5_AEP,Session_4,4/30/2021,12:39:53,TRUE,Session_4__2021-04-30__12-39-53(1).JPG,NA,0,n,
PICT0762.JPG,5_AEP,Session_4,4/30/2021,12:39:57,TRUE,Session_4__2021-04-30__12-39-57(2).JPG,NA,0,n,
PICT0763.JPG,5_AEP,Session_4,4/30/2021,12:40:02,TRUE,Session_4__2021-04-30__12-40-02(1).JPG,NA,0,n,
PICT0764.JPG,5_AEP,Session_4,4/30/2021,12:41:52,TRUE,Session_4__2021-04-30__12-41-52(1).JPG,NA,0,n,
PICT0765.JPG,5_AEP,Session_4,4/30/2021,12:41:56,TRUE,Session_4__2021-04-30__12-41-56(2).JPG,NA,0,n,
PICT0766.JPG,5_AEP,Session_4,4/30/2021,12:42:01,TRUE,Session_4__2021-04-30__12-42-01(1).JPG,NA,0,n,
PICT0767.JPG,5_AEP,Session_4,4/30/2021,12:44:25,TRUE,Session_4__2021-04-30__12-44-25(1).JPG,NA,0,n,
PICT0768.JPG,5_AEP,Session_4,4/30/2021,12:44:30,TRUE,Session_4__2021-04-30__12-44-30(2).JPG,NA,0,n,
PICT0769.JPG,5_AEP,Session_4,4/30/2021,12:44:35,TRUE,Session_4__2021-04-30__12-44-35(3).JPG,NA,0,n,
PICT0770.JPG,5_AEP,Session_4,4/30/2021,12:45:35,TRUE,Session_4__2021-04-30__12-45-35(1).JPG,NA,0,n,
PICT0771.JPG,5_AEP,Session_4,4/30/2021,12:45:40,TRUE,Session_4__2021-04-30__12-45-40(2).JPG,NA,0,n,
PICT0772.JPG,5_AEP,Session_4,4/30/2021,12:45:45,TRUE,Session_4__2021-04-30__12-45-45(3).JPG,NA,0,n,
PICT0773.JPG,5_AEP,Session_4,4/30/2021,12:47:01,TRUE,Session_4__2021-04-30__12-47-01(1).JPG,NA,0,n,
PICT0774.JPG,5_AEP,Session_4,4/30/2021,12:47:06,TRUE,Session_4__2021-04-30__12-47-06(2).JPG,NA,0,n,
PICT0775.JPG,5_AEP,Session_4,4/30/2021,12:47:11,TRUE,Session_4__2021-04-30__12-47-11(3).JPG,NA,0,n,
PICT0776.JPG,5_AEP,Session_4,4/30/2021,12:49:52,TRUE,Session_4__2021-04-30__12-49-52(1).JPG,NA,0,n,
PICT0777.JPG,5_AEP,Session_4,4/30/2021,12:49:57,TRUE,Session_4__2021-04-30__12-49-57(2).JPG,NA,0,n,
PICT0778.JPG,5_AEP,Session_4,4/30/2021,12:50:02,TRUE,Session_4__2021-04-30__12-50-02(1).JPG,NA,0,n,
PICT0779.JPG,5_AEP,Session_4,4/30/2021,12:51:09,TRUE,Session_4__2021-04-30__12-51-09(1).JPG,NA,0,n,
PICT0780.JPG,5_AEP,Session_4,4/30/2021,12:51:14,TRUE,Session_4__2021-04-30__12-51-14(2).JPG,NA,0,n,
PICT0781.JPG,5_AEP,Session_4,4/30/2021,12:51:19,TRUE,Session_4__2021-04-30__12-51-19(3).JPG,NA,0,n,
PICT0782.JPG,5_AEP,Session_4,4/30/2021,12:52:39,TRUE,Session_4__2021-04-30__12-52-39(1).JPG,NA,0,n,
PICT0783.JPG,5_AEP,Session_4,4/30/2021,12:52:43,TRUE,Session_4__2021-04-30__12-52-43(2).JPG,NA,0,n,
PICT0784.JPG,5_AEP,Session_4,4/30/2021,12:52:48,TRUE,Session_4__2021-04-30__12-52-48(3).JPG,NA,0,n,
PICT0785.JPG,5_AEP,Session_4,4/30/2021,12:56:45,TRUE,Session_4__2021-04-30__12-56-45(1).JPG,NA,0,n,
PICT0786.JPG,5_AEP,Session_4,4/30/2021,12:56:49,TRUE,Session_4__2021-04-30__12-56-49(2).JPG,NA,0,n,
PICT0787.JPG,5_AEP,Session_4,4/30/2021,12:56:54,TRUE,Session_4__2021-04-30__12-56-54(3).JPG,NA,0,n,
PICT0788.JPG,5_AEP,Session_4,4/30/2021,12:58:03,TRUE,Session_4__2021-04-30__12-58-03(1).JPG,NA,0,n,
PICT0789.JPG,5_AEP,Session_4,4/30/2021,12:58:07,TRUE,Session_4__2021-04-30__12-58-07(2).JPG,NA,0,n,
PICT0790.JPG,5_AEP,Session_4,4/30/2021,12:58:12,TRUE,Session_4__2021-04-30__12-58-12(3).JPG,NA,0,n,
PICT0791.JPG,5_AEP,Session_4,4/30/2021,13:01:48,TRUE,Session_4__2021-04-30__13-01-48(1).JPG,NA,0,n,
PICT0792.JPG,5_AEP,Session_4,4/30/2021,13:01:52,TRUE,Session_4__2021-04-30__13-01-52(2).JPG,NA,0,n,
PICT0793.JPG,5_AEP,Session_4,4/30/2021,13:01:57,TRUE,Session_4__2021-04-30__13-01-57(3).JPG,NA,0,n,
PICT0794.JPG,5_AEP,Session_4,4/30/2021,13:03:09,TRUE,Session_4__2021-04-30__13-03-09(1).JPG,NA,0,n,
PICT0795.JPG,5_AEP,Session_4,4/30/2021,13:03:14,TRUE,Session_4__2021-04-30__13-03-14(2).JPG,NA,0,n,
PICT0796.JPG,5_AEP,Session_4,4/30/2021,13:03:19,TRUE,Session_4__2021-04-30__13-03-19(3).JPG,NA,0,n,
PICT0797.JPG,5_AEP,Session_4,4/30/2021,13:04:28,TRUE,Session_4__2021-04-30__13-04-28(1).JPG,NA,0,n,
PICT0798.JPG,5_AEP,Session_4,4/30/2021,13:04:32,TRUE,Session_4__2021-04-30__13-04-32(2).JPG,NA,0,n,
PICT0799.JPG,5_AEP,Session_4,4/30/2021,13:04:37,TRUE,Session_4__2021-04-30__13-04-37(3).JPG,NA,0,n,
PICT0800.JPG,5_AEP,Session_4,4/30/2021,13:06:26,TRUE,Session_4__2021-04-30__13-06-26(1).JPG,NA,0,n,
PICT0801.JPG,5_AEP,Session_4,4/30/2021,13:06:30,TRUE,Session_4__2021-04-30__13-06-30(2).JPG,NA,0,n,
PICT0802.JPG,5_AEP,Session_4,4/30/2021,13:06:35,TRUE,Session_4__2021-04-30__13-06-35(3).JPG,NA,0,n,
PICT0803.JPG,5_AEP,Session_4,4/30/2021,13:07:58,TRUE,Session_4__2021-04-30__13-07-58(1).JPG,NA,0,n,
PICT0804.JPG,5_AEP,Session_4,4/30/2021,13:08:02,TRUE,Session_4__2021-04-30__13-08-02(1).JPG,NA,0,n,
PICT0805.JPG,5_AEP,Session_4,4/30/2021,13:08:07,TRUE,Session_4__2021-04-30__13-08-07(2).JPG,NA,0,n,
PICT0806.JPG,5_AEP,Session_4,4/30/2021,13:12:59,TRUE,Session_4__2021-04-30__13-12-59(1).JPG,NA,0,n,
PICT0807.JPG,5_AEP,Session_4,4/30/2021,13:13:04,TRUE,Session_4__2021-04-30__13-13-04(1).JPG,NA,0,n,
PICT0808.JPG,5_AEP,Session_4,4/30/2021,13:13:09,TRUE,Session_4__2021-04-30__13-13-09(2).JPG,NA,0,n,
PICT0809.JPG,5_AEP,Session_4,4/30/2021,13:16:10,TRUE,Session_4__2021-04-30__13-16-10(1).JPG,NA,0,n,
PICT0810.JPG,5_AEP,Session_4,4/30/2021,13:16:15,TRUE,Session_4__2021-04-30__13-16-15(2).JPG,NA,0,n,
PICT0811.JPG,5_AEP,Session_4,4/30/2021,13:16:20,TRUE,Session_4__2021-04-30__13-16-20(3).JPG,NA,0,n,
PICT0812.JPG,5_AEP,Session_4,4/30/2021,13:17:22,TRUE,Session_4__2021-04-30__13-17-22(1).JPG,NA,0,n,
PICT0813.JPG,5_AEP,Session_4,4/30/2021,13:17:27,TRUE,Session_4__2021-04-30__13-17-27(2).JPG,NA,0,n,
PICT0814.JPG,5_AEP,Session_4,4/30/2021,13:17:32,TRUE,Session_4__2021-04-30__13-17-32(3).JPG,NA,0,n,
PICT0815.JPG,5_AEP,Session_4,4/30/2021,13:18:42,TRUE,Session_4__2021-04-30__13-18-42(1).JPG,NA,0,n,
PICT0816.JPG,5_AEP,Session_4,4/30/2021,13:18:46,TRUE,Session_4__2021-04-30__13-18-46(2).JPG,NA,0,n,
PICT0817.JPG,5_AEP,Session_4,4/30/2021,13:18:51,TRUE,Session_4__2021-04-30__13-18-51(3).JPG,NA,0,n,
PICT0818.JPG,5_AEP,Session_4,4/30/2021,13:21:30,TRUE,Session_4__2021-04-30__13-21-30(1).JPG,NA,0,n,
PICT0819.JPG,5_AEP,Session_4,4/30/2021,13:21:35,TRUE,Session_4__2021-04-30__13-21-35(2).JPG,NA,0,n,
PICT0820.JPG,5_AEP,Session_4,4/30/2021,13:21:40,TRUE,Session_4__2021-04-30__13-21-40(3).JPG,NA,0,n,
PICT0821.JPG,5_AEP,Session_4,4/30/2021,13:22:53,TRUE,Session_4__2021-04-30__13-22-53(1).JPG,NA,0,n,
PICT0822.JPG,5_AEP,Session_4,4/30/2021,13:22:57,TRUE,Session_4__2021-04-30__13-22-57(2).JPG,NA,0,n,
PICT0823.JPG,5_AEP,Session_4,4/30/2021,13:23:02,TRUE,Session_4__2021-04-30__13-23-02(1).JPG,NA,0,n,
PICT0824.JPG,5_AEP,Session_4,4/30/2021,13:24:26,TRUE,Session_4__2021-04-30__13-24-26(1).JPG,NA,0,n,
PICT0825.JPG,5_AEP,Session_4,4/30/2021,13:24:31,TRUE,Session_4__2021-04-30__13-24-31(2).JPG,NA,0,n,
PICT0826.JPG,5_AEP,Session_4,4/30/2021,13:24:36,TRUE,Session_4__2021-04-30__13-24-36(3).JPG,NA,0,n,
PICT0827.JPG,5_AEP,Session_4,4/30/2021,13:26:45,TRUE,Session_4__2021-04-30__13-26-45(1).JPG,NA,0,n,
PICT0828.JPG,5_AEP,Session_4,4/30/2021,13:26:49,TRUE,Session_4__2021-04-30__13-26-49(2).JPG,NA,0,n,
PICT0829.JPG,5_AEP,Session_4,4/30/2021,13:26:54,TRUE,Session_4__2021-04-30__13-26-54(3).JPG,NA,0,n,
PICT0830.JPG,5_AEP,Session_4,4/30/2021,13:28:29,TRUE,Session_4__2021-04-30__13-28-29(1).JPG,NA,0,n,
PICT0831.JPG,5_AEP,Session_4,4/30/2021,13:28:33,TRUE,Session_4__2021-04-30__13-28-33(2).JPG,NA,0,n,
PICT0832.JPG,5_AEP,Session_4,4/30/2021,13:28:38,TRUE,Session_4__2021-04-30__13-28-38(3).JPG,NA,0,n,
PICT0833.JPG,5_AEP,Session_4,4/30/2021,13:29:43,TRUE,Session_4__2021-04-30__13-29-43(1).JPG,NA,0,n,
PICT0834.JPG,5_AEP,Session_4,4/30/2021,13:29:48,TRUE,Session_4__2021-04-30__13-29-48(2).JPG,NA,0,n,
PICT0835.JPG,5_AEP,Session_4,4/30/2021,13:29:53,TRUE,Session_4__2021-04-30__13-29-53(3).JPG,NA,0,n,
PICT0836.JPG,5_AEP,Session_4,4/30/2021,13:31:11,TRUE,Session_4__2021-04-30__13-31-11(1).JPG,NA,0,n,
PICT0837.JPG,5_AEP,Session_4,4/30/2021,13:31:16,TRUE,Session_4__2021-04-30__13-31-16(2).JPG,NA,0,n,
PICT0838.JPG,5_AEP,Session_4,4/30/2021,13:31:21,TRUE,Session_4__2021-04-30__13-31-21(3).JPG,NA,0,n,
PICT0839.JPG,5_AEP,Session_4,4/30/2021,13:33:27,TRUE,Session_4__2021-04-30__13-33-27(1).JPG,NA,0,n,
PICT0840.JPG,5_AEP,Session_4,4/30/2021,13:33:31,TRUE,Session_4__2021-04-30__13-33-31(2).JPG,NA,0,n,
PICT0841.JPG,5_AEP,Session_4,4/30/2021,13:33:36,TRUE,Session_4__2021-04-30__13-33-36(3).JPG,NA,0,n,
PICT0842.JPG,5_AEP,Session_4,4/30/2021,13:36:52,TRUE,Session_4__2021-04-30__13-36-52(1).JPG,NA,0,n,
PICT0843.JPG,5_AEP,Session_4,4/30/2021,13:36:57,TRUE,Session_4__2021-04-30__13-36-57(2).JPG,NA,0,n,
PICT0844.JPG,5_AEP,Session_4,4/30/2021,13:37:02,TRUE,Session_4__2021-04-30__13-37-02(1).JPG,NA,0,n,
PICT0845.JPG,5_AEP,Session_4,4/30/2021,13:38:08,TRUE,Session_4__2021-04-30__13-38-08(1).JPG,NA,0,n,
PICT0846.JPG,5_AEP,Session_4,4/30/2021,13:38:13,TRUE,Session_4__2021-04-30__13-38-13(2).JPG,NA,0,n,
PICT0847.JPG,5_AEP,Session_4,4/30/2021,13:38:18,TRUE,Session_4__2021-04-30__13-38-18(3).JPG,NA,0,n,
PICT0848.JPG,5_AEP,Session_4,4/30/2021,13:39:40,TRUE,Session_4__2021-04-30__13-39-40(1).JPG,NA,0,n,
PICT0849.JPG,5_AEP,Session_4,4/30/2021,13:39:44,TRUE,Session_4__2021-04-30__13-39-44(2).JPG,NA,0,n,
PICT0850.JPG,5_AEP,Session_4,4/30/2021,13:39:49,TRUE,Session_4__2021-04-30__13-39-49(3).JPG,NA,0,n,
PICT0851.JPG,5_AEP,Session_4,4/30/2021,13:42:03,TRUE,Session_4__2021-04-30__13-42-03(1).JPG,NA,0,n,
PICT0852.JPG,5_AEP,Session_4,4/30/2021,13:42:08,TRUE,Session_4__2021-04-30__13-42-08(2).JPG,NA,0,n,
PICT0853.JPG,5_AEP,Session_4,4/30/2021,13:42:13,TRUE,Session_4__2021-04-30__13-42-13(3).JPG,NA,0,n,
PICT0854.JPG,5_AEP,Session_4,4/30/2021,13:47:25,TRUE,Session_4__2021-04-30__13-47-25(1).JPG,NA,0,n,
PICT0855.JPG,5_AEP,Session_4,4/30/2021,13:47:29,TRUE,Session_4__2021-04-30__13-47-29(2).JPG,NA,0,n,
PICT0856.JPG,5_AEP,Session_4,4/30/2021,13:47:34,TRUE,Session_4__2021-04-30__13-47-34(3).JPG,NA,0,n,
PICT0857.JPG,5_AEP,Session_4,4/30/2021,13:52:22,TRUE,Session_4__2021-04-30__13-52-22(1).JPG,NA,0,n,
PICT0858.JPG,5_AEP,Session_4,4/30/2021,13:52:26,TRUE,Session_4__2021-04-30__13-52-26(2).JPG,NA,0,n,
PICT0859.JPG,5_AEP,Session_4,4/30/2021,13:52:31,TRUE,Session_4__2021-04-30__13-52-31(3).JPG,NA,0,n,
PICT0860.JPG,5_AEP,Session_4,4/30/2021,13:53:58,TRUE,Session_4__2021-04-30__13-53-58(1).JPG,NA,0,n,
PICT0861.JPG,5_AEP,Session_4,4/30/2021,13:54:03,TRUE,Session_4__2021-04-30__13-54-03(1).JPG,NA,0,n,
PICT0862.JPG,5_AEP,Session_4,4/30/2021,13:54:08,TRUE,Session_4__2021-04-30__13-54-08(2).JPG,NA,0,n,
PICT0863.JPG,5_AEP,Session_4,4/30/2021,13:56:31,TRUE,Session_4__2021-04-30__13-56-31(1).JPG,NA,0,n,
PICT0864.JPG,5_AEP,Session_4,4/30/2021,13:56:36,TRUE,Session_4__2021-04-30__13-56-36(2).JPG,NA,0,n,
PICT0865.JPG,5_AEP,Session_4,4/30/2021,13:56:41,TRUE,Session_4__2021-04-30__13-56-41(3).JPG,NA,0,n,
PICT0866.JPG,5_AEP,Session_4,4/30/2021,14:13:45,TRUE,Session_4__2021-04-30__14-13-45(1).JPG,NA,0,n,
PICT0867.JPG,5_AEP,Session_4,4/30/2021,14:13:49,TRUE,Session_4__2021-04-30__14-13-49(2).JPG,NA,0,n,
PICT0868.JPG,5_AEP,Session_4,4/30/2021,14:13:54,TRUE,Session_4__2021-04-30__14-13-54(3).JPG,NA,0,n,
PICT0869.JPG,5_AEP,Session_4,4/30/2021,14:15:59,TRUE,Session_4__2021-04-30__14-15-59(1).JPG,NA,0,n,
PICT0870.JPG,5_AEP,Session_4,4/30/2021,14:16:03,TRUE,Session_4__2021-04-30__14-16-03(1).JPG,NA,0,n,
PICT0871.JPG,5_AEP,Session_4,4/30/2021,14:16:08,TRUE,Session_4__2021-04-30__14-16-08(2).JPG,NA,0,n,
PICT0872.JPG,5_AEP,Session_4,4/30/2021,14:18:45,TRUE,Session_4__2021-04-30__14-18-45(1).JPG,NA,0,n,
PICT0873.JPG,5_AEP,Session_4,4/30/2021,14:20:01,TRUE,Session_4__2021-04-30__14-20-01(1).JPG,NA,0,n,
PICT0874.JPG,5_AEP,Session_4,4/30/2021,14:20:05,TRUE,Session_4__2021-04-30__14-20-05(2).JPG,NA,0,n,
PICT0875.JPG,5_AEP,Session_4,4/30/2021,14:20:10,TRUE,Session_4__2021-04-30__14-20-10(3).JPG,NA,0,n,
PICT0876.JPG,5_AEP,Session_4,4/30/2021,14:21:16,TRUE,Session_4__2021-04-30__14-21-16(1).JPG,NA,0,n,
PICT0877.JPG,5_AEP,Session_4,4/30/2021,14:21:20,TRUE,Session_4__2021-04-30__14-21-20(2).JPG,NA,0,n,
PICT0878.JPG,5_AEP,Session_4,4/30/2021,14:21:25,TRUE,Session_4__2021-04-30__14-21-25(3).JPG,NA,0,n,
PICT0879.JPG,5_AEP,Session_4,4/30/2021,14:23:10,TRUE,Session_4__2021-04-30__14-23-10(1).JPG,NA,0,n,
PICT0880.JPG,5_AEP,Session_4,4/30/2021,14:23:14,TRUE,Session_4__2021-04-30__14-23-14(2).JPG,NA,0,n,
PICT0881.JPG,5_AEP,Session_4,4/30/2021,14:23:19,TRUE,Session_4__2021-04-30__14-23-19(3).JPG,NA,0,n,
PICT0882.JPG,5_AEP,Session_4,4/30/2021,14:48:02,TRUE,Session_4__2021-04-30__14-48-02(1).JPG,NA,0,n,
PICT0883.JPG,5_AEP,Session_4,4/30/2021,14:48:06,TRUE,Session_4__2021-04-30__14-48-06(2).JPG,NA,0,n,
PICT0884.JPG,5_AEP,Session_4,4/30/2021,14:48:11,TRUE,Session_4__2021-04-30__14-48-11(3).JPG,NA,0,n,
PICT0885.JPG,5_AEP,Session_4,4/30/2021,14:52:26,TRUE,Session_4__2021-04-30__14-52-26(1).JPG,NA,0,n,
PICT0886.JPG,5_AEP,Session_4,4/30/2021,14:52:30,TRUE,Session_4__2021-04-30__14-52-30(2).JPG,NA,0,n,
PICT0887.JPG,5_AEP,Session_4,4/30/2021,14:52:35,TRUE,Session_4__2021-04-30__14-52-35(3).JPG,NA,0,n,
PICT0888.JPG,5_AEP,Session_4,4/30/2021,15:22:02,TRUE,Session_4__2021-04-30__15-22-02(1).JPG,NA,0,n,
PICT0889.JPG,5_AEP,Session_4,4/30/2021,15:22:06,TRUE,Session_4__2021-04-30__15-22-06(2).JPG,NA,0,n,
PICT0890.JPG,5_AEP,Session_4,4/30/2021,15:22:12,TRUE,Session_4__2021-04-30__15-22-12(3).JPG,NA,0,n,
PICT0891.JPG,5_AEP,Session_4,4/30/2021,15:23:24,TRUE,Session_4__2021-04-30__15-23-24(1).JPG,NA,0,n,
PICT0892.JPG,5_AEP,Session_4,4/30/2021,15:23:28,TRUE,Session_4__2021-04-30__15-23-28(2).JPG,NA,0,n,
PICT0893.JPG,5_AEP,Session_4,4/30/2021,15:23:33,TRUE,Session_4__2021-04-30__15-23-33(3).JPG,NA,0,n,
PICT0894.JPG,5_AEP,Session_4,4/30/2021,15:29:11,TRUE,Session_4__2021-04-30__15-29-11(1).JPG,NA,0,n,
PICT0895.JPG,5_AEP,Session_4,4/30/2021,15:29:15,TRUE,Session_4__2021-04-30__15-29-15(2).JPG,NA,0,n,
PICT0896.JPG,5_AEP,Session_4,4/30/2021,15:29:20,TRUE,Session_4__2021-04-30__15-29-20(3).JPG,NA,0,n,
PICT0897.JPG,5_AEP,Session_4,4/30/2021,15:41:01,TRUE,Session_4__2021-04-30__15-41-01(1).JPG,NA,0,n,
PICT0898.JPG,5_AEP,Session_4,4/30/2021,15:41:06,TRUE,Session_4__2021-04-30__15-41-06(2).JPG,NA,0,n,
PICT0899.JPG,5_AEP,Session_4,4/30/2021,15:41:11,TRUE,Session_4__2021-04-30__15-41-11(3).JPG,NA,0,n,
PICT0900.JPG,5_AEP,Session_4,4/30/2021,15:55:01,TRUE,Session_4__2021-04-30__15-55-01(1).JPG,NA,0,n,
PICT0901.JPG,5_AEP,Session_4,4/30/2021,15:55:05,TRUE,Session_4__2021-04-30__15-55-05(2).JPG,NA,0,n,
PICT0902.JPG,5_AEP,Session_4,4/30/2021,15:55:10,TRUE,Session_4__2021-04-30__15-55-10(3).JPG,NA,0,n,
PICT0903.JPG,5_AEP,Session_4,4/30/2021,15:56:34,TRUE,Session_4__2021-04-30__15-56-34(1).JPG,NA,0,n,
PICT0904.JPG,5_AEP,Session_4,4/30/2021,15:56:38,TRUE,Session_4__2021-04-30__15-56-38(2).JPG,NA,0,n,
PICT0905.JPG,5_AEP,Session_4,4/30/2021,15:56:43,TRUE,Session_4__2021-04-30__15-56-43(3).JPG,NA,0,n,
PICT0906.JPG,5_AEP,Session_4,4/30/2021,15:58:28,TRUE,Session_4__2021-04-30__15-58-28(1).JPG,NA,0,n,
PICT0907.JPG,5_AEP,Session_4,4/30/2021,15:58:33,TRUE,Session_4__2021-04-30__15-58-33(2).JPG,NA,0,n,
PICT0908.JPG,5_AEP,Session_4,4/30/2021,15:58:38,TRUE,Session_4__2021-04-30__15-58-38(3).JPG,NA,0,n,
PICT0909.JPG,5_AEP,Session_4,4/30/2021,15:59:48,TRUE,Session_4__2021-04-30__15-59-48(1).JPG,NA,0,n,
PICT0910.JPG,5_AEP,Session_4,4/30/2021,15:59:52,TRUE,Session_4__2021-04-30__15-59-52(2).JPG,NA,0,n,
PICT0911.JPG,5_AEP,Session_4,4/30/2021,15:59:57,TRUE,Session_4__2021-04-30__15-59-57(3).JPG,NA,0,n,
PICT0912.JPG,5_AEP,Session_4,4/30/2021,16:01:58,TRUE,Session_4__2021-04-30__16-01-58(1).JPG,NA,0,n,
PICT0913.JPG,5_AEP,Session_4,4/30/2021,16:02:02,TRUE,Session_4__2021-04-30__16-02-02(1).JPG,NA,0,n,
PICT0914.JPG,5_AEP,Session_4,4/30/2021,16:02:07,TRUE,Session_4__2021-04-30__16-02-07(2).JPG,NA,0,n,
PICT0915.JPG,5_AEP,Session_4,4/30/2021,16:07:29,TRUE,Session_4__2021-04-30__16-07-29(1).JPG,NA,0,n,
PICT0916.JPG,5_AEP,Session_4,4/30/2021,16:07:33,TRUE,Session_4__2021-04-30__16-07-33(2).JPG,NA,0,n,
PICT0917.JPG,5_AEP,Session_4,4/30/2021,16:07:38,TRUE,Session_4__2021-04-30__16-07-38(3).JPG,NA,0,n,
PICT0918.JPG,5_AEP,Session_4,4/30/2021,17:11:54,TRUE,Session_4__2021-04-30__17-11-54(1).JPG,NA,0,n,
PICT0919.JPG,5_AEP,Session_4,4/30/2021,17:11:57,TRUE,Session_4__2021-04-30__17-11-57(2).JPG,NA,0,n,
PICT0920.JPG,5_AEP,Session_4,4/30/2021,17:12:02,TRUE,Session_4__2021-04-30__17-12-02(1).JPG,NA,0,n,
PICT0921.JPG,5_AEP,Session_4,4/30/2021,17:24:45,TRUE,Session_4__2021-04-30__17-24-45(1).JPG,NA,0,n,
PICT0922.JPG,5_AEP,Session_4,4/30/2021,17:24:50,TRUE,Session_4__2021-04-30__17-24-50(2).JPG,NA,0,n,
PICT0923.JPG,5_AEP,Session_4,4/30/2021,17:24:54,TRUE,Session_4__2021-04-30__17-24-54(3).JPG,NA,0,n,
PICT0924.JPG,5_AEP,Session_4,4/30/2021,18:17:09,TRUE,Session_4__2021-04-30__18-17-09(1).JPG,NA,0,n,
PICT0925.JPG,5_AEP,Session_4,4/30/2021,18:17:13,TRUE,Session_4__2021-04-30__18-17-13(2).JPG,NA,0,n,
PICT0926.JPG,5_AEP,Session_4,4/30/2021,18:17:18,TRUE,Session_4__2021-04-30__18-17-18(3).JPG,NA,0,n,
PICT0927.JPG,5_AEP,Session_4,4/30/2021,18:25:10,TRUE,Session_4__2021-04-30__18-25-10(1).JPG,NA,0,n,
PICT0928.JPG,5_AEP,Session_4,4/30/2021,18:25:15,TRUE,Session_4__2021-04-30__18-25-15(2).JPG,NA,0,n,
PICT0929.JPG,5_AEP,Session_4,4/30/2021,18:25:20,TRUE,Session_4__2021-04-30__18-25-20(3).JPG,NA,0,n,
PICT0930.JPG,5_AEP,Session_4,4/30/2021,18:32:51,TRUE,Session_4__2021-04-30__18-32-51(1).JPG,NA,0,n,
PICT0931.JPG,5_AEP,Session_4,4/30/2021,18:32:56,TRUE,Session_4__2021-04-30__18-32-56(2).JPG,NA,0,n,
PICT0932.JPG,5_AEP,Session_4,4/30/2021,18:33:01,TRUE,Session_4__2021-04-30__18-33-01(1).JPG,NA,0,n,
PICT0933.JPG,5_AEP,Session_4,4/30/2021,18:41:26,TRUE,Session_4__2021-04-30__18-41-26(1).JPG,NA,0,n,
PICT0934.JPG,5_AEP,Session_4,4/30/2021,18:41:31,TRUE,Session_4__2021-04-30__18-41-31(2).JPG,NA,0,n,
PICT0935.JPG,5_AEP,Session_4,4/30/2021,18:41:36,TRUE,Session_4__2021-04-30__18-41-36(3).JPG,NA,0,n,
PICT0936.JPG,5_AEP,Session_4,4/30/2021,18:47:34,TRUE,Session_4__2021-04-30__18-47-34(1).JPG,NA,0,n,
PICT0937.JPG,5_AEP,Session_4,4/30/2021,18:47:39,TRUE,Session_4__2021-04-30__18-47-39(2).JPG,NA,0,n,
PICT0938.JPG,5_AEP,Session_4,4/30/2021,18:47:44,TRUE,Session_4__2021-04-30__18-47-44(3).JPG,NA,0,n,
PICT0939.JPG,5_AEP,Session_4,4/30/2021,18:56:12,TRUE,Session_4__2021-04-30__18-56-12(1).JPG,NA,0,n,
PICT0940.JPG,5_AEP,Session_4,4/30/2021,18:56:17,TRUE,Session_4__2021-04-30__18-56-17(2).JPG,NA,0,n,
PICT0941.JPG,5_AEP,Session_4,4/30/2021,18:56:22,TRUE,Session_4__2021-04-30__18-56-22(3).JPG,NA,0,n,
PICT0942.JPG,5_AEP,Session_4,4/30/2021,19:03:15,TRUE,Session_4__2021-04-30__19-03-15(1).JPG,NA,0,n,
PICT0943.JPG,5_AEP,Session_4,4/30/2021,19:03:20,TRUE,Session_4__2021-04-30__19-03-20(2).JPG,NA,0,n,
PICT0944.JPG,5_AEP,Session_4,4/30/2021,19:03:25,TRUE,Session_4__2021-04-30__19-03-25(3).JPG,NA,0,n,
PICT0945.JPG,5_AEP,Session_4,4/30/2021,19:08:02,TRUE,Session_4__2021-04-30__19-08-02(1).JPG,NA,0,n,
PICT0946.JPG,5_AEP,Session_4,4/30/2021,19:08:07,TRUE,Session_4__2021-04-30__19-08-07(2).JPG,NA,0,n,
PICT0947.JPG,5_AEP,Session_4,4/30/2021,19:08:12,TRUE,Session_4__2021-04-30__19-08-12(3).JPG,NA,0,n,
PICT0948.JPG,5_AEP,Session_4,4/30/2021,19:10:01,TRUE,Session_4__2021-04-30__19-10-01(1).JPG,NA,0,n,
PICT0949.JPG,5_AEP,Session_4,4/30/2021,19:10:06,TRUE,Session_4__2021-04-30__19-10-06(2).JPG,NA,0,n,
PICT0950.JPG,5_AEP,Session_4,4/30/2021,19:10:11,TRUE,Session_4__2021-04-30__19-10-11(3).JPG,NA,0,n,
PICT0951.JPG,5_AEP,Session_4,4/30/2021,19:12:51,TRUE,Session_4__2021-04-30__19-12-51(1).JPG,NA,0,n,
PICT0952.JPG,5_AEP,Session_4,4/30/2021,19:12:56,TRUE,Session_4__2021-04-30__19-12-56(2).JPG,NA,0,n,
PICT0953.JPG,5_AEP,Session_4,4/30/2021,19:13:01,TRUE,Session_4__2021-04-30__19-13-01(1).JPG,NA,0,n,
PICT0954.JPG,5_AEP,Session_4,4/30/2021,19:19:18,TRUE,Session_4__2021-04-30__19-19-18(1).JPG,NA,0,n,
PICT0955.JPG,5_AEP,Session_4,4/30/2021,19:19:22,TRUE,Session_4__2021-04-30__19-19-22(2).JPG,NA,0,n,
PICT0956.JPG,5_AEP,Session_4,4/30/2021,19:19:27,TRUE,Session_4__2021-04-30__19-19-27(3).JPG,NA,0,n,
PICT0957.JPG,5_AEP,Session_4,4/30/2021,19:20:28,TRUE,Session_4__2021-04-30__19-20-28(1).JPG,NA,0,n,
PICT0958.JPG,5_AEP,Session_4,4/30/2021,19:20:33,TRUE,Session_4__2021-04-30__19-20-33(2).JPG,NA,0,n,
PICT0959.JPG,5_AEP,Session_4,4/30/2021,19:20:38,TRUE,Session_4__2021-04-30__19-20-38(3).JPG,NA,0,n,
PICT0960.JPG,5_AEP,Session_4,4/30/2021,19:29:54,TRUE,Session_4__2021-04-30__19-29-54(1).JPG,NA,0,n,
PICT0961.JPG,5_AEP,Session_4,4/30/2021,19:29:58,TRUE,Session_4__2021-04-30__19-29-58(2).JPG,NA,0,n,
PICT0962.JPG,5_AEP,Session_4,4/30/2021,19:30:03,TRUE,Session_4__2021-04-30__19-30-03(1).JPG,NA,0,n,
PICT0963.JPG,5_AEP,Session_4,4/30/2021,19:37:20,TRUE,Session_4__2021-04-30__19-37-20(1).JPG,NA,0,n,
PICT0964.JPG,5_AEP,Session_4,4/30/2021,19:37:25,TRUE,Session_4__2021-04-30__19-37-25(2).JPG,NA,0,n,
PICT0965.JPG,5_AEP,Session_4,4/30/2021,19:37:30,TRUE,Session_4__2021-04-30__19-37-30(3).JPG,NA,0,n,
PICT0966.JPG,5_AEP,Session_4,4/30/2021,19:54:51,TRUE,Session_4__2021-04-30__19-54-51(1).JPG,NA,0,n,
PICT0967.JPG,5_AEP,Session_4,4/30/2021,19:54:55,TRUE,Session_4__2021-04-30__19-54-55(2).JPG,NA,0,n,
PICT0968.JPG,5_AEP,Session_4,4/30/2021,19:55:00,TRUE,Session_4__2021-04-30__19-55-00(1).JPG,NA,0,n,
PICT0969.JPG,5_AEP,Session_4,4/30/2021,20:30:26,TRUE,Session_4__2021-04-30__20-30-26(1).JPG,NA,0,n,
PICT0970.JPG,5_AEP,Session_4,4/30/2021,20:30:31,TRUE,Session_4__2021-04-30__20-30-31(2).JPG,NA,0,n,
PICT0971.JPG,5_AEP,Session_4,4/30/2021,20:30:36,TRUE,Session_4__2021-04-30__20-30-36(3).JPG,NA,0,n,
PICT0972.JPG,5_AEP,Session_4,4/30/2021,20:55:39,TRUE,Session_4__2021-04-30__20-55-39(1).JPG,NA,0,n,
PICT0973.JPG,5_AEP,Session_4,4/30/2021,20:55:43,TRUE,Session_4__2021-04-30__20-55-43(2).JPG,NA,0,n,
PICT0974.JPG,5_AEP,Session_4,4/30/2021,20:55:48,TRUE,Session_4__2021-04-30__20-55-48(3).JPG,NA,0,n,
PICT0975.JPG,5_AEP,Session_4,4/30/2021,21:23:27,TRUE,Session_4__2021-04-30__21-23-27(1).JPG,NA,0,n,
PICT0976.JPG,5_AEP,Session_4,4/30/2021,21:23:32,TRUE,Session_4__2021-04-30__21-23-32(2).JPG,NA,0,n,
PICT0977.JPG,5_AEP,Session_4,4/30/2021,21:23:37,TRUE,Session_4__2021-04-30__21-23-37(3).JPG,NA,0,n,
PICT0978.JPG,5_AEP,Session_4,5/1/2021,0:23:02,TRUE,Session_4__2021-05-01__00-23-02(1).JPG,NA,0,n,
PICT0979.JPG,5_AEP,Session_4,5/1/2021,0:23:07,TRUE,Session_4__2021-05-01__00-23-07(2).JPG,NA,0,n,
PICT0980.JPG,5_AEP,Session_4,5/1/2021,0:23:11,TRUE,Session_4__2021-05-01__00-23-11(3).JPG,NA,0,n,
PICT0981.JPG,5_AEP,Session_4,5/1/2021,9:37:29,TRUE,Session_4__2021-05-01__09-37-29(1).JPG,NA,0,n,
PICT0982.JPG,5_AEP,Session_4,5/1/2021,9:37:33,TRUE,Session_4__2021-05-01__09-37-33(2).JPG,NA,0,n,
PICT0983.JPG,5_AEP,Session_4,5/1/2021,9:37:38,TRUE,Session_4__2021-05-01__09-37-38(3).JPG,NA,0,n,
PICT0984.JPG,5_AEP,Session_4,5/1/2021,9:42:48,TRUE,Session_4__2021-05-01__09-42-48(1).JPG,NA,0,n,
PICT0985.JPG,5_AEP,Session_4,5/1/2021,9:42:52,TRUE,Session_4__2021-05-01__09-42-52(2).JPG,NA,0,n,
PICT0986.JPG,5_AEP,Session_4,5/1/2021,9:42:57,TRUE,Session_4__2021-05-01__09-42-57(3).JPG,NA,0,n,
PICT0987.JPG,5_AEP,Session_4,5/1/2021,9:45:30,TRUE,Session_4__2021-05-01__09-45-30(1).JPG,NA,0,n,
PICT0988.JPG,5_AEP,Session_4,5/1/2021,9:45:34,TRUE,Session_4__2021-05-01__09-45-34(2).JPG,NA,0,n,
PICT0989.JPG,5_AEP,Session_4,5/1/2021,9:45:39,TRUE,Session_4__2021-05-01__09-45-39(3).JPG,NA,0,n,
PICT0990.JPG,5_AEP,Session_4,5/1/2021,9:47:28,TRUE,Session_4__2021-05-01__09-47-28(1).JPG,NA,0,n,
PICT0991.JPG,5_AEP,Session_4,5/1/2021,9:47:32,TRUE,Session_4__2021-05-01__09-47-32(2).JPG,NA,0,n,
PICT0992.JPG,5_AEP,Session_4,5/1/2021,9:47:37,TRUE,Session_4__2021-05-01__09-47-37(3).JPG,NA,0,n,
PICT0993.JPG,5_AEP,Session_4,5/1/2021,9:54:42,TRUE,Session_4__2021-05-01__09-54-42(1).JPG,NA,0,n,
PICT0994.JPG,5_AEP,Session_4,5/1/2021,9:54:47,TRUE,Session_4__2021-05-01__09-54-47(2).JPG,NA,0,n,
PICT0995.JPG,5_AEP,Session_4,5/1/2021,9:54:51,TRUE,Session_4__2021-05-01__09-54-51(3).JPG,NA,0,n,
PICT0996.JPG,5_AEP,Session_4,5/1/2021,9:57:53,TRUE,Session_4__2021-05-01__09-57-53(1).JPG,NA,0,n,
PICT0997.JPG,5_AEP,Session_4,5/1/2021,9:57:57,TRUE,Session_4__2021-05-01__09-57-57(2).JPG,NA,0,n,
PICT0998.JPG,5_AEP,Session_4,5/1/2021,9:58:02,TRUE,Session_4__2021-05-01__09-58-02(1).JPG,NA,0,n,
PICT0999.JPG,5_AEP,Session_4,5/1/2021,10:01:46,TRUE,Session_4__2021-05-01__10-01-46(1).JPG,NA,0,n,
MFDC3781.JPG,5_AEP,Session_5,5/12/2021,11:14:39,TRUE,Session_5__2021-05-12__11-14-39(1).JPG,Homo_sapiens,1,n,
MFDC3782.JPG,5_AEP,Session_5,5/12/2021,11:14:39,TRUE,Session_5__2021-05-12__11-14-39(2).JPG,Homo_sapiens,1,n,
MFDC3783.JPG,5_AEP,Session_5,5/12/2021,11:14:39,TRUE,Session_5__2021-05-12__11-14-39(3).JPG,Homo_sapiens,1,n,
MFDC3784.JPG,5_AEP,Session_5,5/13/2021,4:21:00,TRUE,Session_5__2021-05-13__04-21-00(1).JPG,NA,0,n,
MFDC3785.JPG,5_AEP,Session_5,5/13/2021,4:21:01,TRUE,Session_5__2021-05-13__04-21-01(2).JPG,NA,0,n,
MFDC3786.JPG,5_AEP,Session_5,5/13/2021,4:21:01,TRUE,Session_5__2021-05-13__04-21-01(3).JPG,NA,0,n,
MFDC3787.JPG,5_AEP,Session_5,5/13/2021,9:42:37,TRUE,Session_5__2021-05-13__09-42-37(1).JPG,NA,0,n,
MFDC3788.JPG,5_AEP,Session_5,5/13/2021,9:42:37,TRUE,Session_5__2021-05-13__09-42-37(2).JPG,NA,0,n,
MFDC3789.JPG,5_AEP,Session_5,5/13/2021,9:42:38,TRUE,Session_5__2021-05-13__09-42-38(3).JPG,NA,0,n,
MFDC3790.JPG,5_AEP,Session_5,5/13/2021,11:10:12,TRUE,Session_5__2021-05-13__11-10-12(1).JPG,NA,0,n,
MFDC3791.JPG,5_AEP,Session_5,5/13/2021,11:10:12,TRUE,Session_5__2021-05-13__11-10-12(2).JPG,NA,0,n,
MFDC3792.JPG,5_AEP,Session_5,5/13/2021,11:10:12,TRUE,Session_5__2021-05-13__11-10-12(3).JPG,NA,0,n,
MFDC3793.JPG,5_AEP,Session_5,5/13/2021,13:12:26,TRUE,Session_5__2021-05-13__13-12-26(1).JPG,NA,0,n,
MFDC3794.JPG,5_AEP,Session_5,5/13/2021,13:12:26,TRUE,Session_5__2021-05-13__13-12-26(2).JPG,NA,0,n,
MFDC3795.JPG,5_AEP,Session_5,5/13/2021,13:12:28,TRUE,Session_5__2021-05-13__13-12-28(3).JPG,NA,0,n,
MFDC3796.JPG,5_AEP,Session_5,5/13/2021,14:05:28,TRUE,Session_5__2021-05-13__14-05-28(1).JPG,NA,0,n,
MFDC3797.JPG,5_AEP,Session_5,5/13/2021,14:05:29,TRUE,Session_5__2021-05-13__14-05-29(2).JPG,NA,0,n,
MFDC3798.JPG,5_AEP,Session_5,5/13/2021,14:05:29,TRUE,Session_5__2021-05-13__14-05-29(3).JPG,NA,0,n,
MFDC3799.JPG,5_AEP,Session_5,5/13/2021,14:15:15,TRUE,Session_5__2021-05-13__14-15-15(1).JPG,NA,0,n,
MFDC3800.JPG,5_AEP,Session_5,5/13/2021,14:15:16,TRUE,Session_5__2021-05-13__14-15-16(2).JPG,NA,0,n,
MFDC3801.JPG,5_AEP,Session_5,5/13/2021,14:15:17,TRUE,Session_5__2021-05-13__14-15-17(3).JPG,NA,0,n,
MFDC3802.JPG,5_AEP,Session_5,5/13/2021,23:48:01,TRUE,Session_5__2021-05-13__23-48-01(1).JPG,NA,0,n,
MFDC3803.JPG,5_AEP,Session_5,5/13/2021,23:48:01,TRUE,Session_5__2021-05-13__23-48-01(2).JPG,NA,0,n,
MFDC3804.JPG,5_AEP,Session_5,5/13/2021,23:48:02,TRUE,Session_5__2021-05-13__23-48-02(3).JPG,NA,0,n,
MFDC3805.JPG,5_AEP,Session_5,5/15/2021,7:37:21,TRUE,Session_5__2021-05-15__07-37-21(2).JPG,NA,0,n,
MFDC3806.JPG,5_AEP,Session_5,5/15/2021,7:37:20,TRUE,Session_5__2021-05-15__07-37-20(1).JPG,NA,0,n,
MFDC3807.JPG,5_AEP,Session_5,5/15/2021,7:37:21,TRUE,Session_5__2021-05-15__07-37-21(3).JPG,NA,0,n,
MFDC3808.JPG,5_AEP,Session_5,5/15/2021,12:08:50,TRUE,Session_5__2021-05-15__12-08-50(3).JPG,NA,0,n,
MFDC3809.JPG,5_AEP,Session_5,5/15/2021,12:08:49,TRUE,Session_5__2021-05-15__12-08-49(1).JPG,NA,0,n,
MFDC3810.JPG,5_AEP,Session_5,5/15/2021,12:08:49,TRUE,Session_5__2021-05-15__12-08-49(2).JPG,NA,0,n,
MFDC3811.JPG,5_AEP,Session_5,5/15/2021,14:42:39,TRUE,Session_5__2021-05-15__14-42-39(1).JPG,NA,0,n,
MFDC3812.JPG,5_AEP,Session_5,5/15/2021,14:42:39,TRUE,Session_5__2021-05-15__14-42-39(2).JPG,NA,0,n,
MFDC3813.JPG,5_AEP,Session_5,5/15/2021,14:42:39,TRUE,Session_5__2021-05-15__14-42-39(3).JPG,NA,0,n,
MFDC3814.JPG,5_AEP,Session_5,5/16/2021,13:54:33,TRUE,Session_5__2021-05-16__13-54-33(1).JPG,NA,0,n,
MFDC3815.JPG,5_AEP,Session_5,5/16/2021,13:54:33,TRUE,Session_5__2021-05-16__13-54-33(2).JPG,NA,0,n,
MFDC3816.JPG,5_AEP,Session_5,5/16/2021,13:54:33,TRUE,Session_5__2021-05-16__13-54-33(3).JPG,NA,0,n,
MFDC3817.JPG,5_AEP,Session_5,5/16/2021,21:35:49,TRUE,Session_5__2021-05-16__21-35-49(2).JPG,NA,0,n,No flash
MFDC3818.JPG,5_AEP,Session_5,5/16/2021,21:35:48,TRUE,Session_5__2021-05-16__21-35-48(1).JPG,NA,0,n,No flash
MFDC3819.JPG,5_AEP,Session_5,5/16/2021,21:35:49,TRUE,Session_5__2021-05-16__21-35-49(3).JPG,NA,0,n,No flash
